,Unnamed: 0,Comment ID,Parent ID,Author,Body,Score,Created (UTC)
217,217,e5ui1fd,t1_e5txbv4,the_one_true_bool,ipad pro one favorit tech toy time might super excit see go coupl thing littl worri one devic realli want super thin bezel due natur way natur hold phone basic cradl palm ipad tend hold like book know would probabl get palm reject work right afraid hand would alway get way screen time perfect regard bezel imo rumor smart connector move devic portrait mode use keyboard seem insan howev appar leak case come seem support rumor imagin true also rumor use faceid work portrait mode definit use ipad landscap mode time would super annoy rumor seem crazi appl would think high unlik imagin appl make mani sacrific like hope rumor turn true,3,1536764264.0
218,218,e5uhdlj,t1_e5ttv9o,ThamBoi,think,4,1536763707.0
219,219,e5tvpqu,t1_e5tvhg7,boxheadmoose,seri two slow,2,1536731010.0
220,220,e5u5is5,t1_e5twp76,DGAzr,,4,1536750845.0
221,221,e5uhj20,t1_e5twp76,compwiz1202,hope see max headroom show screen announc,2,1536763834.0
222,222,e5ulhm8,t1_e5twp76,Ham54,okay,1,1536767141.0
223,223,e5u0bfx,t1_e5tzf91,lhighlen,appl websit usual front page coupl hour event usual watch replay appl tv get home site like verg also appl event ten minut summari video cut import stuff,5,1536739859.0
224,224,e5ujn66,t1_e5tzf91,TehCannon,appl event page full keynot sure quick updat event though,1,1536765622.0
225,225,e5tvkrx,t1_e5tucxe,ConfusedFlareon,beat exist,15,1536730787.0
226,226,e5ukymu,t1_e5tucxe,Opacy,yeah expect anyth regard outsid chanc airpow style preview tell us work soon turn end,2,1536766714.0
227,227,e5u6rsm,t1_e5tucxe,akara1001,actual excit accord rumour go releas till,1,1536752732.0
228,228,e5tx1xa,t1_e5trysq,Duke2nd,tbh hz would reason upgrad make better experi overal glad drop money want,9,1536733308.0
229,229,e5tseus,t1_e5trysq,nuclear_wynter,serious hope manag bring promot hz iphon general state hfr ole panel wonder afaik compani could pull appl,16,1536726261.0
230,230,e5u0tib,t1_e5trysq,Shockwavepulsar,frequent purchas x signific perform bump perhap one distinguish featur gs video s siri s touch id s d touch,3,1536741006.0
231,231,e5ul4xi,t1_e5trysq,Opacy,know someth unexpect cool come keep everyth great speech alway start minimum minut present tim still talk io eleven devic ipad use school know go underwhelm day,1,1536766857.0
232,232,e5u90se,t1_e5u2b5a,philphan89,man,1,1536755601.0
233,233,e5udwhc,t1_e5udl34,WorldsSleepiestTAway,greet fellow retail employe usa total stoke whole team get excit tri get stream go appl tv enjoy watch custom nerd love hahaha xb also launch season much fun albeit busi store look forward,5,1536760656.0
234,234,e5uh644,t1_e5ufyk9,philphan89,total agre man,3,1536763528.0
235,235,e5ui1iz,t1_e5ufyk9,Knightwolf15,pixel two xl experienc slowdown issu pretti done android xb incred annoy notch replic without justif well appl fan sheep,2,1536764267.0
236,236,e5uiudn,t1_e5ufyk9,mafiosii,pixel one still great phone got one plan upgrad soon miss googl assist googl len,0,1536764948.0
237,237,e5u5qw5,t1_e5u15vz,BlueSwoosh248,plz sweat resist,6,1536751194.0
238,238,e5u1bit,t1_e5u15vz,spudgriffin,virtual ar tour new iphon new airpod,3,1536742143.0
239,239,e5udsat,t1_e5udpcm,EscapeArtistic,waaaaiiittt,1,1536760550.0
240,240,e5ulga3,t1_e5ul8i7,K_Click_D,expect pepsi max lol,5,1536767113.0
241,241,e5ts53b,t1_e5trel2,11member,use iphon six plus last four year pump event,30,1536725910.0
242,242,e5twve5,t1_e5trel2,Drawerpull,iphon upgrad program pretti great get,1,1536732978.0
243,243,e5u4l7m,t1_e5tzavo,deleted,gimm gimm gimm,1,1536749233.0
244,244,e5ue2ie,t1_e5udhms,exjr_,actual section event megathread thought copi past give sec,2,1536760810.0
245,245,e5ts1a0,t1_e5trm2g,Funkbass,realli hope go max name,34,1536725771.0
246,246,e5tstxg,t1_e5tst53,exjr_,mine,31,1536726812.0
247,247,e5tsymw,t1_e5trhq1,sky_valley,haha perfect reason keep phone spoil anyth keep attent date,10,1536726983.0
248,248,e5tu1fu,t1_e5trhq1,manablaster_,enjoy date good time pay attent date go home enjoy video present fun,5,1536728464.0
249,249,e5tt1nk,t1_e5trhq1,Maverick_2_1,congrat hope goe well,4,1536727095.0
250,250,e5u4g1j,t1_e5trhq1,deleted,call sick work call sick date prioriti enjoy,1,1536748961.0
251,251,e5u0db0,t1_e5tyrue,lhighlen,pretti quick normal coupl hour appl tv almost instant,5,1536739976.0
252,252,e5u0bni,t1_e5tzdo7,lhighlen,womp womp,5,1536739872.0
253,253,e5u4iwx,t1_e5tzdo7,deleted,ipad mini,6,1536749115.0
254,254,e5uf39g,t1_e5u76rt,Danner001,two hour shit dedic,1,1536761736.0
255,255,e5ujagr,t1_e5ugeca,Jaymes97,hell yes,3,1536765323.0
256,256,e5ujgak,t1_e5uhzpf,deleted,fantast amaz,1,1536765460.0
257,257,e5tw306,t1_e5tsl52,bennet99,think see new macbook event mac probabl new ipad pros come event octob could wrong shift product cycl around last year,4,1536731621.0
258,258,e5u3fkt,t1_e5tsl52,nick_pl,dude macbook pros liter releas one month ago,2,1536746936.0
259,259,e5uas1n,t1_e5u78i7,WolfXemo,rd generat ipad readi upgrad haha,1,1536757580.0
260,260,e5uawxj,t1_e5uanm6,WolfXemo,hope itch upgrad,2,1536757721.0
261,261,e5uc8qi,t1_e5uanm6,deleted,yeah realli doubt given lack leak would super nice truli surpris appl hardwar event though,2,1536759070.0
262,262,e5uewuh,t1_e5uej7v,WorldsSleepiestTAway,histor product usual becom avail pre order week launch launch happen week half announc case past two year expect continu,3,1536761576.0
263,263,e5uesof,t1_e5uej7v,aggressiveberries,typic releas new product time announc reserv window etc plan get earli whatev reserv new phone year gonna take time plus main need new imac,1,1536761473.0
264,264,e5uetk6,t1_e5uej7v,Danner001,hear new product avail keynot immedi though,1,1536761494.0
265,265,e5ukjpo,t1_e5uj8d3,jpylus,think usual happen older phone drop dollar one hundr new one come,2,1536766370.0
266,266,e5unqyo,t1_e5un4we,burritosandpuppies,someon correct wrong usual releas week launch like next week,5,1536768982.0
267,267,e5tuyfz,t1_e5tuhi2,exjr_,honest mani leak mani name new iphon lost count cnbc report new iphon xr name,2,1536729815.0
268,268,e5uk9yk,t1_e5ui7y1,deleted,happi birthday,5,1536766143.0
269,269,e5ukfvz,t1_e5ujpb8,haruka34,html indic past event look like might readi yet,2,1536766279.0
270,270,e5ukib6,t1_e5ujpb8,freshwanker,wanna say go code revamp someth,1,1536766337.0
271,271,e5uk90h,t1_e5uk6l4,0superman,see slower mo particular compel featur,2,1536766122.0
272,272,e5tyzi8,t1_e5txz7g,boxheadmoose,yes appl site itun h,2,1536736979.0
273,273,e5u4y29,t1_e5u3he3,narcolept,next tuesday case previous releas,3,1536749877.0
274,274,e5uj925,t1_e5u4ye4,twistsouth,tri make post tell peopl updat event nobodi notic post glad found,2,1536765289.0
275,275,e5udr9d,t1_e5u4zmb,EscapeArtistic,meh hope encourag peopl stop say x start say hold breath,1,1536760523.0
276,276,e5uiz93,t1_e5ubwz3,arex333,introduc appl bag sand dollar one thousand two hundr nineti nine pleas,0,1536765062.0
277,277,e5udbbv,t1_e5ud7kh,slayerhk47,like mine never realli workflow reli function key,1,1536760108.0
278,278,e5ula0l,t1_e5ud7kh,BbCortazan,depend use case use logic x lot slider godsend,1,1536766973.0
279,279,e5uhzr5,t1_e5uhg06,albinorhino4321,probabl next week usual seven day announc,5,1536764227.0
280,280,e5ulzpx,t1_e5uib5d,WolfXemo,tomac link believ,2,1536767549.0
281,281,e5ulycn,t1_e5ujv3a,SenorJiang,xc like xr rd lcd iphon,3,1536767518.0
282,282,e5ukobw,t1_e5uk409,cadams7701,day releas time past,2,1536766476.0
283,283,e5un6ox,t1_e5uk409,dplowman,import like splurg red price hold back,2,1536768518.0
284,284,e5ul4lc,t1_e5ul3zv,exjr_,week,2,1536766850.0
285,285,e5uldmg,t1_e5ul3zv,paraxio,tradit goe public week later gold master essenti final releas avail dev get app updat hard get gm want,1,1536767053.0
286,286,e5un87f,t1_e5um1cg,paraxio,typic favorit part well love get new io softwar typic jump gun get gm releas wait lol ipad run beta pretti stabl happi offici releas,1,1536768553.0
287,287,e5unoed,t1_e5unhdk,mutantpbandj,chanc go new iphon announc event price iphon eight go,6,1536768923.0
288,288,e5u4m25,t1_e5ts9a5,deleted,f,6,1536749275.0
289,289,e5u7d3t,t1_e5u7204,sophias_bush,late lol,7,1536753522.0
290,290,e5uj1lo,t1_e5u7204,arex333,,3,1536765116.0
291,291,e5ueieq,t1_e5ueepk,spectradawn77,curious new dollar two hundr use dollar sell trade old phone get dollar two hundr mark,4,1536761216.0
292,292,e5ukasj,t1_e5ueepk,elephantnut,s still fantast phone improv recent qualiti life chang eye make phone better add cost whole heap money latest stuff,2,1536766162.0
293,293,e5u0fwe,t1_e5txqhh,lhighlen,appl com appl tv even twitter first also follow liveblog berg commentari,2,1536740137.0
294,294,e5u0n40,t1_e5txqhh,bennet99,livestream appl com also appl tv,2,1536740595.0
295,295,e5u0e9c,t1_e5ty2rw,lhighlen,like end month could earli next week normal trend,1,1536740032.0
296,296,e5u1k11,t1_e5u0z9u,SuspiciousHistorian,think appl pay avail physic store,1,1536742683.0
297,297,e5uapfd,t1_e5u0z9u,graphitenexus,tri appl store app iphon show appl pay option think abl use compani discount well though,1,1536757506.0
298,298,e5u5wmo,t1_e5u3s4k,Mikesilverii,friday,2,1536751443.0
299,299,e5u4yew,t1_e5u3s4k,narcolept,x preorder start octob th last year,1,1536749893.0
300,300,e5u79sw,t1_e5u4qy4,SystemSettings1990,offici iphon discord good place,1,1536753404.0
301,301,e5uc75i,t1_e5uc2ll,deleted,think verg usual multipl editor quit humor,0,1536759026.0
302,302,e5uclkz,t1_e5ucbde,Jaymes97,recommend buy non touch bar macbook pro new air lower spec,1,1536759421.0
303,303,e5udb4y,t1_e5ucbde,EscapeArtistic,agre poster air play leagu gonna get much better perform pro much student still student id get nice deal right,1,1536760103.0
304,304,e5ud8c6,t1_e5uco36,EscapeArtistic,dunno abl rewind pretti sure could last year even avail watch entireti afterward,3,1536760030.0
305,305,e5uey2z,t1_e5ucyjt,Danner001,wish luck hope disturb colleagu boss,2,1536761607.0
306,306,e5ul7pi,t1_e5ue7gs,BbCortazan,typic friday night midnight,2,1536766920.0
307,307,e5ulx6r,t1_e5uj7qk,Scubaduba77,plug,1,1536767491.0
308,308,e5ukmvm,t1_e5ukm2w,exjr_,two hour,2,1536766443.0
309,309,e5uleve,t1_e5ulbnr,Danner001,approxim two hour,3,1536767080.0
310,310,e5uodmy,t1_e5ulpzp,Rocksand13,best game ever,2,1536769492.0
311,311,e5unxui,t1_e5unjsr,AyanC,must use netscap navig,10,1536769135.0
312,312,e5unvm2,t1_e5unjsr,devp0ll,yep,1,1536769086.0
313,313,e5uohvf,t1_e5uoaqh,burritosandpuppies,usual goe min fluff appl watch iphon accessori assum ipad appletv today case like iphon,7,1536769587.0
314,314,e5ulb03,t1_e5ud171,BbCortazan,get xs hope,2,1536766995.0
315,315,e5try00,t1_e5trvwt,deadnova,three bezel less notch design current x,4,1536725656.0
316,316,e5ts2k1,t1_e5trvwt,mku1ltra,two ole screen one lcd look like x faceid touchid done besid macbook,1,1536725817.0
317,317,e5u91b6,t1_e5u8dzc,WV_Matsui,disappoint hour start even go watch xb,3,1536755619.0
318,318,e5udk4n,t1_e5u8dzc,EscapeArtistic,hate leak hungri cultur tbh sorri excit could still fun inform regardless,1,1536760336.0
319,319,e5uhlfy,t1_e5u8dzc,narcolept,macbook usual octob event one announc one last year appl skip two year row octob event probabl see macbook imac mini updat ipad sitemap leak could still announc show alongsid announc octob event,1,1536763890.0
320,320,e5udcrj,t1_e5uc76s,EscapeArtistic,also hope updat ipad pros look forward edg edg display artwork,2,1536760146.0
321,321,e5uoeae,t1_e5uo3va,paraxio,probabl abl get easiest next week typic allow week announc actual launch give dev time updat app snag gm essenti final version doabl afternoon would imagin take work,2,1536769506.0
322,322,e5uo9a5,t1_e5uo3va,AshtrayFloors,usual week event,1,1536769393.0
323,323,e5uo9fx,t1_e5uo3va,Gabdra,probabl week consid today gm releas,1,1536769397.0
324,324,e5uobak,t1_e5uo3va,marcodj,usual week lead next iphon releas go week sept th,1,1536769440.0
325,325,e5ukt21,t1_e5uhnfc,ilovethosedogs,probabl though,6,1536766585.0
326,326,e5tz3pl,t1_e5tufha,Howdareme9,name never wrong leak close event,1,1536737221.0
327,327,e5ul2zs,t1_e5uh8ib,jpylus,guess go disappoint dongl friend,1,1536766814.0
328,328,e5u96sd,t1_e5u5ycl,MortimerDongle,hope squar display correct decis think longer appl keep higher chanc manufactur realiz right,3,1536755800.0
329,329,e5u0cjc,t1_e5tz3q9,lhighlen,event name less riddl product releas theme,1,1536739928.0
330,330,e5udp4g,t1_e5u5fzp,EscapeArtistic,iphon usual halfway point general start oper system expect appl tv come first accessori watch iphon one thing gonna happen,1,1536760466.0
331,331,e5trwd4,t1_e5trrn8,deadnova,lcd model rumour xc ole xs xs plus max,5,1536725598.0
332,332,e5u0qtp,t1_e5u0q4f,manablaster_,realli know exact inton heart point,28,1536740835.0
333,333,e5u3aip,t1_e5u0q4f,Mr_JellyBean,best iphon yet,22,1536746636.0
334,334,e5u6eu8,t1_e5try73,Arena__Closer,yep,10,1536752211.0
335,335,e5tus6s,t1_e5tunnh,idigsquirrels,much much expens buy europ,62,1536729552.0
336,336,e5tvcu7,t1_e5tunnh,BBarcelona,would save lot money wait exampl iphon x us cost nine hundr nineti nine dollar wherea spain live cost dollar countri think may even cost,12,1536730440.0
337,337,e5ud3t4,t1_e5tunnh,rubbar,wait statesid even ten percent tax cheaper shop around onlin find websit yet charg sale tax outsid state resid b h photo video adorama come mind bought,1,1536759913.0
338,338,e5u2e0x,t1_e5txo0l,kanimaki,r absolutelynotmeirl,23,1536744613.0
339,339,e5ubzpv,t1_e5uag92,SuccessAndSerenity,,1,1536758822.0
340,340,e5u7bif,t1_e5tsoax,alawmandese,type se confirm,32,1536753466.0
341,341,e5u0wma,t1_e5twsc4,tablepennywad,new se upgrad os welcom,36,1536741201.0
342,342,e5ub93g,t1_e5twsc4,ICA2015,think revis se like would beauti design one best glass back would like iphon five iphon four mix would gorgeous,6,1536758071.0
343,343,e5u551m,t1_e5twsc4,deleted,alway go seven eight price drop,5,1536750215.0
344,344,e5uiizl,t1_e5twsc4,BlackWake9,right torn camera comfort phone,1,1536764680.0
345,345,e5u2p1j,t1_e5tzqkf,Microdoted,optic drive,101,1536745313.0
346,346,e5u3vv8,t1_e5tzqkf,s_madushan,better atleast eight gb ram lol,40,1536747865.0
347,347,e5u6ifg,t1_e5tzqkf,matthewzz1997,three sim card tray,41,1536752357.0
348,348,e5ud00k,t1_e5tzqkf,seanleephoto,one sd card could never shoot wed trash one sd card,5,1536759814.0
349,349,e5uohf4,t1_e5tzqkf,Suck_My_Turnip,remov sd card imagin someth reason,1,1536769577.0
350,350,e5uequb,t1_e5ubgut,Juswantedtono,joke man perfect content use airpod icloud feel need headphon jack sd slot said competit tech compani good us good thing differ phone cater differ prefer,5,1536761426.0
351,351,e5uf5pc,t1_e5ubgut,jimbo831,wow appl subreddit realli someth must new,5,1536761796.0
352,352,e5ugev5,t1_e5ubgut,deleted,,4,1536762879.0
353,353,e5ufbt1,t1_e5ubgut,bunrn,preeeetti sure light heart joke,4,1536761945.0
354,354,e5ug2fi,t1_e5ubgut,deleted,,4,1536762582.0
355,355,e5ukfyf,t1_e5ubgut,Falanax,appl make product mass hardcor techi regular peopl need sd card slot remov batteri thing like appl know custom,1,1536766281.0
356,356,e5ukoak,t1_e5ubgut,deleted,honest absolut hate wire headphon headphon jack push get wireless bless,1,1536766475.0
357,357,e5ujcm3,t1_e5ug3a3,anckentucky,say expect one well awar current map softwar enhanc devic get comment want see other felt,1,1536765373.0
358,358,e5uii8y,t1_e5ufy8v,arex333,interest long term android user say widget overr android featur ever one basic clock widget general find easier use open app realli mind io icon grid either inabl fix bottom instead top,3,1536764662.0
359,359,e5u7qbh,t1_e5u4not,selfoscillation,peopl say letter r come alphabet r less perform one best idea,30,1536753984.0
360,360,e5u5s56,t1_e5u4not,coreyonfire,thing think r regular peopl xs excess peoll xr everyon els,10,1536751248.0
361,361,e5ufide,t1_e5u4not,seanleephoto,higher resolut anyth howev mirrorless long put ef lens xb,1,1536762106.0
362,362,e5ukyr3,t1_e5u4not,Ham54,soni thing minus max,1,1536766717.0
363,363,e5uon6f,t1_e5u4not,minghii,thought meant rainbow color exact mani color begin,1,1536769707.0
364,364,e5un5bm,t1_e5uki15,deleted,iphon wrx incom,2,1536768487.0
365,365,e5ttu18,t1_e5tro60,AdAfterlife,prepar p,24,1536728170.0
366,366,e5u78yb,t1_e5u3ts9,Makegooduseof,least go bed earli go bed p,1,1536753373.0
367,367,e5tt4mc,t1_e5tswpj,nuclear_wynter,stay am watch abl catch event live year want miss,1,1536727205.0
368,368,e5ukhln,t1_e5u4qfx,RoboticChicken,,2,1536766320.0
369,369,e5uk0jx,t1_e5u4qfx,riepmich,aboard lovetrain,1,1536765925.0
370,370,e5tynds,t1_e5ts1mr,pm424,kinda went eight s anticip new phone sure realli need upgrad io twelv make s feel almost like eight,13,1536736314.0
371,371,e5tucjy,t1_e5ts1mr,deadnova,yeah app stay memori realli annoy four gb ram xs go life changer,7,1536728911.0
372,372,e5ulgw6,t1_e5u3zvt,Organicmint,christma sub,1,1536767125.0
373,373,e5uco2r,t1_e5tvkrx,SuccessAndSerenity,necessarili rumor specif includ would appl brand much higher qualiti compet like sennheis etc,3,1536759489.0
374,374,e5umj1v,t1_e5ukymu,burritosandpuppies,unfortun believ,1,1536767978.0
375,375,e5u3bei,t1_e5tx1xa,nick_pl,someon tri feel hz make differ,4,1536746689.0
376,376,e5u3u6w,t1_e5tseus,capsicum_fondler,samsung manufactur panel,18,1536747771.0
377,377,e5uj0lt,t1_e5tseus,Iris786,cough samsung,0,1536765093.0
378,378,e5ueepp,t1_e5udwhc,warboats,yassss lowkey jealous caus sound much fun stream work hahaha get share excit custom colleagu end shift gonna stay three hour away,3,1536761121.0
379,379,e5uihxo,t1_e5ui1iz,11235813_,right appl remov headphon jack least replac readi w chip etc android oem like lol suck use bluetooth bluetooth audio massiv clusterfuck,2,1536764654.0
380,380,e5uly4d,t1_e5uiudn,11235813_,mine use get work day batteri app tend hang second done trick cach clear factori reset etc remain either old buggi,1,1536767513.0
381,381,e5un08q,t1_e5u5qw5,DucAdVeritatem,curious sweat major threat current model,1,1536768371.0
382,382,e5ts9lh,t1_e5ts53b,nuclear_wynter,man gonna quantum leap plan upgrad year six plus hold batteri need replac,14,1536726071.0
383,383,e5tuvbq,t1_e5ts53b,moosewi,send launch iphon six plus still halfway tempt replac batteri keep chug touchscreen act get caught hype anyway mad,1,1536729684.0
384,384,e5tvppi,t1_e5ts1a0,Oo0o8o0oO,hope bring whole product line pickup macmax maxipad,25,1536731009.0
385,385,e5tyq7o,t1_e5ts1a0,WhatsUpBras,sorri disappoint,-1,1536736470.0
386,386,e5tsus2,t1_e5tstxg,metroidmen,gotta close ring,6,1536726843.0
387,387,e5txkgn,t1_e5tstxg,TheReacher,riski click day,5,1536734250.0
388,388,e5u3xpi,t1_e5tu1fu,MeanPete,tip watch video afterward without encount spoiler assum go appl com watch alreadi seen releas,1,1536747968.0
389,389,e5uf8ol,t1_e5uf39g,dranide,stomach start bubbl still eat breakfast got lot nasti mcdonald sausag co worker brought stale hospit orang juic brought peanutbutt nutella sandwhich lunch sandwich around ice metaphor cake most cake let shit,2,1536761867.0
390,390,e5ufxjs,t1_e5u3fkt,jimbo831,read want macbook pro want rumor new smaller cheaper macbook,3,1536762467.0
391,391,e5ub63k,t1_e5uawxj,ICA2015,two thousand fifteen ipad pro put io twelv beta run amaz ever slow issu ever share sheet slow display,2,1536757983.0
392,392,e5uixpy,t1_e5uc8qi,ICA2015,yeah whatev happen surpris hope one thing,1,1536765027.0
393,393,e5ulsg5,t1_e5ukjpo,hugocosta,yeap usual howev time may take differ approach like year appl introduc iphon s succeed iphon iphon c like iphon five steroid way also cheaper manufactur think year might someth similar iphon xs iphon xs succeed iphon x iphon xr remain afford option,2,1536767386.0
394,394,e5tv2ij,t1_e5tuyfz,linizue,huh cmd f ed page see xr articl besid url typo permalink,1,1536729990.0
395,395,e5ukkpc,t1_e5ukfvz,inno7,un appl like readi yet mean cue airpow mat thing readi autocapit phone,2,1536766392.0
396,396,e5ukmxc,t1_e5uk90h,Falanax,compel previous iphon either appl still improv,3,1536766444.0
397,397,e5tz0gg,t1_e5tyzi8,tyunga24,thank,1,1536737032.0
398,398,e5u0exb,t1_e5tyzi8,lhighlen,also appl tv one appl event app,1,1536740074.0
399,399,e5umjyp,t1_e5ulycn,deleted,yeah op alreadi mention xr main post,1,1536767998.0
400,400,e5un5lb,t1_e5uldmg,BonusCode,ah got yeah thank,1,1536768493.0
401,401,e5uoclk,t1_e5unoed,jscalise,thank friend listen much appl news,3,1536769469.0
402,402,e5ujc86,t1_e5uj1lo,bafrad,team unnecessari r android section dedic android news discuss pretend kind team entiti invit side honesti cringey fuck phone ident,0,1536765365.0
403,403,e5uf2cp,t1_e5ueieq,crudos_na,depend look bought s practic new box accessori dollar two hundr coupl year ago probabl keep s back use music player car someth like trade valu great point,2,1536761713.0
404,404,e5u37e9,t1_e5u0e9c,deleted,cheer,1,1536746450.0
405,405,e5uaswf,t1_e5uapfd,SaintTDI,yes app problem also appl web site safari appl pay button epp appl websit,1,1536757604.0
406,406,e5u6teh,t1_e5u5wmo,ironpandas,gotcha complet new tri get iphon launch haha got new job actual afford one launch prior experi time,1,1536752793.0
407,407,e5ucxnf,t1_e5u5wmo,ttay24,releas usual follow friday,1,1536759749.0
408,408,e5u8t69,t1_e5u79sw,13cmtaller,thank join,2,1536755343.0
409,409,e5udext,t1_e5uc75i,EscapeArtistic,nilay snark get sometim though,1,1536760202.0
410,410,e5udis4,t1_e5ud8c6,eption_,know watch afterward mean wait hour abl start watch minut start hope rewind thank,2,1536760302.0
411,411,e5uop2m,t1_e5ulx6r,HoodedxSaints,macbook hdmi port,1,1536769750.0
412,412,e5uolgz,t1_e5unxui,Rageino,well safari,1,1536769667.0
413,413,e5uompd,t1_e5uohvf,mp5251,thank forgot ipad next month usual extra io detail reveal,1,1536769697.0
414,414,e5udm34,t1_e5udk4n,RaXXu5,guess releas macbook sooner later,1,1536760386.0
415,415,e5u4nlh,t1_e5tz3pl,deleted,iphon se kinda right usual right though mayb past name scheme predict,1,1536749354.0
416,416,e5udqd5,t1_e5u0qtp,ElectroclassicM,xb train ai recreat appl keynot,1,1536760500.0
417,417,e5u7gym,t1_e5u3aip,skeeterldr2004,realli think gonna love,21,1536753656.0
418,418,e5ul2uy,t1_e5u6eu8,deleted,three,1,1536766810.0
419,419,e5tvrzf,t1_e5tus6s,LorenzoBundy,get sale tax back airport non european,11,1536731112.0
420,420,e5tvpwi,t1_e5tvcu7,bennet99,germani euro tax alreadi includ us one dollar euro moment,6,1536731018.0
421,421,e5ufich,t1_e5ubzpv,AndreiWeb,romanian keyboard layout turn press alt cap lock press behav press alt shift result doubl quot,0,1536762105.0
422,422,e5uh34r,t1_e5u7bif,Mgreen19295,dozen us,9,1536763458.0
423,423,e5uii9z,t1_e5u7bif,ThatOneNomad,real og,3,1536764662.0
424,424,e5u4qrk,t1_e5u0wma,General_Joshington,insan differ io,14,1536749517.0
425,425,e5udfh0,t1_e5u0wma,Stronghold257,differ,3,1536760215.0
426,426,e5uc1rg,t1_e5u0wma,SuccessAndSerenity,welcom welcom welcom,-1,1536758878.0
427,427,e5ud8lo,t1_e5u2p1j,slayerhk47,optic drive also come floppi drive need work spreadsheet one thousand nine hundr nineti two dammit,31,1536760037.0
428,428,e5unhuw,t1_e5u3vv8,TheJimPeror,kind paltri system run expect thirti two gb abil partit ram drive,1,1536768774.0
429,429,e5uk61f,t1_e5u6ifg,Roc_Ingersol,one guy knew need fourth anyth less profit appl price much one part cost anyway,11,1536766052.0
430,430,e5ufael,t1_e5uf5pc,Worth_The_Squeeze,actual correct came android subreddit someon invit peopl android subreddit come connect launch new bunch iphon,2,1536761910.0
431,431,e5ui6na,t1_e5ugev5,Worth_The_Squeeze,yo android user give android user bad name thank would say world move sd card headphon jack yet someth need replac altern exact effect avail simpli case headphon jack sd card furthermor headphon jack aux jack liter univers standard transport audio signal go nowher fast world even close move noth far capabl replac sd card probabl one featur electron devic world share result incred use imagin ever worri storag without pay fortun luxuri imagin abl easili plug play massiv amount data vast differ devic noth world right even remot univers use xb xb,-5,1536764387.0
432,432,e5ufeur,t1_e5ufbt1,Worth_The_Squeeze,joke get old use th time also realli ignor lot peopl believ evid userbas buy appl product offer littl featur option consum,-1,1536762021.0
433,433,e5uiyxr,t1_e5ug2fi,Worth_The_Squeeze,say horribl even talk phone talk featur one actual say devic peopl love horribl liter call everi singl android smartphon junk compar junk android push hypocrit,2,1536765054.0
434,434,e5ugimb,t1_e5ug2fi,StartCraft3,liter said noth could constru manner,0,1536762971.0
435,435,e5umpor,t1_e5ukoak,Worth_The_Squeeze,great smartphon headphon jack still use bluetooth well anyon els tri wire pair option tri wireless pair choic magic thing person pair wire headphon love abl proper use smartphon even headphon jack even abl use small pair earphon proper day devic tri wireless pair phone still use bluetooth someon wireless pair decid buy qualiti set wire headphon realli use proper smartphon,1,1536768129.0
436,436,e5ujmli,t1_e5uii8y,deleted,yeah feel s calendar weather googl keep widget agre usual easier go app,1,1536765609.0
437,437,e5uipzl,t1_e5u7qbh,Iris786,android oneplus joke around name devic instead make point superior devic guess chines taken appl market depart shoot product unit,4,1536764847.0
438,438,e5ud5i2,t1_e5u7qbh,churs_rs,read could someth word realiti hodgepodg augment realiti virtual realiti,6,1536759957.0
439,439,e5ua9fp,t1_e5u5s56,IsTim,iphon ropey peopl dub c cheap one guess r budget end nicknam someth unfavour indic less good model,3,1536757026.0
440,440,e5uo158,t1_e5un5bm,EastCoast2300,id buy,2,1536769209.0
441,441,e5ug3mz,t1_e5ttu18,deleted,,5,1536762613.0
442,442,e5ttjiu,t1_e5tt4mc,deleted,stay am watch peopl would go bed earli get am run am head work whatev although suspect got work commit consid pull nighter wa am awkward time hard go bed earli enough get decent sleep am finish late get decent sleep work,1,1536727764.0
443,443,e5ul7ts,t1_e5tynds,Ham54,realli help grant s use io help batteri life,2,1536766923.0
444,444,e5ujell,t1_e5uco2r,Drawerpull,damn could awesom,2,1536765420.0
