,Unnamed: 0,Comment ID,Parent ID,Author,Body,Score,Created (UTC)
445,445,e5uhl4f,t1_e5u3bei,compwiz1202,crazi action game sport think anyth rapid movement smoother,1,1536763882.0
446,446,e5uiq2c,t1_e5u3bei,arex333,someon tri mean general ui fluiditi normal ipad pretti snappi tablet tri scroll around ui next ipad pro feel like stutteri mess comparison respons finger crazi good,1,1536764849.0
447,447,e5uhufz,t1_e5u3u6w,NihlusKryik,refresh rate part panel control chip,1,1536764102.0
448,448,e5uiuvt,t1_e5uihxo,Knightwolf15,exact b w px got credit card reward program good everyth normal dollar four hundr headphon bleh make sure aptx ldac aac least fun xb xb,2,1536764959.0
449,449,e5tyhrt,t1_e5ts9lh,Fanytastic,iphon six user check yep replac batteri earlier year seem work well enough sinc three thousand recharg cycl previous batteri work pretti good compar batteri replac realli look forward upgrad howev hope deliv edit actual x recommend amount,8,1536736002.0
450,450,e5tu64f,t1_e5ts9lh,EastCoast2300,respond ill upgrad xs six ive sinc week came super pump full phone replac littl year ago mess screen repair batteri wait gorgeous screen camera batteri life face id touch id gen one least pretti slow suuuuper finicki,4,1536728652.0
451,451,e5tvtqm,t1_e5ts9lh,11member,might look replac batteri soon recent phone freez quit bit switch everi hope io twelv batteri replac help last anoth coupl year keep spare babi,2,1536731193.0
452,452,e5tzh78,t1_e5ts9lh,GalantisX,upgrad quantum leap would upgrad sixteen gb iphon six,1,1536738005.0
453,453,e5twjh1,t1_e5tvppi,Funkbass,lol peopl make maxipad joke back origin ipad name announc imagin joke appl actual bring word max adjac product line describ larger size model serious sound far similar mac feel wise enough avoid sure heart rumor also find odd realli heard week lead announc,12,1536732400.0
454,454,e5u48jo,t1_e5u3xpi,manablaster_,save link livestream page readi browser beforehand reload page later readi watch,2,1536748565.0
455,455,e5ub8us,t1_e5ub63k,WolfXemo,rd generat ipad let say itch hard ignor haha,2,1536758064.0
456,456,e5tv7ea,t1_e5tv2ij,exjr_,look like chang titl titl saw news written googl,2,1536730203.0
457,457,e5tv2px,t1_e5tv2ij,deleted,think look,-2,1536730000.0
458,458,e5ukrb8,t1_e5ukkpc,ilovethosedogs,hahaha classic appl,0,1536766544.0
459,459,e5ukni5,t1_e5ujc86,arex333,word imo r android appl stuff subscrib r appl see nice invit thread r android peak interest come see go say invit android sub team anyth someth peopl normal discuss event come take look,1,1536766457.0
460,460,e5ucedo,t1_e5uaswf,graphitenexus,well take free airpod eur discount easili,1,1536759225.0
461,461,e5ulgpf,t1_e5udis4,BbCortazan,good stuff usual toward end anyway first twenti minut usual appl ecosystem cheerlead bring rep compani upcom app,2,1536767121.0
462,462,e5uoryk,t1_e5uompd,burritosandpuppies,depend hardwar relat exampl d touch portrait mode reveal respect wwdc instead save iphon keynot could potenti see someth along line,1,1536769814.0
463,463,e5uj8h3,t1_e5udqd5,riepmich,someth wrong comput repeat best aluminium ever made think gonna love na ai write next appl keynot,2,1536765274.0
464,464,e5ujxgd,t1_e5u7gym,deleted,best thing happen iphon sinc iphon,3,1536765856.0
465,465,e5uo1q9,t1_e5ul2uy,d33thr0ughts,four,2,1536769223.0
466,466,e5twu7l,t1_e5tvrzf,Althestrasz,slim amount even disregard tax currenc exchang unfavor,28,1536732921.0
467,467,e5tzels,t1_e5tvpwi,BBarcelona,euro convert dollar sale tax free state would definit much cheaper us even assum tax would cost dollar still two hundr dollar cheaper tax exempt return price differ may much,4,1536737855.0
468,468,e5u838a,t1_e5tvpwi,legionsanity,us cheap tax probabl,1,1536754456.0
469,469,e5ulwq4,t1_e5uh34r,Sxcred,love mine sometim,3,1536767481.0
470,470,e5ufl33,t1_e5udfh0,deleted,io eleven lot perform problem assum probabl feel larg portion io twelv meant bring back perform across larger rang phone experi may vari,7,1536762169.0
471,471,e5ufzn5,t1_e5ud8lo,funderbunk,actual work android,14,1536762516.0
472,472,e5ufh8a,t1_e5ufael,jimbo831,sub tank appl everi featur devic dumb pointless appl add brilliant best thing ever sd storag dumb appl sell expens memori upgrad sub care appl bottom line appl user lot especi announc day place shit show crazi today,2,1536762078.0
473,473,e5uiq8i,t1_e5ui6na,deleted,,2,1536764853.0
474,474,e5ukixs,t1_e5ui6na,Falanax,world move headphon jack period wireless futur peopl care audio qualiti care conveni wireless deliv,0,1536766352.0
475,475,e5ufor1,t1_e5ufeur,johnyahn,imagin listen android user complain featur one care though,8,1536762256.0
476,476,e5un36c,t1_e5ud5i2,deleted,face realiti afford expens phone,5,1536768437.0
477,477,e5uk719,t1_e5ud5i2,RoboticChicken,issu xs rang probabl better suit ar due dual camera rumour better perform,2,1536766075.0
478,478,e5unx6h,t1_e5ug3mz,camdoodlebop,plan,1,1536769121.0
479,479,e5ttq76,t1_e5ttjiu,nuclear_wynter,suspect got work commit consid pull nighter work start pm base past preced think stay late sleep fuck margin less get earli,1,1536728018.0
480,480,e5tu4g7,t1_e5ttjiu,manablaster_,am super tough good luck,1,1536728583.0
481,481,e5ulqbw,t1_e5uhufz,iChao,,1,1536767339.0
482,482,e5unvb3,t1_e5tyhrt,janusface,three thousand charg cycl mani time per day go entir batteri insan,1,1536769080.0
483,483,e5u4mfy,t1_e5u48jo,MeanPete,link livestream saw anoth user post link open chrome say site reach perhap come aliv right start page contain video livestream,1,1536749295.0
484,484,e5ubar1,t1_e5ub8us,ICA2015,oh yeah def need new one long rock one rememb got one screen blew away ipad retina amaz,2,1536758117.0
485,485,e5tv8t5,t1_e5tv7ea,linizue,guess bound happen flock write articl asap time year crazi busi report,1,1536730264.0
486,486,e5ucl0m,t1_e5ucedo,SaintTDI,yes cours even get free airpod five hundr euro spent sixti day groceri one transact xs sell euro easili alreadi airpod anoth twenti six euro discount bad,1,1536759406.0
487,487,e5ucbj1,t1_e5tzels,deleted,european countri vat ignor exchang rate dollar nine hundr nineti nine model dollar factor hedg exchang rate fluctuat larg compani use forward contract expens plus eu wide distribut cost etc add anoth dollar one hundr cheap appl sell appl like hey european custom gullibl let charg anyth european price sensit lower incom due higher tax dispos incom way lower usa fact japan hong kong cheaper australia despit high incom appl price approxim extra usa advertis non tax price despit fact gst,1,1536759146.0
488,488,e5ukbwo,t1_e5ufl33,Stronghold257,actual felt pretti content phone perform,3,1536766187.0
489,489,e5ummo8,t1_e5ufzn5,notHelpFullatAll,oh god giddi love,2,1536768058.0
490,490,e5ukm6w,t1_e5ufh8a,deleted,bro two thousand ten anymor stop argu appl vs android fan,-2,1536766427.0
491,491,e5ullzi,t1_e5uiq8i,Worth_The_Squeeze,bluetooth cloud exist thing sd card headphon jack cloud store file access whim bluetooth headphon play music mic bluetooth better altern headphon jack headphon jack loss transfer music bluetooth even today standard even close lossless playback mean bluetooth carri signific audio qualiti loss furthermor bluetooth much expens simpli wire connect result bluetooth offer wors audio qualiti wire price point entir point buy product made produc sound bluetooth also issu connect drop someth simpli happen use wire connect bluetooth requir use batteri make product bulkier heavier bluetooth devic much lower life expect especi sinc earphon headphon even replac batteri result fact li ion batteri deterio signific cycl happen everi time use charg last pair headphon earphon batteri mean one thing need charg forget might even abl play music headphon wire pair headphon ever worri work bluetooth know audio industri encompass smartphon right instrument compon amplifi think connect bluetooth massiv audio qualiti loss everyth connect aux jack loss drop connect except billion phone sold without first electron devic encompass smartphon talk camera laptop tablet s tvs second vast smartphon sold sd card slot without dollar net one hundr gb storag either googl fortun probabl refrain buy smartphon first place peopl prefer data full control instead give googl also inconveni necessit internet access order simpli access file addit slower go onlin load file simpli much faster memori phone last instal load app sd card possibl cloud sd card much versatil effici cloud plug devic world smartphon furthermor transfer data instant sd card load devic howev necessit electron devic use app access thing cloud servic well internet connect lot electron devic sd card slot good luck transfer file camera smartphon camera access googl cloud servic furthermor cloud servic compress file ruin qualiti sd card embarrass agre reason xb xb,1,1536767242.0
492,492,e5ufx36,t1_e5ufor1,Worth_The_Squeeze,d touch headphon jack univers standard within audio world sd card even broader liter flexibl compact plug play storag electron devic find use therefor also,0,1536762456.0
493,493,e5tu41y,t1_e5ttq76,deleted,fair call work hour like probabl skip live announc year am awkward work,1,1536728568.0
494,494,e5uobze,t1_e5unvb3,Fanytastic,sound insan went back check email actual x recommend amount brain fart somehow combin two number togeth,1,1536769456.0
495,495,e5ubi8n,t1_e5ubar1,WolfXemo,sinc month came still pretti much condit day got someon want get app develop need someth littl current,1,1536758333.0
496,496,e5ucwgw,t1_e5ucl0m,graphitenexus,ohh right thought need one eur transact case would take eur discount put expens month appl pay difficult hit five hundr get twenti six extra well,1,1536759717.0
497,497,e5unmnk,t1_e5ummo8,SoarinPastTheMoon,guy energi vibe real unscrupul data floppi lol,3,1536768883.0
498,498,e5ugb50,t1_e5ufx36,johnyahn,yeah peopl care need sd card care headphon jack thing say agre decis thing also need need storag use wireless headphon android user unus three inch thick phone mah batteri mani input fit phone one go make phone featur like fifteen peopl genuin want,4,1536762792.0
499,499,e5uc97u,t1_e5ubi8n,ICA2015,that awesom glad given mani year servic new one huge differ size plan get,2,1536759082.0
500,500,e5ud90d,t1_e5ucwgw,SaintTDI,yep think two month drug store six hundr euro famili hope discount offer xs tomorrow sure appl reserv new product epp program,1,1536760048.0
501,501,e5uio5g,t1_e5ugb50,Worth_The_Squeeze,yeah peopl care need sd card care headphon jack thing actual accord made percentag number actual case peopl care sd card headphon jack wanna know anoth fun fact statist made trust need storag appl liter coerco degre liter tell need storag incred android user unus three inch thick phone mah batteri mani input fit phone ever seen android phone life think might leav subreddit go real world one go make phone featur like fifteen peopl genuin want yeah call flagship android smartphon xb,2,1536764803.0
502,502,e5uch6l,t1_e5uc97u,WolfXemo,person fine anoth inch ipad lie said inch ipad pro radar,2,1536759302.0
503,503,e5ue5kb,t1_e5ud90d,graphitenexus,yeah may low prioriti list sell,1,1536760889.0
504,504,e5uciwk,t1_e5uch6l,ICA2015,wait long get pro pro app develop,2,1536759348.0
505,505,e5ue9ku,t1_e5ue5kb,SaintTDI,yes think tri time see date give,1,1536760991.0
506,506,e5ucq3h,t1_e5uciwk,WolfXemo,may persuad appl cement decis nice upgrad haha,2,1536759545.0
507,507,e5uctsg,t1_e5ucq3h,ICA2015,well announc today hope get event octob,2,1536759645.0
508,508,e5uczmm,t1_e5uctsg,WolfXemo,inde total fine wait anoth month one right plus justifi earli christma present,2,1536759804.0
509,509,e5ud2tv,t1_e5uczmm,ICA2015,haha yes way plus appl releas like christma anyway,2,1536759888.0
510,510,e5ud7ow,t1_e5ud2tv,WolfXemo,certain,2,1536760013.0
