,Unnamed: 0,Comment ID,Parent ID,Author,Body,Score,Created (UTC)
0,0,e5tttzz,t3_9f4ge7,manablaster_,wait latest dose good morn xd,141,1536728168.0
1,1,e5trcym,t3_9f4ge7,deleted,happi guy,479,1536724924.0
2,2,e5tskpd,t3_9f4ge7,Stronghold257,could realli successor se,238,1536726471.0
3,3,e5tw2hy,t3_9f4ge7,Exambolor,mojav releas date announc tommorow,32,1536731597.0
4,4,e5twdtr,t3_9f4ge7,greyhair_,hope name iphon bad rumor report,58,1536732134.0
5,5,e5twyn0,t3_9f4ge7,Juswantedtono,person hope dollar one hundr nineti nine iphon come android two headphon jack usb port make r technolog fall love appl,403,1536733140.0
6,6,e5tv4vl,t3_9f4ge7,anckentucky,know io improv year year seen sever redesign sinc incept help feel like grow stale visual realli readi redesign visual interfac know want someth littl differ someth give devic new feel,23,1536730093.0
7,7,e5tuc0i,t3_9f4ge7,EastCoast2300,super excit event still rock six sinc week came first upgrad four year s desper tri convinc upgrad s worth kinda small wrist abl go smaller option still retain screen space would definit plus sinc imo forti two mm look bit big wrist airpow wireless airpod case probabl due cost probabl pick wireless charger xs,23,1536728886.0
8,8,e5tuw72,t3_9f4ge7,beretta01,rais glass promot,49,1536729722.0
9,9,e5ttxxs,t3_9f4ge7,AvatarGastonGlock,rumor name say aloud iphon ten iphon ten see iphon ten ess max pleas name,136,1536728324.0
10,10,e5trgt2,t3_9f4ge7,AdAfterlife,stay til am watch worth tokyo right,85,1536725058.0
11,11,e5tw3w3,t3_9f4ge7,Matuteg,wonder date avail pre order last year iphon x delay henc iup one month earli event make us pay extra month actual releas pre order sinc annual upgrad everyon iup iphon x launch day without pay extra month,15,1536731663.0
12,12,e5trgfa,t3_9f4ge7,Bambinooo,bring hype,29,1536725044.0
13,13,e5truk4,t3_9f4ge7,deadnova,iphon six readi buri space grey iphon xs io twelv help littl feel slow even compar friend s one gb ram kill,76,1536725536.0
14,14,e5ts9kf,t3_9f4ge7,burritosandpuppies,like christma eve happi appl xsmax mean xmas,52,1536726071.0
15,15,e5txbv4,t3_9f4ge7,deleted,,24,1536733807.0
16,16,e5ttv9o,t3_9f4ge7,thnok,xs iphon iphon xr iphon xc iphon xs max xb,34,1536728218.0
17,17,e5tvhg7,t3_9f4ge7,Tamagogo,go wake tokyo think excit appl watch announc phone,9,1536730639.0
18,18,e5twp76,t3_9f4ge7,IceCreaaams,feel like someon grew s charg name scheme max s thing,8,1536732680.0
19,19,e5tzf91,t3_9f4ge7,GalantisX,work abl watch what best way watch entir thing,8,1536737891.0
20,20,e5tucxe,t3_9f4ge7,burritosandpuppies,random thought seem total forgotten rumor appl come pair ear headphon doubt anyth like come tomorrow interest nevertheless,26,1536728926.0
21,21,e5trysq,t3_9f4ge7,okkkkaaaayyyyyyy,hope someth excit xs besid addit larger screen standard processor upgrad hope camera sensor size improv advanc display hz,20,1536725685.0
22,22,e5u2b5a,t3_9f4ge7,deleted,,15,1536744429.0
23,23,e5udl34,t3_9f4ge7,warboats,work appl store singapor equal stoke well go stream one local time appl retail staff excit,6,1536760360.0
24,24,e5ufyk9,t3_9f4ge7,11235813_,pretti excit event got og pixel phone show age seem find android replac decent music connect usb c bt go lag free box sidenot fuck android oem copi notch goddamn reason one new phone half decent price probabl go jump ship grab phone featur want reliabl hq music connect lag box notch damn good reason pixel line everyth want piss took away,8,1536762490.0
25,25,e5u15vz,t3_9f4ge7,LuanReddit,everyth eager see airpod two gonna releas main updat could see happen better rang siri potenti heat rate nois cancel featur,6,1536741790.0
26,26,e5udpcm,t3_9f4ge7,NYKnickerbocker2,dark mode,6,1536760472.0
27,27,e5uedht,t3_9f4ge7,Comedicjustice,chanc new macbook would announc usual event octob,5,1536761091.0
28,28,e5ul8i7,t3_9f4ge7,PointlessTrivia,prepar keynot appropri beverag,6,1536766939.0
29,29,e5trel2,t3_9f4ge7,nuclear_wynter,whatev name new flagship model sold i got rrp back sure hope whatev announc hour worth use iphon six sixteen gb new phone ship,25,1536724980.0
30,30,e5u32nu,t3_9f4ge7,ADefiantGuy,excit see appl watch seri go huge upgrad sinc current use seri,9,1536746162.0
31,31,e5tzavo,t3_9f4ge7,Warzzimus,gimm se,5,1536737641.0
32,32,e5u0vse,t3_9f4ge7,Shockwavepulsar,excit io launch date announc love x minut realli see point upgrad although appl watch tempt,5,1536741148.0
33,33,e5u26n2,t3_9f4ge7,McGeeFeatherfoot,beat sixteen gb se die day ago good time there noth sidegrad one hundr twenti eight gb se shame never made product red se,6,1536744131.0
34,34,e5udhms,t3_9f4ge7,ThePotatoRage,mod probabl creat watch section,4,1536760272.0
35,35,e5un840,t3_9f4ge7,deleted,appl love ya girl name true gonna need intervent,6,1536768551.0
36,36,e5unat2,t3_9f4ge7,unitedfuck,wait see bunch phone afford,5,1536768613.0
37,37,e5trm2g,t3_9f4ge7,GrenobleLyon,offici hashtag appleev appl tweet iphon xs max xs plus sure name appl watch seri function diabet peopl non invas blood sugar measur thank,16,1536725244.0
38,38,e5tst53,t3_9f4ge7,metroidmen,bodi readi,12,1536726782.0
39,39,e5trhq1,t3_9f4ge7,gruuz,look forward event sinc present iphon x first date year mean happi today anyway hope see great stuff,14,1536725089.0
40,40,e5tvlak,t3_9f4ge7,PhD_V,preorder start friday drool,3,1536730810.0
41,41,e5tyrue,t3_9f4ge7,Thirdsun,quick question abl stream event immedi conclud get home two hour start wonder abl watch whole thing immedi done rememb correct appl take day hour offer stream event end,4,1536736561.0
42,42,e5tzdo7,t3_9f4ge7,Superserhat546,feel bad ipod touch,5,1536737802.0
43,43,e5u6grk,t3_9f4ge7,MoonStache,thank invit r android let see store know look upgrad excit,4,1536752291.0
44,44,e5u76rt,t3_9f4ge7,dranide,figur ill take long shit work gotta make believ time drive thru fast food breakfast,3,1536753291.0
45,45,e5ugeca,t3_9f4ge7,nermal543,appl event today nintendo direct tomorrow gonna good coupl day,4,1536762867.0
46,46,e5uhzpf,t3_9f4ge7,AcrobaticMoment,r xb tim cook start morn,5,1536764226.0
47,47,e5unpr0,t3_9f4ge7,UserM16,excit disappoint anoth sheep pay roof new iphon,4,1536768955.0
48,48,e5tsl52,t3_9f4ge7,spoilz,money save new laptop anxious await announc tomorrow around dollar wait see stick recent updat macbook pros give one new macbook air announc tomorrow serious look much leak new laptop anxious await event,6,1536726486.0
49,49,e5u78i7,t3_9f4ge7,nwpa97,wait see new ipad releas today,3,1536753356.0
50,50,e5uanm6,t3_9f4ge7,ICA2015,realli hope new ipad noth sitemap leak feel like happen wonder octob event,3,1536757452.0
51,51,e5uej7v,t3_9f4ge7,GarfieldSighs3,appl store product avail immedi never purchas appl product launch curious estim long take look get xs watch seri,3,1536761237.0
52,52,e5uhwl2,t3_9f4ge7,compwiz1202,pleas announc airpow complet etc,3,1536764152.0
53,53,e5uj8d3,t3_9f4ge7,thebasementtapes,anyon know appl like offer cheaper iphon x upgrad program xs announc got thing stop go x price,3,1536765272.0
54,54,e5un4we,t3_9f4ge7,deleted,,3,1536768477.0
55,55,e5tucyc,t3_9f4ge7,MyNameIsDan_,need new phone year s android product look bit disappoint hardwar end pixel three look horrend probabl go new iphon x whatev call year acclim io way asid lack open file system okay much appreci smooth everyth run without need tweak get hand dirti though part need reliabl phone take realli good pictur accord first appl event excit decid want regular size plus size,3,1536728927.0
56,56,e5tuhi2,t3_9f4ge7,linizue,iphon xr typo,3,1536729114.0
57,57,e5tvhnl,t3_9f4ge7,jakirk01,pump new watch s year someon goe exercis lot look get cellular need lug phone around run ride bring music stream wrist,3,1536730647.0
58,58,e5ui7y1,t3_9f4ge7,dr_diagnosis,today birthday wife got airpod sweetheart talk wait airpod two least charg case guess excus preorder new watch airpod appl tv later today muahaha,5,1536764417.0
59,59,e5ujpb8,t3_9f4ge7,inno7,concern websit blue color arrow bottom left intern forget get code peer review,4,1536765670.0
60,60,e5uk6l4,t3_9f4ge7,Falanax,k fps p fps slow mo call,4,1536766065.0
61,61,e5umcbu,t3_9f4ge7,Kosrock,excit see iphon tenni iphon tenni match iphon tenax,5,1536767827.0
62,62,e5txz7g,t3_9f4ge7,tyunga24,two question watch full event start right finish long event usual go thank guy,2,1536735023.0
63,63,e5ty7ol,t3_9f4ge7,crowquillpen,would love ipad pro textur surfac paper like,2,1536735467.0
64,64,e5tyjrt,t3_9f4ge7,llothar,appl product plan market follow better iphon wors headphon jack alway excit see next,2,1536736112.0
65,65,e5u0mlw,t3_9f4ge7,JammyHendrix,anyon germani berlin bought iphon launch day chanc pick one go onlin go store restock work need new phone wait new iphon cba wait two month actual avail,2,1536740561.0
66,66,e5u3he3,t3_9f4ge7,TeboeCubes,wait io twelv actual releas,2,1536747043.0
67,67,e5u4ye4,t3_9f4ge7,h6nry,anybodi creat gather round keynot bingo yet nevermind alreadi date readi today event,2,1536749892.0
68,68,e5u4zmb,t3_9f4ge7,deleted,xr xs xs max name confirm thought,2,1536749953.0
69,69,e5u5apt,t3_9f4ge7,deleted,macbook air retina version,2,1536750477.0
70,70,e5ubwz3,t3_9f4ge7,deleted,care announc today buy,2,1536758747.0
71,71,e5ud7kh,t3_9f4ge7,the_shining_ryan,issu touch bar realli necessari,2,1536760010.0
72,72,e5uewk9,t3_9f4ge7,brandnamenerd,need coffe buzz morn,2,1536761569.0
73,73,e5ufjtw,t3_9f4ge7,sportsfan161,shame pros,2,1536762140.0
74,74,e5uhg06,t3_9f4ge7,cyberguijarro,recent bought aw three iphon set hardwar want os updat releas asap today tomorrow,2,1536763763.0
75,75,e5uib5d,t3_9f4ge7,BMANN2,stream link put vlc,2,1536764493.0
76,76,e5uig7v,t3_9f4ge7,ThatOneNomad,hope crappi internet fail event,2,1536764613.0
77,77,e5ujv3a,t3_9f4ge7,deleted,xc mean xs,2,1536765802.0
78,78,e5uk409,t3_9f4ge7,asalways88,iphon eight price drop pre order date whenev actual day new phone hit store,2,1536766006.0
79,79,e5ukxz3,t3_9f4ge7,hugocosta,hope see intern love today like news tv app lte watch avail three four countri,2,1536766699.0
80,80,e5ul3zv,t3_9f4ge7,BonusCode,io twelv releas follow event today like tomorrow,2,1536766836.0
81,81,e5um1cg,t3_9f4ge7,stiggie,happi final get io big fan need devic reliabl work iphon beta softwar free also wife recent got iphon wait see reaction get bunch free upgrad previous android stay experi came box die,2,1536767584.0
82,82,e5umkmv,t3_9f4ge7,geechan,excit new watch let gooooo,2,1536768013.0
83,83,e5un0fk,t3_9f4ge7,thenumba1negro,vlc link earli,2,1536768376.0
84,84,e5unhdk,t3_9f4ge7,jscalise,still use iphon new iphon announc hope iphon eight go price bit upgrad,2,1536768763.0
85,85,e5ts9a5,t3_9f4ge7,ben10bhimavaram,iphon c sixteen gb die week back,4,1536726061.0
86,86,e5u5zda,t3_9f4ge7,GeorgioAntonio,give two thousand eighteen macbook air boiiiii,4,1536751558.0
87,87,e5u7204,t3_9f4ge7,bafrad,pleas put invit thread r android like team,4,1536753117.0
88,88,e5tvkia,t3_9f4ge7,Toprelemons,iphon xs hype,2,1536730775.0
89,89,e5u54ae,t3_9f4ge7,deleted,updat se pls thank tim,2,1536750177.0
90,90,e5ueepk,t3_9f4ge7,crudos_na,glad see new iphon said upgrad s s year pay dollar two hundr phone matter new iphon mean price older model drop,2,1536761121.0
91,91,e5unq4b,t3_9f4ge7,paraxio,doubt announc present hope good trade deal new iphon galaxi s like seem love could get good valu trade new iphon glad jump miss io,2,1536768963.0
92,92,e5tuwh5,t3_9f4ge7,hocotate,curious line go name first look like still go keep se s feel like axe x point sinc lot phone juggl,1,1536729734.0
93,93,e5tvo4w,t3_9f4ge7,baymaxums,great job thread info peopl need one spot,1,1536730938.0
94,94,e5txj9e,t3_9f4ge7,Chair_Toaster,itshappen gif,1,1536734189.0
95,95,e5txqhh,t3_9f4ge7,Defined_Boss,anybodi know watch live appl offici livestream case blog updat confer goe,1,1536734558.0
96,96,e5ty2rw,t3_9f4ge7,deleted,mojav like releas nah,1,1536735209.0
97,97,e5tzxws,t3_9f4ge7,letsgodowntownnow,excit need reason upgrad never appl watch version might one hope nice littl one last thing,1,1536739010.0
98,98,e5u0obq,t3_9f4ge7,Shockwavepulsar,sad think new ipad pro today shame get day one ipad three larger paperweight minut enough rumour leak announc imo howev finger cross octob event,1,1536740676.0
99,99,e5u0z9u,t3_9f4ge7,SaintTDI,hi corpor benefitsali epp compani buy appl product iphon x two hundr fifti six gb twenti six euro would like use new xs today need buy appl pay offer bank receiv free airpod spend five hundr euro applepay look could use appl pay window pc possibil way use appl link corpor benefitsali epp safari iphon seven plus tri buy iphon x payment method found credit card find appl pay method someon help p sorri english,1,1536741368.0
100,100,e5u31a0,t3_9f4ge7,GaeMarkus,time final upgrad s still go strong io twelv beta new batteri though,1,1536746077.0
101,101,e5u3s4k,t3_9f4ge7,ironpandas,think iphon pre order live today coupl day,1,1536747655.0
102,102,e5u4a3a,t3_9f4ge7,hatpatprot,expect xr xb,1,1536748647.0
103,103,e5u4qy4,t3_9f4ge7,13cmtaller,hi wonder telegram channel group follow live updat appl event,1,1536749526.0
104,104,e5u4uqi,t3_9f4ge7,itsaride,go broadcast live youtub imagin watch hour start begin youtub live dvr function would perfect know go twitter,1,1536749712.0
105,105,e5u4wx2,t3_9f4ge7,SMIDG3T,seri four airpow iphon x near perfect phone think skip year unless someth groundbreak unlik,1,1536749821.0
106,106,e5u5kzk,t3_9f4ge7,melbrooksbrothers,small part soul hold hope usb c quick charg announc,1,1536750938.0
107,107,e5u6mu6,t3_9f4ge7,Asking4Afren,super excit iphon seven crack know fix let see new iphon offer either fix screen buy,1,1536752535.0
108,108,e5ub978,t3_9f4ge7,sastarbucks,anyon know audio feed would great,1,1536758073.0
109,109,e5uc0c7,t3_9f4ge7,deleted,meet pm est,1,1536758839.0
110,110,e5uc2ll,t3_9f4ge7,TingleMaps,best live blog coverag,1,1536758901.0
111,111,e5ucbde,t3_9f4ge7,the_shining_ryan,guy think likelihood announc new mac air look get first appl comput put hope new air releas current five year old ts thinkpad love want someth much better batteri life excit make switch mac will pay whatev suprem web surf machin prefer air open get pro well would guy recommend most use stream surf internet play leagu legend occasion,1,1536759141.0
112,112,e5ucmf0,t3_9f4ge7,ttay24,abl rewind stream,1,1536759444.0
113,113,e5uco36,t3_9f4ge7,eption_,anyon rememb last year whether rewind live stream start watch one hour event,1,1536759489.0
114,114,e5ucyjt,t3_9f4ge7,Rambo_Jones2,hope great day watch work wish luck,1,1536759775.0
115,115,e5udiho,t3_9f4ge7,deleted,dollar macbook let gooo,1,1536760295.0
116,116,e5ue7gs,t3_9f4ge7,bamaman34,site usual go live preorder look final use iup never order phone earli possibl,1,1536760938.0
117,117,e5ufnao,t3_9f4ge7,Rambo_Jones2,haha thank enjoy event,1,1536762222.0
118,118,e5ug5e9,t3_9f4ge7,RKilbane20,usb c,1,1536762656.0
119,119,e5uggjm,t3_9f4ge7,ShizzleNL,anyon got direct link stream use smart tv,1,1536762921.0
120,120,e5uh8em,t3_9f4ge7,the_one_true_bool,hang base model iphon six sixteen gb storag ever sinc came wait next iphon keep happi next year generat could mayb sure yet know matter phone end futur exact thing smartphon year basic storag camera upgrad,1,1536763582.0
121,121,e5uj7qk,t3_9f4ge7,HoodedxSaints,appl tv pack move way stream event lg smart tv without,1,1536765257.0
122,122,e5ukf36,t3_9f4ge7,asliceofkiwi,excit week raven sunday play thursday get order new airpod let go,1,1536766261.0
123,123,e5ukm2w,t3_9f4ge7,simianforce,anyon know long event run,1,1536766425.0
124,124,e5ul7l2,t3_9f4ge7,curiocritters,gosh wait,1,1536766917.0
125,125,e5ulbnr,t3_9f4ge7,graeme_b,anyon know long usual last,1,1536767009.0
126,126,e5ulpzp,t3_9f4ge7,whatsforsupa,day one preorder iphon xs max whatev call trade valu sixti four gb s good anymor probabl keep abl play pokmon go two phone lol,1,1536767332.0
127,127,e5ulx74,t3_9f4ge7,Trav1989,one year forc upgrad cours first year sinc gs broken phone minor crack across screen disabl home button look get repair weekend least get enjoy new io watch os tvos,1,1536767491.0
128,128,e5unjsr,t3_9f4ge7,Rageino,stream event use browser day,1,1536768818.0
129,129,e5unrlh,t3_9f4ge7,AshtrayFloors,random question anyon rememb video appl show believ two thousand one hundr eight wwdc guy unplug cabl plug phone caus kind havoc song background rather funni draw blank could specif wrong thank,1,1536768996.0
130,130,e5uoaqh,t3_9f4ge7,mp5251,anyon rememb product usual go first ipad macbook softwar know phone probabl last curious ill tie est,1,1536769427.0
131,131,e5uobt9,t3_9f4ge7,I_Am_Now_Anonymous,omg handl verg live blog discuss phone batteri stanchion upsid photo,1,1536769452.0
132,132,e5uocg9,t3_9f4ge7,ranting_swede,guess know soon paus live stream come back say est,1,1536769466.0
133,133,e5ttco9,t3_9f4ge7,ypsm,time aliv,1,1536727509.0
134,134,e5twfls,t3_9f4ge7,HorologicallyInsane,let gooooooo readi get monster say goodby realli hope call max though,1,1536732218.0
135,135,e5ud171,t3_9f4ge7,deleted,disappoint max least better camera,1,1536759844.0
136,136,e5trfub,t3_9f4ge7,Bonedidly,realli hope use rumor name convent remind differ car model l lx lxt etc,1,1536725024.0
137,137,e5trvwt,t3_9f4ge7,IXGhOsTX1,follow news three new iphon screen like x one finger print reader front,1,1536725583.0
138,138,e5u8dzc,t3_9f4ge7,RaXXu5,event seem bit disappoint xb hope new macbook ipad unless announc someth realli excit new phone watch updat x get aswel seem like there anyth worth watch xb unless one thing wait week add new thing site get leak,1,1536754831.0
139,139,e5ubw1n,t3_9f4ge7,Chraaas,pretti excit ipad last ipad still thirti pin connector,1,1536758722.0
140,140,e5uc76s,t3_9f4ge7,adamrammers,hope ipad pro updat current comput burgl hold fresh jump day look like go bit disappoint though,1,1536759028.0
141,141,e5uo3va,t3_9f4ge7,deleted,idea io twelv avail download beta full version,1,1536769271.0
142,142,e5uhnfc,t3_9f4ge7,akkellan,skip class today event worth,0,1536763935.0
143,143,e5tufha,t3_9f4ge7,EastCoast2300,final name guess imo absolut way go xs max think iphon xs iphon iphon xs plus iphon plus iphon xc iphon c either name left name right,-2,1536729030.0
144,144,e5u96g8,t3_9f4ge7,espressojunkie,gather round everyon hit wallet decid move mic around call new design charg dollar,-2,1536755790.0
145,145,e5uh8ib,t3_9f4ge7,JohanDeWitt,quit excit replac se said realli need headphon jack got expens headphon bluetooth stream good stabl trusti wire,0,1536763584.0
146,146,e5u5ycl,t3_9f4ge7,TurboTommyX,mayb gonna see circular appl watch,-1,1536751516.0
147,147,e5tz3q9,t3_9f4ge7,deleted,,0,1536737222.0
148,148,e5u5fzp,t3_9f4ge7,spacemate,due time zone differ use one hour lunch break work see event most interest iphon part event start am pdt anybodi know long typic take start talk iphon know less start lunch break decid start,0,1536750717.0
149,149,e5uniqx,t3_9f4ge7,devp0ll,heavi googl user pixel owner keep close eye camera new iphon vast improv may jump back iphon first time sinc g,0,1536768794.0
150,150,e5trrn8,t3_9f4ge7,UghKakis,wait ole call xc,-6,1536725434.0
151,151,e5truvt,t3_9f4ge7,maxeljulio,hope bring back headphon jack put side phone,-9,1536725547.0
152,152,e5u0q4f,t1_e5tttzz,HDxMASTER,good morn,45,1536740789.0
153,153,e5u4heq,t1_e5tttzz,TheEggRoller,happi,17,1536749032.0
154,154,e5u871l,t1_e5tttzz,ahumanmadethis,readi man phil schiller address leak tongu cheek way believ seen anyth yet,13,1536754588.0
155,155,e5ukjjp,t1_e5tttzz,asliceofkiwi,good morn everyon today special,2,1536766366.0
156,156,e5try73,t1_e5trcym,deleted,,95,1536725664.0
157,157,e5tunnh,t1_e5trcym,Dyinu,europ two week think worth buy phone watch europ,25,1536729362.0
158,158,e5txo0l,t1_e5trcym,ahuiP,happi aliv,28,1536734429.0
159,159,e5u5rkz,t1_e5trcym,Alexhasskills,made,4,1536751225.0
160,160,e5uag92,t1_e5trcym,AndreiWeb,,1,1536757233.0
161,161,e5ue47e,t1_e5trcym,thepontiff_,say drunken smile,1,1536760855.0
162,162,e5uhrca,t1_e5trcym,luis1789,wholesom happi,1,1536764026.0
163,163,e5ujjhe,t1_e5trcym,GhostalMedia,brown iphon,1,1536765536.0
164,164,e5ukjn7,t1_e5trcym,ittofritto,hi guy,1,1536766368.0
165,165,e5u4u9o,t1_e5trcym,TIP_ME_COINS,first appl event excit,1,1536749689.0
166,166,e5umjac,t1_e5trcym,masklinn,past year event underwhelm liter expect whatsoev guess pretti good chanc disappoint edit hahaha sucker event shit expect,0,1536767983.0
167,167,e5tsoax,t1_e5tskpd,vaporwave_enthusiast,amen,48,1536726604.0
168,168,e5twsc4,t1_e5tskpd,Imagopher,limit amount money realli hope new se lower price ergonom great everythingapplepro made video coupl month ago potenti se two glass back screen front finger cross,28,1536732831.0
169,169,e5tzx4v,t1_e5tskpd,rydan,want bought origin iphon two thousand seven receiv septemb bought s unfortun upgrad year phone form factor time,6,1536738961.0
170,170,e5ued9t,t1_e5tskpd,philphan25,screen master race check se would day one buy,2,1536761085.0
171,171,e5ukeje,t1_e5tskpd,BbCortazan,origin announc event come probabl earli next year,2,1536766248.0
172,172,e5udccu,t1_e5tskpd,lakelifeisbestlife,bought se month ago want anyth bigger hate facial recognit se dope,1,1536760135.0
173,173,e5ukeao,t1_e5tskpd,deleted,yup hope get bigger phone soon,1,1536766243.0
174,174,e5unm3u,t1_e5tskpd,BBarcelona,last mohicans,1,1536768871.0
175,175,e5tyh6k,t1_e5tw2hy,Gamer_Chase,like,10,1536735969.0
176,176,e5uik20,t1_e5tw2hy,ThatOneNomad,hope wait sinc got mac,1,1536764706.0
177,177,e5uo6t4,t1_e5tw2hy,epsiblivion,probabl last week month week th unless delay bug fix earli octob,1,1536769337.0
178,178,e5ul5yn,t1_e5twdtr,BankruptOnSelling_,appl keynot meme give,2,1536766881.0
179,179,e5tzqkf,t1_e5twyn0,KnightDragonHawk,forget remov batteri sd card,159,1536738566.0
180,180,e5u8ap8,t1_e5twyn0,ahumanmadethis,throw quadhd display screen mah batteri got deal,19,1536754716.0
181,181,e5ubbp0,t1_e5twyn0,deleted,buy iphon year unless eight track player,22,1536758144.0
182,182,e5ub54f,t1_e5twyn0,pvoluitd,iphon x,6,1536757955.0
183,183,e5ugb2s,t1_e5twyn0,deleted,underr comment,1,1536762791.0
184,184,e5umo0o,t1_e5twyn0,dangerflakes,settl one headphon jack,1,1536768090.0
185,185,e5ubgut,t1_e5twyn0,deleted,,-7,1536758292.0
186,186,e5u4hsz,t1_e5tv4vl,deleted,io next wwdc littl refresh ui would super cool,14,1536749053.0
187,187,e5u0d7l,t1_e5tv4vl,Potatopolis,settl abl put icon want instead enforc left align,21,1536739969.0
188,188,e5udrnt,t1_e5tv4vl,deleted,come next year unfortun postpon radic design overhaul implement io io focus sole perform improv judg beta realli succeed depart,2,1536760533.0
189,189,e5ug3a3,t1_e5tv4vl,jimbo831,io twelv alreadi announc june use sinc beta expect redesign go serious disappoint,2,1536762604.0
190,190,e5ufy8v,t1_e5tv4vl,deleted,guess one weirdo love home screen grid layout want lose sake chang howev would nice evolut io let us replac row icon two row icon widget like widget alway forget hide left,1,1536762483.0
191,191,e5uair7,t1_e5tuc0i,CBreezy2010,s seri new watch watch list right probabl upgrad christma eye set new phone whether x predecessor probabl x though cost save month phone lol,2,1536757308.0
192,192,e5uelfr,t1_e5tuw72,deathbyitaliano,oh feel like underr thing talk might thing notic,11,1536761292.0
193,193,e5ui1t4,t1_e5tuw72,arex333,r android realli hope high refresh display becom common phone asap appl usual stuff first razer asus game phone high refresh screen pretti much everi brand follow suit happi pixel xl plan keep anoth year googl threw hz display pixel three think could hold,10,1536764273.0
194,194,e5u4not,t1_e5ttxxs,flamingllama33,realli get call r higher resolut anyth anyth wors other,28,1536749359.0
195,195,e5uki15,t1_e5ttxxs,KrakenUnchained,appl start sound like car compani r model,2,1536766330.0
196,196,e5tro60,t1_e5trgt2,Noerdy,ouch expect,40,1536725316.0
197,197,e5tunyi,t1_e5trgt2,deleted,bangkok worst possibl time am thursday read news event commut tomorrow morn,10,1536729375.0
198,198,e5ts7oo,t1_e5trgt2,lijohn,watch small discuss base class life find way,18,1536726003.0
199,199,e5u2piy,t1_e5trgt2,Eggyhead,osaka go go bed wake earli enough watch work,3,1536745343.0
200,200,e5u38ik,t1_e5trgt2,Mr_JellyBean,rip start am sydney,1,1536746518.0
201,201,e5u3ts9,t1_e5trgt2,s_madushan,wake earli am auckland nz,1,1536747749.0
202,202,e5u7flq,t1_e5trgt2,educo_,china fourth year stay haha help,1,1536753610.0
203,203,e5uavpv,t1_e5trgt2,deeiks,europ luckili perfect time pm,1,1536757686.0
204,204,e5uimbv,t1_e5trgt2,ThatOneNomad,long event last start pm live,1,1536764759.0
205,205,e5tswpj,t1_e5trgt2,sky_valley,still sure wether stay sleep check morn go instead,1,1536726913.0
206,206,e5tub2e,t1_e5trgt2,Tamagogo,luckili work till,1,1536728849.0
207,207,e5tvevv,t1_e5trgt2,jihanki-kei,tokyo differ prefectur contempl whether want stay work next day mayb take huge nap beforehand haha,1,1536730527.0
208,208,e5u1hvg,t1_e5tw3w3,cocothepops,like friday preorder paid eleven month iup current phone believ pay differ paid eleven month upgrad earli,8,1536742546.0
209,209,e5u4qfx,t1_e5trgfa,h6nry,aboard hype train,5,1536749501.0
210,210,e5u3m64,t1_e5trgfa,AVVG,drank coffe night stay focus later event,2,1536747321.0
211,211,e5ts1mr,t1_e5truk4,nuclear_wynter,use iphon six day sold eight plus xs crazi know know actual pleasant usabl io two gb ram realli would amaz devic,23,1536725783.0
212,212,e5tzgm9,t1_e5truk4,GalantisX,fuck wait ditch person go xr,1,1536737970.0
213,213,e5ua0ea,t1_e5truk4,loldudester,wait price drop x ditch,1,1536756747.0
214,214,e5u3zvt,t1_e5ts9kf,NikeSwish,think meant tenma,17,1536748092.0
215,215,e5u0m51,t1_e5txbv4,bennet99,probabl octob,10,1536740532.0
216,216,e5u5t1i,t1_e5txbv4,mhall85,yes pleas,3,1536751286.0
