,Unnamed: 0,Comment ID,Parent ID,Author,Body,Score,Created (UTC)
522,522,ezue0qd,t1_ezu1tyf,gumbercules6,came knew would top comment like year like everi year phone releas thread iphon smartphon matur product way new laptop realli generat new excit well way chang next paradigm shift,25,1568150343.0
523,523,ezvi9hf,t1_ezu1tyf,mister-capybara,wonder name event innov least innov appl event memori corporatespeak got appl head,2,1568179258.0
524,524,eztzz4z,t1_eztzjpx,xokocodo,mani video get take nice pictur,154,1568142441.0
525,525,ezu0eey,t1_eztzjpx,TimTri,new camera liter import addit phone think ad third len implement new fanci process softwar support made camera bump look differ could market new design made back glass matt destroy premium look x xs,107,1568142716.0
526,526,ezu2ubc,t1_eztzjpx,MightBeJerryWest,shit outta thing talk quick roll video,4,1568144285.0
527,527,ezu4aic,t1_eztzjpx,Ddragon3451,say film two lens kind cool thing know audienc target parent toddler hard pick right zoom keep frame run around nice abl backup zoom version sometim sure limit pro model though thing gave huh kind neat feel keynot,4,1568145131.0
528,528,ezu15gf,t1_eztzfj9,DizzyAcanthocephala,euro sixti four gb insan,113,1568143201.0
529,529,ezujm4y,t1_eztzfj9,iiElysiumx,serious start phone one hundr twenti eight gb price,7,1568153717.0
530,530,ezv3c9o,t1_eztzfj9,Captain_cranky_au,aud dollar one thousand eight hundr nineti nine sixti four gb pro max much fuck laptop,2,1568166122.0
531,531,ezw5677,t1_eztzfj9,We1tfunk,least keep dollar gb option wish add pro accept even compromis feel right pay dollar one hundr fifti metric fuck ton storag need use option give realli piss appl happi throw storag upgrad feel like pay mid tier phone middl slot lineup seen huge upgrad thirti two gb gs s s sixti four gb s one hundr twenti eight gb wherea low tier flagship remain sixteen gb way gs seven upgrad thirti two gb wors qualiti storag thank care appl,2,1568208195.0
532,532,ezu2z1h,t1_eztzfj9,pandabubblepants,see complaint lot consid phone power user three year phone thirti two gb left storag space sixti four gb model honest question fill phone disclaim agre baselin storag,3,1568144369.0
533,533,ezux8xq,t1_eztzfj9,zerostyle,drop upgrad price dollar two hundr dollar one hundr fifti though alway like,1,1568162624.0
534,534,ezu3628,t1_eztzkjd,deleted,,136,1568144494.0
535,535,ezu09uf,t1_eztzkjd,BigBlueDane,tv thing hype,119,1568142634.0
536,536,eztzw0c,t1_eztzkjd,MaGNeTiX,yup new screen someth actual surpris rest fair standard expect realli,87,1568142384.0
537,537,eztzta2,t1_eztzkjd,barktreep,rememb even differ screen faster,125,1568142335.0
538,538,ezu02i0,t1_eztzkjd,JohnAppleMacintosh,ipad os,7,1568142502.0
539,539,ezu5o8n,t1_eztzkjd,DeeVeeOus,came away think dollar one hundr nineti nine seri three highlight price point tv close second,3,1568145841.0
540,540,ezu3tep,t1_eztzkjd,SuccessAndSerenity,last year watch four blew away anyth els show,2,1568144879.0
541,541,ezu8ap7,t1_eztzkjd,h2lmvmnt,watch four highlight last year,2,1568147237.0
542,542,ezuab4z,t1_eztzkjd,yuriydee,lost seri two ocean swim yeah like dumbass know actual excit new watch agre,2,1568148310.0
543,543,ezu08sm,t1_eztzkjd,ZtereoHYPE,except sleep track,1,1568142616.0
544,544,ezud5hl,t1_eztzkjd,PicturesOfBalls,yep switch back io land pixel xl think go watch five dollar five hundr nineti nine iphon xr excit alway watch big price drop xr care wide angl camera seem like a bionic still better android processor expect xr last,1,1568149864.0
545,545,ezuzcis,t1_eztzkjd,XtremePhotoDesign,would agre said alway screen kind prefer privaci screen come look,1,1568163766.0
546,546,ezv8wta,t1_eztzkjd,maxstolfe,dollar month appl tv,1,1568170353.0
547,547,ezvdneb,t1_eztzkjd,polikuji09,linus liter plan tri iphon caus thought appl watch look realli cool chang want,1,1568174435.0
548,548,ezvnfql,t1_eztzkjd,Squif-17,think anyon saw alway display come soon chat pre keynot expect anyth seri five four big redesign say alway display counter one key critic devic pretti damn big,1,1568186114.0
549,549,ezvpdjd,t1_eztzkjd,AriwakeTheGeek,ipad highlight wish student discount avail spain,1,1568189222.0
550,550,eztzoe9,t1_eztzilm,FakeBohrModel,septemb th,129,1568142248.0
551,551,ezu09j8,t1_eztzilm,deleted,,40,1568142629.0
552,552,eztzpov,t1_eztzilm,Squeaky_squeakyninja,,8,1568142271.0
553,553,eztzpht,t1_eztzilm,shazhank3385,yeah mention miss wait ipad os pro,5,1568142267.0
554,554,eztzm1k,t1_eztzfal,Fiti99,plus one asshol spam clown emoji noth done edit wrong guy ban,75,1568142205.0
555,555,eztzk39,t1_eztzfal,vieman,yeah terribl idea,143,1568142170.0
556,556,eztznqr,t1_eztzfal,deleted,,30,1568142236.0
557,557,eztzpsp,t1_eztzfal,dysgraphical,mod test reddit new live chat featur comment use old reddit com comment appear lock display regular real time chat feed new reddit offici reddit app,34,1568142273.0
558,558,ezu0740,t1_eztzfal,Iredditfromwork,made thread absolut cesspool,7,1568142586.0
559,559,eztzy9u,t1_eztzfal,deleted,appropri shit keynot,12,1568142425.0
560,560,ezu03io,t1_eztzfal,I_throw_hand_soap,appl relat lock,3,1568142520.0
561,561,eztzy5j,t1_eztzfal,exjr_,discord like experi admin invit us tri purpos made old reddit third parti app show lock comment experi design chat type thing told sub go happen sunday take guy surpris,45,1568142422.0
562,562,eztzksb,t1_eztzfal,EvilLukeSkywalker,hey mod answer us coward,24,1568142183.0
563,563,ezu001h,t1_eztzfal,blackiechan99,internet janitor unnecessari bad idea love see,5,1568142457.0
564,564,ezu1hjg,t1_eztzfal,2a0c40,push use shitti reddit app shitti new reddit web chat thing,1,1568143416.0
565,565,ezu2jke,t1_eztzfal,ledessert,sooo reddit want fuck third parti app,1,1568144093.0
566,566,ezu3bs6,t1_eztzfal,cbfw86,lol reddit tri forc competit joke,1,1568144594.0
567,567,eztzoli,t1_eztzfal,TheReacher,live chat featur explain event happen reddit version discord like experi,1,1568142251.0
568,568,eztztac,t1_eztzfym,Mc_Lovin81,hold steadi ya see reason upgrad moment held long enough ip switch ipx,94,1568142335.0
569,569,ezu0mb7,t1_eztzfym,I_Am_Now_Anonymous,new batteri get two year,9,1568142857.0
570,570,ezu0btz,t1_eztzfym,SwarlesSparkleyyy,got plus fuck screen wonder get fix,13,1568142670.0
571,571,ezu1uw8,t1_eztzfym,robinisbatman,even though new camera stuff tempt realli worth either also x two hundr fifti six gb love thing batteri capac hold quit well though batteri life notic less got could someth io thirteen beta though gonna wait see like full stabl releas come,3,1568143653.0
572,572,ezu3esh,t1_eztzfym,Lord-Lannister,definit plan iphon x truli someth love own sinc first month launch would last three year easi special batteri updat give away niec someth honest think famili least five year long io updat get support anyway right,3,1568144648.0
573,573,ezua7u4,t1_eztzfym,Tsukune_Surprise,see zero reason upgrad underwhelm keynot filler materi bad game deep dive camera well know els turn iphon eleven reveal got batteri health iphon x fine,3,1568148261.0
574,574,ezupwjt,t1_eztzfym,Quin1617,yeah anyon eight higher realli reason get want new design x xr much cheaper two thousand twenti year upgrad rumor right even x last least xr xs eleven last even longer,2,1568158310.0
575,575,eztztew,t1_eztzfym,Brokendreams0000,still appl care warranti probabl finess appl refurbish x free make anoth year x,6,1568142338.0
576,576,eztzzij,t1_eztzfym,Mr_FixShit,s next year miss,5,1568142447.0
577,577,ezu07ze,t1_eztzfym,ampinjapan,thought mine health,4,1568142601.0
578,578,ezu08de,t1_eztzfym,helloitisgarr,yeah lol batteri realli thing bother,2,1568142608.0
579,579,ezu0j4z,t1_eztzfym,lukedfb,think go get new batteri screen s sixti four gb upgrad next year iphon twelv,2,1568142800.0
580,580,ezu24a1,t1_eztzfym,deleted,,1,1568143821.0
581,581,ezu2bu8,t1_eztzfym,ThePlaidJaraffe,mine go batteri life horribl nowher near day got new two year ago,1,1568143955.0
582,582,ezu2ppf,t1_eztzfym,anthr76,incred unhappi batteri life x readi upgrad get batteri case fact thing realli special k price tag camera disappoint honest usb c jack j would twice excit guess cool appl watch final alway,1,1568144205.0
583,583,ezu41v4,t1_eztzfym,draekia,still seven plus interest upgrad point faceid cool cool,1,1568145008.0
584,584,ezu540v,t1_eztzfym,Falanax,mine,1,1568145549.0
585,585,ezu6lhf,t1_eztzfym,EmptyHead25,mean iphon s,1,1568146335.0
586,586,ezuhhtc,t1_eztzfym,chochazel,think go get new batteri x two hundr fifti six gb upgrad next year iphon twelv hold even better camera,1,1568152347.0
587,587,ezujgxj,t1_eztzfym,iiElysiumx,well appar two thousand twenti iphon big one see thing like p display screen finger print scanner smaller even notch ole line,1,1568153613.0
588,588,ezumg1f,t1_eztzfym,JohrDinh,still s get new phone batteri come iphon twelv drop get far behind wait life chang differ lol,1,1568155745.0
589,589,ezuoaor,t1_eztzfym,deleted,,1,1568157109.0
590,590,ezv3i5f,t1_eztzfym,InclusivePhitness,boat problem phone crack everywher also get sim instal messag time time honest think iphon base model great between phone,1,1568166241.0
591,591,ezv64c9,t1_eztzfym,Subredhit,two year next year would thought,1,1568168170.0
592,592,ezvnmeu,t1_eztzfym,Tallkotten,thirti two gb iphon seven realli hope innov year usb c yet year tim reus much possibl mess suppli line smart bore hold see pixel four store otherwis might buy upgrad thirti two gb get far,1,1568186392.0
593,593,ezvp3do,t1_eztzfym,v0y4932,mean iphon s pro,1,1568188750.0
594,594,ezu0ezh,t1_eztzfym,deleted,,1,1568142727.0
595,595,ezvrhlx,t1_ezu4e7o,rmonik,fair iphon hold way better time innov kind stagnat phone everyth peopl would want phone reason hold one year back day iphon g look like cheap toy compar new,1,1568192810.0
596,596,ezup0jv,t1_ezu3vz2,WhyNotBatman,except seri four,10,1568157647.0
597,597,ezuyqsx,t1_ezu3vz2,HanzoHouse,bout buy eight se got email amazon se dollar one hundr nineteen,2,1568163444.0
598,598,ezvnmm6,t1_ezu3vz2,Squif-17,funni heard close releas iphon five g stupid buy one want five g next year,1,1568186401.0
599,599,eztzuh5,t1_eztzefe,coreyonfire,rumor mill realli shit bed year,289,1568142357.0
600,600,ezu1943,t1_eztzefe,treemeista,wait til see,25,1568143266.0
601,601,ezu04xe,t1_eztzefe,voltxre,lol actual thought gonna tile thing nope,85,1568142546.0
602,602,ezu3a2a,t1_eztzefe,BourgeoisShark,jacki,1,1568144564.0
603,603,eztzgrz,t1_eztzei2,deleted,,196,1568142110.0
604,604,eztzj4b,t1_eztzei2,irridisregardless,even pro model,104,1568142153.0
605,605,eztzgs5,t1_eztzei2,silentsnake09,understat right rip noth pro level sixti four gb,184,1568142110.0
606,606,eztzo9y,t1_eztzei2,RoboYoshi,wait till see new ipad thirti two gb stock,61,1568142246.0
607,607,ezu27wj,t1_eztzei2,robinisbatman,disgust even thought make pro base storag sixti four gb go boast video capabl k make base model sixti four gb ridicul much footag could even record half hour truli rip imo,29,1568143884.0
608,608,ezu4qr2,t1_eztzei2,unsteadied,nickel dime nonsens like realli turn appl use problem justifi price poor handl qualiti issu late across various product macbook pro keyboard anyon sixti four gb dollar pro phone get difficult,15,1568145357.0
609,609,ezu68up,t1_eztzei2,Zabanais,peopl sloowli realiz appl milk consum everyway lol,6,1568146145.0
610,610,ezu9llg,t1_eztzei2,blueturtle00,consid cheap ssd day appl charg absurd,3,1568147928.0
611,611,ezu9yib,t1_eztzei2,Various-Artist,tri discount overal agre peopl actual use much storag got biggest iphon x came never liber download yet even thirti six gb use,2,1568148123.0
612,612,ezu0fj7,t1_eztzei2,SwarlesSparkleyyy,profession need one shot get right realli go need extra storag,3,1568142737.0
613,613,ezu0ux7,t1_eztzei2,Swade009,forget expand memori,1,1568143009.0
614,614,ezu5buy,t1_eztzei2,PorkRollAndEggs,list cheaper price free phone deal start dollar xxx model use cost,1,1568145660.0
615,615,ezu7r86,t1_eztzei2,DOME2DOME,noth person still make money,1,1568146950.0
616,616,ezueul9,t1_eztzei2,caityb34,seven plus g god bless cloud way hell would much shit phone much,1,1568150819.0
617,617,ezvpv0y,t1_eztzei2,4shtonButcher,still sell f ing non upgrad pro macbook one hundr twenti eight gig storag hobbi photograph might abl unload holiday photo singl trip onto brand new macbook pro without even instal softwar edit actual pro stuff imho max everyth rang ridicul price almost everyth overpr toy,1,1568190030.0
618,618,ezu8g3h,t1_eztzei2,baldeagleNL,keep repeat lot peopl need sixti four gb think sixti four eleven fine understand howev sixti four gb pro model,1,1568147313.0
619,619,ezu0v6p,t1_eztzei2,i_spot_ads,,1,1568143013.0
620,620,ezvklc8,t1_eztzei2,AxeellYoung,one last three iphon own never fill sixti four gb obsess need space storag mani app actual need xb edit agre space storag incred cheap especi low gb count,1,1568182105.0
621,621,ezumrm7,t1_eztzei2,3927729,ehm hello earth inde liter market techniqu nobodi forc use low storag phone know bad option liter product price one hundr one one undesir option get man everi year complaint,0,1568155980.0
622,622,ezucpm1,t1_eztzei2,striedinger,hell peopl need two hundr fifti six gb phone jesus power user hard fill macbook,-1,1568149614.0
623,623,eztzpfp,t1_eztzei2,Pepsidudemike,peopl get mid tier one know,-2,1568142266.0
624,624,ezu3fa3,t1_eztzei2,cbfw86,say need much storag averag consum,-8,1568144656.0
625,625,ezu2648,t1_ezu0pkg,mellofello808,pretti funni tbh usual much leviti r appl also went onto r android invit us sure expect happen,18,1568143853.0
626,626,ezu6jw1,t1_ezu0pkg,Iredditfromwork,lot happen hood noth innov ux feel like appl innov long time sinc adopt strategi bring perfect technolog market,1,1568146311.0
627,627,ezvqs6r,t1_ezu21ms,Deadmeat5,honest feel like drag feet purpos get coupl year other alreadi said smartphon matur without complet new paradim els add bet next year go three camera four new innov thing keep sixti four gb year noth new add drop sixti four gb new thing also bet know still tri drag phone thing long hope time liter noth warrant new hardwar version year servic taken much bottom line thing need concentr announc someth new area,0,1568191603.0
628,628,ezu2cu7,t1_eztzfib,deleted,watch sinc probabl two thousand eight definit worst appl live event ever wit,44,1568143973.0
629,629,eztzndu,t1_eztzfib,iamseiko,soooo mani video,199,1568142230.0
630,630,eztzuvu,t1_eztzfib,Pepsidudemike,mani video none interest weirdest point art galleri show middl keynot,65,1568142364.0
631,631,ezu0n4t,t1_eztzfib,cheanerman,mani video guest speaker game app one ever use,62,1568142872.0
632,632,ezu3be2,t1_eztzfib,fatcowxlivee,must talk camera half total present time iphon felt like e amount stretch point polish ad roll guest speaker,17,1568144587.0
633,633,eztznl7,t1_eztzfib,Jewrisprudent,total agre expect pretti low keynot sake keynot septemb mean done anyth keynot worthi last year super disappoint,131,1568142234.0
634,634,ezu3ug3,t1_eztzfib,faja10,past year date news wwdc iphon event bore event like yea alreadi knew move year avoid everi event leak info past two week knew noth expect bore like hell first ok arcad appletv price quit low nice macbook mac pros sinc iphon icamera,6,1568144895.0
635,635,eztzok7,t1_eztzfib,brdsqd,agre pretti dishearten next year better bombshel,16,1568142251.0
636,636,ezvdgv9,t1_eztzfib,jayplus707,final free watch tell even bother base announc seem like snoozefest mayb us fan usual go rabid right keynot let alway perhap decent keynot,2,1568174274.0
637,637,ezu5dnc,t1_eztzfib,hotairbabboon,mean show camera app realli impress use camera capac honest would expect pay much iphon eleven pro,2,1568145685.0
638,638,ezugrj5,t1_eztzfib,RonaldoMessiCrouch,think last year wors xs show bigger x upgrad camera realli,1,1568151923.0
639,639,ezv0zo3,t1_eztzfib,tundrat,chip design weird thing show keynot custom use know feel like filler content either well programm seem like realli impress engin fun hear yeah felt like way much photo video demo usual,1,1568164642.0
640,640,ezvpnt3,t1_eztzfib,cleanutility,yeah realli agre phone camera chip bump upgrad gonna stick x anoth year think,1,1568189694.0
641,641,ezu3o2v,t1_ezu0am1,theylineupfordays,think gonna hold onto x seem like worth upgrad,12,1568144798.0
642,642,ezu3uae,t1_ezu0am1,Trosso,nobodi care,-7,1568144892.0
643,643,ezu8e6q,t1_ezu0am1,maz-o,use d touch x,-3,1568147286.0
644,644,ezu0g90,t1_eztzlb8,thu22jun,wait base model iphon eleven pro,112,1568142749.0
645,645,ezu0ec8,t1_eztzlb8,nikrage,disappoint fact lol,18,1568142715.0
646,646,ezu1rml,t1_eztzlb8,kmanmx,internet live steve job realiti distort field come storag work mdm enterpris smartphon staff use work person devic percentag peopl use close sixti four gb storag pretti insignific larg major peopl need sixti four gb storag even use half storag sixti four gb iphon x interest game take lot space photo icloud googl photo music stream yes chew two hundr fifti six even five hundr twelv gb minor minor,78,1568143595.0
647,647,ezu1n0t,t1_eztzlb8,bryanisbored,four camera record time,2,1568143513.0
648,648,ezu1v7r,t1_eztzlb8,TheRealClose,remov d touch,2,1568143659.0
649,649,ezu87z1,t1_eztzlb8,Kidney05,hell pro phone anyway pro shoot stuff camera pro photograph videograph show shoot iphon expect peopl take serious get,2,1568147197.0
650,650,ezuw8a8,t1_eztzlb8,brrip,think wors xs reveal least announc xsmax made consid switch smaller x year still think need find cheap xsmax,2,1568162052.0
651,651,ezur1t1,t1_eztzlb8,Quin1617,hate appl least essenti one hundr twenti eight gb dollar seven hundr launch even note come standard two hundr fifti six gb abl get seven plus much cheaper,1,1568159153.0
652,652,ezu2lt6,t1_eztzlb8,maz-o,get sixti four gb one,2,1568144133.0
653,653,ezu3hrp,t1_eztzlb8,peduxe,appl storag upgrad model joke across product surpris ever product gave generous storag size base model,0,1568144699.0
654,654,ezu05q3,t1_eztzlc4,Superhobbes1223,sure admit mistak like get cheaper manufactur three year notch era,130,1568142561.0
655,655,ezu155c,t1_eztzlc4,perfectviking,much one though,5,1568143195.0
656,656,ezu4nyh,t1_eztzlc4,bjornetjeneste,lmao increas price dollar fifti norway,3,1568145317.0
657,657,ezu1hsa,t1_eztzlc4,Spanget,price reduc,3,1568143420.0
658,658,ezug396,t1_eztzlc4,Joo_Unit,went back whole make big phone paradigm pretti quick saw samsung success lol,3,1568151533.0
659,659,ezu4xbm,t1_eztzlc4,cjcs,take hit tariff well,1,1568145451.0
660,660,ezuthyg,t1_eztzlc4,Guilty_Peanut,china tariff mean right price right,1,1568160533.0
661,661,ezu116r,t1_eztzlc4,i_spot_ads,point peopl condit appl prais increas alreadi insan price laughabl,-8,1568143123.0
662,662,ezu8qvz,t1_eztzlc4,Xela79,iphon eleven pro price xs last year lower price,0,1568147469.0
663,663,ezuksey,t1_ezu0sp3,deleted,,1,1568154561.0
664,664,ezubohx,t1_eztzfax,zi-za,first headphon jack dtouch innov,6,1568149056.0
665,665,eztztco,t1_eztzmsa,CommenceAwesomeness,look powerbeat pro function access airpod volum control physic button side love mine,19,1568142337.0
666,666,ezu0ddc,t1_eztzmsa,tom_watts,octob event imagin,5,1568142697.0
667,667,ezu2z5r,t1_eztzmsa,RadiantQA,bought ipad pro air pod month ago realli glad noth new announc,2,1568144371.0
668,668,ezu1gw3,t1_eztzmsa,SJBrunel,woah hold think go late octob event kid idea buy great,1,1568143405.0
669,669,ezu4d1h,t1_eztzmsa,iamsograteful,hope innov,1,1568145166.0
670,670,ezv84by,t1_eztzmsa,BornToDraw,smh that excit deserv believ rumor t wait keynot get new airpod three ear bud sinc current one alway fall ear went ahead got galaxi bud work much better expect iphon even though app bud io,1,1568169727.0
671,671,ezu2x5n,t1_eztzlu1,justseeyoutonight,thank bori,14,1568144336.0
672,672,ezu27wk,t1_ezu1z77,dabesdiabetic,subt detect wider angl,5,1568143884.0
673,673,ezuvpjt,t1_ezu1z77,IDontHaveRomaine,rip d touch mayb next year,1,1568161760.0
674,674,ezuqf1h,t1_ezu1z77,seven0feleven,almost guarante improv batteri life come a bionic chip power effeci improv size batteri wager guess exact batteri xr xs model,0,1568158703.0
675,675,ezu7khd,t1_ezu0cfy,maz-o,someth peopl continu buy shit would stupid anyth els busi perspect,3,1568146854.0
676,676,ezu21zn,t1_ezu0cfy,mxforest,courag,7,1568143779.0
677,677,ezu1aer,t1_ezu0cfy,tommotlol,dollar one thousand four hundr canada iphon pro sixti four gb fuck rofl,5,1568143289.0
678,678,ezu184t,t1_eztzn91,mxforest,sneak preview futur tech see deep fusion groundbreak tech,16,1568143249.0
679,679,ezu8fn2,t1_eztzn91,skiier97,sneak preview futur tech doubt ever airpow,4,1568147307.0
680,680,ezu2fch,t1_eztzn91,badass4102,watch screen stay alway display amaz watch tell head could done softwar updat lol appl watch dev dept easi year year,1,1568144019.0
681,681,ezu30uo,t1_eztzn91,deadspider187,part agre underwhelm keynot howev know would call eleven pro upgrad minor better screen around better speaker better camera faster hrs batteri life faster charg durabl know els ask new version phone said xs max plan upgrad eleven pro seem like around upgrad except storag capac everyth updat spec bump area need spec bump use case think anyth take camera batteri upgrad seem like major innov cell phone technolog,0,1568144401.0
682,682,ezu6by0,t1_ezu1qzi,ShivasLimb,see big present tech guy new a chip oh wait cheaper model,42,1568146191.0
683,683,ezu76i8,t1_ezu1qzi,cheanerman,innov like idea,9,1568146647.0
684,684,ezu6eb7,t1_ezu1qzi,Iredditfromwork,want move r name convent appar bring littl line macbook name convent last time macbook pro pro real pro line pro monik mac pro even question year get decis chang name convent hate way tri play pro lone iphon,13,1568146227.0
685,685,ezuxfi0,t1_ezu1qzi,zerostyle,agre pro silli name phone none thing list consid would need pros phone tablet mayb one hundr twenti eight gb realli baselin though given competit b push k video,5,1568162726.0
686,686,ezu5jmy,t1_ezu1qzi,mikami677,least headphon jack though right right,-1,1568145775.0
687,687,ezumrds,t1_ezu1qzi,JohrDinh,get fast charger least airdrop work fine move file never heard anyon use iphon want pencil meanwhil friend make fun peopl new phone stylus got new samsung draw make jealous even tho never need featur lol hz screen would eat away amaz new extra batteri life probabl wanna save featur meaning devic like ipad right would like bigger base storag tho much pimp camera pro featur least give everyon space keep file captur pleas,0,1568155975.0
688,688,ezu77sd,t1_ezu1qzi,maz-o,get fuck usb c happen fuck would proprietari system peopl readi pay dollar dollar dollar cabl probabl highest profit margin percentag product would like worst busi decis ever,-24,1568146667.0
689,689,ezu0fqk,t1_eztzgx1,deleted,,44,1568142740.0
690,690,ezu728k,t1_eztzgx1,maz-o,nobodi need new phone everi year anyway,5,1568146582.0
691,691,ezu4r8n,t1_eztzgx1,cjwilliams37,ah cub fan use,1,1568145364.0
692,692,ezupca0,t1_eztzgx1,burd-,announc today think next year would better even struggl consist,1,1568157889.0
693,693,ezu0fs6,t1_eztzgx1,deleted,almost year year comparison alway increment expect blow us away everi singl keynot,0,1568142741.0
694,694,eztzut5,t1_eztzj4w,TNAEnigma,eleven dollar one hundr xr go,93,1568142363.0
695,695,eztzyfx,t1_eztzj4w,barktreep,way iphon eleven much better valu cpu gpu last year longer much better camera,62,1568142428.0
696,696,ezu081c,t1_eztzj4w,tom_watts,dollar one hundr get new camera better batteri shini though unless miss reason xr better eleven,19,1568142602.0
697,697,ezu4uvr,t1_eztzj4w,BobSaiyaman,p lcd display like xr,3,1568145416.0
698,698,ezu6b8v,t1_eztzj4w,SolsKing,iphon get xr,2,1568146181.0
699,699,ezu0scn,t1_eztzj4w,cheanerman,screen right,1,1568142963.0
700,700,ezu0kwj,t1_eztzj4w,tristanryan,iphon eleven year xr price exact mean got right lol,2,1568142832.0
701,701,ezu0lhh,t1_eztzrfo,IReallyLoveAvocados,think ten year sinc initi iphon much glass rectangl internet connect fast processor go underwhelm sinc alreadi iphon matur product mean excus appl claim revolutionari upgrad think ace sleev clear readi show yet disappoint happen market often see revolutionari redesign wash machin happen often,110,1568142842.0
702,702,ezu01ly,t1_eztzrfo,duuudewhat,could right would innov,0,1568142485.0
703,703,ezu1qn4,t1_eztzrfo,Mr-Dogg,send invit lol,1,1568143578.0
704,704,ezuw9ob,t1_eztzrfo,ruckis,need new phone everi year start releas everi two year mayb folk impress improv,1,1568162074.0
705,705,ezv0lg3,t1_eztzrfo,deleted,,1,1568164434.0
706,706,ezv28p0,t1_eztzrfo,nelisan,record video camera innov featur vlogger,1,1568165322.0
707,707,eztzkxq,t1_eztzi0z,gnarlnick,three camera bro,142,1568142186.0
708,708,ezu036b,t1_eztzi0z,deleted,new font app icon,27,1568142514.0
709,709,ezud09i,t1_eztzi0z,bbqsox,invit,3,1568149782.0
710,710,ezubegj,t1_eztzi0z,zi-za,wherev headphon jack went,1,1568148909.0
711,711,ezuexej,t1_eztzi0z,conversacion,bokeh,1,1568150863.0
712,712,ezuexhq,t1_eztzi0z,ftctkugffquoctngxxh,think main featur would describ innov chang low power alway appl watch screen,1,1568150864.0
713,713,ezvr4qn,t1_eztzi0z,adam2222,slowfi duh,1,1568192197.0
714,714,ezu11ql,t1_eztzi0z,mxforest,two thousand twenti bro,1,1568143133.0
715,715,ezum6rj,t1_ezu3qyp,deleted,se last four yrs best phone ever,4,1568155559.0
716,716,ezu31ub,t1_eztzmrb,Guilty_Peanut,one june good,4,1568144419.0
717,717,ezu0q5f,t1_eztzmrb,rupertLumpkinsBrothr,thing said keynot,65,1568142924.0
718,718,ezu0ao7,t1_eztzmrb,deleted,,18,1568142649.0
719,719,ezv2ddu,t1_eztzmrb,Knights123,would fine drag forev releas new stuff great get hour instead two get rid game bs one care,1,1568165416.0
720,720,ezw02sb,t1_ezu0zby,jalopkung,yeah keep yawn whole event hope someth excit got fifteen minut camera featur instead,1,1568203917.0
721,721,ezv4zam,t1_ezu1fgc,zapengineer,way right tell goe,1,1568167311.0
722,722,ezvj0u6,t1_ezu1fgc,thinkbox,thank input note user,0,1568180153.0
723,723,ezvkhnv,t1_ezujazi,LeakySkylight,expect avoid rumour etc pretti great get close subject start get bore,1,1568181972.0
