,Unnamed: 0,Comment ID,Parent ID,Author,Body,Score,Created (UTC)
1170,1170,ezw514l,t1_ezu2z1h,We1tfunk,app also inflat size late also app cach even religi clean photo video hover around forti five gb use could fit work set sixti four constant worri storag feel like good user experi like ram realli much never make experi wors less,2,1568208084.0
1171,1171,ezv1wii,t1_ezux8xq,mime454,alway way,1,1568165128.0
1172,1172,ezuheqa,t1_ezu3628,aka_liam,never market appl watch announc keynot today amaz find standard,28,1568152298.0
1173,1173,ezu9it4,t1_ezu3628,slandeh,believ announc also work onlin,6,1568147886.0
1174,1174,ezu7qh6,t1_ezu3628,DaftCinema,onlin,2,1568146939.0
1175,1175,ezu0kur,t1_ezu09uf,Pepsidudemike,free first year purchas new appl devic,81,1568142831.0
1176,1176,ezu4nx9,t1_ezu09uf,sennheiserz,eh like sign stream servic like ten show yet releas back catalog movi show say dollar might fair grant year one free hope hook lot peopl show good expand total hate launch bit weak,3,1568145316.0
1177,1177,ezucxdg,t1_ezu09uf,Osuwrestler,seem like ripoff bare content,3,1568149737.0
1178,1178,ezu1w27,t1_eztzw0c,armseyesears,indic alway disabl better batteri life wait two year upgrad watch increas batteri life,8,1568143675.0
1179,1179,ezu1t0e,t1_eztzw0c,deleted,realli disappoint promot,1,1568143619.0
1180,1180,ezu0di9,t1_eztzta2,deleted,alway screen,163,1568142700.0
1181,1181,ezu0hbs,t1_eztzta2,YS_water,good discontinu seri world apart s s sold togeth s still innov though stay,88,1568142768.0
1182,1182,ezu1cdm,t1_eztzta2,Archvile7,new screen variabl refresh rate accommod alway display,5,1568143324.0
1183,1183,ezu0c6t,t1_eztzta2,Iredditfromwork,faster alway intern emerg call new materi,9,1568142676.0
1184,1184,ezu7iar,t1_eztzta2,AutoGeek3000,excit titanium case ss seri four though probabl wait next year,2,1568146821.0
1185,1185,ezuzl9s,t1_eztzta2,XtremePhotoDesign,seri four seri five amount faster seri three accord market materi seem seri five optim increas batteri life power alway screen rather increas perform,2,1568163899.0
1186,1186,ezvfzp2,t1_eztzta2,nmpraveen,say s chip know much faster compar s,2,1568176734.0
1187,1187,ezu083k,t1_eztzta2,rupertLumpkinsBrothr,rememb much either,2,1568142603.0
1188,1188,ezu1e23,t1_ezu02i0,deleted,,3,1568143353.0
1189,1189,ezug436,t1_ezud5hl,taiiigastyle,x standard right idk still watch seri one,1,1568151546.0
1190,1190,ezu9m2p,t1_eztzoe9,NCSUGrad2012,cri iphon might time upgrad use x,6,1568147936.0
1191,1191,ezu0l4x,t1_ezu09j8,TailsTheDigger,first releas ipado releas io,16,1568142836.0
1192,1192,ezu2bd1,t1_ezu09j8,infinitybisect,well aw quit featur depend devic softwar primarili remind updat new remind io stuck sync mac catalina ipado releas,12,1568143946.0
1193,1193,ezu4740,t1_ezu09j8,cbfw86,dualshock appl tv,2,1568145083.0
1194,1194,ezubw0g,t1_ezu09j8,yaboyfriendisadork,mention new featur come realli hope night mode someth similar,1,1568149164.0
1195,1195,ezu1gce,t1_eztzpht,TheReacher,ipado releas septemb th,2,1568143395.0
1196,1196,ezu5300,t1_eztzpht,SuccessAndSerenity,hop beta pretti stabl,2,1568145534.0
1197,1197,eztzzk5,t1_eztzm1k,exjr_,ban implement sub wide ban emoji temporari cut spam,30,1568142448.0
1198,1198,eztznjv,t1_eztzk39,ILikeSugarCookies,suppos reddit mod idea hey let make channel discord instead keep complet function like alway effect ruin specif discuss take place limit general reaction comment,132,1568142233.0
1199,1199,ezu02ys,t1_eztzk39,Coffeebiscuit,brillianc question none ever answerd braveau,8,1568142510.0
1200,1200,ezuo7h5,t1_eztzk39,linotype,reddit admin tri squeez peopl new reddit com discuss beta subreddit argu incomplet broken implement old reddit com support made comment appear lock appar idiot opinion,2,1568157043.0
1201,1201,eztzyuq,t1_eztznqr,Tom_Menino,usual know appl event via reddit heard noth today,3,1568142436.0
1202,1202,ezu0gk8,t1_eztzpsp,CrimsonEnigma,okay lesson learn live chat suck like rest new reddit,28,1568142755.0
1203,1203,ezu050v,t1_eztzpsp,EchoEchoEchoChamber,thank seen anoth sub mod made clear go nd submiss set new reddit live chat,7,1568142548.0
1204,1204,ezu09o0,t1_eztzpsp,deleted,,3,1568142631.0
1205,1205,ezu590d,t1_eztzpsp,TheKharmeleon,suck,1,1568145619.0
1206,1206,ezu0h69,t1_eztzy5j,nofunallowed98765,cool tri pleas never use ever,219,1568142766.0
1207,1207,ezu0aaa,t1_eztzy5j,Iredditfromwork,thank answer terribl experi,39,1568142642.0
1208,1208,ezu0ov4,t1_eztzy5j,EchoEchoEchoChamber,thank think along tell us sunday also told us mega thread expect everyon event also sunday warn view everyon new reddit look like complet joke sure lead even shit post one place could post discuss absolut imposs someon question someth chanc answer discuss other mention anoth repli seen anoth sub live chat thing also normal event submiss peopl could discuss expect,20,1568142902.0
1209,1209,ezu29dr,t1_eztzy5j,Phoenix_King76,unlik discord even respond peopl pleas,8,1568143911.0
1210,1210,ezu2eck,t1_eztzy5j,achanaikia,absolut terribl fill annoy useless asinin comment like big twitch channel,6,1568144000.0
1211,1211,ezu21jl,t1_eztzy5j,deleted,,6,1568143772.0
1212,1212,ezu3en4,t1_eztzy5j,SmartGrowAutomation,new style reddit browser safari maco appear lock comment,3,1568144645.0
1213,1213,ezu3rbn,t1_eztzy5j,crimsonvspurple,tri discord like experi discord next time,3,1568144847.0
1214,1214,ezu65kh,t1_eztzy5j,deleted,,3,1568146096.0
1215,1215,ezuaj2c,t1_eztzy5j,mng8ng,thank experi pleas ever use,3,1568148434.0
1216,1216,ezu09xi,t1_eztzy5j,Merman123,appreci time take volunt,8,1568142635.0
1217,1217,ezua844,t1_eztzy5j,Matuteg,use reddit offici app shit show noth load order press live comment froze app,2,1568148265.0
1218,1218,ezu1y47,t1_eztzy5j,deleted,,3,1568143711.0
1219,1219,ezuhp1o,t1_eztzy5j,ActivateGuacamole,follow announc post sunday show knew megathread would happen use old reddit therefor came across arbitrarili decid prohibit repli reason found way afterward realli frustrat ask question repli anybodi aw format,2,1568152465.0
1220,1220,eztzwow,t1_eztzksb,exjr_,answer time question peopl coward,5,1568142397.0
1221,1221,eztzuy7,t1_eztzoli,gnarlnick,option use,10,1568142365.0
1222,1222,eztzx54,t1_eztzoli,TroyAtWork,either way stupid decis come reddit discord style chat garbag,5,1568142405.0
1223,1223,ezu07px,t1_eztztac,JasonZep,still six might upgrad pain anymor,39,1568142597.0
1224,1224,ezuc66f,t1_eztztac,RelevantExternal,realli see reason upgrad x work perfect fine,2,1568149318.0
1225,1225,ezv9rqj,t1_eztztac,Solkre,still get day thank sprint sinc move cell coverag,1,1568171055.0
1226,1226,ezvnlf8,t1_eztztac,Squif-17,damn sit x appl charg new batteri might interest keep go next twelv month,1,1568186351.0
1227,1227,ezuamev,t1_eztztac,niteshadey,damn x releas day xs,1,1568148486.0
1228,1228,ezu9tu9,t1_ezu0mb7,bgarza18,yeah storag gonna upgrad stuck sixti four gb well thought would enough,2,1568148055.0
1229,1229,ezu2aln,t1_ezu0btz,defrndr,normal phone screen,64,1568143933.0
1230,1230,ezu4a7v,t1_ezu0btz,wildmagickarp,repair seven plus screen two week ago regret phone run fine usag,3,1568145127.0
1231,1231,ezu34w3,t1_ezu0btz,blackwoe,boat bro hahaha,2,1568144474.0
1232,1232,ezu5ri6,t1_ezu0btz,suihcta,get rd parti screen huge regret much cheaper oem screen replac appl perform qualiti bad sinc week one,1,1568145890.0
1233,1233,ezvxuxj,t1_ezu3esh,Ftpini,six actual s got updat month ago appl support phone long time,2,1568201705.0
1234,1234,ezu0f9p,t1_eztztew,SlendyTheMan,,3,1568142732.0
1235,1235,ezu10ro,t1_eztztew,camelCaseCoffeeTable,would one got applecar well anoth year xs max thought pay replac though,2,1568143115.0
1236,1236,ezu02bo,t1_eztzzij,canikeepit,three year cycl two thousand twenti next actual chang expect,14,1568142499.0
1237,1237,ezu0fgd,t1_eztzzij,LarryBrownsCrank,r iphon extrem nervous right read,1,1568142735.0
1238,1238,ezu201u,t1_ezu07ze,gay_unicorn666,see batteri health,1,1568143745.0
1239,1239,ezvalaj,t1_ezu0j4z,blazlelight,good idea save lot dollar bill,1,1568171740.0
1240,1240,ezvakag,t1_ezu24a1,blazlelight,around dollar way cheaper new phone,1,1568171716.0
1241,1241,ezvajui,t1_ezu2ppf,blazlelight,appl watch best thing confer,1,1568171706.0
1242,1242,ezvaisj,t1_ezuhhtc,blazlelight,haha know better,1,1568171683.0
1243,1243,ezvaide,t1_ezujgxj,blazlelight,exact wait worth upgrad,1,1568171672.0
1244,1244,ezvahfw,t1_ezuoaor,blazlelight,wow nineti,1,1568171651.0
1245,1245,ezvah2c,t1_ezv64c9,blazlelight,new redesign featur worth upgrad,0,1568171642.0
1246,1246,ezu2vhe,t1_ezu0ezh,cwhiterun,s iphon three year cycl next year start new cycl y new phone iphon iphon x y version iphon s iphon xs y anoth version get stale give new name iphon iphon also never releas s iphon eight budget phone like c se xr releas s next year budget version alongsid actual new iphon twelv whatev call,3,1568144306.0
1247,1247,ezuxaew,t1_ezup0jv,nionix,honest seri three realli want turn wrist see workout biggest gripe got one,5,1568162646.0
1248,1248,ezu05fc,t1_eztzuh5,deleted,,125,1568142555.0
1249,1249,ezu6kfr,t1_eztzuh5,cravingcinnamon,last minut rumor mill though one thing appl tag appl logo chang revers wireless charg,17,1568146320.0
1250,1250,ezu3i05,t1_eztzuh5,fatcowxlivee,pretti accur filter obvious fake rumor everi half reput sourc confirm correct name convent bodi phone lack heavi hit featur,4,1568144703.0
1251,1251,ezu3nfl,t1_eztzuh5,orcinovein,nah last minut rumor came past coupl week wrong tile tag one thing,2,1568144789.0
1252,1252,ezvl05n,t1_eztzuh5,AxeellYoung,iphon air pod three one thing expect appl event leak video articl june august excit leak video articl twelv hour event money grab honest leak kinda ruin appl event nowaday happi gradual disappoint rather crash watch live,1,1568182655.0
1253,1253,ezvxku8,t1_eztzuh5,Ftpini,everi singl event point kuo addit simpli wrong overwhelm major time habit take possibl futur report fact bilater charg also forget bilater charg,1,1568201407.0
1254,1254,ezu0nxb,t1_eztzuh5,thenerdal,dumbass believ rumor like happen,-3,1568142886.0
1255,1255,ezu35cd,t1_ezu1943,toodrunktofuck,yeah wtf guy,15,1568144482.0
1256,1256,ezupxg7,t1_eztzgrz,nickolove11xk,especi iphonex r appl thought three year,8,1568158329.0
1257,1257,ezu01m1,t1_eztzj4b,Advanced_Path,ipad pros ad usb c least get pro new iphon,70,1568142485.0
1258,1258,eztzmyr,t1_eztzj4b,brdsqd,yep,43,1568142223.0
1259,1259,ezu0k5j,t1_eztzj4b,onlyonebread,doubt pro version product usual big bump pro come less two hundr fifti six gb liter eat shit,5,1568142818.0
1260,1260,ezud3pq,t1_eztzgs5,Harold_Zoid,macbook pro still start one hundr twenti eight gb even ridicul,50,1568149836.0
1261,1261,ezupapb,t1_eztzgs5,emorockstar,ipad pro also sixti four gb iirc,2,1568157855.0
1262,1262,eztzsg6,t1_eztzo9y,Superhobbes1223,yea know low end oof,24,1568142320.0
1263,1263,ezu37v9,t1_eztzo9y,peduxe,talk like replac laptop,15,1568144525.0
1264,1264,ezu3w70,t1_eztzo9y,deleted,plenti mani peopl irk entri level product iphon pro start sixti four gb storag grand disgust though,14,1568144923.0
1265,1265,ezud0y5,t1_eztzo9y,kjm99,eh thirti two gb cheapest ipad bad imo peopl go model probabl take note stream music video huge need storag although sixti four gb still baselin processor upgrad inexcus though year old chang bigger screen,7,1568149793.0
1266,1266,ezu3tcb,t1_eztzo9y,deleted,three hundr euro ipad happi thirti two gb need fifti gb icloud even yet like k photo els guy use devic,7,1568144878.0
1267,1267,ezu8vo7,t1_eztzo9y,MondayToFriday,mayb suitabl special applic build kiosk would probabl use cheaper android tablet instead,1,1568147541.0
1268,1268,ezvrwp8,t1_ezu27wj,Takeabyte,icloud photo librari let upload k video record though price differ sixti four gb two hundr fifti six gb pro two hundr gb cloud storag four year,1,1568193529.0
1269,1269,ezubp7m,t1_ezu4qr2,bbqsox,samsung fan dollar probabl less rate drop price get note two hundr fifti six gig storag expand storag similar camera packag probabl handl low light well seem w charg intel modem usb c stylus iphon better part decad get silli make thing pro exact tri bash tim intellig man definit taken revenu stratospher appl extrem bore,9,1568149066.0
1270,1270,ezu2ehb,t1_ezu0fj7,swancheez,drop,6,1568144002.0
1271,1271,ezv9gp9,t1_ezucpm1,mikeroon,power user least,3,1568170801.0
1272,1272,ezu4fxz,t1_ezu3fa3,unsteadied,pro model suppos specc averag consum price accord,11,1568145207.0
1273,1273,ezu6m06,t1_ezu2648,TravelsInBlue,yeah partak shit post frequent refresh fair amus,5,1568146343.0
1274,1274,ezub9tm,t1_ezu2cu7,burajin,knee jerk reaction noth special must forget iphon se event electron textbook event actual cool never got inch ground sure other,5,1568148837.0
1275,1275,ezury9z,t1_ezu2cu7,Guilty_Peanut,best probabl iphon annouc two thousand seven,2,1568159678.0
1276,1276,ezu0k0f,t1_eztzndu,coriscaa,mid roll ad,111,1568142816.0
1277,1277,ezu65yk,t1_eztzndu,cheanerman,brought three peopl show three underwhelm game appl arcad obvious tri kill time lacklust keynot,28,1568146101.0
1278,1278,ezv5vix,t1_eztzndu,ilovethosedogs,appl execut team sinc job iron made worst public speaker ever seen nervous lame especi phil,3,1568167988.0
1279,1279,ezu5n2i,t1_eztzndu,mightyfty,game add,1,1568145824.0
1280,1280,ezu1mvi,t1_eztzndu,deleted,,0,1568143510.0
1281,1281,ezufxdg,t1_eztzuvu,thisisnatedean,one appl watch stori good though rest meh,24,1568151437.0
1282,1282,ezu0tj8,t1_eztzuvu,ExtremelyQualified,honest littl worri appl market dept one,27,1568142984.0
1283,1283,ezui2ic,t1_eztzuvu,aka_liam,phil comment photo made cring bad,7,1568152680.0
1284,1284,ezukdv8,t1_eztzuvu,thereturnofjagger,art galleri moment mean appl watch commerci,2,1568154271.0
1285,1285,ezu23qv,t1_ezu0n4t,LifeAsPatel,hate stupid ass game much worthi get spot main appl event year mayb appstor homepag stori someth steve would mad hell realli miss joni video,43,1568143811.0
1286,1286,ezunk3j,t1_ezu0n4t,torchboner,game part sole china custom surpris tim wear hanfu segment edit typo,5,1568156562.0
1287,1287,ezupnoo,t1_ezu3be2,sigtrap,pretti much featur realli big upgrad everyth els pretti minor,3,1568158125.0
1288,1288,ezu06qp,t1_eztznl7,Alskdkfjdbejsb,think announc new watch ipad phone,31,1568142580.0
1289,1289,ezu9zrp,t1_eztznl7,wosmo,keynot press event sometim think half problem expect,10,1568148142.0
1290,1290,ezu80hc,t1_ezu3ug3,andrewsteiner88,like lower price video watch realli cool new color nice honest expect retail segment,1,1568147085.0
1291,1291,ezu00bd,t1_eztzok7,hardinho,next year coupl year,40,1568142462.0
1292,1292,ezvdtow,t1_ezvdgv9,rbp25,honest terribl bought everi iter iphon sinc six s gonna first time upgrad talk camera mayb watch see camera like everyth els filler pointless present,1,1568174599.0
1293,1293,ezub6hq,t1_ezu8e6q,BastianWoW,op love use d touch link preview especi brows reddit mobil someon link imgur link forc press without lose spot page open new tab person use daili,6,1568148785.0
1294,1294,ezu9sf9,t1_ezu8e6q,iqstick,main use quick repli text home screen various littl shortcut gotten use use d touch,5,1568148033.0
1295,1295,ezuhnqz,t1_ezu8e6q,RedPanda888,link preview open new tab forc touch link slide cursor locat check bank balanc forc press bank app,2,1568152443.0
1296,1296,ezvfryp,t1_ezu8e6q,Fermats_Last_Account,seven plus sure differ switch app easier d touch left edg swipe right open app switcher gestur swipe far right forc touch anywher keyboard move cursor around d shortcut app notif send messag button add effect,1,1568176513.0
1297,1297,ezu0hn7,t1_ezu0g90,Dave_Matthews_Jam,yes max dollar one thousand one hundr sixti four gb,105,1568142774.0
1298,1298,ezu6jad,t1_ezu0ec8,cheanerman,yes consid anoth whole year later,1,1568146302.0
1299,1299,ezu4hvg,t1_ezu1rml,nolanised,might come appl apologist general popul sixti four gb enough like sixteen gb base model day think app want phone price point competit definit sting though,39,1568145234.0
1300,1300,ezu45d3,t1_ezu1rml,DyZ814,iphon long rememb alway purchas lowest storag devic sixti four gb xs max think someth like thirti gb left never come close hit devic storag cap even sixteen gb back day,6,1568145058.0
1301,1301,ezu3plo,t1_ezu1rml,TONY_BURRITO,think issu showcas graphic intens game sure take gig io around ten gb social media app standard mb app want use camera shut fuck need serious storag space want make movi phone tonyburrito icloud storag pay take care storag limit yes use along googl photo tell mani time bar basement without recept show photo someon connect icloud absolut infuri use appl phone sinc five year year photo live ecosystem could cut middleman keep two hundr fifti six gb phone absolut would storag cheap enough appl could doubl tripl storag space make good use robust io featur emphasi archiv data local probabl never get frustrat peopl say peopl need yes know everi boomer bare oper dollar eight hundr phone like find way fill space powerus younger demograph,3,1568144821.0
1302,1302,ezuk9z3,t1_ezu1rml,HomerMadeMeDoIt,odd enough privat sector user need lot storag amount peopl met gb photo astound crazi also chat app accumul lot data recent saw someon ten gig whatsapp app,1,1568154192.0
1303,1303,ezucfyz,t1_ezu1rml,thekhaos,peopl like justifi appl price goug custom,-2,1568149468.0
1304,1304,ezum6oy,t1_ezu1rml,plastiqmanb,k video chew sixti four gb time,-1,1568155558.0
1305,1305,ezuat4m,t1_ezu1rml,derek_j,use phone take photo claim fill fast trade xs s came five month fill fifti eight gb pictur video two vacat pictur hous built big thing yeah still xs would delet pictur make room pictur,-3,1568148584.0
1306,1306,ezu2upy,t1_ezu1v7r,TNMYSNGL,yes replac haptic touch xr d touch io thirteen tuck trash caus chang feel behavior basic function long press icon,2,1568144293.0
1307,1307,ezu3bk4,t1_ezu2lt6,Dave_Matthews_Jam,pay dollar two hundr storag size default,1,1568144591.0
1308,1308,ezu1cnr,t1_ezu05q3,rick_n_snorty,definit fact everyon offer type screen longer new fanci innov,38,1568143329.0
1309,1309,ezubsnn,t1_ezu05q3,Tsukune_Surprise,exact amort cost x form factor machin mold cost manufactur eleven much much lower make x,6,1568149116.0
1310,1310,ezu33ha,t1_ezu05q3,DeathInLotus,even cheaper manufactur like appl lower price margin,10,1568144448.0
1311,1311,ezu463b,t1_ezu05q3,Lolkac,panel rmb cheaper,2,1568145068.0
1312,1312,ezu2p4o,t1_ezu1hsa,muzzio,knock dollar fifti xr updat pretti smart rebrand xr base phone realiz right away plan upgrad five minut p,29,1568144194.0
1313,1313,ezu2826,t1_ezu1hsa,azndinho,xr vs eleven new ipad seri four vs five think,1,1568143887.0
1314,1314,ezv7gge,t1_ezug396,iamseiko,keep go back forth samsung copi appl remov headphon jack appl copi samsung ad ultrawid camera,2,1568169205.0
1315,1315,ezu153o,t1_ezu116r,CrimsonEnigma,oh fuck sake prais price drop call condit suppos condemn price drop,15,1568143194.0
1316,1316,ezulfxk,t1_ezuksey,halolordkiller3,argu constant need make someth new make current tech better afford look get appl make new product keep busi go standard anywher flip side rather spend research develop drastic improv batteri life get high hors adopt usb c increas storag size speed improv stupid slofi camera featur gimmick minut amount folk use look face emoji,3,1568155034.0
1317,1317,ezu0ren,t1_eztztco,iNeryx,tri airpod better still powerbeat amaz,8,1568142947.0
1318,1318,ezumjme,t1_eztztco,Hoobleton,case seem bit beefi carri pocket,1,1568155816.0
1319,1319,ezu0p2k,t1_ezu0ddc,iNeryx,well tire wait hope regret,4,1568142905.0
1320,1320,ezug9sh,t1_ezu1gw3,foiled_yet_again,might replac lost airpod return month,1,1568151640.0
1321,1321,ezu9cdt,t1_ezu2x5n,Tropical_Centipede,thank trump,-5,1568147788.0
1322,1322,ezu7mj1,t1_ezu1aer,maz-o,know get one,-5,1568146883.0
1323,1323,ezu6hul,t1_ezu184t,SuccessAndSerenity,felt like full blown botch present said look photo let talk technolog behind confus like behind get photo impress explain end product awesom explain accomplish like midway mention someth filter nois pixel sweater strand look crisp first time like oh talk ok,29,1568146281.0
1324,1324,ezu7411,t1_ezu2fch,Iredditfromwork,new screen appl watch someth special impact much day day use,3,1568146609.0
1325,1325,ezuez4m,t1_ezu2fch,Piligrim555,use new screen variabl refresh rate featur avail drain charg like five hour,2,1568150890.0
1326,1326,ezu83xq,t1_ezu6eb7,RanaI_Ape,exact like last year name convent dogshit decid chang someth less dogshit still make sens consid rest product line need stop number altogeth silli call two thousand nineteen iphon way macbook,9,1568147137.0
1327,1327,ezvgf6d,t1_ezuxfi0,Outlulz,think pros ever go reli iphon anyth unless profess offic job need someth send email pros invest thousand real profession sound photo video equip much flexibl granular appl will provid io let alon qualiti,3,1568177192.0
1328,1328,ezwjako,t1_ezumrds,Buziel-411,ipad pro alreadi hz screen hurt batteri life,1,1568217981.0
1329,1329,ezupfcq,t1_ezumrds,RanaI_Ape,new rog phone one hundr twenti hz ole batteri life silli good necessarili especi variabl think appl give best devic could absolut could much offer would rather drip feed new featur span year absolut bare minimum order least somewhat competit keep iphon faith jump ship maintain ridicul profit margin judg comment succeed edit downvot want expect noth less r appl reason get bore ass increment updat instead someth actual innov,-2,1568157953.0
1330,1330,ezu7p4m,t1_ezu77sd,RanaI_Ape,put ipad pros,19,1568146920.0
1331,1331,ezu1zpl,t1_ezu0fqk,-iNfluence,nich joke appreci,7,1568143739.0
1332,1332,ezu4bed,t1_ezu0fqk,cbfw86,genuin laugh loud,3,1568145144.0
1333,1333,ezu13go,t1_ezu0fs6,akbermo,usb c squar edg like iphon current ipad would sold achiev,5,1568143164.0
1334,1334,ezvmuk7,t1_eztzut5,iTouneCorloi,xs eleven,2,1568185233.0
1335,1335,ezu2glm,t1_eztzut5,dubsteponmycat,dollar one hundr buy new processor new camera sure see lot thread compar two short order,6,1568144041.0
1336,1336,ezu1ifj,t1_eztzyfx,deleted,,3,1568143431.0
1337,1337,ezueu8w,t1_ezu081c,kjm99,color look lot better satur xr imo got rid blue coral color complet,2,1568150813.0
1338,1338,ezu9w25,t1_ezu4uvr,yung-rude,yup exact panel,3,1568148088.0
1339,1339,ezu7bwe,t1_ezu6b8v,zoriallemur,think afford extra one hundr dollar go iphon eleven futureproof,3,1568146730.0
1340,1340,ezu24kp,t1_ezu0kwj,stupid_horse,actual dollar fifti cheaper xr last year,9,1568143826.0
1341,1341,ezu2882,t1_ezu0kwj,Gcousin,last year xr dollar seven hundr fifti launch,7,1568143890.0
1342,1342,ezu5vp9,t1_ezu0lhh,ExtremelyQualified,agre name event innov spend two hour tri hype minor improv,20,1568145952.0
1343,1343,ezu2qi0,t1_ezu0lhh,whytakemyusername,appl pencil support pro motion new case design usbc drive reader solid back glass wont smash charg mat back charg wireless item edg edg screen rid notch touchid screen,93,1568144219.0
1344,1344,ezu17db,t1_ezu0lhh,akbermo,give usb c,39,1568143235.0
1345,1345,ezu1mfj,t1_ezu0lhh,IMissMyZune,yeah market whole matur see fold phone compani take random shit like headphon jack sell wireless earbud peopl keep phone longer ever nowaday good reason,2,1568143502.0
1346,1346,ezv1wpo,t1_ezu0lhh,tundrat,guess intern chip camera design could feel like still make breakthrough look impress innov custom look,1,1568165131.0
1347,1347,ezv5r4l,t1_ezu0lhh,retardedbutlovesdogs,bullshit appl lot lot net profit appl work come iphon model,1,1568167895.0
1348,1348,ezu14k2,t1_ezu01ly,eww7633,appl figur part,12,1568143184.0
1349,1349,ezu3bd6,t1_ezu01ly,Swade009,note four camera twelv gb ram wireless powershar inscreen fingerprint favorit featur know phone multipl screen one time pen realli similar appl pencil screen stuff alway display,5,1568144587.0
1350,1350,ezu2d5g,t1_ezu01ly,mxforest,air power,0,1568143979.0
1351,1351,ezuymnc,t1_ezuw9ob,xokocodo,paradigm new phone everi year certain becom less relev suppos redesign year x xs seem akin model upgrad think go everi two year make lot sens except revenu depend heavili push new hardwar often possibl,2,1568163379.0
1352,1352,ezv1o00,t1_ezv0lg3,xokocodo,mayb appl focus innov new devic solv differ problem instead ride coat tail iphon forev,1,1568165001.0
1353,1353,ezu00xj,t1_eztzkxq,sony2kPL,camera care,58,1568142473.0
1354,1354,ezu02p1,t1_eztzkxq,duuudewhat,next year four camera,10,1568142505.0
1355,1355,ezu31gi,t1_eztzkxq,TheWanton123,brave,3,1568144412.0
1356,1356,ezu07y3,t1_eztzkxq,iamsoserious,fusion,3,1568142600.0
1357,1357,ezu0bj9,t1_ezu036b,Doritos2458,pro gonna love,8,1568142664.0
1358,1358,ezvaxck,t1_ezu31ub,Fermats_Last_Account,develop like alway good,4,1568172024.0
1359,1359,ezu1va4,t1_ezu0q5f,Eteacles,one extra bad,164,1568143660.0
1360,1360,ezu2c75,t1_ezu0q5f,crawlywhat,get wors wors everi pass year even new adverti promo video full filler mean appl watch promo restat everi thing sinc first appl watch,6,1568143962.0
1361,1361,ezu21y6,t1_ezu0q5f,i_spot_ads,cook keynot dude tri save everi singl penni design three year straight much time take put god damn fast charger box feel like cook hold appl innov back,32,1568143779.0
1362,1362,ezu40iw,t1_ezu0q5f,toodrunktofuck,get anyth even remot fresh new chip extra camera color product like homepod least excit,6,1568144989.0
1363,1363,ezvm95u,t1_ezu0q5f,iTouneCorloi,like everi new iphon best ever made,2,1568184376.0
1364,1364,ezuekwa,t1_ezu0q5f,deleted,make better,1,1568150660.0
1365,1365,ezu1zz6,t1_ezu0ao7,mxforest,liter took cough drop,10,1568143744.0
1366,1366,ezuf9cr,t1_ezu0ao7,conversacion,thought present one interest though despit voic,2,1568151052.0
1367,1367,ezw0m66,t1_ezw02sb,deleted,heavi featur quick note emot,1,1568204412.0
1368,1368,ezvkjiw,t1_ezvj0u6,mellofello808,note ten also own hundr appl product sinc earli s,1,1568182038.0
1369,1369,ezvksfa,t1_ezvj0u6,SerialBridgeburner,imagin insecur prefer devic brand,0,1568182368.0
1370,1370,ezu09ya,t1_eztzhlw,ZtereoHYPE,think mean underwhelm,9,1568142636.0
1371,1371,ezu2k04,t1_eztzhlw,badass4102,europ,2,1568144101.0
1372,1372,ezu83ot,t1_ezu2q2h,maz-o,usa sale tax,8,1568147133.0
