,Unnamed: 0,Comment ID,Parent ID,Author,Body,Score,Created (UTC)
0,0,eztzsad,t3_d2cglb,deleted,think agre move year mega thread stupid reddit live format absolut horribl idea,2340,1568142317.0
1,1,ezu2mwb,t3_d2cglb,hoodswrath,felt like watch e amount game show smh,115,1568144152.0
2,2,eztzn9z,t3_d2cglb,benc777,aboard two thousand twenti hype train,590,1568142228.0
3,3,ezu00rw,t3_d2cglb,bungallobeaverv2,third year iphon x,688,1568142470.0
4,4,ezu14pu,t3_d2cglb,ExtremelyQualified,believ ball name one innov,947,1568143187.0
5,5,eztzw0s,t3_d2cglb,coreyonfire,d touch offici dead miss three new phone,352,1568142384.0
6,6,eztzdf1,t3_d2cglb,dysgraphical,perhap bit unrel think live chat discuss way go futur appl event amount spam overwhelm buri actual discuss go speed chat went quick undoubt promot spam peopl knew spam comment would get buri spam tri report chat move quick quit honest near imposs moder blame mod sure tweak automod definit help go requir lot hand deck effect cut spam exampl went,300,1568142050.0
7,7,ezu1krz,t3_d2cglb,Lucky-Kangaroo,tile ceo let loud sigh,157,1568143473.0
8,8,ezu1tyf,t3_d2cglb,thu22jun,went extrem low expect still feel underwhelm,645,1568143636.0
9,9,eztzjpx,t3_d2cglb,mragarg,anyon els thought kept show video photo shot eleven pro might hike price innov show,299,1568142164.0
10,10,eztzfj9,t3_d2cglb,Merman123,anoth year sixti four gb dollar real kick nut,419,1568142089.0
11,11,eztzkjd,t3_d2cglb,Klumpmeister,realli someth came away keynot think watch five highlight event,461,1568142178.0
12,12,eztzilm,t3_d2cglb,Jyrpsi,mention io thirteen releas,125,1568142144.0
13,13,eztzfal,t3_d2cglb,EchoEchoEchoChamber,worst mega thread ever reddit pleas explain comment auto lock necessari edit mod repli found,631,1568142085.0
14,14,eztzfym,t3_d2cglb,blazlelight,think go get new batteri x two hundr fifti six gb upgrad next year iphon twelv,325,1568142096.0
15,15,ezu4e7o,t3_d2cglb,PeachyKeen73,miss appl actual made enough improv phone make everyon want new one goal hold onto current one long possibl blow dollar,37,1568145183.0
16,16,ezu3vz2,t3_d2cglb,nionix,heard never better time buy last year model discount price,106,1568144919.0
17,17,eztzefe,t3_d2cglb,IvaHughJhog,one thing,333,1568142069.0
18,18,ezu09yd,t3_d2cglb,viperguy212,wow honest felt like noth might well go ahead call xss,33,1568142636.0
19,19,eztzei2,t3_d2cglb,bittuhari,sixti four gb base model underwhelm note base storag two hundr fifti six gb ffs kind understand ad ground break featur everi year sixti four gb storag pro model appl respect custom jump sixti four gb two hundr fifti six gb show market ploy forc custom go two hundr fifti six gb extra price feel like sixti four gb advertis iphon start one thousand buck,747,1568142070.0
20,20,ezu0pkg,t3_d2cglb,thu22jun,thing innov r appl mod tri new live chat clear becam shit show,154,1568142914.0
21,21,ezu21ms,t3_d2cglb,swansonben,yep wait two thousand twenti spent almost entireti iphon keynot go camera skip lot spec look appl store see sixti four gb base mode terribl still hang lightn cabl least ad fast charger box hope two thousand twenti way impress,28,1568143773.0
22,22,eztzfib,t3_d2cglb,rbp25,honest underwhelm keynot long time much expect go fact drag keynot filler piec chip camera app sad liter noth worthi keynot,570,1568142088.0
23,23,ezu0am1,t3_d2cglb,iqstick,rip d touch even pro devic make want replac x anymor,45,1568142648.0
24,24,eztzlb8,t3_d2cglb,Dave_Matthews_Jam,sixti four gb pro way almost disappoint xs reveal,285,1568142193.0
25,25,eztzlc4,t3_d2cglb,iamseiko,surpris see appl reduc price almost base devic never thought see day appl admit mistak go back strategi realli expect dollar jump iphon watch,184,1568142193.0
26,26,ezu0sp3,t3_d2cglb,halolordkiller3,anyon els feel like drop ball year,58,1568142970.0
27,27,ezu5dt3,t3_d2cglb,mrmonkey3319,game pascal wager hilari awkward would showcas cheap chines plagiar dark soul low content,40,1568145688.0
28,28,eztzfax,t3_d2cglb,rackemrackbar,one less thing,97,1568142085.0
29,29,eztzmsa,t3_d2cglb,iNeryx,tbh watch see airpod three go announc safe go buy current gen,60,1568142219.0
30,30,eztzlu1,t3_d2cglb,VogelImKafig,sixti four gb,47,1568142202.0
31,31,ezu1z77,t3_d2cglb,wolfboyz,fact even pro model still start sixti four gb base storag embarrass exclud entir keynot shame know also mention face id improv still undecid gonna wait teardown see improv face id ram amount specif batteri size edit genuin surpris though put ultra wide camera regular eleven though kudo appl take ultra wide telephoto day,70,1568143730.0
32,32,ezu0cfy,t3_d2cglb,astrangebiscuit,sixti four gb storag dollar one thousand nineti nine phone wow someth,89,1568142680.0
33,33,eztzn91,t3_d2cglb,VokusX,say impress year keynot noth particular special one last thing sneak preview futur tech servic price minor updat product lineup oh well mayb next year year,56,1568142228.0
34,34,ezu1qzi,t3_d2cglb,RanaI_Ape,iphon pro usb c one hundr twenti hz screen pencil support exact pro slap ultra wide camera realli mean much thing everi android flagship alreadi done think go chang industri lmao oh still dollar one thousand one hundr sixti four gb good lord appl exploit custom loyalti like power em guess peopl keep buy would chang,193,1568143584.0
35,35,eztzgx1,t3_d2cglb,FeTemp,last year said next year year say next year,106,1568142113.0
36,36,eztzj4w,t3_d2cglb,zoriallemur,got price iphon eleven baselin model right mention iphon xr five hundr nineti nine dollar phone buy right,135,1568142153.0
37,37,eztzrfo,t3_d2cglb,xokocodo,absolut innov iter appl realli need stop overhyp modest improv focus new product design,215,1568142302.0
38,38,eztzi0z,t3_d2cglb,fjmalik,innov,122,1568142133.0
39,39,ezu3qyp,t3_d2cglb,Huggy_Bear48,look like hold onto anoth year babi might actual get four year colleg lmao,29,1568144842.0
40,40,eztzmrb,t3_d2cglb,dukerock12,one worst appl keynot ever,231,1568142219.0
41,41,ezu0zby,t3_d2cglb,deleted,first time bore one fell asleep,14,1568143089.0
42,42,ezu1fgc,t3_d2cglb,mellofello808,instead ambien white nois machin go start play appl keynot cure insomnia,34,1568143378.0
43,43,ezu31gc,t3_d2cglb,Lord-Lannister,guess care much camera iphon spent thirti min talk camera much els underwhelm event,13,1568144412.0
44,44,ezuahpw,t3_d2cglb,Fin745,start today custom choos pay month appl care plus appl care plus theft loss continu cancel beyond twenti four month appl watch ipad iphon also buy applecar plus airpod beat earphon headphon tri creat thread reddit kept delet,14,1568148412.0
45,45,ezujazi,t3_d2cglb,iiElysiumx,one underwhelm appl keynot long time pretti low expect go god dam still disappoint new ipad bore got kind excit said updat budget ipad mayb would get ipad pro style design appl watch five cool serious call alway display innov new iphon bore feel like gotten iphon ten third year row honest felt like anoth tier upgrad new ipad pro new air pod sixteen inch mac book noth realli interest pretti dull keynot appl tv look kinda cool though tri one month free trial drop uk also could care less arcad servic mobil game still continu bad despit mani consol level graphic put,12,1568153495.0
46,46,ezucvgm,t3_d2cglb,CrouchingPuma,unbeliev disappoint lmao,11,1568149707.0
47,47,ezu38vd,t3_d2cglb,brotherlymoses,appl meet room what bare minimum year,29,1568144543.0
48,48,ezu0ll4,t3_d2cglb,akwilliamson,first keynot stop watch halfway mani keynot appl think get away video filler minut camera video discuss say lifelong appl product owner make live iphon innov water noth substanc,51,1568142844.0
49,49,eztzezi,t3_d2cglb,PerpetualJam,whelm,79,1568142079.0
50,50,ezu0ex5,t3_d2cglb,Meltdown00,iphon eleven price uk versus dollar six hundr nineti nine us dollar six hundr nineti nine even take account vat uk still overpr uk compar exact product us get sick price bullshit,53,1568142726.0
51,51,ezu3g56,t3_d2cglb,sgs06,want usb c iphon tire need differ cabl mac ipad iphon mention watch home,11,1568144671.0
52,52,ezu2jyy,t3_d2cglb,deleted,,47,1568144100.0
53,53,eztzmot,t3_d2cglb,glitterfitte,also horribl horribl live chat deal,26,1568142218.0
54,54,eztzppz,t3_d2cglb,Ricanaire,want tile tbh,28,1568142271.0
55,55,eztztlm,t3_d2cglb,aznnihao,thing use run full two hour noon right wonder end get cut last minut,28,1568142341.0
56,56,ezu0huh,t3_d2cglb,nolifematt,anybodi els notic uk price us price iphon eleven pro rather dollar dollar nine hundr nineti nine today convers rate know pound stabl moment brexit howev price tag insult least match valu pro dollar,24,1568142777.0
57,57,ezu18ib,t3_d2cglb,SloppyinSeattle,innov,29,1568143255.0
58,58,eztzlec,t3_d2cglb,perfectviking,wast fuck time,87,1568142194.0
59,59,ezucxkl,t3_d2cglb,striedinger,sad excit thing announc alway display smart watch come appl fan,10,1568149740.0
60,60,ezu0cun,t3_d2cglb,Advanced_Path,miss steve keynot nowday feel like high school oral present good one cringier oscar hell real time voic over game oh giant babi ffs,38,1568142688.0
61,61,eztzl9h,t3_d2cglb,barktreep,call pro stupid slight updat xs like iphon seven eight generat bare differ give big new name make sound impress,63,1568142192.0
62,62,eztzeoc,t3_d2cglb,aprx4,low expect holi shit,86,1568142073.0
63,63,eztzk4x,t3_d2cglb,_Grimmjow,yea iphon eleven mayb other ill stick iphon plus,37,1568142171.0
64,64,ezu15nw,t3_d2cglb,HeartyBeast,well dull soneon lose key twice week realli hope rumour tile competitor,6,1568143204.0
65,65,ezu1sqf,t3_d2cglb,Homeguy123,anyon get seri five appl watch,7,1568143614.0
66,66,ezumhv4,t3_d2cglb,troubleman23,carrier employe glad back number roman numer tire hear ek ek max ek r day,7,1568155781.0
67,67,eztzmq0,t3_d2cglb,Schinkenpaprika,ipad gen a thirti two gb base storag two thousand nineteen smh head,24,1568142218.0
68,68,eztzqnt,t3_d2cglb,ftwin,appl basic doubl xr popular model call iphon may go well enthusiast may realli success given lower price point may dramat impact industri peopl choos phone,24,1568142289.0
69,69,ezu09do,t3_d2cglb,misterjuju,iphon seven still idea iphon eleven size seem unwieldi smaller hand feel comfort drop dollar one thousand one hundr forti nine eleven pro,12,1568142626.0
70,70,ezu3rbe,t3_d2cglb,ekmaster23,tim alway act like announc someth els end pretti disappoint keep boast haptic touch like remov d touch pretti much noth excit happen also releas one color matt finish probabl go slipperi also,13,1568144847.0
71,71,ezu8j92,t3_d2cglb,lemonick,underwhelm shit ive seen year watch f,12,1568147359.0
72,72,eztzrml,t3_d2cglb,brandawg93,sixti four gb storag ugh,30,1568142305.0
73,73,ezu0tx4,t3_d2cglb,pikameow2,still lightn,6,1568142991.0
74,74,ezu1gni,t3_d2cglb,kwickedbonesc,impress tbh left want inform like go packag deal news tv arcad music differ pro pro max size discontinu seri three watch make whole line new widen screen design get go pro model keep xr xs xs max option streamlin presum eleven go sell like hot cake cheap price tag got say impress alway display seri get seri two month ago would upgrad seri,6,1568143400.0
75,75,ezu1pst,t3_d2cglb,popientis,mod abil ruin everyth crazi hope never tri point lock everi comment,7,1568143563.0
76,76,ezu7mpu,t3_d2cglb,Reallytalldude,happen tile replac lot hype last week look like happen either,6,1568146886.0
77,77,ezu80h5,t3_d2cglb,WoahBeverageHere,like flip round product posit last year budget pick iphon xr year base model pro phone seen upgrad rather default way admit dollar one thousand dollar phone default,6,1568147085.0
78,78,ezub0ra,t3_d2cglb,Astreix_,look pro keen upgrad sixti four gb joke next step two hundr fifti six gb au dollar two thousand dollar,6,1568148696.0
79,79,ezvepvn,t3_d2cglb,hatpatprot,new megathread live system kill whole discuss imo,6,1568175455.0
80,80,ezu7npl,t3_d2cglb,jshah500,itt innov bunch horseshit pro model phone offer base sixti four gb laughabl tv look pretti cool discontinu seri four watch sell seri weaksauc move fuck reddit live chat mega thread best wait two thousand twenti real innov,15,1568146900.0
81,81,eztzy38,t3_d2cglb,deleted,entfernt,22,1568142421.0
82,82,ezuhmec,t3_d2cglb,careslol,felt entir keynot awkward half speaker poor present accent clear throat enthusiasm also audienc care minutia tech spec went talk sensor camera technolog one billion one trillion one blah blah process like throw random catch phrase meet quota someth get meat reveal alreadi guess realli enough thing innov throw filler tech spec video ad place,18,1568152422.0
83,83,eztztqz,t3_d2cglb,deleted,think eight hold anoth year interest lower month payment mean mani mani month instal,11,1568142344.0
84,84,ezu2ova,t3_d2cglb,bibasik7,odd hear anyth io,6,1568144189.0
85,85,ezugqp2,t3_d2cglb,Diablosblizz,everybodi els excit part keynot appl watch section tv see seem interest least give go pretti disappoint overal ladi introduc iphon eleven pro sure name guy introduc appl watch confus neither recogniz face use kevin lynch appl watch phil iphon hope would end pull one thing introduc new realli heavi hit featur hope sleep track watch still think might come softwar updat blood pressur monitor watch least someth new camera iphon perhap revers charg let charg watch screen fingerprint scanner five g readi stupid thing think confus first big name phil came introduc pro go upgrad newest phone year think might hold next year enough upgrad move iphon eight plus still work fine probabl need replac batteri soon storag bit lower like gb manag,5,1568151910.0
86,86,ezugtgy,t3_d2cglb,Pieter0313,nobodi go talk mani voic crack heard tonight,6,1568151954.0
87,87,ezuk2rp,t3_d2cglb,ExtremelyQualified,understand keep make peopl stage presenc speak abil present thing,5,1568154047.0
88,88,ezv2q02,t3_d2cglb,SnakeGuy123,one think iphon eleven ugliest flagship come year,6,1568165673.0
89,89,ezv3tpx,t3_d2cglb,jjban,fuck four camera samsung,5,1568166479.0
90,90,ezu0t48,t3_d2cglb,jgreg728,iter,15,1568142977.0
91,91,eztzye5,t3_d2cglb,SenpaiTati,worth upgrad,12,1568142427.0
92,92,ezu1qn1,t3_d2cglb,SalmonGram,underwhelm keynot even appl biggest watch featur compass non dim screen anyth sure could implement current model even cost batteri life pro model phone start sixti four gb pro thing focus camera mayb miss someth see anyth would warrant call pro,11,1568143578.0
93,93,ezu0f9i,t3_d2cglb,I_throw_hand_soap,get camera get camera get camera,8,1568142732.0
94,94,eztzn9u,t3_d2cglb,LightningZERO,expect someth cool colour cool camera,4,1568142228.0
95,95,ezufj9y,t3_d2cglb,bellhammer,futur go play huh increment updat never end seri product keep sharehold happi insist least someth get peopl buy product think final lost interest tech edit coupl word,5,1568151215.0
96,96,ezuiwzy,t3_d2cglb,mpshimek,anyon els doubt need pro like seem like differ addit rd camera hour batteri,4,1568153217.0
97,97,ezum80q,t3_d2cglb,aesopkc,curtain,4,1568155585.0
98,98,ezvdho9,t3_d2cglb,rafibomb_explosion,one comment fact joni ive narrat hype video al lu minum classi british accent guy got realli terribl,4,1568174292.0
99,99,ezvikty,t3_d2cglb,susrev,lot peopl realli underwhelm understand honesti mani expect includ make better realli honest though good event anyon yet enter appl ecosystem wait wallet friend excus super afford ipad inch afford baselin iphon eleven even afford xr appl watch seri three make entic entri point glad went xr upgrad seven earlier year mayb upgrad earli two thousand twenti one one two thousand twenti model,5,1568179626.0
100,100,ezu0wkn,t3_d2cglb,thu22jun,iter,15,1568143039.0
101,101,eztzk3l,t3_d2cglb,Jpellegrino1990,innov lol,23,1568142171.0
102,102,eztzfxu,t3_d2cglb,FoxySaint,sixti four gb serious,21,1568142096.0
103,103,eztzhbs,t3_d2cglb,khong756,airpod three wya,19,1568142120.0
104,104,ezu0dsa,t3_d2cglb,Weekly_Fee,want tile competitor,7,1568142705.0
105,105,ezu1ivc,t3_d2cglb,Pinkshisno,name thousand dollar phone pro reinforc idea default iphon enough cheap even xr last year camera upgrad seem signific pro wait next year around upgrad iphon eleven sell like hot cake nice cheap ipad pencil support a chip laughabl good enough long life start realli fall behind appl tv arcad almost instant subscript low price wonder well develop paid game hope see cheap seri four sale watch feel like would miss much purchas seri appl realli good oversel present realli critic per se,8,1568143439.0
106,106,eztzpa9,t3_d2cglb,Fiti99,joke new ipad exact spec th gen one goe constant sale dollar bigger expens,14,1568142263.0
107,107,ezu0nzo,t3_d2cglb,stormwolfdanger,realli bum new macbook pro,6,1568142887.0
108,108,eztzjpt,t3_d2cglb,Yeezus_Is_My_Jesus,realli start think appl zero idea custom want,34,1568142164.0
109,109,ezufnfo,t3_d2cglb,CodyCigar96o,fair even x rememb rumour say appl move three year cycl phone oppos two year model fuck six eight anyway make sens still essenti iphon x expect next year iphon notchless dream phone readi hope smaller model,3,1568151281.0
110,110,ezuhmn8,t3_d2cglb,NazTehRpR,iphon twelv pro max ultra come,3,1568152425.0
111,111,ezui8ju,t3_d2cglb,Mitchdawg27,even new colour disappoint,3,1568152776.0
112,112,ezuj489,t3_d2cglb,Chrispy__Bacon,year definit feel like filler year around hardwar thing discuss iphon nowaday updat cpu gpu batteri camera excit thing year io thirteen possibl appl new servic price seem decent least two thousand twenti seem promis howev market upgrad x get macbook pro,3,1568153360.0
113,113,ezv1xyi,t3_d2cglb,thoughtsrediculous,new ultra wide camera len optic imag stabil wide telephoto one,3,1568165149.0
114,114,ezvbrgf,t3_d2cglb,estendius,iter,3,1568172742.0
115,115,eztzgcq,t3_d2cglb,ahmelkady,night mode come io thirteen new iphon,12,1568142103.0
116,116,eztzoi8,t3_d2cglb,deleted,,9,1568142250.0
117,117,ezu0u9t,t3_d2cglb,Tetrylene,absolut disappoint everi regard noth new iphon eleven except new camera sixti four gb base storag tile tracker iphon support appl pencil pro motion display wireless accessori charg iphon glucos monitor appl watch,8,1568142998.0
118,118,ezu167l,t3_d2cglb,Saf94,peopl expect confer know increment upgrad onto three year cycl peopl even want upgrad phone everi year person glad phone way behind everi year feel like need upgrad constant save lot money like next year phone one big new featur knew upset someth knew understand case,7,1568143215.0
119,119,ezu0sz6,t3_d2cglb,cerberus_truther,cue rene ritchi slobber appl event base storag iphon eleven pathet base eleven come fast charger disclaim sub rene ritchi youtub general find video inform well put togeth also appl product enjoy well expect compani ludicr wealthi,6,1568142974.0
120,120,ezu22b8,t3_d2cglb,badass4102,appl event two thousand nineteen big stage present advanc technolog flagship product expect frogger,4,1568143785.0
121,121,ezu258p,t3_d2cglb,ahorseofborscht,welp gone keynot plan wait two thousand twenti five g model noth show chang mind,5,1568143838.0
122,122,ezu2oyu,t3_d2cglb,SargeantAlTowel,anyon spot innov,5,1568144191.0
123,123,ezvc9ba,t3_d2cglb,jack096,realli hope new macbook,5,1568173180.0
124,124,ezvgzb1,t3_d2cglb,JPQJPQJPQJPQJPQJPQ,keynot suck feel like huge focus camera appl tri flaunt say hey look lot camera night mode answer pixel ad campaign though long time come hope bring night mode io thirteen lock behind iphon fuck softwar base also everyon complain sixti four gb base iphon expand storag via microsd anyth look buy iphon wait today pressent extrem lacklust,5,1568177801.0
125,125,eztzguz,t3_d2cglb,BoltEyes,midnight green eleven pro look horribl,28,1568142112.0
126,126,eztzr8h,t3_d2cglb,futurepersonified,pathet,10,1568142298.0
127,127,eztzfm5,t3_d2cglb,Herdnerfer,color pick ugli color match ugli phone,10,1568142090.0
128,128,eztzlks,t3_d2cglb,glitterfitte,dissapoint pro matt like look guess mean less nasti fingerprint mark,4,1568142197.0
129,129,eztzmxj,t3_d2cglb,mragarg,midnight green might everyon want least show appl interest ad color mayb even base season,4,1568142222.0
130,130,eztztro,t3_d2cglb,TroyAtWork,would like emerald style green forest green present bad,3,1568142344.0
131,131,ezu363r,t3_d2cglb,deleted,lol iphon eleven dollar six hundr nineti nine america uk exchang rate meant go way appl,3,1568144495.0
132,132,ezu9hwa,t3_d2cglb,dergachoff,filmic demo multipl camera record thing got actual excit,3,1568147872.0
133,133,ezub2o3,t3_d2cglb,deleted,iphon x pro sixti four two hundr fifti six gb serious offer da fuck appl,4,1568148726.0
134,134,ezuq5ry,t3_d2cglb,ftwin,think point generat reset iphon line appl know dollar one thousand much lot peopl took flagship iphon name attach cheaper model still hell devic get ole get everyth els appl offer big screen great price choic phone peopl also give freedom pack stuff pro model feel constrain price feel weird noth realli chang think good idea appl general peopl get cheaper phone without choos cheaper model enthusiast get high end model k still win win,4,1568158505.0
135,135,ezv62fd,t3_d2cglb,boomsky7,appl tv event,4,1568168129.0
136,136,ezv71p1,t3_d2cglb,Angryangmo,woke morn think gonna go buy new canon slr instead last night horribl opinion one worst keynot ever even underwhelm expect still believ sixti four gb base pro phone,4,1568168885.0
137,137,eztzha1,t3_d2cglb,stebben,much ram pro model,8,1568142120.0
138,138,ezu2bur,t3_d2cglb,Deggyy,dollar k sixti four gb d touch pro model appl need stop snif glue,4,1568143955.0
139,139,ezu4316,t3_d2cglb,Timren1,innov see innov today,5,1568145025.0
140,140,eztzx5l,t3_d2cglb,Ying-Yang-TTR,realli interest year one unfortun probabl either get eleven xs xr instead,2,1568142405.0
141,141,eztzxvh,t3_d2cglb,deleted,,2,1568142418.0
142,142,ezu089h,t3_d2cglb,muhwtvracct,best part lack shock price,2,1568142606.0
143,143,ezu0jxh,t3_d2cglb,ZwnDxReconz,appl knew remov xs line pros increas uk honest cheaper xs would far compel,2,1568142815.0
144,144,ezu0o21,t3_d2cglb,labatomi,eleven get ole pros,2,1568142888.0
145,145,ezu1cro,t3_d2cglb,lionnyc,buy current version appl tv realli need one hold new version like three year sinc came new one,2,1568143331.0
146,146,ezu1ebm,t3_d2cglb,Swedish_Chef_Bork_x3,anyon els catch appl watch present mention app call gosup get paddleboard excit check far tell exist outsid stock app templat,2,1568143359.0
147,147,ezu1fcm,t3_d2cglb,thu22jun,anyon super interest photographi get xs three camera,2,1568143377.0
148,148,ezu1rhg,t3_d2cglb,GreatValueProducts,price canada good us nine hundr seventi nine cad seven hundr forti four usd past least pre tax price us exchang rate account,2,1568143592.0
149,149,ezu1vsl,t3_d2cglb,shit_taste,also hear applecar airpod soon cover loss though dollar twenti nine,2,1568143669.0
150,150,ezu1zhk,t3_d2cglb,clearlybritish,noth worth lose d touch,2,1568143735.0
151,151,ezu21ss,t3_d2cglb,Eteacles,keep xs anoth year,2,1568143776.0
152,152,ezu24j0,t3_d2cglb,deleted,iphon pro still go intel wireless chip go go back one qualcomm connect xs intel horrend happi upgrad would go back qualcomm,2,1568143825.0
153,153,ezu2r72,t3_d2cglb,Soundwarp,anyon know strict trade in iphon x immacul front back side stainless steel full scratch even case,2,1568144231.0
154,154,ezu3n98,t3_d2cglb,BernieForWi,understand pro much experi dollar three hundr ole screen third camera like lcd screen anymor x realli hurt guess wait anoth year least,2,1568144786.0
155,155,ezu3p7b,t3_d2cglb,GreenDoomsDay,store lower cost seri like bell virgin etc,2,1568144815.0
156,156,ezu56v2,t3_d2cglb,ExtremelyQualified,two point game need never anoth live game demo ever alway beyond pain appl seem realli set turn game someth unrecogniz actual gamer know fight much,2,1568145589.0
157,157,ezu6qlf,t3_d2cglb,TVPaulD,eye iphon eleven look good also heart set blue iphon get price cut iphon xr replac iphon x instead miss anyth feel essenti put save toward replac appl watch seri three cellular seri five get larger display devic alway function watch pretti happi lineup,2,1568146411.0
158,158,ezu7ua7,t3_d2cglb,Lockhara,read two thousand twenti iphon leak phone still fenc upgrad keep x though,2,1568146995.0
159,159,ezu8g27,t3_d2cglb,Tunatail,sixti four gb baselin pro model feel person mock dollar seventeen per gb,2,1568147313.0
160,160,ezu9h68,t3_d2cglb,MXAI00D,certain get new appl watch seri one broke would love iphon pro green buy new bike old one broke,2,1568147861.0
161,161,ezubjrd,t3_d2cglb,Short-The-Vix,despis camera look iphon eleven nonpro pro want upgrad x bigger screen xs max help eye what cost effect way trade x xs max sinc appl formal sell xs anymor,2,1568148987.0
162,162,ezubss7,t3_d2cglb,CompetentPretzels,kinda feel like iphon xss iphon xrs,2,1568149118.0
163,163,ezubvu5,t3_d2cglb,Melanjoly,typo new iphon eleven screen eight hundr twenti eight x one thousand seven hundr nineti two bought phone p screen five year ago,2,1568149162.0
164,164,ezuc3r0,t3_d2cglb,deleted,assum new phone would support five g standard evid incent upgrad gone,2,1568149281.0
165,165,ezudal8,t3_d2cglb,mandysux,bit annoy uk gbp price appreci pro phone base storag sixti four gb would pro user want let forc pro user pay two hundr fifti six realli curious see go pan appl,2,1568149945.0
166,166,ezuepgt,t3_d2cglb,RedLightGreenArrow1,item tracker,2,1568150735.0
167,167,ezuet3y,t3_d2cglb,feeblemuffin,promot display d touch find tag,2,1568150795.0
168,168,ezufzlc,t3_d2cglb,NoctisVia,man first keynot bit tune live glad two hour thirti minut worth news lower iphon sale thought would hit park innov panel first time say legitim confid stick current equip better play,2,1568151473.0
169,169,ezug01p,t3_d2cglb,steven10969,hope airpod gen event absolut noth yet probabl gonna buy eleven tmobil go good deal,2,1568151481.0
170,170,ezugwlk,t3_d2cglb,stickel03,appl websit iphon eleven price start appl store app start sooo junk,2,1568152007.0
171,171,ezuhm04,t3_d2cglb,PoliticalLash,anyon know new io,2,1568152415.0
172,172,ezuioh9,t3_d2cglb,hadapurpura,camera pro phone make uneasi also pro app pro phone joke,2,1568153047.0
