,Unnamed: 0,Comment ID,Parent ID,Author,Body,Score,Created (UTC)
1571,1571,ezuf1tw,t1_ezued5r,TheNickm2,well least similar enough delay right probabl terribl differ anyway hope see new thing ad next year rather typic camera chipset updat anyon tell touch hold stuff work way app previous use d touch one favorit reddit app io support d touch post view full size preview interest know work way,1,1568150932.0
1572,1572,ezum3c0,t1_ezult1q,hmg9194,wait wait xs meant xs,1,1568155492.0
1573,1573,ezvcq70,t1_ezu4lpm,mellofello808,work part boost reddit android,0,1568173594.0
1574,1574,ezu5a5g,t1_ezu4rui,Pepsidudemike,great idea hope make work surpris learn moder feel bad work anoth possibl solut would requir regist live event discuss possibl ban futur live discuss spam harass,2,1568145636.0
1575,1575,ezuhk4f,t1_ezugnc9,mellofello808,meh eight hundr fifti five fine,7,1568152385.0
1576,1576,ezva8pf,t1_ezupwi9,Fermats_Last_Account,usb c better start storag remov notch transfer charg wireless devic samsung includ faster charg cabl box put d touch back long press suck idk els,9,1568171449.0
1577,1577,ezvpqli,t1_ezugzsf,thu22jun,care fold phone futur give us avail usb c pro motion iphon,2,1568189825.0
1578,1578,ezuhxih,t1_ezufo10,jlately,screw creat expect keynot everi time releas iphon phone would fine spec bump press releas,3,1568152602.0
1579,1579,ezuiz0a,t1_ezufo10,mellofello808,bar chart look longer guess,1,1568153256.0
1580,1580,ezwoe1o,t1_ezwjghf,mister-capybara,total see happen keynot lol,1,1568221313.0
1581,1581,ezu76he,t1_ezu0snk,Stepwolve,especi sinc resolut framer usual get downgrad peopl upload social media anyway,30,1568146647.0
1582,1582,ezvot4x,t1_ezufv60,ImABitMocha,lot thing miss iphon present phone way cheaper room thing ad thing need,3,1568188281.0
1583,1583,ezv82q5,t1_ezufv60,Noblesseux,yeah fuck neat devic small alway capabl mind pro camera like tri pawn still neat,2,1568169692.0
1584,1584,ezvkzhy,t1_ezufv60,Ballaholic09,one want usb c screen fingerprint sensor appl gang sinc s get curious everi year peek see go buy underwhelm year year,2,1568182630.0
1585,1585,ezvpnhp,t1_ezufv60,4shtonButcher,p pro note other yet may big deal day appl catch play catch soc game unfortun anyon besid gamer still sound stupid phone hard need best regard day,1,1568189679.0
1586,1586,ezw7rxc,t1_ezufv60,jakebeans,phone alreadi less cost call leader innov new featur unveil alreadi market tell experi ultra wide len phone fuck fantast featur s six month none featur new phone better phone alreadi hype like crazi new innov product seem laughabl set market tend like use current follow,1,1568210153.0
1587,1587,ezwyhsl,t1_ezufv60,deleted,idk could hz shit even hz display forget faceid go display fingerprint reader base fuck storag sixti four gb fuck sale buy sd card one hundr twenti eight gb less dollar appl charg dollar one hundr sixti four gb higher resolut screen take away d touch appl complac know everyon buy regardless,1,1568227977.0
1588,1588,ezvouat,t1_ezufv60,Rubixsco,yes buy phone camera could take hi res pictur fuck moon care buy one camera alon,0,1568188332.0
1589,1589,ezvdunc,t1_ezu7xkd,polikuji09,issu name event innov noth realli innov featur besid process simpli get date competit market,2,1568174623.0
1590,1590,ezu9i6f,t1_ezu6eqc,RichestMangInBabylon,sure appl done lot market research probabl know term tech invest camera realli nice probabl top market interest camera slofi lol next biggest sell point imo batteri life a whatev process power nice recent phone still way overpow basic function like social media app video sure would compel anyon upgrad point latest even someon choos buy eight look get iphon upgrad signific older phone,8,1568147876.0
1591,1591,ezuknj0,t1_ezu6eqc,IamtheSlothKing,take good photo video almost decad least interest part supercomput pocket,2,1568154463.0
1592,1592,ezubm1v,t1_ezu9esf,Sandurz,fuck even want new phone lmao,11,1568149020.0
1593,1593,ezu5z32,t1_ezu2u79,nikkynak,dollar one thousand three hundr seventi nine cad north border,16,1568146001.0
1594,1594,ezvkv51,t1_ezu2u79,AxeellYoung,trade price even depress look trade eleven pro us trade xs dollar five hundr nineti nine uk trade xs,1,1568182470.0
1595,1595,ezvnjq5,t1_ezu2u79,Squif-17,mean basic day deal deal expect pound take hit ever brexit actual happen,0,1568186277.0
1596,1596,ezu2qis,t1_ezu28bd,DizzyAcanthocephala,includ vat clear still dumb af serious galaxi s start euro someth atm one hundr twenti eight gb eight gb ram fast charg revers wireless charg admit android fan alway look forward appl keynot well iphon massiv underwhelm two year row meanwhil android counterpart incred innov stuff pop camera nineti hz screen,17,1568144219.0
1597,1597,ezvng4k,t1_ezu5ahh,just_szabi,spotifi use data new telekom packag europ get bigger trend offer applic limit music list soon netflix hbo go amazon video bigger packag,1,1568186131.0
1598,1598,ezuaf16,t1_ezu5ahh,pandabubblepants,see fair enough make sens,1,1568148371.0
1599,1599,ezuabf2,t1_ezu8faw,pandabubblepants,guess common delet thing like movi podcast complet sure help,2,1568148314.0
1600,1600,ezu1ujf,t1_ezu0kur,John_Holliday,keep upgrad iup everi year get free life,26,1568143646.0
1601,1601,ezu3q9c,t1_ezu0kur,nangadef,certain drive new sale devic dollar nice perk,2,1568144831.0
1602,1602,ezu336y,t1_ezu0kur,Xillllix,ten dongl,1,1568144443.0
1603,1603,ezuczut,t1_ezu0kur,CrouchingPuma,start bought ipad week ago get grandfath servic launch,1,1568149775.0
1604,1604,ezu2jqw,t1_ezu1w27,MaGNeTiX,idea yet imagin howev given littl power must use imagin save much batteri turn,13,1568144097.0
1605,1605,ezutomn,t1_ezu1w27,BitchImADogRoof,seri four batteri signific better seri three eighteen hour batter life big estim,1,1568160636.0
1606,1606,ezu2r8c,t1_ezu1t0e,MaGNeTiX,seem pointless watch honest,10,1568144232.0
1607,1607,ezv2w3u,t1_ezu1t0e,aidsy,sorri,2,1568165797.0
1608,1608,ezu3q1t,t1_ezu0di9,DyZ814,behav like normal watch lol say though alway turn wrist get screen turn annoy,32,1568144828.0
1609,1609,ezu21fs,t1_ezu0hbs,azndinho,think s similar s keep peopl buy s discontinu forc peopl choos thing xs eleven pro,81,1568143770.0
1610,1610,ezuepph,t1_ezu0hbs,iHateMyUserName2,exact said keep s discontinu s appl basic said similar s s know lower price s cannib sale s cash profit margin s s give us,3,1568150739.0
1611,1611,ezu0ft3,t1_ezu083k,InsertWittyNameRHere,compass,18,1568142742.0
1612,1612,ezu3ryi,t1_ezu1e23,SuccessAndSerenity,new old ipad surpris outdat felt bezel home button look pro,3,1568144857.0
1613,1613,ezubv7k,t1_ezu9m2p,MrMatt808,refurb x dollar six hundr seventi nine appl com right,5,1568149152.0
1614,1614,ezu0o1t,t1_ezu0l4x,deleted,,21,1568142888.0
1615,1615,ezuez2s,t1_ezu5300,kal423,surpris pretti stabl use week real issu,1,1568150889.0
1616,1616,ezu0bpu,t1_eztzzk5,deleted,,27,1568142667.0
1617,1617,ezu05cg,t1_eztzzk5,Fiti99,see must miss thank,2,1568142554.0
1618,1618,eztzxyl,t1_eztznjv,f0nel,chat even moder overal qualiti discuss go shit non end result peopl spam shitti copypast text,63,1568142419.0
1619,1619,ezu0744,t1_eztznjv,gnarlnick,saw nasti comment stuff babi glass went flow,11,1568142586.0
1620,1620,ezu0yrm,t1_eztznjv,orcinovein,like forget would need moder rapid move chat never experienc twitch mod complet shat bed hard,3,1568143078.0
1621,1621,ezu0nqk,t1_ezu0gk8,dysgraphical,necessarili live chat discuss work well smaller communiti stricter moder communiti million subscrib definit attract fair share troll,3,1568142883.0
1622,1622,ezu0cgp,t1_ezu09o0,dysgraphical,less desktop made comment buri less two second emoji,2,1568142681.0
1623,1623,ezu2lzp,t1_ezu0h69,exjr_,note,115,1568144136.0
1624,1624,ezu65oo,t1_ezu0h69,SebiSeal,yeah reddit alway long form comment ideal contribut well thought anyth useless downvot twitch chat real back yike,9,1568146097.0
1625,1625,ezu4b7t,t1_ezu0h69,RandomRedditor44,like pleas use,-22,1568145141.0
1626,1626,ezu1mio,t1_ezu0ov4,BlueVerse,view everyon new reddit look like complet joke ok look like complet joke everyon new reddit,13,1568143504.0
1627,1627,ezu26ul,t1_ezu21jl,orcinovein,especi mod know popular apollo app around,7,1568143865.0
1628,1628,ezu8mkx,t1_ezu65kh,absentmindedjwc,mayb sticki ing warn,1,1568147406.0
1629,1629,ezu29hg,t1_ezu1y47,exjr_,never expect everyon know would unrealist expect,9,1568143913.0
1630,1630,ezu05ol,t1_eztzwow,EvilLukeSkywalker,know want get outrag,20,1568142560.0
1631,1631,eztzyuk,t1_eztzuy7,TheReacher,cours explain,4,1568142436.0
1632,1632,ezu01e0,t1_eztzx54,FakeBohrModel,well learn probabl gonna use,3,1568142482.0
1633,1633,ezu0m8h,t1_ezu07px,Mc_Lovin81,wow factor gone find keynot interest anymor cring throw pro word around much one iphon user sinc origin one get excit anymor innov year ago everi year new chip percentag better graph chart show keynot meh,65,1568142856.0
1634,1634,ezu0jr6,t1_ezu07px,geocastaneda,look jump plus well,5,1568142812.0
1635,1635,ezu54xn,t1_ezu07px,mikami677,mind ask exact work well pick use one dollar one hundr year ago io develop abl handl everyth thrown use daili driver phone though experi probabl differ,1,1568145561.0
1636,1636,ezucn9n,t1_ezu07px,Zladan,s say health wait next year,1,1568149579.0
1637,1637,ezumc8e,t1_ezu07px,CmdrMcLane,s work great got new free batteri last year anoth year,1,1568155667.0
1638,1638,ezuug2q,t1_ezu07px,nomoreconversations,six phone go amaz upgrad underwhelm us upgrad past year alreadi,1,1568161060.0
1639,1639,ezvg1k9,t1_ezu07px,Outlulz,s get poor perform newer game app realli itch new camera travel lot want captur lot memori partner imagin anyon bought x xs see much bump four generat behind featur point readi catch,1,1568176788.0
1640,1640,ezu8lu2,t1_ezu07px,pellehempton,alway come dark side lot interest android phone sharp price headphon jack care cours,0,1568147394.0
1641,1641,ezvxn4f,t1_ezuamev,Ftpini,x use could simpl general warmer live batteri degrad faster hot environ,1,1568201474.0
1642,1642,ezu5lwy,t1_ezu2aln,PurritoExpress,fuck screen normal old hit puberti,9,1568145807.0
1643,1643,ezu65rf,t1_ezu2aln,PCsAreQuiteGood,fuck screen less,5,1568146099.0
1644,1644,ezu8386,t1_ezu4a7v,crimdelacrim,still feel like seven plus launch steal compar dollar want eleven whatev pro appl replac batteri scandal coupl year ago still go strong also g would pay much phone drastic less memori g dollar one thousand one hundr phone k fps camera standard eat memori like noth unbeliev,6,1568147127.0
1645,1645,ezu8lc6,t1_ezu5ri6,SwarlesSparkleyyy,honest think might end new one unless surfac book three turn fantast,1,1568147388.0
1646,1646,ezu0nf8,t1_ezu0f9p,Brokendreams0000,appl care two year option warranti batteri need servic lower speaker incred weak give replac,4,1568142877.0
1647,1647,ezu1e5j,t1_ezu10ro,Brokendreams0000,yeah unless someth wrong phone need pay batteri need servic lower speaker incred weak noth big realli applecar run novemb rather tri get new one overal pretti chill applecar got new s six seven free real big problem mayb applecar work littl bit differ europ,3,1568143355.0
1648,1648,ezu0sp2,t1_ezu02bo,JackCarbon,hope move fulli screen camera like samsung goal like two thousand twenti two thousand twenti one someth,6,1568142970.0
1649,1649,ezu122n,t1_ezu02bo,Mr_FixShit,holi shit hate new name shit confus stick number model,3,1568143139.0
1650,1650,ezvxrje,t1_ezu02bo,Ftpini,bad news buddi happen get s rumor featur year along better camera slight tweak screen,1,1568201606.0
1651,1651,ezu2k0t,t1_ezu201u,ampinjapan,set batteri batteri health list percentag maximum capac,1,1568144101.0
1652,1652,ezvbmsc,t1_ezvah2c,Subredhit,yes two year time mayb releas next year s,1,1568172630.0
1653,1653,ezvfjbh,t1_ezuxaew,Fermats_Last_Account,especi seri work take screen show sometim anyth,1,1568176266.0
1654,1654,ezu7rk0,t1_ezu05fc,Villager723,appl pencil iphon support new macbook nois cancel airpod new appl tv appl tile competitor back charg iphon right event um yeah none happen,170,1568146955.0
1655,1655,ezu77nf,t1_ezu05fc,HeyCharlieBall,rumor remov haptic touch ad appl pencil support lmao,6,1568146665.0
1656,1656,ezu5flz,t1_ezu05fc,draftburner123,capac dead still sixti four gb entri level,7,1568145714.0
1657,1657,ezujkqc,t1_ezu05fc,iiElysiumx,think appl concentr much softwar forgotten hardwar,1,1568153689.0
1658,1658,ezu1ujr,t1_ezu05fc,deleted,,0,1568143647.0
1659,1659,ezuuy1m,t1_ezu6kfr,bruhvevo,rumor logo chang appl logo icon rumor chang,1,1568161337.0
1660,1660,ezu4edl,t1_ezu35cd,SuccessAndSerenity,someon came long guy tweet basic said nbd chang window display store first guy talk ass,15,1568145185.0
1661,1661,ezvviu4,t1_ezupxg7,Ftpini,paid extra x two hundr fifti six gb eighteen gb use want faster ssd seem worth ton storag want preload bunch movi travel,1,1568199035.0
1662,1662,ezu26ks,t1_ezu01m1,crawlywhat,fast extra camarea,101,1568143860.0
1663,1663,ezu4x1g,t1_ezu01m1,TheRickFromC137,camera advanc coconut hole pattern ever,16,1568145447.0
1664,1664,ezu516w,t1_ezu01m1,Dragon_yum,price,13,1568145508.0
1665,1665,ezu1gvm,t1_ezu01m1,Archvile7,profession camera edit geez guy sarcasm,5,1568143404.0
1666,1666,ezvitom,t1_ezu01m1,mister-capybara,get pro new iphon innov,1,1568179917.0
1667,1667,ezu1rmm,t1_ezu0k5j,y_13,oof boy bad news,10,1568143595.0
1668,1668,ezu1p6q,t1_ezu0k5j,ideonode,well interest uk store bad news,8,1568143552.0
1669,1669,ezu1l7m,t1_ezu0k5j,John_Holliday,look appl websit base pro pro max sixti four gb,4,1568143480.0
1670,1670,ezu72d7,t1_ezu0k5j,jshah500,r agedlikemilk,3,1568146584.0
1671,1671,ezu4sk3,t1_ezu0k5j,SuccessAndSerenity,lol bruh,2,1568145383.0
1672,1672,ezu8ebl,t1_ezu0k5j,mahamoti,liter,1,1568147288.0
1673,1673,ezul78p,t1_ezud3pq,Impedateon,yes mac os fundament offic app instal one hundr gb storag basic right bat,17,1568154859.0
1674,1674,ezv9ql3,t1_ezud3pq,Fermats_Last_Account,yeah shit,1,1568171029.0
1675,1675,ezv5hka,t1_ezupapb,dorv,dad upgrad gen one ipad pro week c level exec small firm check usag still forti nine gig pro mean differ thing differ peopl,6,1568167693.0
1676,1676,ezv9xgt,t1_ezu3tcb,Fermats_Last_Account,say none record big video want space enough k video fit bare use iphon seven purchas music devic wtf peopl,2,1568171188.0
1677,1677,ezvs4c7,t1_ezvrwp8,robinisbatman,yeah fair enough icloud photo librari user tb plan pretti much everyth sync icloud still stuff upload usual happen wifi cellular data would assum video shot alway good enough stabl wifi connect case hell would say lot time one person think reason assum gonna shoot k video sixti four gb iphon upload continu use devic ridicul opinion get say,1,1568193884.0
1678,1678,ezu3hdg,t1_ezu0k0f,Real_Rule,trailer game horribl,12,1568144692.0
1679,1679,ezukapw,t1_ezu65yk,thereturnofjagger,tim cook lot get today gonna skip updat lot get today three demo shitti game video upon video etc,7,1568154208.0
1680,1680,ezv7ari,t1_ezv5vix,iamseiko,think first time actual stood even tim paus awkward sever time speak first,3,1568169084.0
1681,1681,ezvlkwb,t1_ezv5vix,coriscaa,one like craig federighi,3,1568183440.0
1682,1682,ezu2h5p,t1_ezu1mvi,maz-o,think,0,1568144051.0
1683,1683,ezugadv,t1_ezufxdg,Pepsidudemike,ok would stood whole keynot back back video guy background go cut grass kinda weird though edit,5,1568151649.0
1684,1684,ezuiio2,t1_ezui2ic,Pepsidudemike,think even thought bad idea peopl use appl product actual product,3,1568152942.0
1685,1685,ezukhvi,t1_ezukdv8,Pepsidudemike,six imag shot iphon put screen individu comment relat quick still felt place,9,1568154349.0
1686,1686,ezuaw9h,t1_ezu23qv,printedricemuffins,rememb correct steve year also display infin blade game,5,1568148630.0
1687,1687,ezueddv,t1_ezu23qv,iHateMyUserName2,sure made investor media outlet would see shini new subscript base servic make ton money compani look keynot show compani lineup consist get money investor consum make lot sens,4,1568150541.0
1688,1688,ezu1vkp,t1_ezu06qp,Zeref3,updat websit product silent updat worthi,37,1568143665.0
1689,1689,ezu0r1x,t1_ezu06qp,Jewrisprudent,honest go underwhelm adjust keynot appropri spend two hour announc three minut worth new featur quiet releas way iter laptop upgrad altern wait releas someth actual bigger upgrad implement,60,1568142941.0
1690,1690,ezucqt1,t1_ezu06qp,Osuwrestler,new ipad even worth mention,5,1568149632.0
1691,1691,ezudgbj,t1_ezu9zrp,Jewrisprudent,sorri right even wors keynot one part bigger event issu held massiv event slew underwhelm announc first place one set expect plan hour press event cover minut worthwhil featur,5,1568150029.0
1692,1692,ezu13qy,t1_ezu00bd,ScHaKaLaKa___,sad true,9,1568143169.0
1693,1693,ezu1ntn,t1_ezu00bd,SJBrunel,iphon ipad matur product iter get smaller year,3,1568143527.0
1694,1694,ezu2sm7,t1_ezu00bd,zaptrem,iphon x announc great last year watch seri four great,6,1568144256.0
1695,1695,ezvfaiv,t1_ezvdtow,jayplus707,knew go upgrad iphon x still good phone plus dollar one thousand two hundr price tag took two year pay like enjoy time phone payment everyth els ok realli care much phone sinc wait two thousand twenti anyway first time upgrad two year mark,1,1568176021.0
1696,1696,ezubug5,t1_ezub6hq,maz-o,oh that call time lol,1,1568149142.0
1697,1697,ezucdav,t1_ezub6hq,maz-o,differ newer haptic touch,1,1568149426.0
1698,1698,ezv0r1k,t1_ezu9sf9,deleted,,2,1568164515.0
1699,1699,ezu5puz,t1_ezu4hvg,ExtremelyQualified,think realli price nand flash memori cheap day mind start sixti four gb charg extra dollar two hundr two hundr fifti six gb dick move,28,1568145866.0
1700,1700,ezuemf3,t1_ezu4hvg,conversacion,yeah target pros sixti four gb realli low especi go use film photo featur,4,1568150685.0
1701,1701,ezval4n,t1_ezu4hvg,Fermats_Last_Account,agre sad appl charg dollar one thousand sixti four gb sixti four gb enough even fill half thirti two gb iphon price lower,1,1568171737.0
1702,1702,ezucyzj,t1_ezu3plo,kmanmx,sure peopl use doubt state point noth fact sixti four gb enough peopl offer two hundr fifti six gb base model price would higher everyon yet peopl would get use doubt appl price storag bad valu proposit though never argument,5,1568149762.0
1703,1703,ezucizv,t1_ezucfyz,kmanmx,tri made comment cost said lot peopl use sixti four gb,6,1568149514.0
1704,1704,ezucmjs,t1_ezuat4m,kmanmx,put googl photo someth take pic put use icloud delet devic,5,1568149568.0
1705,1705,ezukyvt,t1_ezuat4m,SupremeGodzilla,concern lose photo forev phone becom damag faulti lost blow mind peopl happi carri around ten thousand import potenti irreplac photo piec hardwar probabl use daili toilet,4,1568154692.0
1706,1706,ezu5r6y,t1_ezu2upy,TheRealClose,thought could still keep normal set,1,1568145886.0
1707,1707,ezu584l,t1_ezu3bk4,SuccessAndSerenity,pretend base price,2,1568145607.0
1708,1708,ezu5cr3,t1_ezu3bk4,maz-o,either,0,1568145673.0
1709,1709,ezu6ck5,t1_ezu33ha,Superhobbes1223,mayb abl maintain margin reduc product cost,7,1568146201.0
1710,1710,ezu4x73,t1_ezu2p4o,SkidTrac,sinc peopl like compar set iphon equival samsung counterpart iphon eleven galaxi se would probabl comparison first time samsung phone actual expens iphon knock dollar fifti price pretti huge deal scenario let wait see samsung next year,9,1568145449.0
1711,1711,ezu34a9,t1_ezu2p4o,Spanget,nice price drop right,4,1568144463.0
1712,1712,ezv2vj6,t1_ezu2p4o,Knights123,rebrand xr eleven x pro genius plus whole x roman numer thing threw everyon ten even fit mac os x sure one realiz time new brand far superior x skip go roman numer base x huge price jump etc,2,1568165785.0
1713,1713,ezu1fsm,t1_ezu153o,i_spot_ads,chariti price drop make peopl happi know realis appl feed exact design pas three year straight point manufactur design three year straight get cheaper seen iphon design two year condemn price drop prais second come jesus either,-8,1568143385.0
1714,1714,ezu24f4,t1_ezu0ren,LeftAl,better,-3,1568143823.0
1715,1715,ezuczes,t1_ezu0p2k,xLoneStar,man bought nd gen one two month ago amaz probabl appl best idea recent year regret unless need nois cancel buy,3,1568149768.0
1716,1716,ezu65g6,t1_ezu0p2k,SuccessAndSerenity,airpod dope,2,1568146094.0
1717,1717,ezu7ddv,t1_ezu0p2k,maz-o,current one great continu great regardless behind corner,2,1568146751.0
1718,1718,ezurpws,t1_ezu0p2k,TapatioPapi,long get buyer remors new one get announc fine realli last long time launch one still amaz till day,1,1568159552.0
1719,1719,ezu80de,t1_ezu7mj1,tommotlol,cours get make fun price option open forum,7,1568147083.0
1720,1720,ezu7jv8,t1_ezu6hul,cheanerman,reaction hobbyist photograph thought deep fusion go someth cool comput photographi actual groundbreak even show us bet took portrait x look moreorless,9,1568146844.0
1721,1721,ezwmn88,t1_ezwjako,JohrDinh,cool say requir power phone batteri smaller ipad everi bit count add cool find funni peopl act like pain cuz appl put much game changer five extra hour batteri life imo,1,1568220176.0
1722,1722,ezuq0vn,t1_ezupfcq,JohrDinh,still iphon s alreadi ever need phone non hardwar reason peopl use appl product make appeal judg comment android user complain thing understand hardwar spec sheet nerd differ guess fault peopl work differ see thing differ henc happi devic hate revers true talk android devic hate probabl love fine add stuff guess miss either get way use enjoy low light featur honest extra batteri life general never sat around pine slight less screen lag tho,-2,1568158402.0
1723,1723,ezubz84,t1_ezu7p4m,MrMatt808,laptop tri make ipad pro line laptop replac,-2,1568149211.0
1724,1724,ezvrk95,t1_ezvmuk7,rmonik,xs still expens ole make big differ,2,1568192939.0
1725,1725,ezvxai9,t1_ezvmuk7,TNAEnigma,go eleven reason went xr x way small ole big deal,0,1568201095.0
1726,1726,ezu4ehk,t1_ezu2glm,TNAEnigma,sure a beast longev purpos buy go a phone,38,1568145187.0
1727,1727,ezu8kw8,t1_ezu2glm,blackwoe,new processor camera longev extra dollar one hundr good sell,18,1568147381.0
1728,1728,ezu84ne,t1_ezu2glm,skiier97,would get extra year io support,12,1568147148.0
1729,1729,ezu7mw2,t1_ezu2glm,originalgg,resal valu,12,1568146888.0
1730,1730,ezu4yqm,t1_ezu2glm,orcinovein,yes new camera mile better junk one xr,-6,1568145473.0
1731,1731,ezu6bp6,t1_ezu1ifj,rK3sPzbMFV,current iphon low light photographi mile behind android flagship,14,1568146188.0
1732,1732,ezu238p,t1_ezu1ifj,barktreep,issu gf upgrad like keep phone three year good best get especi night mode good googl,6,1568143802.0
1733,1733,ezukldl,t1_ezueu8w,mau5-head,delet,1,1568154420.0
1734,1734,ezu6ua3,t1_ezu5vp9,Iredditfromwork,especi samsung googl alreadi done,9,1568146466.0
1735,1735,ezu54xp,t1_ezu2qi0,SiakamIsOverrated,good comment lot left appl unreason stuff either flagship good portion featur similar variant featur,35,1568145561.0
1736,1736,ezu6ryr,t1_ezu2qi0,Iredditfromwork,none would innov though exist elsewher alreadi,1,1568146431.0
1737,1737,ezv2irr,t1_ezu2qi0,b1e,lot doabl year imo would less negat launch everi two year instead,1,1568165525.0
1738,1738,ezwd10u,t1_ezu2qi0,Cb6cl26wbgeIC62FlJr,think busi strategi keep everyon either innov like forc touch d touch use trackpad watch wait competitor introduc featur take improv,1,1568213814.0
1739,1739,ezu526c,t1_ezu17db,unpluggedcord,still innov sad,6,1568145522.0
1740,1740,ezv78kr,t1_ezv5r4l,IReallyLoveAvocados,think much left phone space ok iter make nicer give better batteri life nice screen camera alreadi interest devic go watch much greater headroom innov could invent glucos monitor revolution million peopl live phone go appl know need keep releas phone big challeng overcom,1,1568169036.0
1741,1741,ezu3e2s,t1_ezu3bd6,duuudewhat,four camera wow extra camera thing actual want wireless powershar,0,1568144636.0
1742,1742,ezu2eow,t1_ezu2d5g,duuudewhat,trigger,-2,1568144007.0
1743,1743,ezu36np,t1_ezu0bj9,deleted,well thus spake schiller guess els lol,1,1568144504.0
1744,1744,ezvblvt,t1_ezvaxck,deleted,,-2,1568172609.0
1745,1745,ezu2qy8,t1_ezu1va4,byronnnn,agre especi devic follow version product line featur ad x xs xs pro camera batteri life realli,45,1568144227.0
1746,1746,ezu5nvh,t1_ezu1va4,maz-o,wors live emoticon bullshit,3,1568145836.0
1747,1747,ezu6efq,t1_ezu1va4,rupertLumpkinsBrothr,,1,1568146229.0
1748,1748,ezu4ua3,t1_ezu1va4,orcinovein,also said everi year,-3,1568145407.0
1749,1749,ezu3znk,t1_ezu21y6,cbfw86,could explain peopl leav,13,1568144976.0
1750,1750,ezuf6kb,t1_ezu21y6,conversacion,yeah sure iphon would ever happen cook ceo,6,1568151006.0
1751,1751,ezum8rc,t1_ezu21y6,plastiqmanb,wonder joni left,3,1568155599.0
1752,1752,ezujco6,t1_ezuekwa,rupertLumpkinsBrothr,knee jerki point peopl say end buy new product anyway,0,1568153528.0
1753,1753,ezvxrqh,t1_ezvksfa,thinkbox,imagin go sub shit peopl imagin guy,1,1568201611.0
1754,1754,ezu0xwl,t1_ezu09ya,ExtremelyQualified,nope perfect whelm,14,1568143062.0
1755,1755,ezu8vw9,t1_ezu2k04,Jmaster_888,mayb quot robin nightw young justic,3,1568147545.0
1756,1756,ezud3gs,t1_ezu83ot,TravelDude14,yeah way less though highest sale tax us half uk eu,0,1568149832.0
1757,1757,ezuknk6,t1_ezueu0q,kamrun,mean let also rememb minimum wage australia versus much us know still expens see minimum wage doubl home state well start make littl sens,1,1568154464.0
1758,1758,ezvwteo,t1_ezvsezz,IDontHaveRomaine,lol sure dude,0,1568200568.0
1759,1759,ezvwu65,t1_ezvsezz,IDontHaveRomaine,lol sure dude,0,1568200591.0
1760,1760,ezu6td0,t1_ezu4vm9,lacxeht,nope featur almost non us market exampl iphon said start dollar six hundr nineti nine usa start portug euro take away euroish vat left aprox euro dollar dollar expens usa gap get hundr get eleven pros imac mbp,2,1568146452.0
1761,1761,ezu9xu0,t1_ezu840g,OkDot2,forc offer addit warrant year us year us two year uk due eu law come free margin need includ absorb potenti mainten cost increas appl care compar refer tradit basic warranti could potenti cost appl,1,1568148113.0
1762,1762,ezufo2a,t1_ezud5fn,TravelDude14,know probabl appl price product higher,1,1568151292.0
1763,1763,ezuw8io,t1_ezuc7e1,bfig,talk wage valu chain conduct shop sell appl,1,1568162056.0
