,Unnamed: 0,Comment ID,Parent ID,Author,Body,Score,Created (UTC)
256,256,fvm98kd,t1_fvljjb0,bluewolf37,want fix app suspens memori whatev broke last upgrad use abl go back forth app lose place better android ram constant lose place app,3,1592812726.0
257,257,fvm252t,t1_fvlclhz,MentalUproar,appl actual releas mainstream mac product run exclus arm entir industri shift intel stock plummet arm power ms surfac consid scienc fair project appl microsoft actual challeng eachoth event impact lot peopl across multipl industri much bigger releas watch threaten swiss watch maker someth chang even competitor devic made futur,45,1592806173.0
258,258,fvlryzy,t1_fvlclhz,neavts,everi wwdc hype recent year,87,1592798398.0
259,259,fvm7w8n,t1_fvlclhz,PM_ME_CUTE_SM1LE,use android last year kinda lost interest keynot bummer iphon eleven feel like part hype wait beta,1,1592811415.0
260,260,fvlpfbk,t1_fvlowtx,I_Need_Citations,rumor mill suggest maco massiv silverlin monterey,10,1592796662.0
261,261,fvlzyz8,t1_fvlowtx,egeek84,big sur,8,1592804377.0
262,262,fvn4gn9,t1_fvlowtx,KZedUK,avalon absolut solid guess catalina high sierra type updat hold water,3,1592837663.0
263,263,fvmjlie,t1_fvlwks7,skiier97,updat everi keynot,6,1592823274.0
264,264,fvn41qi,t1_fvmtz5m,KZedUK,idk think could happen seem incred like io maco hardwar announc eight year old design hard drive non retina option t chip,2,1592837443.0
265,265,fvnigad,t1_fvnhmiz,FortePiano96,know music remind brian eno ambient work might like music airport,2,1592844825.0
266,266,fvnicri,t1_fvnhmiz,ClumpOfCheese,shazam dude,2,1592844777.0
267,267,fvnioqm,t1_fvnhmiz,loosebolts,get strong brian eno vibe everi time shazam recognis someth differ,1,1592844945.0
268,268,fvmslnh,t1_fvltycq,thiccsupreme,air tag,1,1592830564.0
269,269,fvncpcd,t1_fvn4c63,HackWang,definit,2,1592841941.0
270,270,fvnfs6n,t1_fvnf5hr,mojo276,read think get call take whole screen almost sure default app thing though super surpris happen,3,1592843488.0
271,271,fvnjo2g,t1_fvnjeui,Declanmar,thank,1,1592845441.0
272,272,fvni03b,t1_fvnhs4c,mhall85,need sleep track lol want appl music librari,4,1592844602.0
273,273,fvnigv0,t1_fvnhs4c,loosebolts,get strong brian eno vibe,2,1592844833.0
274,274,fvnie04,t1_fvnhs4c,IngsocInnerParty,nice anyon els cut littl bit,1,1592844794.0
275,275,fvmbbjn,t1_fvm8wvp,my_name_isnt_clever,afaik sourc claim site known run fake leak click,8,1592814820.0
276,276,fvnagdw,t1_fvn1axk,AWildDragon,want hardwar first guess tvos could support ac power,1,1592840802.0
277,277,fvnfs2a,t1_fvn2enc,dysgraphical,,3,1592843486.0
278,278,fvncu3n,t1_fvnb72b,wish_you_a_nice_day,know og,4,1592842008.0
279,279,fvnig8u,t1_fvni1lo,ChrisH100,total agre cool,2,1592844825.0
280,280,fvnkhpy,t1_fvnkav6,chaiscool,contrari show everyth app folder,1,1592845852.0
281,281,fvnehwq,t1_fvnb8li,ant1992,still believ peopl expect hardwar wwdc,5,1592842842.0
282,282,fvlfgqx,t1_fvlegaj,Electrical_Cherry,way man happen obvious right us hear leaker instead appl even appl prepar year redesign mac app store introduc catalyst bring io app maco app one codebas deprec bit app metal ipad pro processor perform well macbook pro hell even consolid multipl control logic board one t chip big one,54,1592790190.0
283,283,fvlflpy,t1_fvlegaj,alien3d,dungeon bug even file manag ipad os still struggl android smooth easi think arm match xeon i capabl,-1,1592790277.0
284,284,fvmv99c,t1_fvmriwm,Marko_Tropoja,realli see default app happen tbh,1,1592832313.0
285,285,fvn7awh,t1_fvn1g5v,thomalexday,better float bounc around,0,1592839176.0
286,286,fvn3tml,t1_fvn22gf,KZedUK,,3,1592837325.0
287,287,fvn269c,t1_fvn22gf,eww7633,yes youtub stream,2,1592836428.0
288,288,fvniuh1,t1_fvnirii,Xylamyla,good morn brother,2,1592845025.0
289,289,fvnk3o8,t1_fvnk1vu,Tropical_Centipede,hope toggl,1,1592845657.0
290,290,fvlebqu,t1_fvld6ys,Mikesilverii,definit seem like littl hurt prematur imac rumor realli excit order new redesign imac soon,12,1592789463.0
291,291,fvle8xe,t1_fvld6ys,MaxCruz,realli make think new hardwar announc tomorrow,5,1592789414.0
292,292,fvn4ip7,t1_fvn00el,tipodecinta,make think stream still live pre record,3,1592837694.0
293,293,fvna2im,t1_fvn00el,ExtremelyQualified,idea predict tim auditorium everyon els present space reason auditorium without audienc honest think would look weird sad,1,1592840606.0
294,294,fvne8hd,t1_fvn16ni,DefinitelyNotSnek,know audio feed download free appl develop app stream base test allow background play unlik appl tv youtub stream,3,1592842712.0
295,295,fvngmvc,t1_fvn3cr2,VariantComputers,well amd use help produc g altivec imposs definit like,2,1592843916.0
296,296,fvncmci,t1_fvnc3vg,wish_you_a_nice_day,develop confer alway announc next major releas oper system talk new api develop new improv develop tool framework time announc new hardwar year expect usual io maco watcho stuff think go spend good time talk new processor transit improv swiftui,8,1592841898.0
297,297,fvnfrab,t1_fvnc3vg,BitingChaos,everyon watch someon stand stage play game phone think possibl watch someon play game phone longer bring peopl gather around tabl play ar game togeth phone yes probabl softwar develop stuff maco io iphoneo ipado watcho tvos xcode etc might slight chanc show hardwar usual softwar,4,1592843476.0
298,298,fvnc8fu,t1_fvnc3vg,NYKnickerbocker2,yea pretti much pure softwar,3,1592841700.0
299,299,fvncfzv,t1_fvnc3vg,aka_liam,yes softwar announc howev possibl might announc hardwar,3,1592841808.0
300,300,fvndoc9,t1_fvnd902,exjr_,show includ use event app app bring section,2,1592842432.0
301,301,fvngpxp,t1_fvnd902,mysaadlife,stream youtub probabl watch way well,2,1592843959.0
302,302,fvniqo6,t1_fvninho,cshaiku,thank say mean lot touch thank friend,3,1592844971.0
303,303,fvnj1hl,t1_fvniv27,cshaiku,usual live thread refresh r appl subreddit,1,1592845122.0
304,304,fvnjwfw,t1_fvnjtzq,ghsNICK,like better regular live version,2,1592845558.0
305,305,fvnkb8e,t1_fvnk76m,r_hcaz,,2,1592845763.0
306,306,fvmwbwh,t1_fvmvvn8,PalmHacks,nbae acronym speak god get old,9,1592832993.0
307,307,fvnij3l,t1_fvmvvn8,BourgeoisShark,doubt may,1,1592844865.0
308,308,fvmpvkv,t1_fvmk4wf,thomalexday,sure know littl anyth go reason think ipado would ignor,4,1592828610.0
309,309,fvlnvmh,t1_fvlgk0p,hishnash,swift roadmap public releas new xcode see featur alreadi,3,1592795640.0
310,310,fvmqzvk,t1_fvm8ns0,jamzfaced,develop preview usual releas immedi public beta usual follow week afterward,8,1592829434.0
311,311,fvnbk57,t1_fvn6c4r,Weekly_Rise,would say chanc major hardwar updat macbook pro year refresh whole lineup,2,1592841363.0
312,312,fvniktx,t1_fvnih5u,r_hcaz,alway start wwdc,4,1592844890.0
313,313,fvnj7b8,t1_fvnj36l,waterboy100,idk,2,1592845205.0
314,314,fvnjbol,t1_fvnj8cn,Flying-Cock,sound like aurora,2,1592845264.0
315,315,fvnjfil,t1_fvnj993,iamkanthalaraghu,suck way pls,1,1592845319.0
316,316,fvnk1ae,t1_fvnjwwd,Freittrain86,yeah might best part happen like wast time dive right dumb applaus,3,1592845625.0
317,317,fvnk964,t1_fvnjxw7,tipodecinta,twelv year ago exact,1,1592845734.0
318,318,fvnkd7z,t1_fvnkc5o,dontfailplz,hm ur right ratio look differ,1,1592845790.0
319,319,fvlnr4p,t1_fvlhsqw,hishnash,think want maco ipad set wrong imag maco touch os appl stire well away,22,1592795556.0
320,320,fvlis9w,t1_fvlhsqw,RadChocolate,oh shit intrigu could end kill macbook air,4,1592792311.0
321,321,fvls093,t1_fvlhsqw,lolwutdo,would cool could load maco arm onto appl tv basic got mac mini new appl tv would abl reach would cool haha,2,1592798423.0
322,322,fvls0ab,t1_fvlhsqw,Easy_Toast,epitom pipe dream,2,1592798423.0
323,323,fvmb83e,t1_fvlhsqw,my_name_isnt_clever,actual dual boot like head alreadi kinda wish gotten bigger capac sixti four gb two thousand eighteen pro,2,1592814723.0
324,324,fvmd45b,t1_fvlhsqw,firelitother,make option two thousand twenti model,2,1592816675.0
325,325,fvlnasy,t1_fvlhsqw,gcoba218,sort doubt would would kill lower end macbook,1,1592795251.0
326,326,fvncn4p,t1_fvnapiy,trillioncells,smoke share,4,1592841910.0
327,327,fvnczd3,t1_fvnapiy,wish_you_a_nice_day,would sick think tech yet process power display technolog,2,1592842084.0
328,328,fvnfkks,t1_fvnapiy,ExtremelyQualified,go think got anoth year get see,1,1592843382.0
329,329,fvnjmjb,t1_fvnjjl2,chaiscool,big crowd anxieti,3,1592845419.0
330,330,fvnjmgn,t1_fvnjk8p,00DEADBEEF,bet prerecord,3,1592845418.0
331,331,fvnjo09,t1_fvnjk8p,dontfailplz,probabl want peopl skip live show,3,1592845440.0
332,332,fvnjnv0,t1_fvnjk8p,Shapoopie,definit produc,3,1592845438.0
333,333,fvnjo92,t1_fvnjk8p,ItWasTheGiraffe,almost chanc live,3,1592845443.0
334,334,fvnjoru,t1_fvnjk8p,tipodecinta,cours someon fluf line reason live sport take question end,3,1592845450.0
335,335,fvnjpdf,t1_fvnjk8p,nmpraveen,see point live,3,1592845459.0
336,336,fvnjrmq,t1_fvnjk8p,deleted,chanc perfect sync subtitl turn,3,1592845490.0
337,337,fvnjn7k,t1_fvnjk8p,veryZexy,feel like caus point know,2,1592845429.0
338,338,fvnjnqc,t1_fvnjk8p,Silvedoge,nah like prerecord less room error,2,1592845436.0
339,339,fvnjoze,t1_fvnjlsl,iamkanthalaraghu,proper sleep bet,2,1592845454.0
340,340,fvnk79f,t1_fvnk6fp,dontfailplz,app drawer widget wow,1,1592845707.0
341,341,fvngqt1,t1_fvnbh6w,i_Killed_Reddit,mom,1,1592843971.0
342,342,fvng8ri,t1_fvnfzdh,Tasteful_Noods,start stream event yt year ago,2,1592843719.0
343,343,fvnhf7v,t1_fvngxld,Hennahane,assum locat peopl watch stream,1,1592844311.0
344,344,fvnihxs,t1_fvnh84k,IngsocInnerParty,usual week long confer one keynot,1,1592844849.0
345,345,fvnixip,t1_fvni61e,TheBrainwasher14,would way doubt,2,1592845068.0
346,346,fvnjn8i,t1_fvnji74,aka_liam,imagin kind person would upset,6,1592845429.0
347,347,fvnjtxh,t1_fvnjr6s,businesskitteh,get advic racism econom equal ceo appl,7,1592845523.0
348,348,fvnjt6n,t1_fvnjr6s,DestroyerR2L2,stay mad,1,1592845512.0
349,349,fvnkv27,t1_fvnkpz7,Tropical_Centipede,premium googl got make money iphon user,-4,1592846036.0
350,350,fvnkn7o,t1_fvnkhfm,dontfailplz,fair alway io updat jailbreak featur,-1,1592845927.0
351,351,fvnjscz,t1_fvnjpm7,Fizzster,tim virtu signal tim genuin say thing fact said show know noth,4,1592845500.0
352,352,fvnklu9,t1_fvnkinj,dontfailplz,okay peopl complain add peopl complain,8,1592845908.0
353,353,fvnjp2u,t1_fvnjkp0,Flying-Cock,symbolis appl support social distanc whatnot,5,1592845455.0
354,354,fvnjntr,t1_fvnjkp0,bananamadafaka,actual realli good photographi,3,1592845438.0
355,355,fvn2i6a,t1_fvmjqcl,itsaride,arm processor superior x mani way except raw speed also decreas relianc extern supplier kind benefit includ secur cost think relationship profit except planet lower energi usag,1,1592836614.0
356,356,fvn45mt,t1_fvmhv8m,KZedUK,uh wwdc unveil iphon til septemb,1,1592837501.0
357,357,fvn48bu,t1_fvmhv8m,nowast3ddays,well unless want replac phone macbook need wait fall iphon event,1,1592837540.0
358,358,fvn881u,t1_fvn7163,w1ldw1ng,good buy arm macbook prob abl match macbookp perform awhil develop need reoptim applic,6,1592839652.0
359,359,fvnh3i0,t1_fvngzcj,Thunderblast,stream appl com work,1,1592844148.0
360,360,fvnh5bs,t1_fvngzcj,thomalexday,work show rotat globe stream,1,1592844172.0
361,361,fvnhpnn,t1_fvngzcj,wiptheman,yes back well,1,1592844457.0
362,362,fvmor69,t1_fvmip2n,mad_poet_navarth,app written swift possibl write audio plugin,2,1592827749.0
363,363,fvmj4ih,t1_fvmip2n,skiier97,yah,2,1592822828.0
364,364,fvn2wya,t1_fvmip2n,itsaride,softwar written day high level low level hardwar anywher near disrupt use lot recompil exploit arm benefit fault yes app use regular still readili avail doubt anyon write app asm day,1,1592836836.0
365,365,fvnjl4k,t1_fvnjffu,TacoChowder,safe move like public safeti polit,6,1592845399.0
366,366,fvnjgt9,t1_fvnjffu,waterboy100,pleas tell serious,5,1592845338.0
367,367,fvnjinw,t1_fvnjffu,Silvedoge,tell joke lol,3,1592845364.0
368,368,fvnjk13,t1_fvnjffu,Shapoopie,nobodi care,1,1592845384.0
369,369,fvnjiw0,t1_fvnjffu,Sebassyion,oh christ,0,1592845367.0
370,370,fvnjjtx,t1_fvnjffu,ant1992,get,0,1592845381.0
371,371,fvnjkby,t1_fvnjffu,aadharsh_2,lmao,0,1592845387.0
372,372,fvmtmtr,t1_fvm507f,kyemaloy14,agre like know stuff leak last screenshot level thing got io fourteen wallpap picker look forward hope surpris stuff pleas let continu steam roll ipado add featur make comput like see xcode engin tweet look forward show work xcode ipado dream still strong,10,1592831259.0
373,373,fvn481e,t1_fvmac0n,TheBrainwasher14,expect much ipad guess move mac arm,3,1592837536.0
374,374,fvn6ifu,t1_fvmymc0,InTheBusinessBro,think get hope keyboard bit hardwar readi make sens announc time ipad way get attent peopl like splurg rather tempt cheaper keyboard appar get hardwar today matter excit see us,3,1592838755.0
375,375,fvma1lq,t1_fvlouvp,YipYepYeah,gotta get peopl tv app somehow haha,58,1592813529.0
376,376,fvm4y7k,t1_fvlouvp,7577406272,futur tv app,29,1592808660.0
377,377,fvn0h10,t1_fvmkfg1,exjr_,yeah sinc app still avail better app take section tv app appl tv app show section unless went app mani other issu cc u btyt,2,1592835463.0
378,378,fvmsvvc,t1_fvmkfg1,bt1234yt,ad row highlight stream tv app,1,1592830755.0
379,379,fvn7084,t1_fvmkfg1,thinkadrian,apart roundabout way indic screen feed appear appear automat,1,1592839019.0
380,380,fvlh4bn,t1_fvlcmc8,McFatty7,excit share io instal iphon releas past year let compar android display two pie graph,95,1592791248.0
381,381,fvleesl,t1_fvlcmc8,eggimage,first let talk develop love appl,131,1592789517.0
382,382,fvlffxy,t1_fvlcmc8,ken27238,think gonna love,54,1592790176.0
383,383,fvllt20,t1_fvleas8,Tesla_UI,gonna love,28,1592794271.0
384,384,fvlcnr0,t1_fvlcmf7,aaronp613,thank,8,1592788404.0
385,385,fvngpwr,t1_fvmdwml,abra-su-mente,underr comment,2,1592843959.0
386,386,fvma0zw,t1_fvm928j,espenbirch,trivia competit work retail,6,1592813512.0
387,387,fvmxd2i,t1_fvm928j,anckentucky,buy appl store sale merchandis appl campus,4,1592833622.0
388,388,fvmsqf9,t1_fvmqgww,espenbirch,hah actual matt black iphon seven,2,1592830655.0
389,389,fvm2mzj,t1_fvlzj7p,RadChocolate,would sick,10,1592806601.0
390,390,fvmkinx,t1_fvlzj7p,Eruanno,honest psych jump amd arm move appl alreadi great term gpus get board cpus well,7,1592824134.0
391,391,fvmqbju,t1_fvlnnbz,widget66,also want remov everi singl compon comput replac screen annoy enter screen method current imac least make screen replac pretti simpl long snake hand connect goddam short cabl also talk wish list repair hope go back magnet hold screen adhes,7,1592828941.0
392,392,fvmkmwj,t1_fvmgd1i,Eruanno,mac pro ssd upgrad kit would like word,5,1592824242.0
393,393,fvnbgkt,t1_fvm01ie,-14k-,yes might ask wee bit much mean half fun code trial error approach rush get accident get right rush get next time accident get right idea first time work,2,1592841313.0
394,394,fvn0cgg,t1_fvmnn3r,Anton_Pannekoek,funki cold medina,4,1592835391.0
395,395,fvma6aw,t1_fvm3nfj,cultoftheilluminati,think gonna love,24,1592813660.0
396,396,fvmu7y8,t1_fvmerqo,jgreg728,would ya look head hair,5,1592831644.0
397,397,fvn59wj,t1_fvmerqo,Sydney_Gamer,craig know kregg,2,1592838092.0
398,398,fvn8jvm,t1_fvmixrf,gallifreys,fantast never seen,2,1592839822.0
399,399,fvlgljt,t1_fvlgisr,ken27238,know hunt dev profil idiot,28,1592790916.0
400,400,fvloojp,t1_fvlgisr,soupx3,clear solut buy three phone,11,1592796170.0
401,401,fvma0lg,t1_fvlgisr,cultoftheilluminati,th type checkran io,2,1592813501.0
402,402,fvmhj3x,t1_fvlfvi9,peachybuttcheek,xms ruin wireless headphon match sign,7,1592821275.0
403,403,fvlzpgi,t1_fvlfvi9,chaiscool,soni autom updat though lose nc overnight like airpod pro,29,1592804165.0
404,404,fvmkxu1,t1_fvlfvi9,SkyGuy182,also nicer name,2,1592824524.0
405,405,fvmaric,t1_fvlfvi9,nick_pl,conveni airpod,1,1592814254.0
406,406,fvmn2i2,t1_fvlfvi9,deleted,nc stand context,1,1592826375.0
407,407,fvn7c6r,t1_fvlfvi9,MangyCanine,know reliabl rumor ear vs ear airpod studio matter anyon compar soni sennheis macbook six hundr sixti macbook nc microphon awesom anyth microphon sensit pick mous movement desk sound qualiti macbook six hundr sixti meh though nowher good wire headset still better old soni mdr xbbt,1,1592839194.0
408,408,fvmsebv,t1_fvma20p,LyrMeThatBifrost,lol b almost irrelev categori bose soni appl aim compet,5,1592830424.0
409,409,fvnfuh1,t1_fvn3b79,Cmdr_Nevarlan,known,2,1592843521.0
410,410,fvm9kjj,t1_fvlrtcb,MightBeJerryWest,remain dub dub hunt defeat,6,1592813053.0
411,411,fvlgcqs,t1_fvle0sp,deleted,,24,1592790759.0
412,412,fvmadml,t1_fvlpatn,j1ggl,suck ass without proper monitor support let start,7,1592813867.0
413,413,fvmat1t,t1_fvlsxph,my_name_isnt_clever,want abl make app ipad ipad without own mac expect someth season dev would use would good start,6,1592814299.0
414,414,fvm3w4v,t1_fvlsxph,Thewordisnot,oh god yes pleas would somewhat short amaz right manag get django run local tandem work copi pyto textast iphon even imagin possibl stuff normal run mac,4,1592807703.0
415,415,fvm8pjz,t1_fvm27dq,TheBrainwasher14,multitask right clusterfuck need improv,5,1592812208.0
416,416,fvm3949,t1_fvll1sw,squareswordfish,hope bought tablet anoth laptop get wrong understand peopl like use comput problem bought tablet new featur focus four hundr euro touchpad would feel pretti unpleas,5,1592807135.0
417,417,fvm3twg,t1_fvm2t0n,ContinuingResolution,could run xcode,2,1592807648.0
418,418,fvm26lp,t1_fvlpkkv,deleted,,38,1592806211.0
419,419,fvlpvq0,t1_fvlpkkv,The_Ejj,long enough rememb ar thing better suit glass,17,1592796972.0
420,420,fvmbqh6,t1_fvlpkkv,j1ggl,sinc minecraft earth event hear word ar clear sign need watch next coupl minut go bathroom grab drink jeez stuff alway lame,2,1592815249.0
421,421,fvn9t2a,t1_fvn8nis,The_Ejj,yes io recal correct appl took time remov softwar bottleneck much prioriti,2,1592840472.0
422,422,fvm9kba,t1_fvm252t,Proditus,think overestim immedi benefit arm though mac realli industri shaper appl line smartphon tablet might see forward movement pc arm space go year long even decad long process much depend x even consid transit away reason timefram,12,1592813047.0
423,423,fvm1pz7,t1_fvlryzy,deleted,,47,1592805817.0
424,424,fvmg70n,t1_fvlryzy,KZedUK,yeah mean last year god damn mac pro hype know,7,1592819928.0
425,425,fvn4h2a,t1_fvlzyz8,KZedUK,surpris go horribl name edit surpris,1,1592837670.0
426,426,fvn65ml,t1_fvn41qi,aka_liam,honest fulli expect day ago seen mani analyst say announc today kind lost hope would love wrong though,2,1592838566.0
427,427,fvnbwkz,t1_fvn41qi,Lost_the_weight,appl store still new hardwar announc today store would,2,1592841536.0
428,428,fvnim7b,t1_fvnigad,mhall85,look thank,2,1592844908.0
429,429,fvnihm6,t1_fvnicri,mhall85,tri twice got two differ result dude spotifi,2,1592844844.0
430,430,fvnjbr9,t1_fvnioqm,mhall85,conspiraci lol siri shazam troll p someon els post lotus journey confirm spotifi,1,1592845265.0
431,431,fvn3fz2,t1_fvmslnh,16Paws,appl tracker ultra wideband support,1,1592837120.0
432,432,fvnh0hs,t1_fvnfs6n,deleted,,1,1592844104.0
433,433,fvnj2pw,t1_fvnie04,CoasterFreak2601,mine solid sinc use tv app appl tv,1,1592845141.0
434,434,fvnfd6l,t1_fvnehwq,MoiraMain,announc new mac pro pro display last year two thousand seventeen announc new ipad pro imac pro homepod hardwar announc wwdc unheard,5,1592843278.0
435,435,fvlghgv,t1_fvlfgqx,ken27238,think u auralucario tri say yes see appl announc intel arm transit announc hardwar use arm,24,1592790842.0
436,436,fvltx03,t1_fvlfgqx,yanksrock1000,realli seem like perfect storm mayb tomorrow realli day feel like wait decad,4,1592799785.0
437,437,fvmbvme,t1_fvlfgqx,j1ggl,yeah exact reason appl well readi arm mac know condit exact ideal year would understand,3,1592815396.0
438,438,fvn9ld6,t1_fvlfgqx,ethanjim,much evid develop ipado suggest io form factor io laptop desktop etc one bang keyboard mous support fact care enough maco enough even develop proper app anymor multi window app full desktop browser chang home screen pull window push develop keyboard shortcut consum point view make sens look post last night lot develop want keep x need virtualis specialist applic etc would work maco step arm io laptop much closer would allow tap wider consum market imagin ipad becom io laptop appl tv becom io desktop comput,1,1592840362.0
439,439,fvmbz2x,t1_fvlflpy,j1ggl,sure point tri make file manag issu io softwar fault could lightn fast butteri smooth appl better job optim,1,1592815497.0
440,440,fvlfxn6,t1_fvlflpy,BostonDrivingIsWorse,k,0,1592790487.0
441,441,fvliqrk,t1_fvle8xe,HeyCharlieBall,similar mac pro announc last year shown,3,1592792284.0
442,442,fvlxphu,t1_fvle8xe,deleted,,4,1592802609.0
443,443,fvn5okv,t1_fvn4ip7,jwink3101,well question still stand assum present stage also well could wrong suspect live evid contrari,3,1592838311.0
444,444,fvncyws,t1_fvncmci,DrawTings,cool thank alot,2,1592842077.0
445,445,fvneda6,t1_fvndoc9,MrEcon,tri work end go youtub app,2,1592842778.0
446,446,fvnj12i,t1_fvniqo6,pandas795,problem know recent event brought anxieti tri check everyon,1,1592845117.0
447,447,fvnje84,t1_fvnj1hl,mikesay98,see anyth actual live discuss,1,1592845301.0
448,448,fvmyu7c,t1_fvmwbwh,lignarius1,anyon els,1,1592834507.0
449,449,fvnjit7,t1_fvnjfil,waterboy100,oh drop,1,1592845366.0
450,450,fvlnval,t1_fvlnr4p,FullSpectrumWizard,ipad os use catalyst run maco app specif use magic keyboard mayb access maco purchas magic keyboard idk lmao,0,1592795633.0
451,451,fvljs5z,t1_fvlis9w,FullSpectrumWizard,ipad pro two thousand twenti six gb ram magic keyboard maco would kill air,6,1592792950.0
452,452,fvnecoc,t1_fvncn4p,w1ldw1ng,pass joint next done,2,1592842770.0
453,453,fvnhjcy,t1_fvnhf7v,00DEADBEEF,seem even spread liter perfect line way around itali coast,1,1592844370.0
454,454,fvnilxv,t1_fvnihxs,walle58533,oh okay today live stream catch rest normal tech youtub,2,1592844904.0
455,455,fvn970b,t1_fvn881u,firelitother,boat wait announc might want peopl sell use cheap could also announc new imac would like,2,1592840153.0
456,456,fvmjmcv,t1_fvmj4ih,deleted,,0,1592823297.0
457,457,fvnc5bk,t1_fvn2wya,Lost_the_weight,ms crow rebuild calcul engin excel use asm year back,1,1592841656.0
458,458,fvnjnbm,t1_fvnjl4k,Tropical_Centipede,cinema open though,0,1592845430.0
459,459,fvnjlwm,t1_fvnjgt9,medgno,unfortun respons covid time consid polit,3,1592845410.0
460,460,fvnjkry,t1_fvnjgt9,nmpraveen,cours lol,2,1592845394.0
461,461,fvnjju3,t1_fvnjgt9,Tropical_Centipede,like appl bow big donor class dnc,-3,1592845381.0
462,462,fvngyo6,t1_fvn481e,a_bigdonger,think anyth els could add side thing mayb peopl other ipado seem realli polish basic user like let see appl add,2,1592844079.0
463,463,fvn88p5,t1_fvn6ifu,jsbabbles,take consid make way sens haha reason side fenc analyst,1,1592839661.0
464,464,fvmvivw,t1_fvm4y7k,elarq,futur tv app,9,1592832487.0
465,465,fvmu35p,t1_fvm4y7k,jgreg728,actual one app channel app within app,2,1592831558.0
466,466,fvmunqj,t1_fvmsvvc,Doelago,appear,4,1592831929.0
467,467,fvmwrr6,t1_fvmsvvc,Eruanno,huh noth like tvos movi tv show,6,1592833264.0
468,468,fvmza9i,t1_fvmsvvc,deleted,countri see tv app india,3,1592834773.0
469,469,fvn6yar,t1_fvmsvvc,thinkadrian,sweden eu noth find tv app,2,1592838991.0
470,470,fvma94s,t1_fvlh4bn,j1ggl,fair skip last year,16,1592813741.0
471,471,fvlemp2,t1_fvleesl,exjr_,develop love appl,136,1592789658.0
472,472,fvlfnd3,t1_fvleesl,deleted,,63,1592790306.0
473,473,fvlewy1,t1_fvleesl,encogneeto,cricket,25,1592789840.0
474,474,fvlv8vd,t1_fvlffxy,cshaiku,one thing,12,1592800753.0
475,475,fvluj9l,t1_fvllt20,tails618,realli gonna love mean beta gonna buggi batteri drain etc gonna love anyway,13,1592800236.0
476,476,fvm9hl3,t1_fvllt20,SuitingUncle620,gonna love,5,1592812973.0
477,477,fvn2y2w,t1_fvmkinx,BIGSTANKDICKDADDY,appl move arm offer anoth option long term goal everi appl product use appl design develop chip go effort switch amd cpus one two cycl devic pull plug x altogeth would strang unfocus decis hardwar team opinion,7,1592836852.0
478,478,fvmldim,t1_fvmkmwj,Garrosh,dollar six hundr tb storag though,4,1592824916.0
479,479,fvlshh9,t1_fvlgljt,stopalltheDLing,everi goddamn year know wait,14,1592798756.0
480,480,fvmacmb,t1_fvlgljt,ehsteve23,public beta probabl week away,1,1592813839.0
481,481,fvlr4no,t1_fvloojp,TestFlightBeta,jb old phone,6,1592797815.0
482,482,fvm1wzf,t1_fvlzpgi,MobiusOne_ISAF,kind nitpick consid whmx blow pretti much everi anc headset water audio qualiti nois cancel solid app batteri life boot beat solo indic appl would long way go even touch soni,37,1592805980.0
483,483,fvn4u67,t1_fvmaric,KZedUK,well asid numer benefit wireless headphon benefit airpod integr seamless connect transfer devic,3,1592837863.0
484,484,fvn83je,t1_fvmaric,Throwaway_Consoles,one thing never see peopl mention use one time bluetooth earbud like lg hbs lg tone beatsx powerbeat listen one ear whatev reason side die truli wireless headphon charg one half use half sinc charg faster discharg listen one hear die beep quick swap sinc case sit anywher charger effect result unlimit batteri life sinc detect one like miss half song play side one ear real beauti listen thing like netflix podcast separ left right import,1,1592839589.0
485,485,fvmqegu,t1_fvmn2i2,gojizillakong,nois cancel,3,1592829001.0
486,486,fvmtela,t1_fvmsebv,dishfishbish,term sale mayb term audio qualiti,1,1592831105.0
487,487,fvmyaez,t1_fvm9kjj,NinjaJayNuva,resolv stronger ever right,1,1592834180.0
488,488,fvm3sik,t1_fvlgcqs,Logseman,march cupertino dc would power statement know would,5,1592807614.0
489,489,fvmgaqj,t1_fvm3949,FullSpectrumWizard,like thing find use mk otherwis tablet mode,2,1592820037.0
490,490,fvn0w36,t1_fvm26lp,robinisbatman,yeah ar stuff seem incred batteri hungri,2,1592835703.0
491,491,fvlq4h0,t1_fvlpvq0,Kilmonjaro,ya ar glass make sens never seen good use phone except mayb measur thing point,12,1592797136.0
