,Unnamed: 0,Comment ID,Parent ID,Author,Body,Score,Created (UTC)
0,0,fvlkdzu,t3_hdigku,kyemaloy14,realli felt like year thin leak mani massiv one io mean got screenshot dark mode week realli word ipado centric chang either tvos new appl watch face may get homepod get chang seem virtual noth leak chang come maco,181,1592793345.0
1,1,fvlkiw2,t3_hdigku,bt1234yt,fyi mod appl discontinu appl event app tvos move event stream appl tv app,157,1592793431.0
2,2,fvlcjhk,t3_hdigku,aaronp613,good even r appl,296,1592788329.0
3,3,fvm5tox,t3_hdigku,espenbirch,matt black appl brand cup reserv special day like pictur said cup gb edit spell,54,1592809471.0
4,4,fvlfjck,t3_hdigku,RadChocolate,hope redesign imac happen unlik happen dream dream dream keep ram access also add abil access nvme ssd slot,80,1592790235.0
5,5,fvlfthz,t3_hdigku,SparkyRobinson,sure mani develop hype swiftui combin updat,75,1592790414.0
6,6,fvm5zu9,t3_hdigku,AdditionalMarten,wait maco high catalina,37,1592809629.0
7,7,fvln22k,t3_hdigku,kirbyCUBE,anyon got bingo board,32,1592795092.0
8,8,fvm24hx,t3_hdigku,bXm83,miss pic banner go,22,1592806159.0
9,9,fvlfsg5,t3_hdigku,ken27238,friend remind yes dev profil inevit leak post onlin instal risk first releas io watcho ipado bug might work expect also watcho downgrad end user watch sent appl downgrad,54,1592790395.0
10,10,fvleijr,t3_hdigku,neon-lights,airpod studio airpod studio airpod studio,118,1592789583.0
11,11,fvlf1q7,t3_hdigku,hungry_russian,much updat ipado seen much onlin,17,1592789924.0
12,12,fvmvprd,t3_hdigku,deleted,,16,1592832609.0
13,13,fvm7tdf,t3_hdigku,PM_ME_CUTE_SM1LE,blame sub hype good morn feel like would excit part keynot,15,1592811338.0
14,14,fvlwfyo,t3_hdigku,Mixon696,realli wait excit io fourteen new mac os new hardwar announc would awesom friend get today special,14,1592801645.0
15,15,fvld97r,t3_hdigku,AnotherAvgAsshole,year dub dub die,59,1592788778.0
16,16,fvldr7m,t3_hdigku,Totoro10101,realli hope got good improv ipado asid carri io name anyth specif want want see ipado get power mayb file manag abl slide side idk wait see unveil tomorrow decid whether buy magic keyboard ipad pro,26,1592789098.0
17,17,fvm4ihj,t3_hdigku,SmugMaverick,homepag redesign widget support app align chang incom call iphon forc full screen io complet,23,1592808259.0
18,18,fvn3tii,t3_hdigku,kooks51,io fourteen redesign caller ui pls,11,1592837323.0
19,19,fvljjb0,t3_hdigku,The_Ejj,hope like io io fourteen beta run smoother current iter also pleas dear lord siri announc,46,1592792791.0
20,20,fvlclhz,t3_hdigku,obelisk0,wait probabl hype wwdc recent year,79,1592788364.0
21,21,fvm93zp,t3_hdigku,klokkert1,hope abl use appl watch press paus play macbook mayb ipad also like see batteri status iphon watch like see watch batteri iphon,9,1592812599.0
22,22,fvmto4i,t3_hdigku,ExtremelyQualified,go weird applaus,10,1592831283.0
23,23,fvlnkkq,t3_hdigku,bananamadafaka,boy wait beta crash fi ligatur,9,1592795432.0
24,24,fvlowtx,t3_hdigku,gmanist1000,bet maco avalon,8,1592796323.0
25,25,fvlwks7,t3_hdigku,iampsychic,wwdc bingo board year,8,1592801747.0
26,26,fvm7vbv,t3_hdigku,Ventrace,want ask much love see real extern monitor support ipad pro better file manag exampl zip folder contain five thousand file without crash use rd parti app,9,1592811391.0
27,27,fvmtz5m,t3_hdigku,aka_liam,sound like go happen man realli hope imac announc first time ever market one definit bring buy current model,10,1592831486.0
28,28,fvlx5q1,t3_hdigku,PapaLags,look countdown event stream time wwdc,8,1592802186.0
29,29,fvnhmiz,t3_hdigku,mhall85,music super relax lol anyon know,8,1592844414.0
30,30,fvnjd3s,t3_hdigku,FindTheFishyFish,thank god memoji,6,1592845285.0
31,31,fvlhbq1,t3_hdigku,MaxelAmador,pleas announc new imac pleas announc new imac pleas pleas pleas,6,1592791377.0
32,32,fvlq6ed,t3_hdigku,deleted,hope ipad key split onscreen keyboard,7,1592797172.0
33,33,fvltycq,t3_hdigku,deleted,,6,1592799813.0
34,34,fvmcibh,t3_hdigku,hepgiu,thing realli want new call ui iphon maco proper call maco,6,1592816049.0
35,35,fvmgb72,t3_hdigku,iHeartTuesdays,hope appl fact pull maco big sur redesign io fourteen homepag facelift onlin present year hope someth sleev surpris us year dubdub,6,1592820050.0
36,36,fvmz2to,t3_hdigku,lignarius1,maco catalina wine mixer pow,6,1592834650.0
37,37,fvn4c63,t3_hdigku,tipodecinta,odd get imac macbook instead macbook imac,7,1592837598.0
38,38,fvnf5hr,t3_hdigku,deleted,,5,1592843172.0
39,39,fvnijvv,t3_hdigku,Matuteg,hope event live chat thing reddit last year terribl,7,1592844876.0
40,40,fvnjeui,t3_hdigku,tom_watts,song daydream aurora,5,1592845310.0
41,41,fvnkj3v,t3_hdigku,hijimmylin,io fifteen gonna introduc widget librari organ widget,6,1592845871.0
42,42,fvnhs4c,t3_hdigku,Shloomth,anyon els absolut love pre event music,10,1592844491.0
43,43,fvm8wvp,t3_hdigku,halesnet,littl sad read might new hardwar announc wallet thank look forward see map arm futur,4,1592812408.0
44,44,fvn1axk,t3_hdigku,Twrd4321,want hear today appl support av io final k youtub video,4,1592835938.0
45,45,fvn2enc,t3_hdigku,awkward_pause_,thread r android invit,5,1592836559.0
46,46,fvnb72b,t3_hdigku,swim_to_survive,cant find anywher saw last night anyon link video post fake io fourteen reveal one new wallpap thought hilari want send slack team someon hook,5,1592841179.0
47,47,fvni1lo,t3_hdigku,nmpraveen,wish releas screensav iss rad,4,1592844623.0
48,48,fvnk0ft,t3_hdigku,thehauntedmattress,pictur pictur iphon,5,1592845613.0
49,49,fvnk1qh,t3_hdigku,ghsNICK,wow massiv upgrad io home screen,4,1592845631.0
50,50,fvnk1v9,t3_hdigku,dontfailplz,bruh app drawer,4,1592845633.0
51,51,fvnkav6,t3_hdigku,mhall85,longer need banish unus app hidden page folder,6,1592845758.0
52,52,fvnb8li,t3_hdigku,Oceanbriz,go disappoint hardwar sure leak rumor wwdc primarili softwar announc consid hardwar announc bonus instead mandatori,8,1592841200.0
53,53,fvlegaj,t3_hdigku,deleted,,27,1592789543.0
54,54,fvmriwm,t3_hdigku,mushroomtoasty,happi end default app level customis home screen io featur long overdu opinion,5,1592829811.0
55,55,fvn1g5v,t3_hdigku,deleted,,4,1592836019.0
56,56,fvn22gf,t3_hdigku,Tropical_Centipede,peopl public watch free,4,1592836369.0
57,57,fvnhd2n,t3_hdigku,Captaincadet,seem like show map world current whoever goe live stream appl websit come upon world animoji,4,1592844281.0
58,58,fvnirii,t3_hdigku,deleted,,4,1592844983.0
59,59,fvnjcoh,t3_hdigku,pandas795,like song,4,1592845278.0
60,60,fvnk117,t3_hdigku,00DEADBEEF,announc better homescreen,5,1592845621.0
61,61,fvnk1vu,t3_hdigku,iamkanthalaraghu,resiz widget lmao,5,1592845633.0
62,62,fvnk5ik,t3_hdigku,bike_tyson,love,4,1592845683.0
63,63,fvnka40,t3_hdigku,thekidfromyesterday,fender guitar tab take craig play guitar,4,1592845748.0
64,64,fvnkuts,t3_hdigku,cranil,big sur,3,1592846032.0
65,65,fvnkxjd,t3_hdigku,iamkanthalaraghu,bigsur offici wwdc,5,1592846069.0
66,66,fvld6ys,t3_hdigku,HeyCharlieBall,will bet new hardwar shown tomorrow wont releas month iphon os ipad os watcho probabl zzzzzz mac os star show app run new appl chip port iphon ipad app,19,1592788739.0
67,67,fvmw5ym,t3_hdigku,gallifreys,good moooooorn,3,1592832889.0
68,68,fvmwmka,t3_hdigku,Nickp1991,make taco wwdc start,3,1592833177.0
69,69,fvn00el,t3_hdigku,jwink3101,random question littl consequ presum keynot present stage empti auditorium case think present wear mask,3,1592835196.0
70,70,fvn0547,t3_hdigku,TheBKBurger,rip batteri life work proper app happi wwdc day everyon,3,1592835272.0
71,71,fvn16ni,t3_hdigku,deleted,,3,1592835871.0
72,72,fvn3cr2,t3_hdigku,zomedleba,amd cpus never mac sorri burst bubbl,3,1592837072.0
73,73,fvna2om,t3_hdigku,NYKnickerbocker2,set expect low hope good keynot,3,1592840609.0
74,74,fvna5qe,t3_hdigku,kyo_jazz,recent bought iphon eleven phone basic die option look forward hope larg softwar updat maco io ipado cross finger,3,1592840652.0
75,75,fvnc3vg,t3_hdigku,DrawTings,anyon filter new someon tell happen event total new idea suppos expect softwar,3,1592841636.0
76,76,fvnd902,t3_hdigku,MrEcon,anyon abl find wwdc stream appl tv appletv app,3,1592842218.0
77,77,fvnhku6,t3_hdigku,nmpraveen,would cool actual real updat peopl join map,3,1592844390.0
78,78,fvninho,t3_hdigku,pandas795,hello hope well,3,1592844927.0
79,79,fvniv27,t3_hdigku,mikesay98,go live chat start still,3,1592845033.0
80,80,fvnj1jy,t3_hdigku,sjsharksfan12,would love appl tv wallpap get golden gate bridg mani time love outer space pictur,3,1592845123.0
81,81,fvnjstg,t3_hdigku,dontfailplz,craigggg,3,1592845507.0
82,82,fvnjtzq,t3_hdigku,bananamadafaka,fuck cool lol,3,1592845524.0
83,83,fvnk6xi,t3_hdigku,sjsharksfan12,ok love zoom app page app drawer might actual better,3,1592845703.0
84,84,fvnk76m,t3_hdigku,rdmdota,chat somewher,3,1592845706.0
85,85,fvnksme,t3_hdigku,dontfailplz,call guess io hit point noth els realli add,3,1592846002.0
86,86,fvnkvgl,t3_hdigku,dontfailplz,yall note get big sur that thd mac os name,3,1592846041.0
87,87,fvnky8m,t3_hdigku,Flying-Cock,siri get help everi day like everi year,3,1592846079.0
88,88,fvnkzi9,t3_hdigku,cranil,hope let hide call updat ffs,3,1592846097.0
89,89,fvmvvn8,t3_hdigku,lignarius1,nbae appl drop ten maco releas maco sixteen fall alongsid io ipado etc,5,1592832710.0
90,90,fvmk4wf,t3_hdigku,DLPanda,hope lot ipad os improv year seem like get oh well guess alway next year,5,1592823782.0
91,91,fvmwtfc,t3_hdigku,Lucky-Kangaroo,els pregam,3,1592833293.0
92,92,fvnkk0i,t3_hdigku,iamkanthalaraghu,smartstack amaz wish android,4,1592845884.0
93,93,fvlgk0p,t3_hdigku,scybert42,swift languag level chang use implement interpret languag almost work,2,1592790888.0
94,94,fvlh095,t3_hdigku,work_alias,let,2,1592791176.0
95,95,fvm8ns0,t3_hdigku,ando772,io beta releas tmw event,2,1592812162.0
96,96,fvmanbb,t3_hdigku,congalala,honest wish improv swiftui fun develop ui error sometim quit confus also uikit equival,2,1592814137.0
97,97,fvmdlwp,t3_hdigku,Scotching123,airtag come,2,1592817204.0
98,98,fvn2cbp,t3_hdigku,Nickp1991,hope airpod studio spacial audio,2,1592836523.0
99,99,fvn6c4r,t3_hdigku,TheChims,hold buy new macbook pro hope announc new design featur wait,2,1592838662.0
100,100,fvn9nv7,t3_hdigku,oharabk,tim cook good moorn,2,1592840398.0
101,101,fvngvli,t3_hdigku,polic1,announc airtag happi keep lose key,2,1592844036.0
102,102,fvnh3is,t3_hdigku,philphan25,lot memoji,2,1592844148.0
103,103,fvnhavf,t3_hdigku,ExtremelyQualified,assum go stream event develop app indic yet go happen static schedul event,2,1592844251.0
104,104,fvni01h,t3_hdigku,joshskj,appl hint airtag pre event live wallpap sure hope,2,1592844602.0
105,105,fvnih5u,t3_hdigku,PabloNeirotti,develop app appl websit seem anyon els,2,1592844838.0
106,106,fvnivnn,t3_hdigku,Bmanzella527,realli hope get pip iphon direct link app choic exampl click reddit link goe apollo app email app upgrad appl watch better flexibl fit challeng watch face appl watch face store ipad os better multi screen support better extern display support,2,1592845042.0
107,107,fvnj312,t3_hdigku,kuse,happen,2,1592845145.0
108,108,fvnj36l,t3_hdigku,BlazerStoner,awesom ambient song play shazam know,2,1592845147.0
109,109,fvnj5ze,t3_hdigku,The_MetalDog,love ambient music,2,1592845186.0
110,110,fvnj8cn,t3_hdigku,iamkanthalaraghu,wow chang music anyon know song love,2,1592845219.0
111,111,fvnj993,t3_hdigku,waterboy100,pleaaaaaas let keynot memoji form,2,1592845231.0
112,112,fvnjfdt,t3_hdigku,philphan25,good morn,2,1592845317.0
113,113,fvnjhk4,t3_hdigku,barney13,dubyadubyadc,2,1592845349.0
114,114,fvnjvd8,t3_hdigku,ant1992,holi shit io first,2,1592845543.0
115,115,fvnjwwd,t3_hdigku,dontfailplz,man got io fourteen fast fluff,2,1592845565.0
116,116,fvnjxw7,t3_hdigku,sjsharksfan12,get app drawer final catch android year ago,2,1592845578.0
117,117,fvnjyrg,t3_hdigku,dontfailplz,oh wow widget,2,1592845590.0
118,118,fvnk2br,t3_hdigku,thekidfromyesterday,look pretti good,2,1592845639.0
119,119,fvnkc5o,t3_hdigku,speedyturt13,iphon look taller usual,2,1592845776.0
120,120,fvmhp8b,t3_hdigku,suppreme,new hardwar maco redesign fun littl leak year would make sens scrap hardwar announc particular great time catch peopl attent,3,1592821445.0
121,121,fvmkfvi,t3_hdigku,deardickson,first time wwdc appl exec go back desk check email,3,1592824060.0
122,122,fvlhsqw,t3_hdigku,FullSpectrumWizard,call dual boot ipad os maco arm edit ipad pro first mac arm hardwar,8,1592791677.0
123,123,fvm0i1w,t3_hdigku,johndoeiswhoiam,casual follow appl put damn date time thing gonna happen pre thing gonna happen thread post thx,4,1592804807.0
124,124,fvnkeor,t3_hdigku,aka_liam,someon page worth app trembl unexcit edit hmm smartstack quit nice though,4,1592845811.0
125,125,fvluo34,t3_hdigku,tails618,would love introduc kind compat bit app mac similar albeit good afaik compat surfac pro x unfortun doubt gonna,2,1592800332.0
126,126,fvnapiy,t3_hdigku,deleted,,2,1592840930.0
127,127,fvnjjl2,t3_hdigku,00DEADBEEF,tim seem less dull usual,2,1592845377.0
128,128,fvnjk8p,t3_hdigku,Flying-Cock,anyon know actual live,2,1592845386.0
129,129,fvnjuv1,t3_hdigku,thekidfromyesterday,wow start io surpris,2,1592845536.0
130,130,fvnjlsl,t3_hdigku,bananamadafaka,open eye much drive nut,2,1592845408.0
131,131,fvnk6fp,t3_hdigku,00DEADBEEF,took ten year widget,3,1592845696.0
132,132,fvnjmuq,t3_hdigku,soupx3,believ tim cook said acab crazi,3,1592845423.0
133,133,fvnjqtg,t3_hdigku,ChickinWaaaang,tim wear appl glass,2,1592845479.0
134,134,fvnkqiv,t3_hdigku,Tropical_Centipede,lol bet appl renam siri karen,0,1592845974.0
135,135,fvmz3sb,t3_hdigku,sjsharksfan12,pleas someth appl music bring back function also improv car play good last year would fun realli look anyth look buy new tv old generat four appl tv hd bring price k appl tv might updat mine wish remot better though also interrupt applaus like state union hope keynot around hour mark mayb give take ten minut,1,1592834666.0
136,136,fvn961t,t3_hdigku,Nickp1991,gonna interest day appleland,1,1592840140.0
137,137,fvnbh6w,t3_hdigku,Kilgorio1,wow,1,1592841322.0
138,138,fvnfzdh,t3_hdigku,Rickmasta,first time avail youtub,1,1592843588.0
139,139,fvngn3n,t3_hdigku,mysaadlife,excit ipado hope get improv ive want,1,1592843919.0
140,140,fvngoqt,t3_hdigku,thnok,hope appl com crash,1,1592843942.0
141,141,fvngrkm,t3_hdigku,SixtyForceDemon,maco monterey jack,1,1592843982.0
142,142,fvngxld,t3_hdigku,00DEADBEEF,memoji kind mean,1,1592844063.0
143,143,fvnh84k,t3_hdigku,walle58533,mani day never watch wwdc lack anyth els interest rumor arm power mac,1,1592844212.0
144,144,fvnhk4j,t3_hdigku,philphan25,got text messag ding key background music mind blown,1,1592844380.0
145,145,fvni20h,t3_hdigku,strumthestrings,,1,1592844628.0
146,146,fvni61e,t3_hdigku,jack2018g,anyon know animoji head actual updat viewer around world,1,1592844685.0
147,147,fvnj256,t3_hdigku,goldenninjadragon,youtub went live,1,1592845132.0
148,148,fvnj2z4,t3_hdigku,tom_watts,aaaaand live,1,1592845144.0
149,149,fvnj63y,t3_hdigku,pandas795,peac,1,1592845188.0
150,150,fvnjbs8,t3_hdigku,00DEADBEEF,memoji wave,1,1592845266.0
151,151,fvnjc4x,t3_hdigku,cshaiku,love light avatar chang wave nice,1,1592845271.0
152,152,fvnjc6o,t3_hdigku,sidd1943,memoji,1,1592845271.0
153,153,fvnjsfu,t3_hdigku,iphone69plus,never seen sticker clean laptop ever,1,1592845502.0
154,154,fvnjtbk,t3_hdigku,iamkanthalaraghu,free freee hear say free wow,1,1592845514.0
155,155,fvnjtjc,t3_hdigku,deleted,,1,1592845518.0
156,156,fvnjwnv,t3_hdigku,It-Wanted-A-Username,crowd cheer,1,1592845561.0
157,157,fvnjwpg,t3_hdigku,iamkanthalaraghu,know record event wwdc,1,1592845562.0
158,158,fvnk2ut,t3_hdigku,Flying-Cock,ahh velox titan first ten second,1,1592845646.0
159,159,fvnk8v1,t3_hdigku,Gaston44,cool,1,1592845730.0
160,160,fvnk8zw,t3_hdigku,sjsharksfan12,think brought watch os io like way watch organ app,1,1592845732.0
161,161,fvnkaxr,t3_hdigku,hijimmylin,foldercept,1,1592845759.0
162,162,fvnktfh,t3_hdigku,isthisnamechangeable,start doubt alreadi two thousand twenti us,1,1592846013.0
163,163,fvnji74,t3_hdigku,iamkanthalaraghu,ofcours gotta address blacklivesmatt covid wwdc,3,1592845358.0
164,164,fvmzg0o,t3_hdigku,deleted,wwdc one two favorit appl event per year iphon unveil wwdc often includ featur super awesom day day siri shortcut great exampl,1,1592834865.0
165,165,fvnhirq,t3_hdigku,thomalexday,possibl virtual steve job,1,1592844361.0
166,166,fvnjr6s,t3_hdigku,afieldonearth,look want live better world without racism topic forc everi convers ever,-2,1592845484.0
167,167,fvlzsj3,t3_hdigku,theobserver_,nz need worri larg crowd,1,1592804234.0
168,168,fvm25uf,t3_hdigku,kylorand,dubdub,1,1592806192.0
169,169,fvmavgn,t3_hdigku,sbos_,good morn look forward keynot,1,1592814366.0
170,170,fvnkgvr,t3_hdigku,fpschubert,app librari similar smart launcher android,1,1592845841.0
171,171,fvnkpz7,t3_hdigku,deleted,youtub support come next year,1,1592845966.0
172,172,fvnjq34,t3_hdigku,thelawtalkingguy,siri set alert lectur,-2,1592845469.0
173,173,fvmx0ch,t3_hdigku,dragoneater713,think chang pdt,0,1592833410.0
174,174,fvnkhfm,t3_hdigku,Flying-Cock,realli hope chang call ui everyth els jailbreak featur alreadi,0,1592845848.0
175,175,fvnjpm7,t3_hdigku,deleted,,-5,1592845462.0
176,176,fvnjp3g,t3_hdigku,crunchtaco,oh god,-3,1592845455.0
177,177,fvnktjh,t3_hdigku,fpschubert,pip android sinc android oreo,-3,1592846015.0
178,178,fvnkinj,t3_hdigku,sjsharksfan12,ok bring widget home screen new appl pretti much caught android circa two thousand eleven,-6,1592845865.0
179,179,fvnjkp0,t3_hdigku,iphone69plus,film empti audienc back lmao,-1,1592845393.0
180,180,fvmjqcl,t3_hdigku,deleted,,-4,1592823403.0
181,181,fvmhv8m,t3_hdigku,deleted,,0,1592821608.0
182,182,fvn7163,t3_hdigku,ChargingWirelessly,pull trigger macbookp new processor talk worri though wait,0,1592839033.0
183,183,fvngzcj,t3_hdigku,wiptheman,websit icloud,0,1592844088.0
184,184,fvnjwcm,t3_hdigku,soupx3,camera angl kill,0,1592845557.0
185,185,fvnk9cw,t3_hdigku,ant1992,happi two thousand seventeen x wait jailbreak shit,0,1592845737.0
186,186,fvmip2n,t3_hdigku,deleted,,-3,1592822412.0
187,187,fvnjffu,t3_hdigku,Tropical_Centipede,polit move zero audienc trump liter thousand peopl audienc day ago,-23,1592845318.0
188,188,fvlhyvz,t3_hdigku,your_username,appl,-6,1592791787.0
189,189,fvlgiln,t3_hdigku,International-Juice1,thank alot appl screw ass raw,-2,1592790863.0
190,190,fvm507f,t1_fvlkdzu,deleted,littl excit realli know expect tomorrow rememb last time said eve larg appl keynot,84,1592808712.0
191,191,fvmac0n,t1_fvlkdzu,j1ggl,one part excit one part worri mean got noth,33,1592813822.0
192,192,fvm4zd6,t1_fvlkdzu,itsmegoddamnit,iron easier contain leak employe work home compar work offic,14,1592808690.0
193,193,fvmymc0,t1_fvlkdzu,jsbabbles,expect someth come ipado sinc bother releas keyboard earli could easili someth releas event instead opt custom acclim idea consid devic keyboard strang sort two announc pro app like xcode final cut pro mayb pleas love god want calcul action center easi appl pleas,2,1592834378.0
194,194,fvn45xd,t1_fvlkdzu,TheBrainwasher14,screenshot io seen new wallpap ui carkey exampl,1,1592837505.0
195,195,fvn5krw,t1_fvlkdzu,SleepingSicarii,feel like leak regard io thirteen pretti crazi definit felt like inform leak,1,1592838254.0
196,196,fvlouvp,t1_fvlkiw2,The_Ejj,feel weird reason,60,1592796286.0
197,197,fvmkfg1,t1_fvlkiw2,Eruanno,idea get event stream insid appl tv app though way figur actual find way go old event app send stream insid appl tv confus hope massiv overhaul tv app general super fuck confus,14,1592824050.0
198,198,fvlzjo7,t1_fvlkiw2,xvilo,stream youtub wat better peopl mac idevic apppl tv,8,1592804034.0
199,199,fvmj1y8,t1_fvlkiw2,Fantastic_Individual,appl also recommend use appl develop app,4,1592822759.0
200,200,fvlcmc8,t1_fvlcjhk,ezidro3,got lot show,190,1592788379.0
201,201,fvleas8,t1_fvlcjhk,SuitingUncle620,gonna love,38,1592789446.0
202,202,fvlcmf7,t1_fvlcjhk,exjr_,happi cake day phil,17,1592788380.0
203,203,fvmrokv,t1_fvlcjhk,DreamyLucid,good morn thank,3,1592829923.0
204,204,fvn7286,t1_fvlcjhk,thinkadrian,good morn,1,1592839048.0
205,205,fvmdwml,t1_fvm5tox,deleted,c u p,23,1592817523.0
206,206,fvmuboj,t1_fvm5tox,jgreg728,matt black hi name marqu brown would like buy cup,17,1592831709.0
207,207,fvm928j,t1_fvm5tox,david6283,purchas cup,7,1592812552.0
208,208,fvmqgww,t1_fvm5tox,AndersonTheCooper,space grey,3,1592829050.0
209,209,fvn7poh,t1_fvm5tox,Hoobleton,mug similar work tesla realli want one discontinu could buy swipe one think replac similar one like much,1,1592839389.0
210,210,fvlzj7p,t1_fvlfjck,ekwipt,dream switch amd ryzen cpu sixteen core pcie four gpu dream borderless suffic,19,1592804024.0
211,211,fvlnnbz,t1_fvlfjck,hishnash,flat side concept like access screen screw bottom open abl open regular nvme use stick buy macpro real question appl put gpu separ board,9,1592795483.0
212,212,fvmgd1i,t1_fvlfjck,KZedUK,imac ssds t chip encrypt replac work even stick,2,1592820102.0
213,213,fvn05yl,t1_fvlfjck,jwink3101,dream one happen realli happen would still love maco ipad pro go happen good reason still like,1,1592835286.0
214,214,fvlxj5i,t1_fvlfthz,ihatecompvir,yeah see new swiftui catalyst arkit look forward hope final get uicollectionview equival swiftui,10,1592802474.0
215,215,fvlnsol,t1_fvlfthz,kiwi0803,wait see improv swiftui love still mess,12,1592795584.0
216,216,fvm01ie,t1_fvlfthz,iNoles,would love see swiftui document much ask,11,1592804434.0
217,217,fvlkm6e,t1_fvlfthz,milesper,biggest thing well hope swiftui two bring lot improv,20,1592793491.0
218,218,fvlz4rs,t1_fvlfthz,GanjaMake,oh hell yeah swiftui intrigu sinc launch heard still need uikit lot thing current js stuff react react nativ go pick swiftui eventu swift nice languag toy someon come c c java wait see today day fulli sold swiftui also hope someth new coreml,5,1592803704.0
219,219,fvm6jc7,t1_fvlfthz,Spudly2319,miss combin hype train found month beyond stoke,3,1592810137.0
220,220,fvlwldj,t1_fvlfthz,AFRUITPIE,swiftui one absolut joy hope move lot view make mani represent,2,1592801759.0
221,221,fvmygkq,t1_fvlfthz,ahuiP,swiftui actual use use work play around lil,1,1592834282.0
222,222,fvlr74e,t1_fvlfthz,42177130,appl introduc lot develop stuff last year mind advanc year iter new framework even though peopl would disappoint,1,1592797862.0
223,223,fvmnn3r,t1_fvm5zu9,pianistzombie,wait sunni catalina someth,9,1592826853.0
224,224,fvm3nfj,t1_fvln22k,ContinuingResolution,good morn,33,1592807487.0
225,225,fvmerqo,t1_fvln22k,thomalexday,tell us like invit craig federighi stage craig,26,1592818439.0
226,226,fvm961m,t1_fvln22k,david6283,proud announc,10,1592812655.0
227,227,fvmixrf,t1_fvln22k,countmora,found one,12,1592822645.0
228,228,fvmm1ba,t1_fvm24hx,cocoman2121,next year,5,1592825497.0
229,229,fvlgisr,t1_fvlfsg5,deleted,,23,1592790867.0
230,230,fvmjsnh,t1_fvlfsg5,JoelTheSuperior,dream dev build maco leak ton new featur except finder liter broken think pretti much one expect develop softwar,1,1592823463.0
231,231,fvlfvi9,t1_fvleijr,deleted,,75,1592790448.0
232,232,fvm11qv,t1_fvleijr,juliuscruickshank,hardwar ear headphon reveal would satisfi design appl team would sell like crazi,5,1592805258.0
233,233,fvnax2g,t1_fvleijr,SirNelsonOfWales,yeah actual good sound qualiti would will drop littl bit cash,1,1592841037.0
234,234,fvljme7,t1_fvleijr,deleted,nope,-2,1592792846.0
235,235,fvm8iao,t1_fvleijr,TheBrainwasher14,happen enough els happen discuss two hour,-1,1592812012.0
236,236,fvma20p,t1_fvleijr,dishfishbish,think appl compet compani like b,-1,1592813540.0
237,237,fvn3b79,t1_fvmvprd,16Paws,start,7,1592837050.0
238,238,fvlrtcb,t1_fvld97r,TheGeorgeForman,dub dub die thunder applaus,15,1592798288.0
239,239,fvle0sp,t1_fvld97r,ExtremelyQualified,realli drop ball call www dc,50,1592789270.0
240,240,fvmeowo,t1_fvld97r,thomalexday,glad offici call dub dub year,4,1592818354.0
241,241,fvlgc7f,t1_fvld97r,ken27238,long long time ago still rememb code use make smile,7,1592790749.0
242,242,fvlpatn,t1_fvldr7m,The_Ejj,point real shoe drop ipado app want final cut want audio hijack want real d editor want devinci resolv know dream one far ipado announc most look api facilit type app,25,1592796579.0
243,243,fvlsxph,t1_fvldr7m,hechacker1,xcode termin ssh rubi python curl want web net develop stack keep leav maco,18,1592799076.0
244,244,fvm27dq,t1_fvldr7m,undergroundbynature,want cohes way manag instanc app feel could much better,8,1592806229.0
245,245,fvmbgat,t1_fvldr7m,j1ggl,like sort memori swap ipad k cach regular storag ram full mac pc get mani app load like much comput slow respons quit ipad though take full control random quit app background ram fill say result annoy reload even wors loss unsav work could see power mode switch control center enabl get choos app launch one keep one quit even loss perform featur,3,1592814956.0
246,246,fvmv0cg,t1_fvldr7m,wilso850,wanna use slide without app open lol,3,1592832156.0
247,247,fvll1sw,t1_fvldr7m,FullSpectrumWizard,realli hope magic keyboard play good part new ipad os featur,7,1592793779.0
248,248,fvm2t0n,t1_fvldr7m,deleted,,2,1592806746.0
249,249,fvmv4i6,t1_fvldr7m,Kinto_il,want better slideov capabl app app iphon variat definit slideov capabl use youtub youtub music would rather abil slide peek video current play choos new select without swipe ipad open dedic app iphon counterpart think develop would need much time build specif ipad also tire vertic app ipad servic vertic app make slideov abl,2,1592832228.0
250,250,fvmb1zy,t1_fvm4ihj,my_name_isnt_clever,could forget default app,9,1592814552.0
251,251,fvnb7nf,t1_fvm4ihj,maxwms,pretti much,1,1592841187.0
252,252,fvn5tgf,t1_fvn3tii,i_Killed_Reddit,ha ha ha,2,1592838385.0
253,253,fvn97lh,t1_fvn3tii,aadharsh_2,think might actual happen base dreamer leaker,1,1592840162.0
254,254,fvlpkkv,t1_fvljjb0,Kilmonjaro,say ar honesti use ar thier phone,52,1592796763.0
255,255,fvn8nis,t1_fvljjb0,ethanjim,rememb one releas might averag perform improv across major iphon year need plenti bug fix small tweak new massiv featur,2,1592839875.0
