,Unnamed: 0,Comment ID,Parent ID,Author,Body,Score,Created (UTC)
492,492,fvn4nr2,t1_fvm9kba,MentalUproar,move underway alreadi data center move arm power chip away x thing appl abl convinc peopl new tech worth tri arm space would pretti much new tech appl acceler process away x alreadi underway iron consid intel kill x tri move itanium,4,1592837771.0
493,493,fvmm36m,t1_fvm1pz7,santaliqueur,custom sat troubl stay chart,1,1592825542.0
494,494,fvn7mvf,t1_fvn4h2a,stopalltheDLing,think great name familiar big sur,3,1592839348.0
495,495,fvndxmk,t1_fvn3fz2,thiccsupreme,ah ok,1,1592842561.0
496,496,fvnj02x,t1_fvnh0hs,mojo276,deal,2,1592845103.0
497,497,fvnjidu,t1_fvnj2pw,IngsocInnerParty,watch seem fine,1,1592845360.0
498,498,fvnh70s,t1_fvnfd6l,00DEADBEEF,most pro hardwar announc expect new pro stuff seem unlik anyth certain appl tv like mani peopl seem want,0,1592844196.0
499,499,fvlgy5t,t1_fvlghgv,Electrical_Cherry,oh yeah make sens figur event tell develop get readi arm releas first mac next year end year,13,1592791140.0
500,500,fvmf2a8,t1_fvmbz2x,alien3d,unsur kinda lazi test again sinc beta ipad mini two thousand nineteen connect pendriv without extern power releas usabl burn money adapt think work intend allreadi bought old macbook two thousand eleven bring meet devic instead ipad,1,1592818746.0
501,501,fvlxspe,t1_fvliqrk,deleted,,5,1592802674.0
502,502,fvmj81p,t1_fvlxphu,davecrist,first titanium powerbook imac releas wwdc,2,1592822920.0
503,503,fvmntiq,t1_fvlxphu,deleted,,1,1592826997.0
504,504,fvnfn3g,t1_fvncyws,Lost_the_weight,care softwar chang come new os releas might well catch articl publish keynot end,2,1592843417.0
505,505,fvn3wty,t1_fvmyu7c,KZedUK,nbae start inb alreadi exist,2,1592837373.0
506,506,fvlq1aw,t1_fvlnval,hishnash,catalyst uikit ui lib maco let run appkit app differ ui framework,6,1592797077.0
507,507,fvnir6i,t1_fvnilxv,IngsocInnerParty,correct,1,1592844978.0
508,508,fvnjqjp,t1_fvnjju3,waterboy100,ok troll cool,1,1592845475.0
509,509,fvmvce1,t1_fvmunqj,bt1234yt,tri forc close app open,3,1592832371.0
510,510,fvmzf7z,t1_fvmza9i,bt1234yt,us,1,1592834852.0
511,511,fvmxk5y,t1_fvlemp2,geoffh2016,wwdc audienc steve job tell us great web app need nativ app room silent meme definit crowd reaction,18,1592833741.0
512,512,fvmovtf,t1_fvlfnd3,Rhed0x,crowd would senseless cheer everyth anyway,4,1592827849.0
513,513,fvn87gu,t1_fvn2y2w,myironlung6,great analysi big stank dick daddi,6,1592839644.0
514,514,fvmqygy,t1_fvmldim,Eruanno,say cheap even well price said possibl replac ssds t chip machin,5,1592829405.0
515,515,fvma86j,t1_fvlshh9,CarlHen,major break chang happen yet let see lucki streak keep give,5,1592813715.0
516,516,fvm20pm,t1_fvm1wzf,chaiscool,even appl exceed still risk nc disappear overnight,8,1592806069.0
517,517,fvmzsur,t1_fvm1wzf,abrahamisaninja,first got earphon back octob app crash non stop extrem difficult figur get stop eventu manag get run good ever sinc,2,1592835075.0
518,518,fvn8cs5,t1_fvn83je,nick_pl,use sennheis momentum tw listen right left airpod talk non pro airpod evalu purchas altern close ear appli,2,1592839720.0
519,519,fvmtkom,t1_fvmtela,LyrMeThatBifrost,audio qualiti pretti averag sound signatur none stand b includ,2,1592831221.0
520,520,fvlsz0p,t1_fvlq4h0,xx_trickydick_xx,,25,1592799101.0
521,521,fvm9hue,t1_fvlq4h0,bluewolf37,use ar pokmon go back fun end turn kill batteri fast nephew love monster park though get feel need huge jump batteri technolog becom use glass,8,1592812980.0
522,522,fvll8sm,t1_fvlgy5t,tman152,bet tell dev work swift alreadi done get readi arm everyon els get tool prepar app,11,1592793905.0
523,523,fvlovlj,t1_fvlgy5t,sulaymanf,worri osbourn effect could tank mac sale everyon think hardwar obselet,5,1592796300.0
524,524,fvlh7e6,t1_fvlgy5t,ken27238,yea arm mac might one thing septemb ppc intel switch announc transit later date releas first consum product,3,1592791301.0
525,525,fvlyht4,t1_fvlxspe,HeyCharlieBall,agre hardwar import accessori,3,1592803207.0
526,526,fvlq2f9,t1_fvlq1aw,FullSpectrumWizard,okay make work way,0,1592797098.0
527,527,fvnit54,t1_fvnir6i,walle58533,good know thank hope cool announc,2,1592845007.0
528,528,fvn7b5i,t1_fvmvce1,Doelago,yes,2,1592839179.0
529,529,fvng2yj,t1_fvmovtf,mbrady,wooo,1,1592843638.0
530,530,fvm2wwr,t1_fvm20pm,MobiusOne_ISAF,lose nois cancel overnight regular issu sure understand talk edit ah mean airpod auto updat bad thought meant mxs yeah appl would redesign can ground even start convers,12,1592806839.0
531,531,fvn8xqg,t1_fvn8cs5,Throwaway_Consoles,regular airpod weird left someth keep mind recommend anyon also forget pros audio pass mode bring ambient nois want shut one ear comfort regular airpod someth keep mind,1,1592840022.0
532,532,fvn5b20,t1_fvmtkom,dishfishbish,take look mrmobil review hi,1,1592838109.0
533,533,fvmkvtt,t1_fvll8sm,Eruanno,adob avid applic get half ass port mayb,7,1592824472.0
534,534,fvlpjs8,t1_fvlovlj,Electrical_Cherry,perhap leap faith mean still releas new powerpc mac even intel announc mayb take littl courag,5,1592796748.0
535,535,fvme4cp,t1_fvlovlj,m0rogfar,ppc intel sale tank much lot peopl buy mac need new machin lot peopl rush get last intel machin expect softwar port initi,4,1592817753.0
536,536,fvlrlfj,t1_fvlq2f9,hishnash,catalyst full maco vm maco lot extra api expos develop io exampl maco use memori user ram os smart swap disk ipado get regular maco app run ipado need maco light wait shim like catalyst,4,1592798135.0
537,537,fvn9ers,t1_fvn8xqg,nick_pl,sennheis also also comfort wear normal airpod alreadi normal iphon headphon fit macbook goddam light think get wireless instead one thing piss sennheis disabl bluetooth iphon want listen macbook press five second redo pair read onlin airpod work seamless multipl devic still get actual play two audio time connect two devic work,2,1592840266.0
538,538,fvmvx1r,t1_fvmkvtt,ken27238,dollar one hundr year extra arm support,2,1592832735.0
539,539,fvnidcv,t1_fvmkvtt,BourgeoisShark,adob work sooner later lot creativ communiti either go leav appl leav adob,1,1592844785.0
540,540,fvnbnel,t1_fvn9ers,Throwaway_Consoles,let say listen audio macbook want switch phone fastest way find icon bottom circl yellow sometim look like tap open menu click circl circl yellow switch like trade macbook saturday new one arriv friday would give exact exampl easiest way open control center tap yellow icon tap icon tap icon take extra step work everi time album step click one one,1,1592841408.0
