,Comment ID,Parent ID,Author,Body,Score,Created (UTC)
925,e8q8q14,t3_9so41z,skeeterou,LOL that creepy face,2,1540911851.0
926,e8q8s12,t3_9so41z,rebel5788,User setting 100% from 3. Scrub had to cheat to beat the computer ,2,1540911899.0
927,e8q8v91,t3_9so41z,chaiscool,How about the backgrounds fan 2k haha does it have story mode though ,2,1540911974.0
928,e8q90mf,t3_9so41z,BigGreekMike,Apple really needs to design their own chips for MacOS,2,1540912100.0
929,e8q90us,t3_9so41z,deleted,Do they do the Oscars here,2,1540912105.0
930,e8q9833,t3_9so41z,kaboom987,What's the ppi/resolution of this iPad pro,2,1540912276.0
931,e8q98qc,t3_9so41z,philphan25,"Wonder how much the PS app will cost, or if it can be bundled with CC.",2,1540912291.0
932,e8q99b3,t3_9so41z,medpre,Let’s go for the one more thing !,2,1540912303.0
933,e8q9b14,t3_9so41z,Luph,lmao phil,2,1540912344.0
934,e8q9ch4,t3_9so41z,Hoobleton,"Deep presentation, Tim handed to John who handed to Sian, who handed to the adobe woman, who handed to the other adobe women. ",2,1540912376.0
935,e8q9dhv,t3_9so41z,kaboom987,If i put this on my Christmas list will Santa go broke?,2,1540912400.0
936,e8q9e3o,t3_9so41z,AnImproversation,I miss his voice. ,2,1540912414.0
937,e8q9hvo,t3_9so41z,Endlessxo,The music in this iPad pro advertisement lol,2,1540912501.0
938,e8q9il3,t3_9so41z,kaboom987,HOW MUCH FAM,2,1540912517.0
939,e8q9iob,t3_9so41z,deleted,They're taking their sweet time on the price,2,1540912519.0
940,e8q9j20,t3_9so41z,rockinadios,Not seeing a headphone jack on the new iPad...,2,1540912528.0
941,e8q9jnc,t3_9so41z,Tackticat,Phil Schiller the new Apple Ad guy! ,2,1540912542.0
942,e8q9juh,t3_9so41z,scroopy_nooperz,999 for 12.9,2,1540912546.0
943,e8q9kjr,t3_9so41z,newmacbookpro,And that's it for today!,2,1540912563.0
944,e8q9km8,t3_9so41z,ndcoil,Not terrible pricing ,2,1540912564.0
945,e8q9ljz,t3_9so41z,Derpshiz,999+,2,1540912586.0
946,e8q9lti,t3_9so41z,chut_has_no_religion,one more thing?,2,1540912592.0
947,e8q9mxu,t3_9so41z,cherryfree2,One more thing please,2,1540912618.0
948,e8q9nfy,t3_9so41z,Eugene1026,because ios 11 was a shit fest,2,1540912630.0
949,e8q9ntb,t3_9so41z,deleted,MY WALLET,2,1540912638.0
950,e8q9oh3,t3_9so41z,PickleBugBoo,No AirPods???,2,1540912653.0
951,e8q9olq,t3_9so41z,RandomUsername232323,Boom. Right in the wallet.,2,1540912656.0
952,e8q9onk,t3_9so41z,rebel5788,Does 12.1 fix wifi and LTE problems on XS Max tho?,2,1540912657.0
953,e8q9q96,t3_9so41z,baddesthombre,I only have 3 friends. One is a Shar pei.,2,1540912693.0
954,e8q9qws,t3_9so41z,chut_has_no_religion,one more things 🤤,2,1540912709.0
955,e8q9t90,t3_9so41z,ebevan91,Did anyone catch the new prices for the current iPad Pros? They showed them on the screen but I looked back over too late.,2,1540912763.0
956,e8q9unz,t3_9so41z,astraltraveltrip,"OMG, no new imacs??",2,1540912795.0
957,e8q9uy8,t3_9so41z,AlexanderBeta213,Please One More Thing Please One More Thing PLEASEEEE,2,1540912801.0
958,e8q9ve2,t3_9so41z,filmantopia,No Bono?,2,1540912811.0
959,e8q9yt4,t3_9so41z,Wtucker4,norman fucking rockwell,2,1540912889.0
960,e8qadla,t3_9so41z,Logseman,"At least in Ireland, The store is still showing the Macbook and the nTB MacBook Pro alongside the new Air.",2,1540913223.0
961,e8q6f1w,t3_9so41z,RepsForKoreanJesus,A core i-3 for $799? Lmfao.,6,1540909895.0
962,e8q70ld,t3_9so41z,RepsForKoreanJesus,She just doesn’t stop does she.,5,1540910410.0
963,e8q6eoi,t3_9so41z,deleted,actually a decent price on the mac mini wow,3,1540909886.0
964,e8q6g17,t3_9so41z,JuniperJumps,$799 isn’t bad at all,7,1540909918.0
965,e8q6kqm,t3_9so41z,deleted,😡Where are my iPads 😡,6,1540910030.0
966,e8q72zs,t3_9so41z,cjohn4043,I just realized the Mac Mini doesn't have an SD card slot. -\_\_-,6,1540910467.0
967,e8qanpp,t3_9so41z,Buffalotto,"What kind of apple event is that without an ""one more thing part""",7,1540913456.0
968,e8qaxsl,t3_9so41z,promethxus,"Man, I dislike Cook’s forced charisma. ",7,1540913684.0
969,e8q5py6,t3_9so41z,zorinlynx,"We're never going to be rid of that shit keyboard design, are we?",5,1540909282.0
970,e8q69kc,t3_9so41z,deleted,who tf needs 64gb of RAM,3,1540909762.0
971,e8q72qy,t3_9so41z,rebel5788,"Recycled aluminum, raise the price yip yip ",4,1540910461.0
972,e8q76i9,t3_9so41z,quitethewaysaway,Tim likes the New York crowd lolol,4,1540910550.0
973,e8q7ob1,t3_9so41z,ignaciobarrena,So no headphone jack? ,4,1540910969.0
974,e8q811x,t3_9so41z,flamingllama33,"If it's so flat, and you're supposed to lay it on a table and draw on it with the pencil, I feel like that protruding camera is going to get really annoying. Could they really not have engineered that to be flat?",4,1540911267.0
975,e8q87og,t3_9so41z,deleted,"I think if the iPad moves to an OLED display, we lose the 120Hz refreshment rate.",3,1540911424.0
976,e8q8pau,t3_9so41z,gda19,It looks like garbage dawg,5,1540911834.0
977,e8q8x4q,t3_9so41z,quantastical,Shantelle shaky as fuck with that Apple Pencil  Who wouldn't be though ,3,1540912018.0
978,e8q90wj,t3_9so41z,shotofbourbon,Her hand is shaking so much.,3,1540912106.0
979,e8q9lo2,t3_9so41z,speech-geek,$799 is not that bad if you use your iPad as a laptop replacement. ,4,1540912588.0
980,e8q9n17,t3_9so41z,yanksrock1000,"Wow, the price isn't too bad. People were saying $999 for the 11inch. ",5,1540912621.0
981,e8q9qc8,t3_9so41z,the_one_true_bool,Crowd is finally coming down off their high.,3,1540912695.0
982,e8qa0n1,t3_9so41z,limehead,Nooo. I have been waiting for over a year for an iMac update. Fuck fuck fuck. F.,4,1540912931.0
983,e8q6fre,t3_9so41z,mrjohnhung,"wawow, price increase again. Now with a shitty i3 instead. Apple is on  a roll today",5,1540909912.0
984,e8q6lwg,t3_9so41z,rainloading,Angela yesss queen! I stan her!,4,1540910059.0
985,e8q9lke,t3_9so41z,AnImproversation,So fucking cheap for what you’re getting. ,4,1540912586.0
986,e8q59a3,t3_9so41z,Sapz93,Great my MacBook Pro I just bought two months ago don’t have Touch ID 🙄,4,1540908873.0
987,e8q59zy,t3_9so41z,TempestXax,"YES, TOUCH ID.  I'll take it on the computer even though Face ID is superior.",2,1540908891.0
988,e8q5j2n,t3_9so41z,xvinciuSx,"just wait for the price, they just killed of idea of the air",2,1540909116.0
989,e8q60s0,t3_9so41z,kaboom987,Remember the $799 rumours? 😂😂😂😂,3,1540909547.0
990,e8q62dk,t3_9so41z,Mr-Dogg,They are creating TOOO much HYPE for both these products when it looks exactly the same :P,3,1540909586.0
991,e8q67kt,t3_9so41z,crapusername47,No crappy mobile CPUs? Go on... I’m listening...,3,1540909712.0
992,e8q684o,t3_9so41z,Fuzzyduck76,"I love this guy’s stage presence, haha",4,1540909726.0
993,e8q6wml,t3_9so41z,medpre,Bring on the iPads ffs,4,1540910317.0
994,e8q788z,t3_9so41z,Catdaddypanther97,Ok. Tim Cook is def on something.  ,3,1540910591.0
995,e8q79kt,t3_9so41z,speech-geek,The unsung heroes: the retail workers having to deal with customer’s bullshit on a daily basis,3,1540910621.0
996,e8q7g1s,t3_9so41z,taario,Ahhh the inner radius doesn't flow with the outer radius.   Nitpicky but Apple always has that on point.,3,1540910773.0
997,e8q7i0s,t3_9so41z,strongjs,No OLED iPad.  It's LED,4,1540910820.0
998,e8q7saw,t3_9so41z,WFR22,Where does this leave the normal retina MacBook?,3,1540911064.0
999,e8q7wmk,t3_9so41z,kaboom987,UGH FINE APPLE I'LL BUY AN IPAD JESUS,3,1540911163.0
1000,e8q828z,t3_9so41z,cschmidt0525,USB-C ,3,1540911295.0
1001,e8q82gh,t3_9so41z,Sexy_Persian,USB-C!,3,1540911301.0
1002,e8q82hk,t3_9so41z,Shimmer89,USB-C?  Wow. Bought,3,1540911301.0
1003,e8q834r,t3_9so41z,sungm64,WHAT USB-C,3,1540911316.0
1004,e8q88l5,t3_9so41z,PaddysChub432,No new iMac. 😒 damn it,2,1540911445.0
1005,e8q8bux,t3_9so41z,AlexanderBeta213,"A12*X* as *ecks*, lol.",2,1540911521.0
1006,e8q8hnk,t3_9so41z,gda19,I swear if this is $200 more,4,1540911656.0
1007,e8q8hxb,t3_9so41z,rebel5788,"This lady on meth, slow down speedy Gonzales damn ",2,1540911662.0
1008,e8q8lv6,t3_9so41z,TheBrainwasher14,Remember how game-changing it was when the iPad was announced at $499 in 2010?,2,1540911753.0
1009,e8q8ujj,t3_9so41z,cbfw86,I had no idea Felicia Hardy worked for Adobe.,4,1540911957.0
1010,e8q9bvu,t3_9so41z,cbfw86,where's jonny ive? this guy sounds like a cast member of cheers.,2,1540912364.0
1011,e8q9d7m,t3_9so41z,cbfw86,"""About a pound.""  *1.5lbs*",3,1540912393.0
1012,e8q9i79,t3_9so41z,PaddysChub432,Where is the pad mini 5 and iMac update?! Nooooooo,3,1540912509.0
1013,e8q9n8g,t3_9so41z,BigGreekMike,“It changes the way we think about computers”  but what is a computer,4,1540912626.0
1014,e8q9v3k,t3_9so41z,deleted,"Holy shit guys check the website. 1100 to get a Mac mini with i5, 8gb of ram and a 256gb ssd. WTF. ",4,1540912805.0
1015,e8q9xl7,t3_9so41z,deleted,">	 The artist here has sold 15 million albums. The emotional honesty of her work is undeniable  No one cares about the musical tastes of Ars writers, why did they even mention that",3,1540912861.0
1016,e8qa1lj,t3_9so41z,thortilla27,The acoustics in this setting is on point. ,3,1540912952.0
1017,e8qagwm,t3_9so41z,getBusyChild,iPad Pro 11” WIFI ONLY from $1229 (64GB) to $2349 (1TB) iPad Pro 11” WIFI + Cellular from $1449 (64GB) to $2569 (1TB)  iPad Pro 12.9” WIFI ONLY from $1529 (64GB) to $2649 (1TB) iPad Pro 12.9” WIFI + Cellular from $1749 (64GB) to $2869 (1TB)  https://twitter.com/peterwells/status/1057290900718653441,4,1540913299.0
1018,e8qbja5,t3_9so41z,swagmaxster,Thanks guys! I’m pretty sure it’s my education discount ,3,1540914168.0
1019,e8q6nm5,t3_9so41z,deleted,[gelöscht],7,1540910099.0
1020,e8q8gla,t3_9so41z,BigGreekMike,There’s something hilarious about a grandma introducing the tech behind the latest iPad,7,1540911631.0
1021,e8q5jek,t3_9so41z,guuchguuch,"Imagine selling, or even buying, a dual core laptop in 2018 lol. Jesus christ.",5,1540909124.0
1022,e8q745i,t3_9so41z,Bobking11,Well that was damn boring.,4,1540910494.0
1023,e8q75i8,t3_9so41z,rainloading,queen of positivity and human connection 😭 ugh her mind!!,4,1540910526.0
1024,e8q912b,t3_9so41z,deleted,There's no way all these presenters just happen to wear Apple Watches. They 100% gave them to them to wear,4,1540912110.0
1025,e8q6k3x,t3_9so41z,CitrusEye,$1200 for a fucking dual-core. Are you fucking kidding me Apple. My $500 windows laptop has a 8th gen 4c/8t part. pathetic. ,6,1540910016.0
1026,e8q6i16,t3_9so41z,deleted,$799 for an i3. I can build a htpc with an i7 and dedicated GPU for that. Come on Apple.,9,1540909966.0
1027,e8qbuht,t3_9so41z,winsome_losesome,I really hate to go all Apple in my tech life...   ...but I want to buy them all Apple techs.,7,1540914418.0
1028,e8q5xq9,t3_9so41z,deleted,wow 128gb. in 2018. what the fuck,4,1540909473.0
1029,e8q62yq,t3_9so41z,ShinsBlownOff,Lol new MacBook “Air”. It’s basically a MacBook with extra usb c and fingerprint scanner. Jesus Christ smh,4,1540909600.0
1030,e8q6fb6,t3_9so41z,deleted,[gelöscht],3,1540909901.0
1031,e8q7mex,t3_9so41z,AgentX5000,Why an LCD apple? This would've been a day one insta-buy with an OLED.,4,1540910924.0
1032,e8q909q,t3_9so41z,getBusyChild,She needs some recycled aluminium.,4,1540912091.0
1033,e8q6jq8,t3_9so41z,rockybbb,128GB is disappointing but $799 is a decent starting point and with a desktop the internal SSD isn't as limiting. I'm just glad they are finally without a spinning HDD on the base model. ,4,1540910007.0
1034,e8q6jym,t3_9so41z,finally_not_lurking,Oh course it’s the biggest update ever for Apple. It’s also the longest Apple has ever gone between updates. ,4,1540910013.0
1035,e8q6l7d,t3_9so41z,deleted,[gelöscht],3,1540910041.0
1036,e8q6ot9,t3_9so41z,NeuronalDiverV2,Did they pay them to scream for mrs. Town square?,3,1540910127.0
1037,e8q82zr,t3_9so41z,Redwoodsilouette,OHHHH LAWD USB-C,4,1540911313.0
1038,e8q8b54,t3_9so41z,deleted,[entfernt],3,1540911504.0
1039,e8q8ixj,t3_9so41z,deleted,[gelöscht],3,1540911686.0
1040,e8q948h,t3_9so41z,mhall85,We’re at a music school.  Can we do something related to... music? Maybe?,3,1540912184.0
1041,e8q9wl5,t3_9so41z,iwilitu,Lana omg!!!!,3,1540912839.0
1042,e8q9wz3,t3_9so41z,getBusyChild,Oh god what is this...,4,1540912847.0
1043,e8q9xjc,t3_9so41z,Nothematic,Where. Is. My. Air. Power.,3,1540912860.0
1044,e8qahnt,t3_9so41z,Evari,Macbook air and cheapest MacBook Pro are virtually identical...?,4,1540913317.0
1045,e8qalyt,t3_9so41z,RGG2000,Curious to see that the new MacBook Air has a jack connector.,3,1540913415.0
1046,e8qan92,t3_9so41z,I_Am_Now_Anonymous,No free songs?? ,2,1540913445.0
1047,e8q6s11,t3_9so41z,MrCoolesta,"This crowd will applaud at anything Apple does, I bet they would roar if the hostess farted.",4,1540910206.0
1048,e8q6n2i,t3_9so41z,Hoobleton,Do people care about this?,2,1540910086.0
1049,e8q8hmg,t3_9so41z,cbfw86,"What the hell are they talking about? Assassin's Creed has had about 8 apps on iOS. First time ever?   hahahaha ""something no console can deliver""  Stick to productivity and media. Don't go near games.",5,1540911655.0
1050,e8q6yw6,t3_9so41z,Catdaddypanther97,"I don’t give a f, please move on. ",4,1540910371.0
1051,e8q9n07,t3_9so41z,riesendulli,"No new iPad mini, no buy.",2,1540912620.0
1052,e8q9tzr,t3_9so41z,riesendulli,No iPad mini No new AirPods No new Mac Pro  No new iPhone SEx ,3,1540912780.0
1053,e8qa386,t3_9so41z,I_Am_Now_Anonymous,Can I be the first to say that we didn’t get the AirPower or wireless AirPods case? ,3,1540912989.0
1054,e8qadh1,t3_9so41z,arsene14,"I've heard of Lana Del Ray, but I've honestly never heard a single song of hers. And it's not at all my style, so I guess that makes sense.",3,1540913220.0
1055,e8qlu4e,t3_9so41z,SauCe-lol,Why did they removed the headphone jack if they want it to be a pro device for production? Would’ve instant buy it if they didn’t ,4,1540922392.0
1056,e8q5l5t,t3_9so41z,szzzn,She's having a rough time,4,1540909166.0
1057,e8q68hj,t3_9so41z,BigGreekMike,This whole event is giving me a real sickly feeling. It feels like the uncanny valley version of an Apple event.,4,1540909735.0
1058,e8q6wij,t3_9so41z,TempestXax,Called the /r/Apple [reaction to the pricing](https://old.reddit.com/r/apple/comments/9so41z/apples_there_is_more_in_the_making_event/e8q6a93/).,3,1540910315.0
1059,e8q7gvu,t3_9so41z,BigGreekMike,It has a camera bump are you fucking shitting me,3,1540910792.0
1060,e8q7ydw,t3_9so41z,Ventorus,"Oooooph, the comparison to the Xbox one S was a poor decision. Completely different markets, apples to oranges comparison.",4,1540911204.0
1061,e8q9lrb,t3_9so41z,Ventorus,$799 and $999... Nope nope nope WHY!?,3,1540912590.0
1062,e8q4vq0,t3_9so41z,ozkxr,Is the VLC link broken or is just me? [/u/exjr\_](https://www.reddit.com/u/exjr_),2,1540908538.0
1063,e8q59qm,t3_9so41z,thortilla27,"Customers asked for better screen, Touch ID and REASONABLE PRICE. ",2,1540908885.0
1064,e8q5hk2,t3_9so41z,Cmac0801,"Using a MagSafe port icon to indicate power, way to rub it in Apple... :(",2,1540909078.0
1065,e8q5lk8,t3_9so41z,salzarslytherin,So. What’s the point in the MacBook now?,2,1540909176.0
1066,e8q5p3k,t3_9so41z,thortilla27,"Geez, recycled aluminium sounds more expensive than the mined ones.. ",2,1540909261.0
1067,e8q5sbq,t3_9so41z,thortilla27,"No Jony Ive, finally. Or they are saving him for the iPad. ",2,1540909340.0
1068,e8q5tsu,t3_9so41z,AgentX5000,Why can't the iPhone folks tell us real battery life like these mac folks.  12 mac battery hours = 12 real hours  All day iPhone battery = less than six hours screen on hours.,2,1540909375.0
1069,e8q5vjy,t3_9so41z,TheMuffStufff,"""USB-C is the most powerful and versatile port ever"" Yet they still dont have it on their phones. Hello???",2,1540909418.0
1070,e8q5w6q,t3_9so41z,Anthonybuck21,Lol atomic level ,2,1540909435.0
1071,e8q69kd,t3_9so41z,yuriydee,Well the Macbook Air price isnt horrible at least. Might be worth looking into. ,2,1540909762.0
1072,e8q69nx,t3_9so41z,deleted,User replaceable ram. ,2,1540909764.0
1073,e8q6iaq,t3_9so41z,JuniperJumps,Now we need a new Thunderbolt Display!,2,1540909973.0
1074,e8q6jkh,t3_9so41z,deleted,AirPods please ,2,1540910004.0
1075,e8q6ykv,t3_9so41z,deleted,"I'm out of the loop, but do we still expect the new iPads?",2,1540910364.0
1076,e8q724i,t3_9so41z,IThinkThings,Can somebody in DC go check the Smithsonian for Jerry's Puffy Shirt? Just make sure its still there?,2,1540910446.0
1077,e8q7a59,t3_9so41z,The_B1ack_One,Ooof flex on em Tim,2,1540910635.0
1078,e8q7cg8,t3_9so41z,ElHatso,Wait. Where are the iMacs. There better be one more thing at the end,2,1540910688.0
1079,e8q7gyt,t3_9so41z,deleted,[gelöscht],2,1540910794.0
1080,e8q7mqe,t3_9so41z,OviraptorGaming,It looks exactly like all those iSlate rumors from 2010.,2,1540910932.0
1081,e8q7o4i,t3_9so41z,chaiscool,If only the iPad pros run Mac OS ,2,1540910964.0
1082,e8q7oy0,t3_9so41z,yallrealize,fuck I barely just woke up but I’m excited,2,1540910985.0
1083,e8q7vbz,t3_9so41z,cbfw86,"That CPU rivals my desktop, and I'm a PC gamer with a pretty good rig.",2,1540911134.0
1084,e8q7wo1,t3_9so41z,medpre,RIP all other tablets,2,1540911164.0
1085,e8q7wsk,t3_9so41z,philphan25,"This is going to be $999, isn't it?",2,1540911167.0
1086,e8q822l,t3_9so41z,yanksrock1000,"Damn USB-C, that was unexpected. I didn't believe the rumors. ",2,1540911291.0
1087,e8q85ie,t3_9so41z,stulogic,They're going to need a separate Special Event just to show us all the dongles we're going to need. ,2,1540911373.0
1088,e8q89mg,t3_9so41z,theNEWgoodgoat,So I Guess can’t use the new Apple Pencil with the old iPads cuz you can’t charge it without the new iPad Pro ,2,1540911469.0
1089,e8q8g1z,t3_9so41z,Luph,UBIHSOFT,2,1540911618.0
1090,e8q8m05,t3_9so41z,Sockin,Ok the graphics on this are really impressive.,2,1540911756.0
1091,e8q8otz,t3_9so41z,mak103020,okay,2,1540911822.0
1092,e8q8shu,t3_9so41z,nmpraveen,that was cringy af,2,1540911910.0
1093,e8q90tz,t3_9so41z,deleted,[gelöscht],2,1540912104.0
1094,e8q973p,t3_9so41z,riesendulli,What bout 120 hz refresh on the pro?,2,1540912252.0
1095,e8q9bu3,t3_9so41z,vacacay,"Back to you Shawntel, Back to you John, Back to you Tim",2,1540912362.0
1096,e8q9dd4,t3_9so41z,deleted,[gelöscht],2,1540912397.0
1097,e8q9hue,t3_9so41z,SuccessAndSerenity,"wait was that the ""what's a computer?"" girl at the end of the video?",2,1540912500.0
1098,e8q9i04,t3_9so41z,GauMandwaUmar36,Doesn’t seem to be a headphone jack based on this video - I think they showed all the angles and I couldn’t spot one ,2,1540912504.0
1099,e8q9ksn,t3_9so41z,IThinkThings,What that's a good price.,2,1540912568.0
1100,e8q9leg,t3_9so41z,the_dugong,Won’t lay flat because the camera protrudes?,2,1540912582.0
1101,e8q9ma5,t3_9so41z,Sciphis,Thats not as bad as I thought it would be.,2,1540912602.0
1102,e8q9n7b,t3_9so41z,tru3gam3r,where are my airpods2,2,1540912625.0
1103,e8q9u38,t3_9so41z,SolarPhantom,I don’t expect to see air power or air pods 2 until next September. Make sense they’d launch along a new iPhones lineup than any other product tbh. ,2,1540912782.0
1104,e8q9u9v,t3_9so41z,getBusyChild,"Sorry to waste your time to the engineers that worked on the mac mini, and Macbook Air. Looks like Tim and Co. are now pushing the iPad front and center, along with the R&D funding.",2,1540912786.0
1105,e8q9uoc,t3_9so41z,thearchdill,Please no AirPods... so many other Apple products I need before having to buy another pair... ,2,1540912795.0
1106,e8q9vnj,t3_9so41z,Wtucker4,LANA <3,2,1540912817.0
1107,e8q9w8j,t3_9so41z,deleted,[gelöscht],2,1540912831.0
1108,e8qa1to,t3_9so41z,phomasta,Apple site is updated,2,1540912957.0
1109,e8qaexi,t3_9so41z,getBusyChild,Um did it just cut off in the middle of her singing...?,2,1540913254.0
1110,e8qapuc,t3_9so41z,kefaren,Any news on when this new iPad even comes out?,2,1540913505.0
1111,e8q4ojw,t3_9so41z,RandomUsername232323,Sure. Bring a Macbook to the dessert. The Keyboard certainly loves it,2,1540908365.0
1112,e8q5k0h,t3_9so41z,Virtualizedadmin,The new mba is ruined by the keyboard. They're terrible. ,4,1540909139.0
1113,e8q64bo,t3_9so41z,rainloading,the trailers are so extra lol marvel is shaking,3,1540909632.0
1114,e8q71tq,t3_9so41z,deleted,200 years later...,2,1540910439.0
1115,e8q73a5,t3_9so41z,mjr2p3,all I want is AirPods that are water resistant rated,1,1540910473.0
1116,e8q8q64,t3_9so41z,ftwin,These tables need controller support. The only thing holding mobile gaming back is the touch controls.,3,1540911854.0
1117,e8q9ho0,t3_9so41z,deleted,[gelöscht],3,1540912496.0
1118,e8q9m9h,t3_9so41z,IThinkThings,AIR-POW-ER  AIR-POW-ER  AIR-POW-ER  AIR-POW-ER  AIR-POW-ER,3,1540912602.0
1119,e8q9w33,t3_9so41z,kuyakew,Please be Cardi B,1,1540912827.0
1120,e8q9x58,t3_9so41z,rrfg1,I think AirPower is dead as we knew it. ,2,1540912851.0
1121,e8qah6k,t3_9so41z,Kaidou99,Store has been updated. No airpods 2 RIP,2,1540913306.0
1122,e8qar7e,t3_9so41z,deleted,[gelöscht],1,1540913536.0
1123,e8q6w26,t3_9so41z,BigGreekMike,stoptryingtomaketodayatapplehappen.jpg,1,1540910304.0
1124,e8q6qr1,t3_9so41z,Neg_Crepe,Thread has been hijacked by r/technologies marks,2,1540910174.0
1125,e8q5xqe,t3_9so41z,kilobitch,1199 not bad. Was thinking 1299. ,2,1540909473.0
1126,e8q6zu1,t3_9so41z,deleted,Booooo who cares about sessions ,0,1540910392.0
1127,e8q730u,t3_9so41z,ftwin,BORED,2,1540910467.0
1128,e8q7nz1,t3_9so41z,deleted,[gelöscht],3,1540910960.0
1129,e8q8so0,t3_9so41z,deleted,Nothing like watching a global trillion dollar company present new products for consumers in the morning.,2,1540911914.0
1130,e8qamib,t3_9so41z,thortilla27,Thanks for the update Apple. Price is a nawww for me dawg ,3,1540913428.0
1131,e8q79hi,t3_9so41z,nvidiasuksdonkeydick,Tim cook could put his dick into the mouth of any person in the crowd and they'd suck it.,3,1540910619.0
1132,e8qflho,t3_9so41z,digiorno,Can we please get and iPhoneSE2 announcement?,1,1540917388.0
1133,e8q5kgi,t3_9so41z,deleted,[gelöscht],2,1540909150.0
1134,e8q9mnj,t3_9so41z,TempestXax,"64GB is a goddamn travesty, though.  Fuck out of here with that LOL.",1,1540912612.0
1135,e8q6ura,t3_9so41z,deleted,[gelöscht],1,1540910273.0
1136,e8qalxf,t3_9so41z,hostelo,No new iMac is FUCKING ABSURD,1,1540913414.0
1137,e8q483n,t3_9so41z,devp0ll,Hoping for a new Mac mini at a decent price. I'm trying to get back on Apple Island but it's a pricey trip back. Also hoping to see Final Cut and/or Logic on the iPad Pro,1,1540907954.0
1138,e8q4ev0,t3_9so41z,deleted,You are my eyes and ears guys,1,1540908122.0
1139,e8q4geo,t3_9so41z,MrManh,people are ready to froth all over new macs haha,1,1540908161.0
1140,e8q4kb6,t3_9so41z,deleted,"Stuck in a car waiting for somebody. Important meeting. Anyway, tried to buy apple Tv today, they said to wait until after the event. What do you think?",1,1540908258.0
1141,e8q4kht,t3_9so41z,deleted,"Stuck in a car waiting for somebody. Important meeting. Anyway, tried to buy apple Tv today, they said to wait until after the event. What do you think?",1,1540908263.0
1142,e8q4l9r,t3_9so41z,G_Wom,In awe at the size of this unit,1,1540908282.0
1143,e8q4mkl,t3_9so41z,thortilla27,I know you love playing videos ,1,1540908314.0
1144,e8q4rkf,t3_9so41z,IThinkThings,Lets hear it for customer sat!,1,1540908440.0
1145,e8q4v2w,t3_9so41z,G_Wom,MacBook R incoming,1,1540908523.0
1146,e8q4vid,t3_9so41z,IThinkThings,YESSSSSSS,1,1540908533.0
1147,e8q4vwi,t3_9so41z,renegadeturkeys,wonder what they're gonna do ...,1,1540908543.0
1148,e8q503r,t3_9so41z,deleted,Retina display ,1,1540908645.0
1149,e8q51zn,t3_9so41z,my_name_is_worse,no tb lol,1,1540908692.0
1150,e8q526l,t3_9so41z,NameGO,I wish Dark Mode could be enabled on a per-app basis,1,1540908697.0
1151,e8q54wa,t3_9so41z,xvinciuSx,"Macbook 12"" (Air)",1,1540908764.0
1152,e8q566d,t3_9so41z,NameGO,I'm an apple fan obv but people clapping and cheering after every pause is weird,1,1540908797.0
1153,e8q571e,t3_9so41z,Carl2011,resolution?,1,1540908817.0
1154,e8q5fy7,t3_9so41z,philphan25,A whole host of adapters you buy.,1,1540909038.0
1155,e8q5ieu,t3_9so41z,kuyakew,damn didnt know eGPU's were a thing,1,1540909100.0
1156,e8q5ilt,t3_9so41z,thortilla27,I’m guessing the base model is going to be cheapened out to reach a reasonable price point.,1,1540909104.0
1157,e8q5nzn,t3_9so41z,NikeSwish,I feel like this is the first product in a while where most of the features are a surprise. I know there were many rumors of a new mid range MacBook but the details were conflicting. It’s kind of nice not knowing exactly what’s coming like for most iPhone keynotes. ,1,1540909234.0
1158,e8q5pq2,t3_9so41z,chut_has_no_religion,Ive time,1,1540909276.0
1159,e8q5q2v,t3_9so41z,sleepyuzi,I wish they would’ve kept more ports on the air,1,1540909285.0
1160,e8q5t4d,t3_9so41z,Mr-Dogg,their videos are so awesome,1,1540909359.0
1161,e8q5u3v,t3_9so41z,filmantopia,"Wow, a new era in Apple video voiceovers. Either that or Ive had strep.",1,1540909382.0
1162,e8q5u53,t3_9so41z,Eugene1026,wait... i thought jonny ive was coming up...,1,1540909383.0
1163,e8q5vcc,t3_9so41z,medpre,think 999 starting price ,1,1540909413.0
1164,e8q5vce,t3_9so41z,Chrisixx,"I want this thing, but I got a Macbook last year.... 😅",1,1540909413.0
1165,e8q5vs7,t3_9so41z,Sollja,Sounds like an AI talking in the video. ,1,1540909424.0
1166,e8q5wbr,t3_9so41z,kaboom987,If this is $999 it's all over. ,1,1540909438.0
1167,e8q5x03,t3_9so41z,Redwoodsilouette,I’m gonna need those wallpapers ,1,1540909455.0
1168,e8q5xjw,t3_9so41z,IThinkThings,"Okay, Silver, Space Grey, and Gold.",1,1540909469.0
1169,e8q5xms,t3_9so41z,philphan25,Next week...whoa.,1,1540909471.0
1170,e8q5yph,t3_9so41z,Chrisixx,"$1199, could have been much worse. But it'll probably be around 1400-1600 to get one with decent specs. ",1,1540909497.0
1171,e8q5z6l,t3_9so41z,TomLube,MAC MINI AHHHHH,1,1540909508.0
1172,e8q5z7e,t3_9so41z,SuccessAndSerenity,lolllll miniiiiiii!,1,1540909509.0
1173,e8q5zbw,t3_9so41z,chut_has_no_religion,mac mini,1,1540909512.0
1174,e8q604h,t3_9so41z,thortilla27,Ahh 1199. ,1,1540909531.0
