,Comment ID,Parent ID,Author,Body,Score,Created (UTC)
1627,e8q5zuu,t1_e8q5yyg,sebacote,$1200 for 128 GB SSD lol,2,1540909525.0
1628,e8q6370,t1_e8q60a7,TomLube,It better have ROCKET BOOSTERS and be FOUR DOLLARS,1,1540909606.0
1629,e8q67lz,t1_e8q63u0,mulasien,I literally said that to myself the second they mentioned it :P ,1,1540909713.0
1630,e8q69tx,t1_e8q65l1,ca2mt,You’re forgetting about the courage it took  to add an additional ISB-C port. ,2,1540909768.0
1631,e8q6am3,t1_e8q67vp,dbogaev,"After all this time, if I was announcing the new Mac Mini, I'd be psyched, too.",1,1540909788.0
1632,e8q6fxc,t1_e8q69mu,ggill1313,*Wait for it*,1,1540909916.0
1633,e8q6lme,t1_e8q6iky,deleted,Yes,2,1540910052.0
1634,e8q79sm,t1_e8q765a,mjr2p3,"Alexa, play Taps",1,1540910626.0
1635,e8q7ijw,t1_e8q7gf2,speech-geek,The Pencil wireless charging did it for me.,3,1540910832.0
1636,e8qlbd6,t1_e8q7odk,hadapurpura,Without a headphone jack.,1,1540921982.0
1637,e8q89p4,t1_e8q86ps,aza6001,"That was only when the camera was connected at the same time, so I guess its a limitation of having multiple devices connected",2,1540911471.0
1638,e8q8y29,t1_e8q8seu,sonnytron,What kind of IPA to unlock those pimples? $1.99 a month for sweat drops!,2,1540912040.0
1639,e8q95zh,t1_e8q936h,szzzn,That's a no from me dawg.,5,1540912226.0
1640,e8q98an,t1_e8q936h,TempestXax,"Nah.  More expensive than the base Mac Mini, but cheaper than the base MB Air.",3,1540912281.0
1641,e8qasoy,t1_e8qaeql,deleted,[gelöscht],2,1540913572.0
1642,e8qalbk,t1_e8qajcr,juliaday11,What??? For sure??? I was going to buy the new apple pencil. Someone needs to give me the link,2,1540913399.0
1643,e8qb0ff,t1_e8qajcr,deleted,There would be no way to charge it otherwise.,2,1540913744.0
1644,e8qaw5k,t1_e8qanmd,mdurfee,You could build such a ridiculously better computer for that price though. ,13,1540913649.0
1645,e8qb4sl,t1_e8qavw2,deleted,[gelöscht],3,1540913841.0
1646,e8qb01i,t1_e8qavw2,d_wc,Correct - only compatible with new iPad Pro's.,2,1540913735.0
1647,e8qb18j,t1_e8qavw2,theNEWgoodgoat,Didn’t mention it and I Don’t think it’ll work. Cuz even if it works with the old ipad; won’t be able to charge it ,2,1540913762.0
1648,e8qb1q4,t1_e8qavw2,royalstaircase,I was wondering this too. I guess they'll have to keep the Gen 1 pencils in print for people who don't have the newest iPad. ,2,1540913773.0
1649,e8qba7z,t1_e8qb2yu,Sapz93,Sounds like you got the student discount...They don't verify student discounts online ,7,1540913966.0
1650,e8qb53l,t1_e8qb2yu,InTheBusinessBro,"You just bought the older one, enjoy!  Kidding, but does this have something to do with taxes, by any chance?",4,1540913849.0
1651,e8qb8y1,t1_e8qb2yu,TheJohnny346,education pricing,2,1540913937.0
1652,e8qb90h,t1_e8qb2yu,Chckensammich,That’s the price with the education discount.,2,1540913939.0
1653,e8qdp6n,t1_e8qbc8a,MyNameIsSushi,Have you seen the price? ,7,1540915893.0
1654,e8qe6gl,t1_e8qbc8a,TemporaryBoyfriend,"It has to do with the fact that Apple used to make genuinely leading-edge equipment. The 2012 Mac Minis Servers were amazing at the time - but the 2014’s were objectively crap - slow HD’s, and too little soldered-in RAM.  Then they let them languish for 4 years.  So, expectations were high for the new models — CPU’s and Storage have come a long way, and prices have come down — but the new machines appear to be lacklustre at best.  We know what Apple is capable of, and they just keep making half-assed, too-little-too-late announcements. ",5,1540916272.0
1655,e8qbtqa,t1_e8qbc8a,BMOA11,Yep. That's how all tech events go. Nothing is ever good enough there's always a missing feature or the price is too much.   &#x200B;,9,1540914401.0
1656,e8qd8zk,t1_e8qbc8a,deleted,"> A year on this sub and i've seen countless pleas for the mac mini (which admittedly i didn't even know why everyone wanted it so bad), it gets released today and is immediately shit on  maybe because the prices n such deserve to be shit on?",8,1540915533.0
1657,e8qbeme,t1_e8qbc8a,IThinkThings,Oh yeah these megathreads are absolute garbage every time. Some *exact* complains every single time.,3,1540914064.0
1658,e8qem6m,t1_e8qbc8a,swollennode,"Every year, someone will say that this year’s product updates are underwhelming and won’t be upgrading. They are the same people who bought last year’s release.  They forget that there are people who have had the same item for 5 years and are looking to upgrade.",-1,1540916615.0
1659,e8q7phe,t1_e8q7l4p,AHLondon,Ba da bum. ,1,1540910997.0
1660,e8q8pwm,t1_e8q8o5f,granger744,exactly 8(,2,1540911848.0
1661,e8q8rik,t1_e8q8osa,CuntSmellersLLP,"Nah, they're saving that quote for a future OLED iPad.",7,1540911887.0
1662,e8q8q8a,t1_e8q8osa,deleted,Lmao,3,1540911856.0
1663,e8q6iw9,t1_e8q6fwl,gagnonca,I'm going with the 64GB of RAM with a 128GB SSD,10,1540909987.0
1664,e8q6kub,t1_e8q6fwl,peduxe,sometimes I wonder if Apple think people use these just to browse Safari.,7,1540910033.0
1665,e8q8lxg,t1_e8q6fwl,deleted,"I don't get it, SSD's are so cheap now a days. ",3,1540911755.0
1666,e8q6k1z,t1_e8q6fwl,TomLube,Mate it's a desktop just plug an external into it lmao are you serious,-3,1540910015.0
1667,e8q5fi5,t1_e8q5es7,kaboom987,Literally me rn,7,1540909027.0
1668,e8q5rhj,t1_e8q5es7,rhinguin,"Pro users beside themselves, driving around downtown Cupertino begging (thru texts) Apple for a refund. ",2,1540909319.0
1669,e8q6xco,t1_e8q5xbf,nathreed,"Apple usually enables hyper threading on dual core i5. Intel doesn’t sell them like that, but OEMs can enable the feature. ",2,1540910334.0
1670,e8q61s6,t1_e8q5zbv,kevyn123,that was the same price I paid for my 2017 ntb pro....,6,1540909572.0
1671,e8q626f,t1_e8q5zbv,center24tp,"Maybe they'll drop the price on the regular Macbook?  Eh, who am I kidding.  Apple is done selling any computers for less than 1K",4,1540909581.0
1672,e8q71o6,t1_e8q5zbv,fatt_maddison,"Apple don't make budget laptops, they never have and never will.",3,1540910436.0
1673,e8q81zz,t1_e8q5zbv,daymanlol,"Their entire line up has a much cheaper alternative on the market, especially the pro. So I’m confused why, when the same spec XPS is $930 (just reduced from $1,025 very recently), there was an expectation that a self proclaimed luxury hardware manufacturer would price competitively against dell. ",1,1540911289.0
1674,e8q79vz,t1_e8q777z,limac_,100% recycled aluminium fumes are being released in the auditorium ,7,1540910629.0
1675,e8q7c9x,t1_e8q777z,CuntSmellersLLP,"Brooklyn is more of a cocaine borough, but yeah, SF likes weed, NYC likes coke.  Gives you different audiences.  Also, it seems there are a lot of Apple store employees in the audience.",2,1540910684.0
1676,e8q793j,t1_e8q777z,silvs1,so is the company $800 for fucking i3????,2,1540910610.0
1677,e8q9r89,t1_e8q9ouh,Baykey123,I have 32 enemies 🤨,5,1540912716.0
1678,e8q9qbx,t1_e8q9ouh,PickleBugBoo,Conference calls idk like for business,3,1540912695.0
1679,e8qlm58,t1_e8q9ouh,hadapurpura,Sounds like online classes,1,1540922213.0
1680,e8q9soe,t1_e8q9rzo,deleted,Rip ,5,1540912750.0
1681,e8q9wxn,t1_e8q9rzo,Mr_Incredible91,F,2,1540912846.0
1682,e8q9twe,t1_e8q9rzo,TheBrainwasher14,AirPods isn't dead it's just selling really well how it is,1,1540912778.0
1683,e8qa3tq,t1_e8q9rzo,teratron27,What would you want from new AirPods? ,1,1540913002.0
1684,e8q9tyh,t1_e8q9rzo,CrimsonEnigma,"Man, the AirPods have been for sale for a while now...",1,1540912779.0
1685,e8qa2kh,t1_e8q9zdv,deleted,[gelöscht],4,1540912974.0
1686,e8qabq9,t1_e8q9zdv,Danielvonluchau,"What's your stereotype for ""Lana Del Rey"" guys?",1,1540913180.0
1687,e8q4o0f,t1_e8q4msp,tf2-idiot,I noticed that too,2,1540908351.0
1688,e8q5eh4,t1_e8q5d7r,metalupyerarse,Thats what I’m thinking ,6,1540909001.0
1689,e8q5gkr,t1_e8q5d7r,deleted,I’m guessing starting at $1399,2,1540909054.0
1690,e8q5nd7,t1_e8q5d7r,renegadeturkeys,My bets on $1199,2,1540909219.0
1691,e8q5mtm,t1_e8q5d7r,sonnytron,Huge if true. Basically no longer a college starter computer.   It was the best notebook under $1000 for many years.   I hope $1099. Would make it $999 for students.,1,1540909206.0
1692,e8q60h5,t1_e8q5z31,TempestXax,It's significantly lighter.  And the Pro at that price won't have Touch ID.  Nice try.,-3,1540909539.0
1693,e8q63ab,t1_e8q60ev,wpm,I think the MB will stay around as the ultra portable until the 5W chips are fast enough. ,1,1540909608.0
1694,e8q63xv,t1_e8q62tq,AGenericUsername1004,Getting the band back together.,3,1540909623.0
1695,e8q8a13,t1_e8q854d,Shivercorn,Let’s hope so!,1,1540911478.0
1696,e8q8aq7,t1_e8q87hi,PickleBugBoo,Same. I have the Apple Pencil and a 9.7 Pro I use for school. I’m happy other than the screen being a lil small but it’s adequate. I don’t need it I don’t need it I don’t need it,1,1540911495.0
1697,e8q8gr9,t1_e8q8ehm,CuntSmellersLLP,"$100 under  If they charge $1199 or more for it, it's a signal that they're killing off macbooks.  I don't think they have that much courage yet.",3,1540911634.0
1698,e8q8hox,t1_e8q8ehm,thortilla27,Over,3,1540911657.0
1699,e8q8fkh,t1_e8q8ehm,livelikeian,Over. ,2,1540911607.0
1700,e8q8gke,t1_e8q8ehm,TheMuffStufff,Over.. lol,2,1540911630.0
1701,e8q8fcw,t1_e8q8ehm,kaboom987,If it's over that would be hilarious ,1,1540911603.0
1702,e8q8o2v,t1_e8q8h1k,rpungello,/r/pcmasterrace statements coming from Apple? What a world!,2,1540911805.0
1703,e8q8jz6,t1_e8q8h1k,IThinkThings,"Good stuff, but not an upgrade.",1,1540911709.0
1704,e8q8s9v,t1_e8q8q7a,MojoMaster2,still the best Nets player lmao,4,1540911905.0
1705,e8q9uxl,t1_e8q9qho,IThinkThings,Gotta wait for Marzipan. ,1,1540912801.0
1706,e8qa8nt,t1_e8q9wdv,johnkphotos,I've been waiting months to order assuming there would be an update today :(,1,1540913110.0
1707,e8qaxxd,t1_e8qap06,IPman0128,"They don't usually tell, it's up to reviewers to find out",4,1540913687.0
1708,e8q5zhj,t1_e8q5y49,Lakailb87,They were doing so well.. then defeated the purpose of the air ,27,1540909516.0
1709,e8q5zg4,t1_e8q5y49,mrjohnhung,"for a core Y too, told ya it's gonna be a dissapointment",11,1540909515.0
1710,e8q5yxb,t1_e8q5y49,deleted,Maybe the MacBook will take the cheap price point????,3,1540909502.0
1711,e8q6ajp,t1_e8q67xq,vinng86,That was my first thought. All these speed comparisons against 5 year old tech makes me roll my eyes right out of their sockets.,3,1540909786.0
1712,e8q90s5,t1_e8q8xd5,GibsonD90,That’s kinda sad.  But do you see how awful people are in these threads? One mistake and you’re crucified online.   And she’s doing fine. I sure couldn’t do it lol,14,1540912103.0
1713,e8q5yim,t1_e8q5vyw,Luph,Yeeeah that sucks. I thought $999 was unrealistic but $1100 would have been better...,3,1540909492.0
1714,e8q5xgv,t1_e8q5vyw,drunkspaniel,"Oof that, i felt that in my soul",2,1540909466.0
1715,e8q5y9w,t1_e8q5vyw,szzzn,Uh oh,1,1540909486.0
1716,e8q664l,t1_e8q634y,Neg_Crepe,Cheapest Mac ever with retina screen,3,1540909676.0
1717,e8q68g5,t1_e8q634y,ebevan91,"Seriously, my MSI laptop has 1TB, a 2.7ghz quad core, a GTX 970, and it was only $999",3,1540909734.0
1718,e8q6iy0,t1_e8q6hhq,TheBrainwasher14,Blame the market,4,1540909988.0
1719,e8q6jrz,t1_e8q6hhq,IThinkThings,None of these laptops have OLED displays or FaceID in a relatively tiny form factor.,0,1540910008.0
1720,e8q8sve,t1_e8q8qyp,thepatientoffret,BuZz BeAtEr,0,1540911918.0
1721,e8qa2q9,t1_e8qa1d1,ABDL-GIRLS-PM-ME,You're gonna need that USB C to 3.5mm dongle,6,1540912978.0
1722,e8qp382,t1_e8qb4s4,ta2025,why?  &#x200B;,0,1540924937.0
1723,e8q8exe,t1_e8q8ai8,ABDL-GIRLS-PM-ME,Gotta have something to announce next year! ,2,1540911592.0
1724,e8q8h2b,t1_e8q8ai8,flamingllama33,"yeah that should've happened, it would've been the perfect opportunity",1,1540911642.0
1725,e8q6hht,t1_e8q6fud,deleted,Yeah base model is probably 8gb ram and 128gb ssd ,3,1540909953.0
1726,e8q67aq,t1_e8q663n,TempestXax,Courage.,8,1540909705.0
1727,e8q79uj,t1_e8q773e,causethey_pollute,😂,1,1540910627.0
1728,e8q8yt0,t1_e8q8w6m,andrewmackoul,"Yeah, I noticed that too!  She's doing a good job hiding it though.",6,1540912057.0
1729,e8q8ysj,t1_e8q8w6m,deleted,Probably the adrenaline,3,1540912057.0
1730,e8q606t,t1_e8q5ysh,Unclassified1,Huge fail here.   ,0,1540909532.0
1731,e8q95ex,t1_e8q94jl,kaboom987,That'd go viral immediately ,5,1540912213.0
1732,e8q95xw,t1_e8q94jl,TheBrainwasher14,Oh my god lmao,4,1540912225.0
1733,e8q96th,t1_e8q94jl,999mal,Jobs threw a camera to someone once and they dropped it. ,4,1540912246.0
1734,e8q9n3s,t1_e8q9kic,Catdaddypanther97," I know people will complain, but for what you get it really isn’t. ",2,1540912622.0
1735,e8q9win,t1_e8q9kic,deleted,It's a huge spike tho. This is after they already upped the price for the Pro line a couple years back..,1,1540912837.0
1736,e8qe6i2,t1_e8qd42r,TempestXax,AirPods (MOTHER FUCKING ZERO),3,1540916273.0
1737,e8q5pl5,t1_e8q5o3o,deleted,So cool ,2,1540909272.0
1738,e8q5qcq,t1_e8q5o3o,starvinmartin,Seriously! :O ,1,1540909291.0
1739,e8q5h1d,t1_e8q56og,OMGzKakaniz,This. They’ll switch them,3,1540909066.0
1740,e8q6857,t1_e8q64nv,MrCoolesta,"Hey if Apple presents it as a bigger number it must be better, right?",1,1540909726.0
1741,e8q6mq9,t1_e8q6j3t,thortilla27,Hahah I thought I misheard that too!,1,1540910077.0
1742,e8q6wm0,t1_e8q6p3e,intensenerd,Thank you. Was trying to figure out who she reminded me of. ,2,1540910317.0
1743,e8q7a85,t1_e8q78y7,IThinkThings,"You got an iMac Pro last year, man.",1,1540910636.0
1744,e8q7g8j,t1_e8q7f1g,BagelBites619,"It looks like an iPhone 5. So yes, it looks awesome lol",2,1540910777.0
1745,e8q801t,t1_e8q7f1g,AHLondon,"Yeah, I’m tempted but want desktop functionality. ",1,1540911243.0
1746,e8q7o2p,t1_e8q7n01,medpre,Helps when stuff is not leaked,3,1540910963.0
1747,e8q80dw,t1_e8q7ssd,deleted,[gelöscht],2,1540911251.0
1748,e8q7x9l,t1_e8q7ssd,Mr-Dogg,and A12X Octa Core and 7 Core GPU.  It is going to be insannne,1,1540911178.0
1749,e8q82as,t1_e8q7ut4,deleted,Its Apple.  Its hip to hate everything they do.,1,1540911297.0
1750,e8q7wxw,t1_e8q7v57,enotonom,"Both, sorry",4,1540911170.0
1751,e8q86au,t1_e8q82nh,Catdaddypanther97,You know it ,1,1540911391.0
1752,e8q8auu,t1_e8q87al,deleted,You also have a headphone jack too ,3,1540911498.0
1753,e8q8mlz,t1_e8q8cui,ftwin,Nope because this is 2018 ,1,1540911770.0
1754,e8q8h21,t1_e8q8d53,deleted,Two more things please. AirPod2 and AirPower. :D,1,1540911642.0
1755,e8q8gp4,t1_e8q8eeu,JoelTheSuperior,Same but Logic Pro X. ,4,1540911633.0
1756,e8q98wj,t1_e8q92le,G-Note,The only issue with FCPX is the amount of space the clips and edits take. You could do it with an attached “scratch” hard drive but on just the iPad you would run out of space really quickly. ,1,1540912294.0
1757,e8q96nj,t1_e8q95uy,Sydney_Gamer,How can you tell?,0,1540912242.0
1758,e8q9ae9,t1_e8q9973,PickleBugBoo,Yeah reminds me of half my professors lmao,1,1540912329.0
1759,e8q9j21,t1_e8q9fvw,ElHatso,Lol,2,1540912528.0
1760,e8q9jan,t1_e8q9fvw,it_am_silly,especially on the 'holding light' bit!,2,1540912534.0
1761,e8qa7m6,t1_e8qa64m,chancemehmu,$799 for Mac Mini and iPAD Pro. $1199 for Macbook Air.,4,1540913086.0
1762,e8qalmy,t1_e8qa64m,SolarPhantom,"If I recall correctly   New MacBook Air: $1200, Touch ID but no Touch Bar, redesigned form for the Air - similar to the MacBook, Retina display, same keyboard as the new MacBook pros, force touch trackpad   New MacMini: $799, redesigned internally, comes in black now, has some cool daisy changing capabilities, quad core base and up to 6 codes, all desktop components now - no more mobile processors   New iPad pros: $799, 11” and 12.9” sizes, Face ID in any orientation, “liquid retina”, new cpu that’s really fast - graphics performance on par with Xbox One S, USB C, new Apple Pencil that charges wirelessly, redesigned form factor without the home button and smaller bezels ",2,1540913407.0
1763,e8qa6ow,t1_e8qa64m,ios_static,Check the app,0,1540913065.0
1764,e8qar31,t1_e8qakq3,RGG2000,"I thought they would say something about the iPad Mini as they mentionned it quite a few times. An A8 processor in 2018 (almost 2019) has no more sense, unless it is for a smart speaker (HomePod). ",1,1540913534.0
1765,e8qamfj,t1_e8qakq3,ahuiP,Some uninformed bozo will still get it,1,1540913426.0
1766,e8qd74i,t1_e8qavlw,Exist50,"> thankfully I can get it with just 8 GB of RAM and update that bad boy myself  Oh, it has actual slots? Got a link?",4,1540915491.0
1767,e8qb6ew,t1_e8qaywm,jancy7,"11"" model? Did you pick up any of the accessories (*new Pencil and Smart Keyboard*) $129 and $179 seem steep.",2,1540913878.0
1768,e8qbrnz,t1_e8qbioy,TempestXax,"You give Apple too much credit.  It's going to keep selling the retina MacBook at its current price despite the fact that the retina Air shits on it.  As I've said multiple times, the product line is in shambles.",12,1540914355.0
1769,e8qd2ns,t1_e8qbioy,_your_face,"When Steve was here, of course, now, haha naw you’ll be confused and you’ll pay more for it!",3,1540915392.0
1770,e8qqcp1,t1_e8qn292,IKn0wKnothingAMA,Yes.,0,1540925922.0
1771,e8qa6ev,t1_e8q9zja,deleted,another disappointing year,1,1540913059.0
1772,e8q6io2,t1_e8q6fqe,LS_DJ,The ram looked user replaceable. The SSD may not be soldered on?,2,1540909981.0
1773,e8q71bh,t1_e8q6yt9,throwaway_the_fourth,"Yeah, this is so dry.",3,1540910427.0
1774,e8q8bfm,t1_e8q83vj,pynzrz,"USB-C is mainly useful for attaching professional accessories like displays, large hard drives, etc. Why would you need that on an iPhone?",1,1540911510.0
1775,e8qai6d,t1_e8qagyf,TheBrainwasher14,WHAT,2,1540913328.0
1776,e8qb6ue,t1_e8qagyf,IPman0128,Might as well just get a ticket to Hawaii or something and buy it there,1,1540913888.0
1777,e8qbgyk,t1_e8qagyf,deleted,Australian dollars or American dollars?,1,1540914117.0
1778,e8qdi8a,t1_e8qau1q,IHateSpiderMan,I thought this was the next time.  Edit: typo,1,1540915740.0
1779,e8q6zi1,t1_e8q6qxd,sonnytron,"Game over when they said it can be ""configured"" with 10gb Ethernet. Like wtf why?   They're seriously drawing the cost line on Ethernet?",3,1540910385.0
1780,e8q6t2l,t1_e8q6qxd,deleted,[gelöscht],4,1540910231.0
1781,e8q5ntk,t1_e8q5l6k,deleted,Precisely. ,1,1540909230.0
1782,e8q5dz2,t1_e8q5cep,getBusyChild,No way in hell this is under $1k.,7,1540908989.0
1783,e8q5m3p,t1_e8q5ki3,ftwin,because this event actually has new things that are actually upgrades,3,1540909189.0
1784,e8q5pfl,t1_e8q5ki3,SpartanSK117,"This is what happens when you don’t renew a device yearly. I think it’s getting to the point where a new phone isn’t needed every year, but I guess it’s profitable so they’ll keep doing it. iPhone events would be so more exciting if it was every 2 or 3 years. ",1,1540909269.0
1785,e8q6mju,t1_e8q6i2h,deleted,🅱️ac 🅱️ini,11,1540910074.0
1786,e8q6l8w,t1_e8q6i2h,lifehacker25,"Haha yeah he did, LOL.",2,1540910042.0
1787,e8q73yh,t1_e8q7364,deleted,Investors maybe ,3,1540910489.0
1788,e8q74eg,t1_e8q7364,the_one_true_bool,"Hell yeah man, I live for this shit. ^^^/s",2,1540910500.0
1789,e8q7r3u,t1_e8q7hhh,deleted,Ripped??,1,1540911035.0
1790,e8q7j40,t1_e8q7hhh,1724_qwerty_boy_4271,I want to suck his peen,0,1540910845.0
1791,e8q8md9,t1_e8q88w1,rodrye,"No ports at all, just wireless :p",1,1540911765.0
1792,e8q956y,t1_e8q93gh,deleted,[gelöscht],5,1540912208.0
1793,e8q9j26,t1_e8q93gh,pynzrz,That's already pretty good for Photoshop.,1,1540912528.0
1794,e8q9do9,t1_e8q98jh,PaddysChub432,Probably for app developers more than average users,1,1540912404.0
1795,e8q9q88,t1_e8q9l7y,youvelookedbetter,"Yes, but tablets still haven't taken over laptops. They're getting there, but they're not quite there yet.",1,1540912693.0
1796,e8q9vkv,t1_e8q9nn0,Sciphis,"When the surface pro starts at 799 with only a core m3, yeah, it's not bad.",1,1540912816.0
1797,e8qa3qv,t1_e8q9nn0,bach99,799 base was what they offered the 12.9 Pro before. This is a stupid price bump. ,1,1540913000.0
1798,e8qamod,t1_e8qajvi,TempestXax,Mac mini Pro.,3,1540913432.0
1799,e8qalki,t1_e8qajvi,Catdaddypanther97,Ouch. ,3,1540913405.0
1800,e8qbz7l,t1_e8qappx,winsome_losesome,They can’t just refresh everything in one go man. ,4,1540914522.0
1801,e8qazvy,t1_e8qappx,BenchPressCovfefe,"It must me a big redesign is coming, probably at WWDC.  I don’t see how they can go two years without even a spec bump.",1,1540913732.0
1802,e8qbild,t1_e8qappx,maxvalley,Just wait five years. Everything on their mac lineup keeps getting so outdated because they keep waiting until the last,1,1540914153.0
1803,e8q4adr,t1_e8q4755,XNY,Please have removable/different size tips!,0,1540908009.0
1804,e8q4xvb,t1_e8q4xeg,deleted,Yep,2,1540908592.0
1805,e8q51or,t1_e8q4xeg,Mr-Dogg,To much build up for it not to be a redesign :P,1,1540908684.0
1806,e8q6j7v,t1_e8q6c9s,deleted,Lmao ,1,1540909995.0
1807,e8q6ibx,t1_e8q6gvd,phomasta,Cheapest was $500,3,1540909974.0
1808,e8q6kbr,t1_e8q6gvd,throwaway_the_fourth,starts at $499 (last updated 2014),2,1540910021.0
1809,e8q6ivp,t1_e8q6gvd,TomLube,"Iirc, the extremely anemic base model was $599. The new one is literally leaps and bounds better in every way",1,1540909987.0
1810,e8q6hd5,t1_e8q6gvd,baddesthombre,500,0,1540909950.0
1811,e8q7jmw,t1_e8q7fgs,qwerty_77,Can I watch it now anywhere? I missed it.,1,1540910858.0
1812,e8q7w4g,t1_e8q7vai,SuccessAndSerenity,lol i think your stream may be delayed. ,7,1540911151.0
1813,e8q87k8,t1_e8q7x9i,JesusXP,How's the a12x stand up to a core i3(ew... I can't believe they are doing an i3... At the base model.  Makes it hard to root for these guys... ,1,1540911421.0
1814,e8q7zoo,t1_e8q7xx1,jccool5000,Love this dude... the way he talks reminds me of Scott forestall ,2,1540911234.0
1815,e8q7yw3,t1_e8q7y08,jccool5000,Compared to the first iPad,3,1540911216.0
1816,e8q91xz,t1_e8q8bnc,msavic6,The picture of the iPad hooked up to an external monitor editing video looks like Final Cut. Fingers crossed.,1,1540912130.0
1817,e8q8kjj,t1_e8q8jed,JoelTheSuperior,To be fair it's totally possible. Not yet and not for everyone but I can genuinely already do a decent amount of my work on an iPad. ,3,1540911723.0
1818,e8q8t9p,t1_e8q8qrw,deleted,"buttons on screen, like most gaming apps.",1,1540911927.0
1819,e8q92mq,t1_e8q91xn,AWildDragon,Yes,7,1540912147.0
1820,e8q92t4,t1_e8q91xn,medpre,Yes,2,1540912151.0
1821,e8q947c,t1_e8q91xn,IThinkThings,I don't see why they'd ever downgrade it. It's had it for years now.,4,1540912183.0
1822,e8q92oc,t1_e8q91xn,Sollja,Yes,3,1540912148.0
1823,e8q937k,t1_e8q91xn,Singulariain,Yep!,2,1540912160.0
1824,e8q9ix6,t1_e8q9ean,IngsocInnerParty,"Nah, he's the ""Chief Design Officer"". All these other people are various Vice Presidents. I think he really doesn't like putting himself out there very much. Plus they probably want more people in the company to get exposure.",2,1540912525.0
1825,e8q9f32,t1_e8q9efl,kaboom987,Apple is fat shaming. 😢,3,1540912438.0
1826,e8q9mll,t1_e8q9koq,attrition0,"It was from the assassins creed franchise, but not sure about the specific title.",3,1540912610.0
1827,e8q9qi2,t1_e8q9mbj,jbaker1225,$649. They're keeping it in the lineup without even dropping the price. Depressing.,5,1540912699.0
1828,e8q9oju,t1_e8q9mbj,Devoliscious,"No change, that’s what it was before",3,1540912655.0
1829,e8q9new,t1_e8q9mbj,deleted,Still 649. They didn't even drop it,2,1540912630.0
1830,e8q9mzg,t1_e8q9mbj,Osuwrestler,Same lol,1,1540912619.0
1831,e8q9ngs,t1_e8q9mbj,crunch94,same,1,1540912631.0
1832,e8q9oee,t1_e8q9mbj,54lzy,The same,1,1540912652.0
1833,e8q9ujs,t1_e8q9oep,79stanger,32 friends that all happen to have iPhones as well.,1,1540912792.0
1834,e8qbkna,t1_e8q9v6z,jecowa,The new Air is better than the Retina MacBook except that the Retina MacBook is still smaller and lighter. And the Retina MacBook might have a better keyboard. I think 3rd generation Butterfly switches might be a downgrade over 2nd generation Butterfly switches.  And the old non-Retina MacBook Air might still be the best seller since it's 200$ cheaper than the latest Retina MacBook Air.,1,1540914198.0
1835,e8q9za9,t1_e8q9w0l,AvoidingIowa,Honestly the iPad Pro prices are more justified than the ridiculous Air and Mini prices.,3,1540912900.0
1836,e8qabfi,t1_e8qa5he,deleted,[gelöscht],0,1540913174.0
1837,e8qaaen,t1_e8qa9cm,Osuwrestler,No ,5,1540913151.0
1838,e8qac9n,t1_e8qa9cm,scroopy_nooperz,Probably about the same,1,1540913193.0
1839,e8qadxa,t1_e8qa9cm,XPGamingYT,"Base 17 mbp is a 7th gen processor but it’s faster, mba has an 8th gen processor but it’s slower  ",1,1540913231.0
1840,e8qadu5,t1_e8qacej,ABDL-GIRLS-PM-ME,In our dreams my dude,-1,1540913228.0
1841,e8qbyoq,t1_e8qb0sj,reddypower,How much did that cost? ,2,1540914511.0
1842,e8qgjub,t1_e8qckbf,deleted,"Yeah iPads are so mature now. Not really a reason to upgrade my current iPad Pro.. Maybe if I was rich, I would buy every new thing they sell.",3,1540918133.0
1843,e8qmyt8,t1_e8qckbf,ta2025,What was your existing one?,1,1540923286.0
1844,e8ql305,t1_e8qkjfm,ta2025,"It was tough, but I just bought the 12.9""    Its EXACTLY the size of a standard 8.5 x 11"" pad of paper.  It does weigh exactly 3X the pad of paper, but I stood there holding the 3 pads in my hand for a few minutes and then pulled the trigger.",6,1540921801.0
1845,e8qkmb7,t1_e8qkjfm,cbianco96,"The same day they ship/go on sale, so next Wednesday.",4,1540921434.0
1846,e8q8qaj,t1_e8q8h4z,seapilot_,but its as fast as the fastest PC she says  /s,1,1540911857.0
1847,e8qal9o,t1_e8qa3sv,RGG2000,MacBook has just no more sense right now...  And I really think the new iPad Pro will support USB-C hubs.,1,1540913398.0
1848,e8q6n87,t1_e8q6lyo,Sydney_Gamer,This is surreal. For sure the audience has been stacked. ,7,1540910089.0
1849,e8q6tay,t1_e8q6lyo,TechnicalExample,"It's Apple employees, hyping up things they think is important. ",4,1540910237.0
1850,e8q579h,t1_e8q56in,deleted,Yes please ,3,1540908823.0
1851,e8q5clz,t1_e8q56in,TomLube,I'm going to guess $1099 USD.,2,1540908956.0
