,Comment ID,Parent ID,Author,Body,Score,Created (UTC)
2291,e8q6e8y,t1_e8q6bzl,deleted,$1000 for the 128GB SSD and 8GB Ram version,1,1540909876.0
2292,e8q6y1c,t1_e8q6v06,Carl2011,33.33% repeating ,3,1540910351.0
2293,e8q6wnh,t1_e8q6v06,Singulariain,"Probably unlikely tbh after the rumours that have been flying around, hope they surprise use though!",2,1540910318.0
2294,e8q6yed,t1_e8q6v06,IThinkThings,Very low but I'll pulling for it.  I kind of love how it's been ignored for over a year now though. It amuses me.,2,1540910359.0
2295,e8q6yor,t1_e8q6v06,Cptcongcong,0.1,2,1540910366.0
2296,e8q732y,t1_e8q6v06,stulogic,All I'm tuning in for is AirPods and airpower. I have a sneaky suspicion the latter has been canned though.,1,1540910469.0
2297,e8q7arb,t1_e8q70gn,LZmiljoona,Yeah... apparently not. What I was waiting for...,1,1540910649.0
2298,e8q7fx7,t1_e8q7d77,kilobitch,Maybe bodes well for upgrade today. ,2,1540910770.0
2299,e8q7wn1,t1_e8q7uio,laurenannika1,Not yet,1,1540911163.0
2300,e8q7wpj,t1_e8q7uio,SuccessAndSerenity,price at the end,1,1540911165.0
2301,e8q85fv,t1_e8q81vm,deleted,This is what I have and it is getting old lol,1,1540911371.0
2302,e8q8n0e,t1_e8q85id,deleted,lmao don't even go there,1,1540911779.0
2303,e8q8aa9,t1_e8q89kp,deleted,Not yet,1,1540911484.0
2304,e8q8auh,t1_e8q89kp,jangerhofer,Not yet!  We're maybe 60-70% of the way through the keynote.,1,1540911497.0
2305,e8q8hgf,t1_e8q8dq1,IngsocInnerParty,I think pretty much any Mac on the market would be a suitable replacement for a 10 year old iMac.,2,1540911652.0
2306,e8q8etj,t1_e8q8dq1,corruptbytes,definitely ,1,1540911590.0
2307,e8q8fw8,t1_e8q8f22,cherryfree2,Yep,1,1540911614.0
2308,e8q9fe6,t1_e8q9em4,IngsocInnerParty,Phil Schiller,6,1540912445.0
2309,e8q9qa5,t1_e8q9pgv,duuudewhat,Wasn’t already?,3,1540912694.0
2310,e8q9r66,t1_e8q9pgv,TempestXax,Yup.  That's a great price for people who need something cheaper and don't have an iPhone X device yet.,-2,1540912715.0
2311,e8qaaz8,t1_e8qa7vz,roldham,I would LOVE that,1,1540913164.0
2312,e8qaf2o,t1_e8qa7vz,CuntSmellersLLP,Read this as FOCPX and was wondering what mutual funds had to do with this.,1,1540913257.0
2313,e8qal1j,t1_e8qa7vz,42177130,Can't even get iMovie to feature parity with the Mac version yet,1,1540913393.0
2314,e8qmfnb,t1_e8qemkt,ta2025,"the new 12.9"" is almost exactly the size of a standard 50 sheet pad of 8 1/2 x 11"" paper.  It weighs almost exactly the same as 3 of those pads.",1,1540922867.0
2315,e8qa9k5,t1_e8qa6bp,3mmagic,what I thought it's beautiful damn hahaha,9,1540913131.0
2316,e8qa9lm,t1_e8qa6bp,PickleBugBoo,I love how relaxed she is. So many artists are flipping out and tense but she’s chill. It’s nice ,12,1540913132.0
2317,e8qakkv,t1_e8qa6bp,vhs29,"I never paid attention to her live performances since everyone says she's terrible live. But I am positively impressed by this tbh, expected much worse.",5,1540913382.0
2318,e8qaeo0,t1_e8qa6bp,thortilla27,I think this is by far the best setting for her style and voice. You can hear her lips and the “ends” of the words she sang. ,3,1540913248.0
2319,e8qah4k,t1_e8qa6bp,juliaday11,Yeah. Why the heck apple invited here? Doesn’t suit apple image. ,-1,1540913305.0
2320,e8q65wh,t1_e8q62nv,rogersniper1,Lol “every couple of years”. I was using my 2010 MacBook Air till last year and I switched only because I wanted a nicer screen. ,4,1540909671.0
2321,e8q6bhq,t1_e8q62nv,TomLube,"Lmao, you clearly haven't been an Apple fan for very long if you think this is expensive. Reminder the Macbook Air was $1499 when it was introduced.",4,1540909809.0
2322,e8q6e7w,t1_e8q62nv,youvelookedbetter,I've been using my Apple computers for many years without issue.,3,1540909875.0
2323,e8q69en,t1_e8q62nv,Stealth528,128gb starting on a $1200 laptop is actually insulting. I think I’m done buying Macs after seeing the price inflation the past few years. ,1,1540909757.0
2324,e8q8coo,t1_e8q89x6,Ventorus,"Exactly, If I could use a mouse with this thing with a GOOD file management system, I could switch right over to this.",2,1540911541.0
2325,e8q8fpe,t1_e8q89x6,deleted,"Full Photoshop is coming. And USB C will enable new things too. iOS is constantly evolving, it's getting there. Not to mention there's lots of things only iOS can do that PCs and macs can't do.",1,1540911610.0
2326,e8q9koy,t1_e8q9jyf,Conejitobrincasalta,Lol are you even watching? ,3,1540912566.0
2327,e8q6tir,t1_e8q6naw,TomLube,She literally never said this so you're just a liar lmao,6,1540910242.0
2328,e8q6qd6,t1_e8q6naw,mrjohnhung,she crippled apple genius and repair service,6,1540910165.0
2329,e8q6y60,t1_e8q6naw,intensenerd,When/where did she say this? ,1,1540910354.0
2330,e8qb3au,t1_e8qahzt,Neg_Crepe,A swing and a miss,0,1540913808.0
2331,e8q6ae8,t1_e8q69dz,Sapaa,"Not hating the product, only hating the price",3,1540909783.0
2332,e8q5jq0,t1_e8q5h69,AGenericUsername1004,Never seen her before but so low energy and keeps stumbling over her words. ,3,1540909132.0
2333,e8q9a1d,t1_e8q8u6e,Jnbly,"I don't think they're seriously trying to compete with Sony, Microsoft, or Nintendo yet in the gaming arena. They'd need to reintroduce a serious Game Center-like platform for social gaming and come out with their own controller.",1,1540912321.0
2334,e8q5k2t,t1_e8q5ht9,IThinkThings,"It's an entry level MacBook, not a MacBook Pro.",2,1540909141.0
2335,e8q5m8d,t1_e8q5ht9,Aliff3DS-U,"That was probably the default configuration, there should be an i7 model for users to upgrade to.",1,1540909192.0
2336,e8q5mx1,t1_e8q5ht9,deleted,[gelöscht],0,1540909209.0
2337,e8q5on5,t1_e8q5nf7,WindiPaper,A lot more real estate on the Macs so no real reason to ditch it,6,1540909250.0
2338,e8q5qie,t1_e8q5nf7,deleted,Why would they ditch it?,2,1540909295.0
2339,e8q6id2,t1_e8q6f6j,KingBooScaresYou,"Yup my thoughts exactly. Losing USB-A ports, losing the better keyboard... all for 1200... nope.",2,1540909975.0
2340,e8q6tn4,t1_e8q6f6j,it_am_silly,This! I've upgraded my 2012 to have more storage and ram than a new one for half the price....,2,1540910245.0
2341,e8q6ifw,t1_e8q6f6j,deleted,I have a feeling they're gonna merge the MBA and the MBP eventually... ,1,1540909976.0
2342,e8q6q0o,t1_e8q6f6j,attrition0,"I have a 2010 13"" MBP and it's kind of frustrating how well it runs with an ssd and battery replacement. I occasionally feel the urge to upgrade because of its age, but it runs so damn well. And not to mention I paid much less for it than the current MBP lineup :/",1,1540910157.0
2343,e8q6qr3,t1_e8q6o9u,PM_ME_YOUR_AFIs,"Honestly, I use my iPad Pro as my laptop and RDP when I need to. It’s awesome. ",2,1540910174.0
2344,e8q6vux,t1_e8q6o9u,deleted,definitely get the iPad Pro if the specs are what was rumored but if you used your MBP for editing or heavy workloads I wouldn't get the Mac Mini. ,1,1540910299.0
2345,e8q8j85,t1_e8q8h1s,ABDL-GIRLS-PM-ME,>not announcing skyrim on the iPad ,6,1540911692.0
2346,e8q9wd3,t1_e8q9vft,Sydney_Gamer,It’s Rebecca Black. ,2,1540912834.0
2347,e8q8jm9,t1_e8q8idu,TheBrainwasher14,The X does not run 240 fps,2,1540911701.0
2348,e8q8mwf,t1_e8q8idu,deleted,Yeah lol Xbox one x is gonna be like 400 bucks Black Friday. This nba game has somewhat high poly count players but everything else looks straight ps3,1,1540911777.0
2349,e8q8k9m,t1_e8q8idu,Ninboycl,Fps lock thoooo,1,1540911716.0
2350,e8q9wzy,t1_e8q9vs1,TheInsaneMind,Lol what do you mean how did they get her. They’re Apple ,13,1540912847.0
2351,e8qa15e,t1_e8q9vs1,mkmkd,How on earth did a trillion dollar company get Lana,6,1540912942.0
2352,e8qa83d,t1_e8q9vs1,JulioCesarSalad,They paid her,3,1540913098.0
2353,e8q4ve2,t1_e8q4tri,The_B1ack_One,Buildup my dude,2,1540908530.0
2354,e8q4x4h,t1_e8q4tri,G_Wom,You don’t drop the beat with no buildup,2,1540908573.0
2355,e8q6rt5,t1_e8q5eea,AnImproversation,Christmas though. ,1,1540910200.0
2356,e8q5g79,t1_e8q5ew3,Smgslipk,Silver & rosegold,3,1540909044.0
2357,e8q5s4d,t1_e8q5q7a,ftwin,NAh she just sucks at presenting,1,1540909335.0
2358,e8q5run,t1_e8q5r3a,FormulaGamer123,rip,1,1540909328.0
2359,e8q5z17,t1_e8q5wl0,EastCoast2300,nope,1,1540909505.0
2360,e8q5z1v,t1_e8q5wl0,jccool5000,USB C is the future,1,1540909505.0
2361,e8q721s,t1_e8q6vv0,jonny-,"no, that was Tim Cook.",1,1540910445.0
2362,e8q74kc,t1_e8q6z3l,ImYourHuckleberry_78,I am here for when you give away your new iPad Pro.   You’re welcome.,1,1540910504.0
2363,e8q75r8,t1_e8q73vx,deleted,Not a small enclosure like a MacBook so I doubt it,3,1540910532.0
2364,e8q7iu5,t1_e8q7i29,deleted,lmao,1,1540910839.0
2365,e8q7vdf,t1_e8q7qqf,PickleBugBoo,I had a keyboard case for my 9.7 pro,1,1540911135.0
2366,e8q88ew,t1_e8q7smq,Brostradamus_,They probably leave them like that so that your hand has a place to hold it without touching the screen. Very much intentional i think--shit's bigger than a phone so your thumb is going to have to grip around it. Gotta have a place to put it. ,1,1540911441.0
2367,e8q7x6h,t1_e8q7smq,CuntSmellersLLP,"Do you feel the same about the equal-sized bezels on the iPhone X, XS, and XR?",0,1540911176.0
2368,e8q7zlr,t1_e8q7x54,enotonom,They can say 1 million times faster and no one there will bat an eye,1,1540911232.0
2369,e8q87p2,t1_e8q84fk,IThinkThings,"It's very versatile. It can transmit basically any kind of data, from power to video to audio to really anything. So it allows you to specialize your adapters to whatever you specifically need.",4,1540911424.0
2370,e8q86ni,t1_e8q84fk,Mr_Incredible91,way more connections for higher transfer rates vs lightning ,3,1540911399.0
2371,e8q86yz,t1_e8q84fk,flamingllama33,"Extremely fast data transfer, data and power transfer at the same time, fast video output for monitors, plus its becoming the new computer standard of USB",2,1540911407.0
2372,e8q8i95,t1_e8q84fk,musicman21,More of an industry standard than lightning. A lot of stuff is going to it. My laptop has 2 USB-C ports and only one regular USB.,2,1540911670.0
2373,e8q8bld,t1_e8q84fk,AHLondon,"Not very techy answer: it’s annoying to need multiple charging cords. Those multi-head usb to everything cords help, but they are still unwieldy. ",1,1540911515.0
2374,e8qafhz,t1_e8q9mwl,MultiverseWolf,"Would like to know this too, but then again, how will it charge?",2,1540913267.0
2375,e8qbh84,t1_e8q9mwl,theMaxscart,"Check their website, but no, it doesn't show compatibility. Seems like the new Pencil is for the new iPads only. Can't use the old Pencil with them either.",1,1540914123.0
2376,e8qoi9x,t1_e8q9mwl,eXes0r,"According to Apple’s website,  no",1,1540924482.0
2377,e8qa031,t1_e8q9vgx,deleted,Nope. Event is done. ,2,1540912918.0
2378,e8q8vqu,t1_e8q8u9o,deleted,[gelöscht],5,1540911986.0
2379,e8q693y,t1_e8q66a0,deleted,Imagine financing a laptop. Apple is doing something right.,1,1540909750.0
2380,e8q6yzs,t1_e8q6vw2,Poltras,"My mom went to these sessions. She learnt so much new stuff on how to use her iPad. Now she can send videos of her fishes in iMessage in groups to all her kids, which is really for better or worse.",7,1540910373.0
2381,e8q756l,t1_e8q7414,throwaway_the_fourth,Aren't they all?,2,1540910519.0
2382,e8q76sz,t1_e8q7414,deleted,Duh? Like... what did you think it would be? ,0,1540910557.0
2383,e8qa7kp,t1_e8qa2g6,aza6001,"I don't understand this, its not like it's replacing another product announcement or anything, its just a nice extra at the end.",11,1540913086.0
2384,e8qa4eb,t1_e8qa2g6,baddesthombre,Well they've done this several times are you shocked?,9,1540913015.0
2385,e8qaa57,t1_e8qa2g6,orcinovein,"Music is what transformed Apple into the company it is today. It ain't out of the ordinary, dude.",5,1540913144.0
2386,e8qac5b,t1_e8qa2g6,Error-416,"Well they're at the Brooklyn Academy of Music, they have to have some music performance.",7,1540913189.0
2387,e8qa5ou,t1_e8qa2g6,the_one_true_bool,"Every party has a pooper, and today this pooper is you!",12,1540913044.0
2388,e8qagww,t1_e8qa2g6,chaiscool,Apple had similar performance before. Apple don’t consider themselves just a ‘tech’ company though. Steve talks about intersections between art and tech before,2,1540913300.0
2389,e8q8cx3,t1_e8q89h2,jgreg728,Lol the Surface doesn't do iPad's iOS...,3,1540911546.0
2390,e8q8exo,t1_e8q89h2,Smorfar,its a bad tablet and laptop.  Jittery and heat problems.,3,1540911592.0
2391,e8q8awq,t1_e8q89h2,IThinkThings,Well its a good thing the iPad does too now then.,3,1540911499.0
2392,e8q7jbw,t1_e8q7il9,clutchtow,what screen issues?,7,1540910851.0
2393,e8q7kpv,t1_e8q7il9,deleted,Given that there’s no notch and limited space it’s probably fine.,2,1540910884.0
2394,e8q7loh,t1_e8q7il9,Pulp__Reality,What are the issues? People literally cant tell it apart from 1080p screens on other phones,2,1540910907.0
2395,e8qa58o,t1_e8q9y02,lovethewebs,"Cellular capabilities, engineering cost to fit in a small form factor and daily use battery life, dual cameras, 3D Touch technologies, haptic feedback.... mainly its cellular though",3,1540913034.0
2396,e8qa1z6,t1_e8q9y02,skeeterou,"Bro, the XR is the best iphone out.  Halide app even does portrait mode on non-human subjects as of yesterday.",1,1540912961.0
2397,e8qe87n,t1_e8qcs97,TempestXax,"> Underwhelming.  LOL. Fuck out of here. If you thought that was underwhelming, you should just stop watching. Not the other way around.",9,1540916310.0
2398,e8q77uj,t1_e8q73bi,TomLube,"I mean yea, that's how things work. If you don't want to have the entire environment destroyed in 50 years you're going to have to make concessions in life.",1,1540910582.0
2399,e8q78vl,t1_e8q73bi,IThinkThings,Yes.,1,1540910605.0
2400,e8q7d9i,t1_e8q73bi,ExtremelyQualified,What's the complaint?,1,1540910707.0
2401,e8q7p4a,t1_e8q7m6r,waterskier2007,[you sure?](https://www.staples.com/Staples-College-Ruled-Filler-Paper-8-1-2-x-11-400-Pack-27521M/product_849398),3,1540910988.0
2402,e8qae4t,t1_e8qabfb,Neural_Droid,Lol them brows tho,1,1540913236.0
2403,e8q7zi5,t1_e8q7y4j,blazin1414,erm wtf are you talking about? it's 900p not 720p,2,1540911230.0
2404,e8q8583,t1_e8q7y4j,deleted,Angry Birds and Fruit Ninja are gonna look bomb on here!,2,1540911366.0
2405,e8q82r3,t1_e8q7y4j,deleted,Yeah also can the tablet actually steadily handle that under load and without needing battery.  GPU chips aren't all that big but the issue is if you can get it to full performance without thermal issues and now here with battery issues.,1,1540911307.0
2406,e8q84gw,t1_e8q7y4j,BagelBites619,Well the Xbox One S is the same thing as the 2013 console (gaming-wise). Just with 4K blue ray.,1,1540911347.0
2407,e8q74qu,t1_e8q70fp,clutchtow,"MacBook Pro got updated in July, so probably not MacBook Pro.",4,1540910509.0
2408,e8q74u1,t1_e8q70fp,IThinkThings,Doubtful. Just MacBook Air and Mac Mini. Then probably on to iPad Pros.,2,1540910510.0
2409,e8q77r8,t1_e8q70fp,youthcanoe,not pros,1,1540910579.0
2410,e8q7bgc,t1_e8q70fp,treyhunna83,"nope MBPs just gotta spec refresh. and MBA like the 12"" MB is prolly dead. as its just a 1"" smaller, fanless MBA with 1 port now",1,1540910665.0
2411,e8q9tiv,t1_e8q9jxh,Neg_Crepe,It’s not much,1,1540912769.0
2412,e8q9thq,t1_e8q9qux,scroopy_nooperz,The new Air is definitely better than the Macbook,2,1540912768.0
2413,e8qa9ku,t1_e8q9ysz,Tyroneus,"Yeah I was a little dissapointed in what they showed for the pencil. The leaks made it seem that the Pencil 2 would have multiple stroke touch options, but here we've only seen the double tap option. ",2,1540913131.0
2414,e8qa1c7,t1_e8q9ysz,1724_qwerty_boy_4271,it'll be on the apple website in like an hour,1,1540912947.0
2415,e8qa32t,t1_e8q9ysz,Sir_Bryan,It's $129,1,1540912985.0
2416,e8qa4s3,t1_e8q9ysz,AvoidingIowa,$129. They even price creeped the pencil.,1,1540913023.0
2417,e8qa8sd,t1_e8q9ysz,deleted,[gelöscht],1,1540913113.0
2418,e8q91y8,t1_e8q91f8,Porqueuepine,No lag,2,1540912130.0
2419,e8q92x5,t1_e8q91f8,TempestXax,What?,2,1540912154.0
2420,e8q8k5r,t1_e8q8b72,Mentalmadness,They'll probably announce it after,1,1540911714.0
2421,e8q9fwd,t1_e8q9enz,deleted,[gelöscht],-2,1540912456.0
2422,e8q4v5n,t1_e8q4rqs,RandomUsername232323,With the Edge browser if you are using a windows machine,3,1540908525.0
2423,e8q4t5w,t1_e8q4rqs,deleted,Apple website or Apple TV ,2,1540908478.0
2424,e8q4tac,t1_e8q4rqs,G_Wom,On their site,2,1540908480.0
2425,e8q4ujb,t1_e8q4rqs,Chrisixx,https://www.apple.com/apple-events/livestream/,2,1540908510.0
2426,e8q67jb,t1_e8q6597,mrv3,I like when they say how much faster than it was before... that's because their previous models are years old.,2,1540909711.0
2427,e8q7w7z,t1_e8q7uvl,TheBrainwasher14,I've got it in Picture in Picture on my Mac,2,1540911153.0
2428,e8q9nka,t1_e8q9j45,YouBetterChill,nope fuck this company is stupid,-1,1540912633.0
2429,e8q9zkx,t1_e8q9xii,1724_qwerty_boy_4271,pretty sure thats what today means,3,1540912906.0
2430,e8qa6j2,t1_e8q9xii,AvoidingIowa,Already up for iPad,2,1540913062.0
2431,e8q9meo,t1_e8q9lnv,AnImproversation,Literally how? ,10,1540912605.0
2432,e8q9pxj,t1_e8q9lnv,Catdaddypanther97,This is the best that I can remember in a good while. ,2,1540912686.0
2433,e8quit1,t1_e8qrb81,A2ndRedditAccount,Where did you see that?,8,1540929179.0
2434,e8q9q0z,t1_e8q9m1v,Neg_Crepe,You gotta be a dummy to not understand you’re now not a pro user and comment shit like this,2,1540912688.0
2435,e8q9pvj,t1_e8q9m1v,Trosso,im buying ama,1,1540912684.0
2436,e8q9q45,t1_e8q9m1v,enotonom,of course for an office drone it’s just gonna be a netflix machine,1,1540912690.0
2437,e8q7qto,t1_e8q7m98,CodedGames,"The ""Retina"" term has nothing to do with the display being LCD or OLED. All iPads have had LCD displays.",3,1540911029.0
2438,e8q7sxp,t1_e8q7m98,attrition0,"iPad Pros always had LCD. Retina is an indicator of how pixel dense the display is, and this is still in that range (but using the new Liquid Retina buzzword they used for XR display).",3,1540911079.0
2439,e8q7p6l,t1_e8q7m98,420JZ,Retina is LCD still. IPS LCD.,2,1540910990.0
2440,e8q7pul,t1_e8q7m98,RiseFTA,No 120Hz OLED panels made to this date as far as I'm concerned....would rather take higher refresh rate any day though.,1,1540911006.0
2441,e8q5ocf,t1_e8q5mz1,ivenevereatenapear,On the right,1,1540909242.0
2442,e8q5omj,t1_e8q5mz1,philphan25,I thought I saw one in the video.,1,1540909249.0
2443,e8q5pl2,t1_e8q5mz1,SuccessAndSerenity,there's a 3.5mm jack on the right side. ,1,1540909272.0
2444,e8q6xoo,t1_e8q6vi1,Hoobleton,"Go to the store, return it, and order a new one?",1,1540910342.0
2445,e8q6yew,t1_e8q6vi1,Cptcongcong,You can return within 1 month. Return it and get the new one if you don't mind the price bump. ,1,1540910360.0
2446,e8q71io,t1_e8q6zot,deleted,[gelöscht],2,1540910432.0
2447,e8q83f4,t1_e8q7ziy,jccool5000,It works better for me than Touch ID. My sweaty fingers never work with it.,1,1540911323.0
2448,e8q80k1,t1_e8q7ziy,hdjunkie,Lol change is hard for people to accept,1,1540911255.0
2449,e8q6r1y,t1_e8q65jf,Funkbass,It was already stylized that way.,1,1540910182.0
2450,e8q7jsu,t1_e8q7hao,Sapaa,AMOLED cant do 120Hz yet,4,1540910862.0
2451,e8q7kox,t1_e8q7hao,mjr2p3,Imagine the price though...$1599+ easily,2,1540910883.0
2452,e8q7k2e,t1_e8q7hao,viners,"Because ""Liquid Retina"" makes them more money.",1,1540910869.0
2453,e8q7myg,t1_e8q7hao,Mr-Dogg,That would make it a LOT more expensive,1,1540910937.0
2454,e8q6foj,t1_e8q6drq,filmantopia,"It has 4 USB-C ports, looks like.",2,1540909911.0
2455,e8q6for,t1_e8q6drq,deleted,Thunderbolt 3 is always compatible with usb c but not the other way around. ,2,1540909911.0
2456,e8q6gjy,t1_e8q6drq,deleted,"I think the Thunderbolt port also supports USB-C.  &#x200B;  Edit: On [apple.com](https://apple.com), the iMac page confirms this I think:  "" Two Thunderbolt 3 (USB-C) ports with support for:  * DisplayPort * Thunderbolt (up to 40 Gbps) * USB 3.1 Gen 2 (up to 10 Gbps) * Thunderbolt 2, HDMI, DVI, and VGA supported using adapters (sold separately)""",2,1540909930.0
2457,e8q6gdu,t1_e8q6drq,Sonbart,Compatible,1,1540909926.0
2458,e8q6hb7,t1_e8q6drq,TheMacMan,Thunderbolt 3 and USB-C have the same plug type.,1,1540909949.0
2459,e8q6hlu,t1_e8q6drq,dohhhnut,It has 4 of them,1,1540909956.0
2460,e8q6hrr,t1_e8q6drq,SuccessAndSerenity,thunderbolt is compatible.,1,1540909960.0
2461,e8q6ito,t1_e8q6drq,DaytonaZ33,"USB-C would connect to Thunderbolt, yes.",1,1540909985.0
2462,e8q825q,t1_e8q80tq,jccool5000,Maybe next several years. With USB C they seem to be moving in that direction,1,1540911293.0
2463,e8q87ei,t1_e8q864e,Matuteg,There is USBC on the air ,10,1540911417.0
2464,e8q8agb,t1_e8q864e,deleted,"You know there were two USB-C ports on the Air, right? They’re capable of both USB and Thunderbolt 3. ",10,1540911488.0
2465,e8q87il,t1_e8q864e,scroopy_nooperz,The Macbook air has two thunderbolt 3 ports,8,1540911420.0
2466,e8q8761,t1_e8q864e,AlexanderBeta213,Why not? Isn’t the Air Thunderbolt 3?,6,1540911411.0
2467,e8q88gv,t1_e8q864e,clutchtow,??? The MacBook Air had 2 USB-C ports...,4,1540911442.0
2468,e8q8a2z,t1_e8q864e,Js425,Isn't that what thunderbolt 3 is at it's core or am I missing /s?,3,1540911479.0
2469,e8q8adl,t1_e8q864e,werenotwerthy,Thunderbolt is the same,3,1540911486.0
2470,e8q91y3,t1_e8q8v26,thefaizsaleem,Not going to happen. I have no doubt that Face ID will be coming to MacBooks very soon.,1,1540912130.0
2471,e8qame8,t1_e8q895o,exjr_,Pineapple Pizza   Fight me Pineapple Pizza haters(ง •̀_•́)ง,5,1540913426.0
2472,e8q8h2h,t1_e8q7ipy,TBoneTheOriginal,I unlocked it.,1,1540911642.0
2473,e8q8xrb,t1_e8q8txy,Catdaddypanther97,There are some serious meme masters on that sub. ,4,1540912033.0
2474,e8q6iac,t1_e8q69yr,EndOfTheDream,"Salt, pepper, no ketchup pleaaaseee",4,1540909973.0
2475,e8q67mi,t1_e8q65uy,rockybbb,"He was never this excited even with the iPhone X, which was much more significant business-wise than any of Macs and arguably even technology-wise as well. ",3,1540909713.0
2476,e8qjnmh,t1_e8qa6rj,Overlord_Karellen,Cupertino is almost all media. Only a few select employees get in. ,6,1540920665.0
2477,e8q7u3n,t1_e8q7rba,happygodavid,He seems like such a nice guy. I bet he could be friends with just about anyone. ,10,1540911106.0
2478,e8qb0vt,t1_e8qaau2,RGG2000,Totally agree. The crowd was just so much excited about Today At Apple. ,3,1540913755.0
2479,e8qcpz6,t1_e8qaau2,quintsreddit,I have a friend who works at that store and can confirm they were holding things down across the street. Probably not them.,1,1540915113.0
2480,e8qdl9z,t1_e8q4phc,GodDamnDirtyLiberal,Saw a Pro with a CD drive too!,2,1540915807.0
2481,e8q6s2t,t1_e8q6gag,Stubb,eGPU,9,1540910207.0
2482,e8qa81j,t1_e8qa3dy,cjohn4043,You must be a delight at parties.,7,1540913097.0
2483,e8q9sdo,t1_e8q835j,filmantopia,Google.,9,1540912743.0
2484,e8qbds7,t1_e8q829t,ivanvzm,"Didn't watch the event, what's new on the iPad front?",4,1540914045.0
2485,e8qsy7c,t1_e8qrahp,sourcecodesurgeon,One more thing: Starbucks inside all Apple Stores. We think you're going to love it.,2,1540927941.0
2486,e8q7g9a,t1_e8q748a,ExtremelyQualified,Mostly NYC that I have experience with,1,1540910778.0
2487,e8q99he,t1_e8q92xt,ElHatso,"Not top notch, but if the iPad is as powerful as they claim, they should’ve been able to tweak it I guess. Would’ve been more impressive at least",6,1540912308.0
2488,e8qcdfy,t1_e8qbzvq,winsome_losesome,"My man, if you asked people from 10 years ago what the tech in the future would look like, they would probably describe the iPad Pro.  Looks like I’m not going to upgrade my SE anytime soon.",8,1540914837.0
2489,e8qdbu8,t1_e8qbzvq,fonyboy,Such a real computer replacement at $800 and 64gb of storage. Like come on 128gb should be minimum for a pro device. ,7,1540915598.0
2490,e8qel6t,t1_e8qe8rd,winsome_losesome,iPad Air 2 here! This new release is like a whole different tablet. 😍I’m curious how the new edges will feel while holding it for prolonged periods.  That price point though. ,3,1540916594.0
2491,e8qe9vs,t1_e8qdtsh,Phaggg,"That's what I thought when I saw it as well, but it looks they are keeping that old 13 inch Pro in the lineup as well",5,1540916346.0
2492,e8qfphy,t1_e8qdtsh,LemonJuice96,"You’re right, but at that price point and design will eat up all the MacBook sales. Either they will discontinue the MacBook or make something different with it for next year. ",1,1540917475.0
2493,e8qnox9,t1_e8qdtsh,MuddyPuddle_,Shame they don't get iris graphics though,1,1540923846.0
2494,e8qa5cr,t1_e8qa3uq,TempestXax,#FART APPLE,3,1540913036.0
2495,e8qd0p1,t1_e8q8826,Anthonybuck21,2019 confirmed?,3,1540915348.0
2496,e8q8x57,t1_e8q8gqm,bach99,"my guess is 11"" is $799 and 12.9"" is $999",2,1540912019.0
2497,e8q94qj,t1_e8q917t,TheBrainwasher14,I'm gonna predict the rumour is incorrect,1,1540912197.0
2498,e8qbbks,t1_e8qb73w,sonicrage81,and $199 for the bigger model. ,3,1540913996.0
2499,e8qbdf1,t1_e8qb73w,deleted,[gelöscht],5,1540914037.0
2500,e8qjzbw,t1_e8q9q5i,ducsekbence,But aren't those buyers supposed to buy the iPad 6th gen?,3,1540920924.0
2501,e8qb7hz,t1_e8qb1om,TempestXax,"Yup. There's literally no reason to wait.  They're not updating them before June.  If new versions come out in June, I'll have long forgotten about the $150 I spent now, lol.",6,1540913903.0
2502,e8qcbtr,t1_e8qb7i4,TempestXax,"Except not actually.  Removing the headphone jack and Lightning port from the iPad Pro, another on-the-go device (just like the MacBook Air, actually) was also a great opportunity to announce new AirPods.",1,1540914802.0
2503,e8qb600,t1_e8qas79,elephantnut,Never heard her live singing voice. Kind of insane how good she is. ,5,1540913869.0
2504,e8qb8ow,t1_e8qas79,AomameOkada,Yeah but the crowds are usually there to see her. This is a tech crowd who potentially wouldn't know or like her.,7,1540913931.0
