,Comment ID,Parent ID,Author,Body,Score,Created (UTC)
0,e8q4a8n,t3_9so41z,exjr_,"FYI, Inbox replies (for me) are disabled for this post. If you need me to update something on the post or on the Live Thread, tag me on your comment (like this, ""/u/exjr_"") or reply to this comment.",1,1540908006.0
1,e8q8rls,t3_9so41z,dephantom,Waiting for that price announcement like https://imgur.com/a/NTDJE5i,106,1540911889.0
2,e8q64dm,t3_9so41z,rockybbb,The NY version of Tim Cook seems so much more hype. What are they feeding him on the east coast?,96,1540909633.0
3,e8q7kg8,t3_9so41z,happygodavid,"After the crowd reactions here, Apple is never going to hold another event in Cupertino. ",97,1540910878.0
4,e8q96sy,t3_9so41z,the_NURV,Me when I get the new iPad Pro. “I can watch Netflix on it”,74,1540912246.0
5,e8q4mv0,t3_9so41z,SuccessAndSerenity,that sure is a lot of glowing apple logos on those macbooks... ,57,1540908321.0
6,e8q9p5i,t3_9so41z,Jnbly,"Tim: ""Before we stop, I have one....""  Me: ""MORE THING!""  Tim: ""...quick update.""  Me: ""DAMMIT!""",106,1540912668.0
7,e8q6dff,t3_9so41z,Cmac0801,"Apple: ""You wanted a new Mac Pro? Just stack three Mac mini's!""",87,1540909855.0
8,e8q91bb,t3_9so41z,enotonom,Guys you’ll be shaking worse than her if you’re the one tasked to edit photo projected to a massive ass screen,36,1540912115.0
9,e8q91ok,t3_9so41z,AnImproversation,Her voice is really stable for how bad her hand is shaking. ,37,1540912124.0
10,e8q94wz,t3_9so41z,szzzn,She's trembling as much as my wallet is. ,38,1540912201.0
11,e8q9zo8,t3_9so41z,cjohn4043,CONFIRMED: Lana Del Rey is now made out of 100% recycled aluminum.,98,1540912908.0
12,e8q7vqf,t3_9so41z,filmantopia,"Every company that's currently trying to compete in tablets: ""Fuck.""",58,1540911142.0
13,e8q5b8h,t3_9so41z,Carl2011,This isn't gonna be under $1000....,26,1540908921.0
14,e8q6s66,t3_9so41z,ExtremelyQualified,I know they're really trying to make the Today at Apple happen. But I've never seen people paying attention to any of the demos or classes. It's usually just someone standing up front trying to talk to people who are waiting for their genius bar appointment.,29,1540910210.0
15,e8q8jjw,t3_9so41z,clutchtow,"I like this lady, she like watching a lecture at 2x speed!",26,1540911700.0
16,e8q8t1m,t3_9so41z,ElHatso,"Should’ve showcased Civ VI, a much better iPad game",28,1540911922.0
17,e8q91lr,t3_9so41z,G_Wom,"Of course she’s nervous, it’s not your backyard BBQ presentation !",25,1540912122.0
18,e8q9pom,t3_9so41z,IThinkThings,"Jokes on you, I don't have 32 friends.",25,1540912680.0
19,e8qa0ex,t3_9so41z,PickleBugBoo,“They told us not to swear” lmao apple ,27,1540912926.0
20,e8qa98g,t3_9so41z,reader313,continue to rest in peace AirPower. you were too courageous for your time. ,27,1540913123.0
21,e8qbiaw,t3_9so41z,winsome_losesome,Guys guys guys! iPad Pro holy fucking shit!,27,1540914146.0
22,e8qc55k,t3_9so41z,Phaggg,Well the Macbook lineup just got even more confusing ,27,1540914654.0
23,e8q6mtd,t3_9so41z,deleted,[gelöscht],26,1540910079.0
24,e8qa27g,t3_9so41z,TempestXax,The album is called *Norman Fucking Rockwell*.,22,1540912966.0
25,e8qa7bj,t3_9so41z,ExtremelyQualified,"Tim immediately after the presentation today: ""Cancel everything, we're moving to Brooklyn"" ",25,1540913080.0
26,e8q8657,t3_9so41z,yallrealize,No one saw that charging an iPhone part coming,22,1540911387.0
27,e8q9k5h,t3_9so41z,deleted,[gelöscht],22,1540912553.0
28,e8q86x7,t3_9so41z,TheBrainwasher14,I'm cringing in anticipation of the price,21,1540911405.0
29,e8q8nfl,t3_9so41z,philphan25,"""Nets"" *crickets*  ""Warriors"" *loud cheers*",23,1540911790.0
30,e8q9msp,t3_9so41z,joshskj,Not sure if price is low or I’m getting stockholm syndrome from apple’s pricing habits,21,1540912615.0
31,e8qb0ka,t3_9so41z,sonicrage81,"For those that are curious, the price of the pencil went up to $129... wow. ",20,1540913747.0
32,e8q7ryf,t3_9so41z,deleted,ah so this iPad is the *real* iPhone XS **MAX**,18,1540911056.0
33,e8qalgd,t3_9so41z,1724_qwerty_boy_4271,">No I'm the one thats nervous, you were great  LOL",19,1540913403.0
34,e8q9kz3,t3_9so41z,johnkphotos,Fair pricing if it didn’t start at 64GB,19,1540912573.0
35,e8qau7b,t3_9so41z,TempestXax,"Guess I'm finally buying AirPods.  There's no way a new version comes out before the next WWDC, so there's no point for me to wait any longer.",18,1540913606.0
36,e8q8xzh,t3_9so41z,kaboom987,Poor girl 😢 she's going great!,34,1540912038.0
37,e8q90yr,t3_9so41z,Bobking11,"""No lag"" she says as the scroll lags behind her lol",39,1540912108.0
38,e8qan36,t3_9so41z,ExtremelyQualified,"OFFSTAGE  Lana: ""I was so nervous""   Tim: ""No I'm the one thats nervous, you were great""  Seriously, this is one of the best keynotes. Can't even handle it.",35,1540913442.0
39,e8q86bf,t3_9so41z,qwerty_77,Apple put all their Engineers on ipad pro and they freaking delivered.,16,1540911391.0
40,e8qa92n,t3_9so41z,im_caffeine,No imac upgrade? Wtf?,15,1540913119.0
41,e8qatv0,t3_9so41z,deleted,[gelöscht],16,1540913599.0
42,e8q8mr1,t3_9so41z,philphan25,2K just sees more microtransaction opportunities.,14,1540911773.0
43,e8qb08m,t3_9so41z,Luph,So can anyone explain what the point of the 12 inch Macbook is now? It feels like it's in a weird place.,15,1540913740.0
44,e8q744b,t3_9so41z,TheJohnny346,All Today at Apple sessions are made with 100% Recycled Aluminum,27,1540910493.0
45,e8qbyht,t3_9so41z,bike_tyson,These prices are awful. Checked the store and the entry level prices are bad then going up to the midrange is absurd. I5 in the mac mini is $1099. 256 GB in the Air is $1399. Pencil costs more. Keyboard costs more. ,29,1540914506.0
46,e8qa5fi,t3_9so41z,colinstalter,Press F to pay respects to:  * Airpods 2  * AirPower  * Mac Pro  * iPad headphone jack  * iPad Mini (which they talked about repeatedly but didn't update????)  * Regular iMac  * Pro display,49,1540913038.0
47,e8q56t7,t3_9so41z,Smgslipk,Please be 999,14,1540908811.0
48,e8q5zf9,t3_9so41z,medpre,1199 for dual core 128gb? Lol,13,1540909514.0
49,e8q7jow,t3_9so41z,ExtremelyQualified,Oh hey it's Apple Jim Halpert,14,1540910860.0
50,e8q9zpv,t3_9so41z,XelaSiM,"I'm struggling to really figure out how the updated Air compares to the Macbook. It now sits between the Macbook and the Pro, in terms of specs and power right? I'm suprised they haven't just combined the Macbook and Air into one product for simplicity sakes.   Thin, Light, Cheap, Less Powerful: Macbook Powerhouse: Macbook Pro   Not sure why they need three honestly. ",13,1540912909.0
51,e8qc55a,t3_9so41z,npiterman,No iMac or Mac Pro....? ,12,1540914653.0
52,e8q69gr,t3_9so41z,philphan25,"6 core, 64 GB, 2 TB SSD = probably $3,999",11,1540909759.0
53,e8q6mkw,t3_9so41z,deleted,Everyone is super high energy today for some reason!,11,1540910075.0
54,e8q7dyo,t3_9so41z,deleted,THE PENCIL IS MAGNETIC. PRAISE.,12,1540910723.0
55,e8q8e6r,t3_9so41z,stulogic,This iPad is ridiculous. Aside of the bezel corners not matching it's pretty much perfect.   Bye paycheck.,12,1540911575.0
56,e8qa5b2,t3_9so41z,cherryfree2,Lana about to announce AirPods 2,10,1540913035.0
57,e8qa5i7,t3_9so41z,RGG2000,"So.... AirPower is definetely dead, such a shame. ",12,1540913040.0
58,e8qa5y2,t3_9so41z,stulogic,RIP AirPower. Taken too soon. ,11,1540913049.0
59,e8qahkk,t3_9so41z,rfguevar,Fully speced out 12.9 inch iPad Pro with new folio keyboard and new Apple Pencil $2356 USD ,11,1540913315.0
60,e8qehk7,t3_9so41z,HFoletto,"About the new Macbook Air, apple claims that the CPU is a [""1.6GHz dual-core 8th-generation Intel Core i5 processor with Turbo Boost up to 3.6GHz""](https://www.apple.com/shop/buy-mac/macbook-air). At first I already thought this was really odd, because since it's 8th gen, it should have been quad-core. So I decided to check [all the i5 8th processors](https://ark.intel.com/products/series/122597/8th-Generation-Intel-Core-i5-Processors), and there is none that matches that specs.      Is it a typo? What is the actual processor apple is using in the new Macbook Air?      Edit: That wasn't a typo, it is a 5W chip, part of Intel's Amber Lake family, the model is **[i5-8210Y](https://ark.intel.com/products/189912/Intel-Core-i5-8210Y-Processor-4M-Cache-up-to-3-60-GHz-)**, which Intel hasn't added to their public product specifications database until just recently.   I think this is a huge letdown from Apple, since the device could easily be using Intel's 15W Whiskey Lake i5, which would perform miles better.",13,1540916515.0
61,e8qf2w9,t3_9so41z,-GolfWang-,How come the thread isn’t updated with what was announced like usual? ,13,1540916982.0
62,e8qj30q,t3_9so41z,MattAlbie60,"How stupid would it be to buy an iMac right now?  I need a new desktop for my home office, like, yesterday. I even bought a desk, and I'd been waiting patiently for months for today's iMac refresh and... then it didn't happen.  How bad of an idea would it be for me to just settle and buy the current iMac, knowing that at some point, theoretically, in the future, there's a new one on the horizon with ""significant display enhancements"" or whatever that dumb rumor was? I can maybe get away with waiting another month or so, but I don't know if I can wait until the spring.",13,1540920203.0
63,e8q6qve,t3_9so41z,AomameOkada,The amount of cheering for Angela coming on stage to talk about Apple Stores pretty much shows you just how many Apple employees are in the room. ,50,1540910177.0
64,e8q57yj,t3_9so41z,SolarPhantom,I feel like they’re just reintroducing the MacBook as the “new MacBook Air” because of the brand recognition the Air moniker gets. ,24,1540908840.0
65,e8q670o,t3_9so41z,deleted,[gelöscht],22,1540909698.0
66,e8q76v7,t3_9so41z,roldham,All of our team members are made of 100% recycled aluminum ,26,1540910558.0
67,e8q95tt,t3_9so41z,TempestXax,"Y'all are acting as though you wouldn't be shaking if your boss was like ""You're going to be on stage in front of 2,000 people to give a presentation in a month.""",25,1540912223.0
68,e8q8gga,t3_9so41z,yallrealize,Is it me or did someone press the 2x speed button on her talking rate,10,1540911627.0
69,e8q970x,t3_9so41z,PaddysChub432,This lady is the female version of Tim Cook lol,11,1540912251.0
70,e8q9dvn,t3_9so41z,deleted,Has Jony died?,11,1540912409.0
71,e8q9j8v,t3_9so41z,ABDL-GIRLS-PM-ME,$799??,12,1540912533.0
72,e8qa2h9,t3_9so41z,astraltraveltrip,But iMacs...,12,1540912972.0
73,e8qaml2,t3_9so41z,JohrDinh,"[""Apple also today announced new MacBook Pro graphics options that will bring powerful Radeon Pro Vega graphics to MacBook Pro... These new graphics options deliver up to 60 percent faster graphics performance...""](https://twitter.com/markgurman/status/1057280207873286144)  Apparently next month, but YES PLEASE TAKE MY MONEY!! ",11,1540913430.0
74,e8qapfx,t3_9so41z,GhostalMedia,Touch ID with out the Touch Bar!  They actually listened and removed a feature many of us hated!  ,11,1540913495.0
75,e8q8ede,t3_9so41z,kinkosmyers,"Haha the Guardian's live thread on this is pretty funny.   >Now we get the standard bit where [Apple](https://www.theguardian.com/technology/apple) pretends that people use Augmented Reality. The iPad is good for Augmented Reality, apparently.  &#x200B;  &#x200B;",31,1540911579.0
76,e8qa90a,t3_9so41z,TempestXax,"I swear to god, if, at the end of the performance, she doesn't pull her hair aside to reveal the new AirPods, I'm going to fucking scream.  Then go online to finally buy the current pair in despair.",41,1540913118.0
77,e8q8y7c,t3_9so41z,limac_,"Man, that shaking",20,1540912043.0
78,e8q8zl7,t3_9so41z,szzzn,"Man, this poor girl is nervous as fuck.",21,1540912075.0
79,e8q9r5o,t3_9so41z,SuccessAndSerenity,damn he def sounds like he's wrapping up...   rip airpod 2,19,1540912714.0
80,e8q5yhc,t3_9so41z,kaboom987,$1200 USD for 128gb 😂😂😂😂 y'all fucked ,53,1540909491.0
81,e8q5wuv,t3_9so41z,EClarkee,Damn a $200 increase,10,1540909451.0
82,e8q63g3,t3_9so41z,facemelt,mac mini made by aliens confirmed,11,1540909612.0
83,e8q6nhc,t3_9so41z,IThinkThings,"I do love hearing about the store design, I'll be honest.",10,1540910096.0
84,e8q7fev,t3_9so41z,TheBrainwasher14,Calling it. The price is going to be obscene and you're all gonna crap your pants.,10,1540910758.0
85,e8q7yao,t3_9so41z,DaBlackProdigy,Shot at Xbox lool,10,1540911202.0
86,e8q8d9g,t3_9so41z,deleted,This might be the best Apple Event I've watched in at least the past 5 years so far.,10,1540911553.0
87,e8q8izi,t3_9so41z,Whisperwind_DL,$1000+ guaranteed lol ,10,1540911687.0
88,e8q986s,t3_9so41z,deleted,[gelöscht],11,1540912278.0
89,e8q9h1k,t3_9so41z,pibroch,Phil is so much more pleasant to listen to when he’s been edited and not stumbling over every other word.,11,1540912482.0
90,e8q9n1l,t3_9so41z,MyManD,I love how this price is getting both very positive and extremely upset reactions.,9,1540912621.0
91,e8q9yce,t3_9so41z,LevelReward,"Lana Del Ray sounds like the public radio ""though for your thoughts"" host guy from Parks & Rec",8,1540912878.0
92,e8qa8ec,t3_9so41z,NDKim,So should I buy the current airpods or wait longer ..?,9,1540913104.0
93,e8qac35,t3_9so41z,DKMode4Life,"\*looks at Canadian pricing... ""fuckkkk""",10,1540913188.0
94,e8q74f4,t3_9so41z,Eugene1026,when today at apple is as important as the macbook air ,19,1540910501.0
95,e8qbsuo,t3_9so41z,sonicrage81,"So, according the apple's website, the old apple pencil is only compatible with the older ipads, and not the new ones. So if I wanted to use my old pencil, and not fork over another $129 for the new one (yep, price increase), I'm kind of screwed??? Anyone see anything different? ",18,1540914381.0
96,e8q8yvp,t3_9so41z,getBusyChild,"She's very nervous. Breathe in, breathe out.",30,1540912059.0
97,e8q9r3a,t3_9so41z,deleted,[gelöscht],28,1540912713.0
98,e8qa23v,t3_9so41z,happytreepanda,"after the concert, “and to enjoy Lana del Rey’s music on the go here are our all new airpod 2”",26,1540912964.0
99,e8ql90f,t3_9so41z,hadapurpura,That new iPad Pro is so orgasmic... **except they got rid of the goddamn headphone jack. On a Pro device**. Which musicians are supposed to use to **make music** because it’s supposedly targeting and inspiring “creative types”. ,26,1540921931.0
100,e8qafp4,t3_9so41z,naturedwinner,"So if you have a new ipad and a new iphone, and purchase high quality wired headphones, you need two different dongles? ",18,1540913272.0
101,e8q6al9,t3_9so41z,hewkii2,"reading between the lines, it looks like they really wanted the T2 chip ready before they did a Mac refresh. ",10,1540909787.0
102,e8q6pzl,t3_9so41z,techno_telemann,Is that the puffy shirt,10,1540910156.0
103,e8q7dbj,t3_9so41z,deleted,Giant iPhone 5,9,1540910708.0
104,e8q7evx,t3_9so41z,ebevan91,Finally an non-idiotic way to charge the pencil,10,1540910746.0
105,e8q7fdw,t3_9so41z,MarvelousRedditor,Damn that Apple Pencil shot with its magnetic connection and inductive charging was sick,9,1540910757.0
106,e8q7sal,t3_9so41z,jccool5000,I like this dude. Great presenter,10,1540911064.0
107,e8q82r1,t3_9so41z,JohanDeWitt,Are they going to announce RDR2 now?   Also this will be amazingly expensive.,10,1540911307.0
108,e8q86y7,t3_9so41z,deleted,[gelöscht],10,1540911406.0
109,e8q88j8,t3_9so41z,medpre,This iPad is a fucking monster ,9,1540911444.0
110,e8q8jb9,t3_9so41z,medpre,"Everyone’s flying though their stuff, it’s only 11am lol... what’s the one more thing?",10,1540911695.0
111,e8q8qdp,t3_9so41z,Rubixsco,Look at the beads of sweat! THE PINHOLES!,8,1540911860.0
112,e8q8qny,t3_9so41z,MLGameOver,iPad so good it fixed Boogie’s legs,9,1540911867.0
113,e8q8rhr,t3_9so41z,PaddysChub432,"Come to Brooklyn and shit on their team with the Warriors, Apple is so ruthless",8,1540911887.0
114,e8q92nx,t3_9so41z,yanksrock1000,"I can barely write without shaking if somebody is watching me, so I can totally understanding shaking in front of all these cameras with a slippery Apple pencil. ",10,1540912148.0
115,e8q9zac,t3_9so41z,mr_duong567,Wonder if Azealia Banks is in the crowd,9,1540912900.0
116,e8qa2iu,t3_9so41z,IThinkThings,"Just realized, as with all FaceID devices, no more white bezel option for iPad Pro.",8,1540912973.0
117,e8qa4ve,t3_9so41z,facemelt,piano guy looks like Boris in Golden Eye,10,1540913026.0
118,e8qa8ep,t3_9so41z,PickleBugBoo,"She’s so relaxed performing, I gotta see her in person now",9,1540913104.0
119,e8qa8uy,t3_9so41z,YouBetterChill,NO iMACS WTF ,8,1540913115.0
120,e8qa9kb,t3_9so41z,dabocx,So Imacs are staying on 7th gen? No updates :(,9,1540913131.0
121,e8qa9ze,t3_9so41z,kaboom987,"IPad starting price 11"" $999 CAD and 12.9"" $1249 CAD",8,1540913141.0
122,e8qahti,t3_9so41z,RGG2000,"I used to say after the MacBook release that the MacBook Air was dead. I will now correct myself and say that the MacBook is the one dead now, not the Air anymore.   Apple should now remove the MacBook from its line and have just the Air and the Pro, although I would’ve liked them to take off the “Air” and call it just MacBook. The lineup naming would be so much clearer with both a MacBook and a MacBook Pro.",9,1540913320.0
123,e8qcz1f,t3_9so41z,Hothotemper,"Dear secret santa, all I want for Christmas is the iPad Pro 😁",9,1540915311.0
124,e8q6lla,t3_9so41z,rebel5788,God. The iPads are gonna go up $200 too probably,17,1540910051.0
125,e8q9p9f,t3_9so41z,LevelReward,iOS 12.1 -- now also with ..you guessed it...100% recycled aluminum,18,1540912670.0
126,e8q67bj,t3_9so41z,deleted,"I'm so happy to see that most people in this thread aren't defending the absurd price of the new MBA. $1,200? Fucking lol.",15,1540909706.0
127,e8q7xy5,t3_9so41z,nvidiasuksdonkeydick,They admitted the ipad pro is more powerful than their new MacBook Air,14,1540911194.0
128,e8q91fl,t3_9so41z,the_one_true_bool,"Damn, she's nervous. I've been there before though - I *hate* having to do demos in front a bunch of people (software dev). I can't imagine millions of people watching. ",15,1540912118.0
129,e8q93kd,t3_9so41z,JuniperJumps,"We get it, her hand is shaking. No need to repeat what’s already been said a million times.",17,1540912168.0
130,e8q95cr,t3_9so41z,ftwin,This is like the first real PRO ipad.  Do you think they'll update the base ones though?,14,1540912212.0
131,e8q48at,t3_9so41z,super_granola,HOW COOL ARE THESE LOGOS?! 😍,9,1540907959.0
132,e8q59dk,t3_9so41z,IThinkThings,Wooahhh TouchID with no touchbar?,7,1540908875.0
133,e8q5xow,t3_9so41z,V8-Turbo-Hybrid,Air seems more expensive than 12ich Macbook.,8,1540909472.0
134,e8q5ylb,t3_9so41z,Core33,we THinK You‘Re gOnNa LoVe iT,8,1540909494.0
135,e8q5za2,t3_9so41z,akwilliamson,Thanks Claire Underwood!,8,1540909510.0
136,e8q64sp,t3_9so41z,deleted,I thought the air's were supposed to be more affordable? At this point it costs just as much as a MacBook Pro from this year.,8,1540909644.0
137,e8q65vv,t3_9so41z,Core33,Not that hard if you only update every 5 years,9,1540909671.0
138,e8q67ur,t3_9so41z,NeiloMac,User upgradeable RAM on a Mac?  Fuck my old boots.,8,1540909719.0
139,e8q771l,t3_9so41z,renegadeturkeys,tim cook with the owen wilson inpression,9,1540910563.0
140,e8q78r0,t3_9so41z,efbo,What's a computer?,8,1540910602.0
141,e8q7hu3,t3_9so41z,deleted,[gelöscht],9,1540910815.0
142,e8q7yjy,t3_9so41z,G_Wom,"Yeah, but does it run RDR2 ?",8,1540911208.0
143,e8q8d1j,t3_9so41z,TempestXax,"Please, please, please surprise us with new AirPods and AirPower after this.",7,1540911549.0
144,e8q8f7e,t3_9so41z,scroopy_nooperz,Autocad on ipad? Holy shit that's amazing  inventor too pls,8,1540911599.0
145,e8q8k26,t3_9so41z,bigeorgester,Fuck me this iPad is gonna make my wallet call it daddy. ,7,1540911711.0
146,e8q8k9e,t3_9so41z,JohanDeWitt,Here's my guess: starting at $1499.,6,1540911716.0
147,e8q8vzs,t3_9so41z,deleted,[gelöscht],8,1540911991.0
148,e8q95a8,t3_9so41z,theNEWgoodgoat,The shake intensifies with the AR ,8,1540912210.0
149,e8q9clt,t3_9so41z,Eugene1026,wait is that phil schiller?,7,1540912379.0
150,e8q9f6f,t3_9so41z,ExtremelyQualified,Schiller has transcended into the ether like Jony Ive,9,1540912440.0
151,e8q9lha,t3_9so41z,ABDL-GIRLS-PM-ME,Rip iPad mini fans ,8,1540912584.0
152,e8q9nn4,t3_9so41z,cjohn4043,$799...not bad I guess  $999...ooph that hurt a little.,9,1540912635.0
153,e8q9or3,t3_9so41z,johnkphotos,No iMac update!?!? Spec bump!?,8,1540912659.0
154,e8q9rul,t3_9so41z,deleted,I don't have 32 friends and barely even 3,9,1540912730.0
155,e8q9u0g,t3_9so41z,johnabc123,So is airpower dead? lol,6,1540912780.0
156,e8q9v43,t3_9so41z,zwilley09x,No AirPods or AirPower?,7,1540912805.0
157,e8qa0uy,t3_9so41z,deleted,[gelöscht],8,1540912936.0
158,e8qagck,t3_9so41z,deleted,I need Robert Downey Jr to come out in the iron man suit and then I'll buy your products,8,1540913286.0
159,e8qb5am,t3_9so41z,plazman30,"Now if only Apple had OS level handwriting recognition, you could use the Apple Pencil instead of the keyboard.  You were there in the 90s, Apple with the Newton.  Bring it back.",8,1540913853.0
160,e8qetey,t3_9so41z,CisternaChyli,So the new apple pencil isn't backwards compatible? ,8,1540916774.0
161,e8qg3fy,t3_9so41z,hotairbabboon,"Hey guys, kind of related question. Are the MacBook Pro’s updated with different keyboards or do they all still have the loud clicks and the troubled keys? I have a friend asking my opinion for a new laptop.",8,1540917778.0
162,e8q6280,t3_9so41z,ftwin,Should be 999.  After tax you're looking at almost 1300 for a pretty under-powered laptop.,24,1540909582.0
163,e8q65k8,t3_9so41z,audigex,"""Every Mac Mini comes with 4 cores""  Oh great, we've finally caught up with 2007",23,1540909662.0
164,e8q8au1,t3_9so41z,qwerty_77,"This ipad pro doesn’t leave anything for any other manufacturers. They can’t compete with this. Holy hell. What a machine, more powerful than laptops.",21,1540911497.0
165,e8q60p7,t3_9so41z,deleted,$1199 for Macbook Air.  RIP affordable Macbooks,12,1540909545.0
166,e8q7onn,t3_9so41z,TheMuffStufff,I still can't get over the fact that a dual core y processor macbook air marketed for students is only $100 cheaper than a macbook pro.. Facepalm.,15,1540910977.0
167,e8q8quw,t3_9so41z,G_Wom,Scripted AF,12,1540911871.0
168,e8q8xar,t3_9so41z,PickleBugBoo,Homegirl is shaking she’s so nervous!,15,1540912022.0
169,e8qchug,t3_9so41z,Luph,Yeah I'm buying AirPods now before they update them next year and tack on another $30-50. L0L,14,1540914936.0
170,e8q513h,t3_9so41z,Carl2011,rip macbook    :(,7,1540908670.0
171,e8q52ts,t3_9so41z,AlbinoAlex,How is this different from the standard MacBook?,7,1540908712.0
172,e8q5acg,t3_9so41z,getBusyChild,People seem to be confused when to applaud and when to start speaking again.,6,1540908900.0
173,e8q5jbx,t3_9so41z,gelftheelf,This is replacing the Macbook Pro without touchbar.,7,1540909122.0
174,e8q5pku,t3_9so41z,ResettiRevenge,3.5mm headphone jack?,7,1540909272.0
175,e8q5vvn,t3_9so41z,the_one_true_bool,"No Jony with ""Aloomineeum"".  Sorry guys and gals, I'm out.",7,1540909427.0
176,e8q5xaj,t3_9so41z,ebevan91,affordable  1199  pick one,7,1540909462.0
177,e8q5xv8,t3_9so41z,mrjohnhung,"woowahh, price increase, just like i predicted. ",8,1540909476.0
178,e8q5yyg,t3_9so41z,the_one_true_bool,$1200 for dual-core!? Absolute madlads!,7,1540909503.0
179,e8q60a7,t3_9so41z,Washington_Fitz,People want all theses new features but don’t wanna spend the money.,8,1540909535.0
180,e8q6194,t3_9so41z,MrManh,mr cook has defs taken something ,7,1540909559.0
181,e8q61j3,t3_9so41z,TempestXax,"Oh shit, a Mac Mini is coming.",8,1540909565.0
182,e8q63u0,t3_9so41z,Luph,"""the biggest update ever to the Mac Mini"" ... not exactly a high bar lol.",7,1540909621.0
183,e8q65l1,t3_9so41z,skiier97,"So basically, the non-touch bar Macbook Pro has been renamed a Macbook Air...",5,1540909663.0
184,e8q67vp,t3_9so41z,Endlessxo,He's so caffeinated and enthusiastic. I love it. ,7,1540909720.0
185,e8q69mu,t3_9so41z,SpartanSK117,"**""GET THIS""**",7,1540909763.0
186,e8q6iky,t3_9so41z,deleted,[gelöscht],7,1540909980.0
187,e8q765a,t3_9so41z,anakinfan8,Well now it’s official. R.I.P Magsafe,8,1540910541.0
188,e8q78qi,t3_9so41z,johnkphotos,No iMac update??,8,1540910602.0
189,e8q7gf2,t3_9so41z,deleted,[gelöscht],8,1540910781.0
190,e8q7odk,t3_9so41z,V8-Turbo-Hybrid,New Ipad Pro is supersize iphone 5 ,7,1540910970.0
191,e8q841p,t3_9so41z,ExtremelyQualified,Next year USBC iPhone confirmed,6,1540911337.0
192,e8q84qj,t3_9so41z,d1rtydutch,fuck this thing is a monster ,7,1540911354.0
193,e8q8519,t3_9so41z,yuriydee,USB C for the iPad??? Wow im surprised.,7,1540911361.0
194,e8q86ps,t3_9so41z,rodrye,"Well we saw the USB-C display output displayed only the same aspect ratio as the iPad :\\ Black bars,",7,1540911400.0
195,e8q8seu,t3_9so41z,deleted,[gelöscht],6,1540911908.0
196,e8q936h,t3_9so41z,zwilley09x,"$1500, bet",6,1540912159.0
197,e8q9a4t,t3_9so41z,MarvelousRedditor,Me: wow this event is running pretty quickly it shouldn’t take over an hour Apple: Here’s a 20 minute apps demo segment. We think you’re going to love it.,7,1540912323.0
198,e8q9b3e,t3_9so41z,cherryfree2,Fuck did Jony die??,7,1540912345.0
199,e8q9chk,t3_9so41z,IThinkThings,Oh hey Phil. I guess Jony was sick that day.,7,1540912377.0
200,e8q9p3u,t3_9so41z,Funkbass,“Before we go I have one.... quick update.” Dammit Tim don’t do this to us,7,1540912667.0
201,e8q9q9c,t3_9so41z,Anonasty,"I wish they could stop the ""best x (of our products) ever!"" Hello mister obvious...",7,1540912693.0
202,e8q9tw7,t3_9so41z,deleted,I’d like to introduce... U2.,6,1540912777.0
203,e8q9uk0,t3_9so41z,TheItalianStallion64,_ONE MORE THING TIM COME ON_,8,1540912792.0
204,e8qa1u9,t3_9so41z,G_Wom,Yo ! That new female Siri voice has been greatly improved !,7,1540912958.0
205,e8qaeql,t3_9so41z,Anonasty,"Alright, the store is open. Here in Europe (Finland) the Air prices are absurd. The new 8/128 model is 1379€ (1567Usd) and the 8/256 is 1629€ (1851usd). For a Dual Core 8Gt ram machine.",7,1540913250.0
