,Comment ID,Parent ID,Author,Body,Score,Created (UTC)
1367,ejcodus,t3_b5d6fv,alttabbins,Wyatt looks like he escaped from a prison in 2065.,10,1553534352.0
1368,ejcoon7,t3_b5d6fv,Cootch,$9.99 and family sharing? Hell of a deal.   Wish it was in Canada.   Omg it’s in Canada!!,8,1553534544.0
1369,ejcq0ln,t3_b5d6fv,TheRealMe99,"""Goldman Saachs will never share your data""  Hah.",8,1553535403.0
1370,ejcrst5,t3_b5d6fv,deleted,Wow. A whole lot of garbage networks up there.,8,1553536537.0
1371,ejct1us,t3_b5d6fv,crapusername47,"The TV app outside of North America is still going to be lacklustre.   Here in the UK you will never see Sky getting on board with this. The Sports section of the app will therefore completely lack the sports British people watch. No Premier League football, no Cricket, no Formula 1, no Golf, not even Darts.  There will still be no Netflix and no WWE Network either. ",9,1553537348.0
1372,ejcu876,t3_b5d6fv,deleted,[gelöscht],7,1553538116.0
1373,ejcuk0d,t3_b5d6fv,deleted,[gelöscht],8,1553538328.0
1374,ejcuny6,t3_b5d6fv,sheburns,Spielberg heavily criticising Netflix yet taking money from Apple to direct something for their new streaming service. What a hypocrite. ,9,1553538400.0
1375,ejcwbvm,t3_b5d6fv,BrianDawkins,She’s a very good speaker ,8,1553539608.0
1376,ejcwk1q,t3_b5d6fv,Ravens2017,THIS WAS IT? ,9,1553539760.0
1377,ejcw6mr,t3_b5d6fv,Dorito_Lady,"Jesus Christ, reddit, you make Youtube comment sections look good today.",11,1553539511.0
1378,ejcmjrb,t3_b5d6fv,tecialist,Not expecting any new hardware. But still excited! ,3,1553533152.0
1379,ejcmpra,t3_b5d6fv,HappyHolidays666,how come when i got to a theater it's never that damn dark,3,1553533259.0
1380,ejcmwrk,t3_b5d6fv,davidvu396,That intro though.,3,1553533388.0
1381,ejcnaxo,t3_b5d6fv,tggoulart,"Apple News, fucking hell",3,1553533653.0
1382,ejcny8v,t3_b5d6fv,deleted,Wait so this is just magazines? Hard pass.,3,1553534072.0
1383,ejcnywe,t3_b5d6fv,IamTheJman,I can’t believe they went with plus. Everything is plus now jeez ,3,1553534084.0
1384,ejcnyym,t3_b5d6fv,IThinkThings,Roger didn't get the business casual memo.,3,1553534085.0
1385,ejcnzl7,t3_b5d6fv,TroyAtWork,A flood must be coming,3,1553534097.0
1386,ejco0zs,t3_b5d6fv,T3CH--SUPP0RT,live covers huh,3,1553534123.0
1387,ejco2bb,t3_b5d6fv,gnarlnick,"There should be one sub for Music, News+, future movie service, & the games thing",3,1553534146.0
1388,ejco4na,t3_b5d6fv,quitethewaysaway,I’m willing to subscribe. I love magazines.,3,1553534189.0
1389,ejco9ye,t3_b5d6fv,TheMacMan,"I subscribe to a dozen or more magazines right now. At ~$10/year each for those subscriptions, I'm down for a monthly service that includes those and more.",3,1553534284.0
1390,ejcobc2,t3_b5d6fv,meowl,PressReader already exists as a subscription for magazines... or for free through a library subscription.,3,1553534308.0
1391,ejcod2u,t3_b5d6fv,T3CH--SUPP0RT,are we watching someone read live! ,3,1553534338.0
1392,ejcoebr,t3_b5d6fv,stanleys_tucci,"Hey guys, I just got here. Is Apple News+ the only thing they've announced so far? Apparently you can't backtrack on the livestream.",3,1553534360.0
1393,ejcof56,t3_b5d6fv,MightBeJerryWest,Is this the longest they’ve gone in an event without clapping in the middle of a demo? ,3,1553534373.0
1394,ejcoftf,t3_b5d6fv,hatpatprot,finally! i swear i could hear people yawning in the audience,3,1553534386.0
1395,ejcojsh,t3_b5d6fv,yanksrock1000,So no New York Times?,3,1553534457.0
1396,ejconfn,t3_b5d6fv,its_Shehan,$10 a month I knew it,3,1553534523.0
1397,ejcoqx3,t3_b5d6fv,jimbo831,$9.99 for just me was a no. For me and my wife and we will have to consider. ,3,1553534583.0
1398,ejcoral,t3_b5d6fv,deleted,So I'm gonna pass on this one. Let's see how the video goes.,3,1553534590.0
1399,ejcospp,t3_b5d6fv,schoolairplane,Poutine magazine ,3,1553534615.0
1400,ejcot6w,t3_b5d6fv,deleted,1 month free trial is nice,3,1553534624.0
1401,ejcounr,t3_b5d6fv,treasy2,"For 1 person it’s meh, for a family of 6 it’s a decent deal",3,1553534650.0
1402,ejcox1a,t3_b5d6fv,kyemaloy14,"Ahh that's sucks, no UK release till the fall :(",3,1553534691.0
1403,ejcox4q,t3_b5d6fv,benc777,Growth off the charts.................here's a chart to show you the growth  ,3,1553534693.0
1404,ejcoy9n,t3_b5d6fv,italianwog28,I fucking love living in Australia,3,1553534713.0
1405,ejcp184,t3_b5d6fv,julinay,Apple Pay for transit in NYC? :O,3,1553534767.0
1406,ejcp1zk,t3_b5d6fv,deleted,You mean I don’t gotta deal with refilling my metrocard every month?,3,1553534781.0
1407,ejcp4gi,t3_b5d6fv,topdude155,Apple Pay+ Confirmed,3,1553534825.0
1408,ejcp5d0,t3_b5d6fv,T3CH--SUPP0RT,Apple card!,3,1553534841.0
1409,ejcpk63,t3_b5d6fv,ThorTheWiseCracker,The fuck?,3,1553535108.0
1410,ejcpkti,t3_b5d6fv,TheRealMe99,okay good i was really concerned for a second there you wouldn't be able to use the cash card to pay the balance,3,1553535120.0
1411,ejcpldx,t3_b5d6fv,deleted,[gelöscht],3,1553535129.0
1412,ejcpnog,t3_b5d6fv,ThorTheWiseCracker,JESSE PINKMAN,3,1553535171.0
1413,ejcpnvk,t3_b5d6fv,CrystalRam,Aaron paul?!,3,1553535175.0
1414,ejcpo08,t3_b5d6fv,jdbrew,"Honestly.. I didn't like the card at first, but I'll totally apply for this  &#x200B;",3,1553535177.0
1415,ejcpqbx,t3_b5d6fv,ninjadinogaming,Apple need a debit card ,3,1553535219.0
1416,ejcpqu8,t3_b5d6fv,whereyoufirstmetme,2% in cash daily? Time for me to switch from my debit card! Too bad I just bought a smart battery case and leather phone case last week else I would’ve held out smh,3,1553535229.0
1417,ejcpqvh,t3_b5d6fv,ken27238,No Fees!!!,3,1553535230.0
1418,ejcpydv,t3_b5d6fv,pah-tosh,Pretty cool to get 3% back on the purchase of an imac !,3,1553535363.0
1419,ejcpyqa,t3_b5d6fv,SheSaysCiao,So this means it would be accepted when traveling internationally? So... no fiddling with money exchanges?,3,1553535369.0
1420,ejcpz31,t3_b5d6fv,Stephs_mouthpiece,This would be perfect if there were physical cards. But it makes sense for them to push Apple Pay more ,3,1553535376.0
1421,ejcpzt8,t3_b5d6fv,jamesk93,Have they mentioned if you can use it abroad without international fees? I use Monzo right now but this seems pretty cool,3,1553535389.0
1422,ejcq0ke,t3_b5d6fv,Chrispy__Bacon,A physical card would also be nice for places without Apple Pay...,3,1553535403.0
1423,ejcq1fb,t3_b5d6fv,T3CH--SUPP0RT,physical card!!!!,3,1553535417.0
1424,ejcq2ku,t3_b5d6fv,Nolemretaw,That secure element better be damn near bulletproof if not they better get that thing to withstand some quantum level brute force shanking.   — edit —  Eh? I think I invented some words there but hopefully the intent of the post comes through ,3,1553535437.0
1425,ejcq2td,t3_b5d6fv,medpre,Please be metal and heavy ,3,1553535441.0
1426,ejcq4n5,t3_b5d6fv,Mystikal6700,Game over,3,1553535474.0
1427,ejcq67u,t3_b5d6fv,julinay,"NGL, this is pretty cool.",3,1553535501.0
1428,ejcq6sr,t3_b5d6fv,dph11,Is Apple card gonna be in Canada ??,3,1553535512.0
1429,ejcq6zz,t3_b5d6fv,Stephs_mouthpiece,Only 1% with the physical card. That’s lame Apple ,3,1553535514.0
1430,ejcq7ph,t3_b5d6fv,medpre,But how much does the physical card cost??,3,1553535527.0
1431,ejcq84f,t3_b5d6fv,hocotate,You can hear everyone giggling in the background lol,3,1553535534.0
1432,ejcq96p,t3_b5d6fv,elephantnut,That kind of awkward half-chuckle by the audience.   It’s such a pointlessly pretty Apple *card*. ,3,1553535552.0
1433,ejcq9jy,t3_b5d6fv,egeek84,my credit is awful i likely wont be approved :(,3,1553535558.0
1434,ejcq9ux,t3_b5d6fv,DentateGyros,just 1% with the physical card is a disappointment,3,1553535564.0
1435,ejcq9ww,t3_b5d6fv,dph11,Is this card available to Canadians ??,3,1553535565.0
1436,ejcqbqb,t3_b5d6fv,XmiteYT,APP STORE?,3,1553535596.0
1437,ejcqd12,t3_b5d6fv,XmiteYT,GAMINGGGG,3,1553535618.0
1438,ejcqetf,t3_b5d6fv,brotherlymoses,Candy crush 2,3,1553535649.0
1439,ejcqf4x,t3_b5d6fv,TheRealMe99,oh boy angry birds time my favorite,3,1553535655.0
1440,ejcqfg0,t3_b5d6fv,deleted,[gelöscht],3,1553535660.0
1441,ejcqg1n,t3_b5d6fv,XmiteYT,ugh ew fortnite,3,1553535671.0
1442,ejcqgsv,t3_b5d6fv,julinay,Still interested what they meant re: bringing Apple Pay to NYC transit. :P,3,1553535684.0
1443,ejcqhp4,t3_b5d6fv,techguy69,"Fortnite emotes, wtf??",3,1553535700.0
1444,ejcqihu,t3_b5d6fv,deleted,[gelöscht],3,1553535714.0
1445,ejcqizg,t3_b5d6fv,philphan25,DELE,3,1553535723.0
1446,ejcqjd8,t3_b5d6fv,pussyonapedestal,prediction is something like $25 a month for all services.,3,1553535729.0
1447,ejcql1n,t3_b5d6fv,R4J4PR3M,Apple Arcade ,3,1553535759.0
1448,ejcql59,t3_b5d6fv,T3CH--SUPP0RT,arcade ??,3,1553535761.0
1449,ejcql8f,t3_b5d6fv,XmiteYT,Apple Arcade!,3,1553535762.0
1450,ejcqp3d,t3_b5d6fv,sjsharksfan12,So last week Google announced Stadia and today Apple announces Apple Arcade.  The gaming industry wants some of that Netflix pie. ,3,1553535832.0
1451,ejcqt8x,t3_b5d6fv,jimbo831,“Console Game”,3,1553535904.0
1452,ejcqx7c,t3_b5d6fv,MardocAgain,Anyone else digging this background music? Wondering how to look up similar stuff,3,1553535973.0
1453,ejcqy2k,t3_b5d6fv,chaiscool,Apple controller ?,3,1553535988.0
1454,ejcqzag,t3_b5d6fv,TheRealMe99,is Stardew Valley in it tho,3,1553536010.0
1455,ejcr46v,t3_b5d6fv,IllustriousSandwich,on a Mac?,3,1553536096.0
1456,ejcr68d,t3_b5d6fv,Bieberkinz,"At this point, I’m curious to know the packages, hopefully, they’ll be split into reasonable tiers or even a pick + choose x amount for $x.xx/mo",3,1553536132.0
1457,ejcr7an,t3_b5d6fv,Goldenshepherds,Movies and TV next and then probably a deal for all 3 services?,3,1553536151.0
1458,ejcr7ox,t3_b5d6fv,ExtremelyQualified,A lot of sick burns directed at Google today ,3,1553536158.0
1459,ejcragf,t3_b5d6fv,Thrakia,Where is Skyrim? ,3,1553536207.0
1460,ejcrcjj,t3_b5d6fv,sjsharksfan12,I wouldn't be surprised if this was between 16 and 20 bucks a month.  I'm not really a gamer but i do like the idea of entire access to a game and the end of the whole freemium craze. ,3,1553536245.0
1461,ejcrdlw,t3_b5d6fv,-Starwind,Anyone know the name of some of those games? That video of the games looked amazing,3,1553536265.0
1462,ejcrehx,t3_b5d6fv,TroyAtWork,"Schitt's Creek front and center  *Ew, David!*",3,1553536280.0
1463,ejcrfrp,t3_b5d6fv,elephantnut,"Ugh, no pricing on Apple Arcade. :(",3,1553536304.0
1464,ejcrs93,t3_b5d6fv,HappyHolidays666,Apple Sling TV lol   still won’t have sports games on the local networks unless you buy xfinity,3,1553536527.0
1465,ejcrwlx,t3_b5d6fv,pk3maross,Fire TV has all of this,3,1553536607.0
1466,ejcrww7,t3_b5d6fv,voltxre,EXPERT CURATORS AGAIN,3,1553536612.0
1467,ejcryjo,t3_b5d6fv,gosbts,Live scores loool thanks apple,3,1553536641.0
1468,ejcrzne,t3_b5d6fv,peetad,Why no ultimate streaming service?,3,1553536660.0
1469,ejcs05v,t3_b5d6fv,deleted,Does this subscription give me access to the iTunes movie library?,3,1553536670.0
1470,ejcs1su,t3_b5d6fv,WastingMyTime2013,"none of their employees are natural presenters, been that way for years. kind of annoying. not saying it is easy just saying everyone sounds so scripted. ",3,1553536698.0
1471,ejcs3zx,t3_b5d6fv,SlendyTheMan,RuPaul’s Drag Race,3,1553536738.0
1472,ejcs4m3,t3_b5d6fv,lakernation21,Trailers? Lmao ,3,1553536749.0
1473,ejcs6c4,t3_b5d6fv,f00gers,No Netflix and chill with this lady,3,1553536780.0
1474,ejcs7pr,t3_b5d6fv,sneekerhad,Watching an ad in a ad for a service. Next level.,3,1553536804.0
1475,ejcs8ll,t3_b5d6fv,RealisticCount,Even the crowd clapping sounds confused at this point,3,1553536820.0
1476,ejcs8oc,t3_b5d6fv,FanofK,She uses spectrum so she works out of so cal or new york or something?,3,1553536822.0
1477,ejcs9vi,t3_b5d6fv,IcelandicHumdinger,SOOO Many,3,1553536844.0
1478,ejcsb5o,t3_b5d6fv,BlackBriarReserve,*yawn*,3,1553536868.0
1479,ejcsb7s,t3_b5d6fv,Tapacehko,Well that was underwhelming,3,1553536869.0
1480,ejcsc8v,t3_b5d6fv,quitethewaysaway,Spongebob better be there.,3,1553536888.0
1481,ejcscx2,t3_b5d6fv,PicklesAnonymous,I really hate the way she stands,3,1553536900.0
1482,ejcsfq3,t3_b5d6fv,swaggy_p,I would Apple TV and chill with Cindy.,3,1553536951.0
1483,ejcsfqp,t3_b5d6fv,Nasjere,Thank good for Roku. ,3,1553536951.0
1484,ejcshzf,t3_b5d6fv,Tapacehko,I am confused.,3,1553536991.0
1485,ejcsi8u,t3_b5d6fv,RealisticCount,"Yeah, but I already have AppleTv",3,1553536995.0
1486,ejcsiuy,t3_b5d6fv,Phoenix_King76,surprised Amazon is allowing apple tv on their firestick,3,1553537007.0
1487,ejcsiwx,t3_b5d6fv,Nothematic,"Ok so all these countries get it, but presumably the channels are US only as always.",3,1553537007.0
1488,ejcsixv,t3_b5d6fv,iSe4n,won't be out on Mac OS until fall? seriously...,3,1553537008.0
1489,ejcsj5r,t3_b5d6fv,javiergame4,"Apple TV app looks sweet. Instead of me switching apps all the time, I can just watch all in one place.",3,1553537011.0
1490,ejcsjd0,t3_b5d6fv,deleted,"Aw, would be nice to have an Xbox/PS4 app for it as well.",3,1553537015.0
1491,ejcskua,t3_b5d6fv,Carl2011,Gimme a price!!,3,1553537042.0
1492,ejcsoh6,t3_b5d6fv,pk3maross,+++++++++++++++++++,3,1553537107.0
1493,ejcsoo8,t3_b5d6fv,its_Shehan,Apple Tv+ wow such a original name,3,1553537111.0
1494,ejcsor7,t3_b5d6fv,holderORfolder,Apple TV+ wow that's huge,3,1553537112.0
1495,ejcsot6,t3_b5d6fv,DrGiggleFr1tz,Oh fuck me lmao,3,1553537113.0
1496,ejcsox8,t3_b5d6fv,airtraq,Make the world a better place by making wallets lighter. Reducing carbon footprint.,3,1553537115.0
1497,ejcsp1n,t3_b5d6fv,deleted,++++,3,1553537118.0
1498,ejcspm8,t3_b5d6fv,ThorTheWiseCracker,*Unlike anything that has been done before*,3,1553537128.0
1499,ejcspsh,t3_b5d6fv,thu22jun,Damn. Which visionary is coming up with all the service’s names?,3,1553537131.0
1500,ejcsq34,t3_b5d6fv,poopnugget998,IS THIS A JOKE,3,1553537136.0
1501,ejcsqhr,t3_b5d6fv,smkane28,What's Captain America doing there??,3,1553537143.0
1502,ejcsqm6,t3_b5d6fv,DentateGyros,you gotta tell us what the revolution is before expecting applause,3,1553537145.0
1503,ejcsshz,t3_b5d6fv,Stephs_mouthpiece,"Apple TV channels isn’t a subscription service, just one app to combine other services? Lame",3,1553537179.0
1504,ejct0hb,t3_b5d6fv,SuccessAndSerenity,oh shit its mnight shamalamadingdong,3,1553537324.0
1505,ejct6y8,t3_b5d6fv,wiptheman,What’s the difference between Apple TV and Apple TV+ ?,3,1553537439.0
1506,ejct9kq,t3_b5d6fv,Sollja,The CC is the best thing yet. And it isn’t even available in my country. ,3,1553537485.0
1507,ejctcfm,t3_b5d6fv,se7entythree,What is the point we're trying to make here?,3,1553537537.0
1508,ejctdag,t3_b5d6fv,w1x0r,"I don't want to forget myself , I have to go to work tomorrow 😫",3,1553537552.0
1509,ejctdaw,t3_b5d6fv,lakernation21,Lmao ,3,1553537552.0
1510,ejctdcn,t3_b5d6fv,mention,This took way too long,3,1553537553.0
1511,ejctdh8,t3_b5d6fv,watashiwaerudes,Nothing works   -Ron Howard,3,1553537555.0
1512,ejctduz,t3_b5d6fv,deleted,This is a betrayal to Disney ,3,1553537562.0
1513,ejctf4q,t3_b5d6fv,hosker2,Speilberg onstage??  That's a helluva get for a tech product announcement.,3,1553537584.0
1514,ejcti0l,t3_b5d6fv,klingtkomischisabaso,"It's his first time at Apple, guys. Like totally...",3,1553537638.0
1515,ejctik3,t3_b5d6fv,thu22jun,Spielberg’s face looks weird on the screen. ,3,1553537648.0
1516,ejctkt9,t3_b5d6fv,whereyoufirstmetme,Should’ve just made this a product event and weaved in streaming services to make it cohesive,3,1553537690.0
1517,ejctmx8,t3_b5d6fv,retarded_raptor,Is this the Academy awards?,3,1553537728.0
1518,ejctn0j,t3_b5d6fv,ThisOneTimeAtLolCamp,Woooo!! Woooo!! One of us woooo!,3,1553537730.0
1519,ejctn29,t3_b5d6fv,Jinno,"""Let's see what happens when a WWII pilot flies through space and time""  We're getting American Airplane Tardis?",3,1553537731.0
1520,ejctpx8,t3_b5d6fv,DebrahRunner,"Aww man, no Steve Carrell with Reese and Jen.  EDIT: There he is!",3,1553537784.0
1521,ejctry6,t3_b5d6fv,deleted,Wasn't interested until Steve arrived.,3,1553537822.0
1522,ejctsbg,t3_b5d6fv,dapcook,"ok, just had to jump out to take a pee.. anyone tell me what tv+ is? What did I miss?",3,1553537828.0
1523,ejctshi,t3_b5d6fv,turnuppig,The office reboot confirmed? 😂,3,1553537832.0
1524,ejctsou,t3_b5d6fv,FanofK,Just tell me what the shows are and a trailer.. ,3,1553537836.0
1525,ejctsqk,t3_b5d6fv,lakernation21,Gravitas ,3,1553537836.0
1526,ejctt32,t3_b5d6fv,therealcoon,That's what she said!!,3,1553537842.0
1527,ejctt56,t3_b5d6fv,JM2845,Actinnnggggg! ,3,1553537843.0
1528,ejctuny,t3_b5d6fv,plsdontattackmeok,Hey is this Xbone announcement?,3,1553537871.0
1529,ejctwjk,t3_b5d6fv,nvidiasuksdonkeydick,I bet these past it actors and directors formed a union to beg Apple for this opportunity,3,1553537905.0
1530,ejctwx6,t3_b5d6fv,FreeSM2014,MAH MAN,3,1553537912.0
1531,ejctxnz,t3_b5d6fv,tekthebeast,AQUAMAN SIGHTING! ,3,1553537926.0
1532,ejcty1b,t3_b5d6fv,deleted,This is so bad.,3,1553537932.0
1533,ejcty4t,t3_b5d6fv,WastingMyTime2013,"Wow Apple is so bold, morning show gonna be lit. asking the tough questions. can't imagine what they will be!",3,1553537934.0
1534,ejctzx5,t3_b5d6fv,WastingMyTime2013,holy shit how much did the spend on celebrities to sell this shit to us. ,3,1553537966.0
1535,ejcu01p,t3_b5d6fv,Nolemretaw,Black seems to be the clothing color choice of the day. ,3,1553537968.0
1536,ejcu09r,t3_b5d6fv,FanofK,workers at San Jose airport got to see a celebrity or two this morning i see,3,1553537972.0
1537,ejcu0zt,t3_b5d6fv,scoot87,I do like how they do this surprise thing,3,1553537985.0
1538,ejcu10m,t3_b5d6fv,zikronix,Is this an old spice commercial,3,1553537985.0
1539,ejcu2de,t3_b5d6fv,poopnugget998,APPLE VR   Edit: nevermind APPLE BLIND,3,1553538009.0
1540,ejcu44m,t3_b5d6fv,anObscurity,Premise actually sounds kinda interesting.,3,1553538041.0
1541,ejcu7ix,t3_b5d6fv,PicklesAnonymous,Guys! It’s Birdbox +max geez. Get it right ,3,1553538103.0
1542,ejcu7k7,t3_b5d6fv,its_Shehan,Hey it's that dude from Silicon Valley,3,1553538104.0
1543,ejcu91q,t3_b5d6fv,elephantnut,Please turn your screen brightness down ,3,1553538131.0
1544,ejcu97j,t3_b5d6fv,deleted,This guy had a glow up. That beard and suit ,3,1553538134.0
1545,ejcua2e,t3_b5d6fv,YipYepYeah,Finally someone with charisma haha,3,1553538150.0
1546,ejcuiy7,t3_b5d6fv,pk3maross,"You gotta wonder, is this what is best for apple shareholders? ",3,1553538309.0
1547,ejcuoh4,t3_b5d6fv,deleted,This ain’t looking too good ,3,1553538409.0
1548,ejcurni,t3_b5d6fv,lemons_for_deke,Seriously ,3,1553538466.0
1549,ejcutnv,t3_b5d6fv,darkskeptic,Just when I thought it couldn’t get worse. ,3,1553538502.0
1550,ejcuu4b,t3_b5d6fv,deleted,"Looking at some of the audience, I can tell they are thinking something along the lines of: “I came here for product announcements, not this.”",3,1553538510.0
1551,ejcuukx,t3_b5d6fv,thu22jun,The most impressive thing is how the celebrities enter and leave the stage in the dark. ,3,1553538518.0
1552,ejcuv98,t3_b5d6fv,WastingMyTime2013,i think I am going to turn this off now. ,3,1553538531.0
1553,ejcuvlw,t3_b5d6fv,Shitwascashbruh,Damn I forgot ios 12.2 is a thing right now and had been hoping for 13,3,1553538537.0
1554,ejcuwdd,t3_b5d6fv,IcelandicHumdinger,Up next- Baby Shark!,3,1553538550.0
1555,ejcuxg2,t3_b5d6fv,Lolkac,Will they show new ios or is this wrong event for that? ,3,1553538570.0
1556,ejcuzkm,t3_b5d6fv,Doctor_Disco_,Okay a children’s show that teaches coding is a cool idea ,3,1553538608.0
1557,ejcv0ak,t3_b5d6fv,JammyHendrix,Watch all the reporters not call this a shitshow because they are afraid Apple won't invite them for next event.,3,1553538621.0
1558,ejcv0r2,t3_b5d6fv,nopethefuuuckout,"Create a recall program to fix laptops with failing screen cables? Nah, too expensive to hang onto existing customers. We need....whatever this is",3,1553538630.0
1559,ejcv2nt,t3_b5d6fv,deleted,Is JJ Abrams kinda swole ,3,1553538664.0
1560,ejcv2qk,t3_b5d6fv,kaiju78,"Okay, at least JJ Abrams is cool",3,1553538665.0
1561,ejcv34q,t3_b5d6fv,wokeiraptor,My stream froze for a minute.  Did big bird announce SE2?,3,1553538673.0
1562,ejcv3zc,t3_b5d6fv,poopnugget998,SARA BARILLA PASTAAAA,3,1553538688.0
1563,ejcv6qy,t3_b5d6fv,vashaunp,this would have been so much better if we got a trailer or even a teaser. have they even started filming these shows they are talking about? ,3,1553538739.0
1564,ejcv83b,t3_b5d6fv,EClarkee,I don't even know what the fuck is happening at this point,3,1553538764.0
1565,ejcv8aw,t3_b5d6fv,HappyHolidays666,this is far more basic than i expected it to be ,3,1553538767.0
1566,ejcv93s,t3_b5d6fv,darkskeptic,Oh lord. ,3,1553538782.0
1567,ejcvaj7,t3_b5d6fv,sneekerhad,Why not Grand Piano 2 Sara?,3,1553538808.0
1568,ejcvav7,t3_b5d6fv,FanofK,Will she write me a love song?,3,1553538814.0
1569,ejcvbu0,t3_b5d6fv,IThinkThings,"Folks, these are the Apple Original TV shows/movies being created for the streaming service called AppleTV+. It's been in the news for over a year now.",3,1553538831.0
1570,ejcvcgr,t3_b5d6fv,deleted,Apple subscription to get all these celebrities for only 9.99,3,1553538857.0
1571,ejcvd1d,t3_b5d6fv,deleted,WOW y’all couldn’t get KD for the keynote?,3,1553538911.0
1572,ejcvdoq,t3_b5d6fv,ChrisH100,$50/mo lmao,3,1553538933.0
1573,ejcvdym,t3_b5d6fv,joshskj,Apple got all those celebrities to show up for the worst keynote ever lmao,3,1553538940.0
1574,ejcve8s,t3_b5d6fv,deleted,M Night hahaha,3,1553538945.0
1575,ejcviki,t3_b5d6fv,LISSAGASM,All they've done is make me not want to hear about tv+ ever again,3,1553539032.0
1576,ejcvjlv,t3_b5d6fv,DrDreMuthafuka,Please tell me I didn't stay up at 245AM here in my time zone for this cringey shit. Good night. ,3,1553539054.0
1577,ejcvlq1,t3_b5d6fv,T3CH--SUPP0RT,uh price?,3,1553539097.0
1578,ejcvmgd,t3_b5d6fv,X678X,So... is this just another netflix?,3,1553539112.0
1579,ejcvmoa,t3_b5d6fv,Draiko,"They should've called this event ""But wait... There's less!""",3,1553539117.0
1580,ejcvmq3,t3_b5d6fv,Dontalay,Is this just Apple originals? Or all the iTunes movies and TV shows in the store?,3,1553539118.0
1581,ejcvnw4,t3_b5d6fv,se7entythree,No price? -_- ,3,1553539142.0
1582,ejcvo0n,t3_b5d6fv,Chrispy__Bacon,Morgan Freeman,3,1553539145.0
1583,ejcvoss,t3_b5d6fv,poopnugget998,Are they going to bundle all these services together? Or would I have to pick and choose ,3,1553539161.0
1584,ejcvp7m,t3_b5d6fv,peetad,Tim Cook looks like it’s upper body controlled by a tiny alien.,3,1553539169.0
1585,ejcvpho,t3_b5d6fv,poopnugget998,IPOD TOUCH 7 IS HERE GUYS ITS WHAT WEVE BEEN WAITING FOR,3,1553539175.0
1586,ejcvrfj,t3_b5d6fv,airtraq,One more thing... apple watch bands,3,1553539215.0
1587,ejcvs2l,t3_b5d6fv,Universal-Omnicide,Malala?,3,1553539228.0
1588,ejcvsct,t3_b5d6fv,ThorTheWiseCracker,Another one,3,1553539234.0
1589,ejcvtgx,t3_b5d6fv,deleted,YOU GET A STREAMING SERVICE! EVERYONE GETS A STREAMING SERVICE!!!!!,3,1553539257.0
1590,ejcvu6t,t3_b5d6fv,6d2c,Oprah giveaway when?,3,1553539272.0
1591,ejcvugg,t3_b5d6fv,Nolemretaw,Even Oprah is in,3,1553539277.0
1592,ejcvumr,t3_b5d6fv,darthjoey91,"Oprah, now the new voice of Siri?",3,1553539281.0
1593,ejcvv33,t3_b5d6fv,MattMurdock84,Fuck Oprah ,3,1553539289.0
1594,ejcvvcy,t3_b5d6fv,schwebbs84,I can't. I really can't. That's it for me. It's been real. Hopefully I get decent money for my stuff.,3,1553539295.0
1595,ejcvvgt,t3_b5d6fv,scoot87,It's the female Joe Rogan!,3,1553539297.0
1596,ejcvvj8,t3_b5d6fv,deleted,[gelöscht],3,1553539298.0
1597,ejcvvoy,t3_b5d6fv,Klynn7,"Our ""One more thing..."" was Oprah...",3,1553539301.0
1598,ejcvw8d,t3_b5d6fv,IThinkThings,YOU GET AN AIRPOWER. YOU GET AN AIRPOWER. EVERYBODY GETS AN AIRPOWERRRRRRR,3,1553539311.0
1599,ejcvwaf,t3_b5d6fv,BaconIsHappiness,was hoping for them to finish off by announcing the rumoured disney partnership for TV+ rather than Oprah tbh...,3,1553539312.0
1600,ejcvwag,t3_b5d6fv,terminaldetective,Of course she is wearing a cape. ,3,1553539312.0
1601,ejcvwd3,t3_b5d6fv,deleted,Does Oprah age anymore ,3,1553539313.0
1602,ejcvwgv,t3_b5d6fv,Batman_00,Why was there so much build up for Oprah.,3,1553539315.0
1603,ejcvwmd,t3_b5d6fv,GooseSpringsteenJrJr,random platitudes the show! man this whole thing has been a joke.,3,1553539318.0
1604,ejcvx0r,t3_b5d6fv,pah-tosh,Can we get airpower + already,3,1553539325.0
1605,ejcvx1a,t3_b5d6fv,_DEAL_WITH_IT_,I wish I could pull off wearing a cape...,3,1553539326.0
1606,ejcvxer,t3_b5d6fv,theFavbot,YOU GET AN AIRPOWER AND YOU GET AN AIRPOWER EVERYBODY HERE GETS AN AIRPOWER,3,1553539332.0
1607,ejcvy05,t3_b5d6fv,Mr_Duckerson,She bout to try and sell some weight loss shakes.,3,1553539344.0
1608,ejcw2mw,t3_b5d6fv,Mezuzah,Can I please have an Oprah free phone. ,3,1553539434.0
1609,ejcw30n,t3_b5d6fv,gnarlnick,Apple Card/Pay MVP of today’s event,3,1553539442.0
1610,ejcw4cp,t3_b5d6fv,RepsForKoreanJesus,I’m really hating this whole segment but Oprah’s documentaries really seem spot on. ,3,1553539467.0
1611,ejcw5n8,t3_b5d6fv,TroyAtWork,S T I M U L A T I N G  B O O K   C L U B,3,1553539492.0
1612,ejcw5ww,t3_b5d6fv,Hammytime2007,STIMULATINGGG,3,1553539497.0
1613,ejcw76c,t3_b5d6fv,Lolkac,Is apple trying to solve all world's stigmas with this apple tv+ thing?,3,1553539520.0
1614,ejcw7lg,t3_b5d6fv,jcw4455,Did they ever mention cost...? ,3,1553539528.0
1615,ejcw7ok,t3_b5d6fv,ThatRainbowGuy,Anyone else think Oprah sorta looks like elton john?,3,1553539530.0
1616,ejcw7y2,t3_b5d6fv,TheJohnny346,The way they’re announcing these it feels like someone’s gonna announce they found to cure to cancer.,3,1553539535.0
1617,ejcw8bd,t3_b5d6fv,ElHatso,Wait. Is the book club really happening? Lmao,3,1553539542.0
1618,ejcw904,t3_b5d6fv,pipe_tyson,oprah looks like she’s about to compose a symphony ,3,1553539555.0
1619,ejcw9nk,t3_b5d6fv,ChrisH100,AirPower not coming out today ,3,1553539567.0
1620,ejcwa37,t3_b5d6fv,ThorTheWiseCracker,APPPPPPPPPLLLEE,3,1553539575.0
1621,ejcwalr,t3_b5d6fv,kaiju78,AAAPPPPPPLEEEEE,3,1553539585.0
1622,ejcwaus,t3_b5d6fv,lakernation21,I just want black matte air pods ,3,1553539589.0
