,Comment ID,Parent ID,Author,Body,Score,Created (UTC)
3045,ejcng68,t3_b5d6fv,richking34,Who has that wallpaper that was on the iMac at the start? The sunset one,1,1553533747.0
3046,ejcnjrg,t3_b5d6fv,meowl,I never realised Tim had a Southern accent.,1,1553533812.0
3047,ejcnm8g,t3_b5d6fv,quaitheoftheeast,"Magazines? Hopefully not cosmo, vogue and other non sense..   Edit: I really like the idea of having one place to read science and nature magazines not so much the gossip stuff",1,1553533856.0
3048,ejcnpkj,t3_b5d6fv,AIienreborn,Looks like Economist isn't there. :/ ,1,1553533916.0
3049,ejcnw5a,t3_b5d6fv,SupaZT,Holy nerd lol,1,1553534035.0
3050,ejcoa2u,t3_b5d6fv,Chrispy__Bacon,If this is a penny more than $9.99/mo for unlimited magazines they can pound sand,1,1553534286.0
3051,ejcobgx,t3_b5d6fv,deleted,[gelöscht],1,1553534310.0
3052,ejcofy1,t3_b5d6fv,njgreenwood,Apple hired Paul Scheer?,1,1553534388.0
3053,ejcolbe,t3_b5d6fv,ChrisH100,Are there ads as well??,1,1553534485.0
3054,ejcolqo,t3_b5d6fv,jamesk93,Correct me if I’m wrong but weren’t magazines available to download on your device before?,1,1553534492.0
3055,ejconax,t3_b5d6fv,thinkme,Apple kills the news stand along with NY TImes and Washington Post,1,1553534520.0
3056,ejconhg,t3_b5d6fv,Cheechers23,someone tell me if that's overpriced,1,1553534524.0
3057,ejconll,t3_b5d6fv,jdbrew,"I will pay for this solely on the precedent so that other news publications to see this is a viable business model.  &#x200B;  I already pay for LA Times, NYT, and WSJ. This will cost me less. ",1,1553534526.0
3058,ejcorus,t3_b5d6fv,slightly_entertained,meh,1,1553534601.0
3059,ejcotoc,t3_b5d6fv,Xerxster,It is nice to get some Canadian content.,1,1553534632.0
3060,ejcov2p,t3_b5d6fv,juanegg,Dota???,1,1553534657.0
3061,ejcovqa,t3_b5d6fv,prpfl,"Can somebody inform these guys about the brexit please?   ""Starting at the UK""",1,1553534668.0
3062,ejcoxo9,t3_b5d6fv,mention,Better be Apple Pay in the Netherlands.,1,1553534703.0
3063,ejcoxqc,t3_b5d6fv,pah-tosh,So people are whining that the service they hates isn’t released in their country ?,1,1553534704.0
3064,ejcp107,t3_b5d6fv,dph11,Apple Pay cash to Canada please ,1,1553534763.0
3065,ejcp15a,t3_b5d6fv,27581009,Live market isn't looking too interested. ,1,1553534766.0
3066,ejcp3sw,t3_b5d6fv,ken27238,Whoa no fees?,1,1553534813.0
3067,ejcp4mp,t3_b5d6fv,ninjadinogaming,Apple’s credit card has been announced!,1,1553534828.0
3068,ejcp5b3,t3_b5d6fv,barronflux,apple card,1,1553534840.0
3069,ejcp5qi,t3_b5d6fv,Durinthal,Hopefully the next revision of the MBTA's system allows for them to integrate in Boston as well.,1,1553534848.0
3070,ejcp9jp,t3_b5d6fv,hosker2,"Apple Card, interesting.    So now do we start the countdown to Apple Money?",1,1553534916.0
3071,ejcpjb7,t3_b5d6fv,wiptheman,So Apple Card is basically Revolut?,1,1553535093.0
3072,ejcpohk,t3_b5d6fv,treasy2,2% is good but I’ll keep my citi double cash card,1,1553535186.0
3073,ejcposz,t3_b5d6fv,Stephs_mouthpiece,"2% back with Apple Pay, what about without ",1,1553535192.0
3074,ejcpqnz,t3_b5d6fv,chaiscool,Daily cash ~ only for 1st transaction kind of crap ?,1,1553535226.0
3075,ejcpsw3,t3_b5d6fv,rbarton812,Aaron Paul being in the crowd is to tease that Apple Pay will now be accepted by meth dealers throughout the New Mexico area.,1,1553535265.0
3076,ejcpur5,t3_b5d6fv,DebrahRunner,"Wow, no fees?  That's surprising as fuck. Holy hell.",1,1553535299.0
3077,ejcq0nj,t3_b5d6fv,ergonelsa,Now if they could do a debit card version of this I would be sold in an instant,1,1553535404.0
3078,ejcqaa3,t3_b5d6fv,FanofK,"Seems pretty normal for a credit card, but cool physical card",1,1553535571.0
3079,ejcqapw,t3_b5d6fv,T3CH--SUPP0RT,getting this card 2% is amazing ,1,1553535579.0
3080,ejcqbf0,t3_b5d6fv,Flawlesscazzazz,Can Australians at least get Apple cash soon then please?!?,1,1553535591.0
3081,ejcqbr8,t3_b5d6fv,T3CH--SUPP0RT,app store zzzzz,1,1553535596.0
3082,ejcqcuq,t3_b5d6fv,deleted,So how does 1% back compare to 1 delta point per $1?,1,1553535615.0
3083,ejcqew9,t3_b5d6fv,T3CH--SUPP0RT,what is she wearing ,1,1553535651.0
3084,ejcqhrj,t3_b5d6fv,Demelo,"That dance came from SNL dance kid, not Fortnite. ",1,1553535701.0
3085,ejcqjpy,t3_b5d6fv,deleted,"Wait, is WSJ in Apple News+ every article?",1,1553535735.0
3086,ejcqkrh,t3_b5d6fv,PicklesAnonymous,Mainly the Chinese market plays clash royal   No offense ,1,1553535754.0
3087,ejcqo8t,t3_b5d6fv,pah-tosh,Arcade ? Huh,1,1553535818.0
3088,ejcqwmv,t3_b5d6fv,FreeSM2014,This is gonna be huge!,1,1553535964.0
3089,ejcqym7,t3_b5d6fv,MrCelroy,Did my eyes deceive me or did I see Zelda?,1,1553535998.0
3090,ejcrb4p,t3_b5d6fv,pah-tosh,Will new games be added all the time ?,1,1553536219.0
3091,ejcrbqh,t3_b5d6fv,shanec07,All us centric can’t see half of these “features” ever making it to ireland ,1,1553536230.0
3092,ejcrhgu,t3_b5d6fv,XmiteYT,#GOOD PLACEEEEE,1,1553536336.0
3093,ejcrppv,t3_b5d6fv,philphan25,OMG is this true a la carte?,1,1553536483.0
3094,ejcs2wm,t3_b5d6fv,jimbo831,I wish this Apple TV app would come to my X1 or PS4. ,1,1553536718.0
3095,ejcs42c,t3_b5d6fv,SupaZT,Please release a new apple 4K TV!!!,1,1553536739.0
3096,ejcs4n0,t3_b5d6fv,ThorTheWiseCracker,Lmaooooo,1,1553536749.0
3097,ejcsdzt,t3_b5d6fv,benc777,Could they end up still dropping the new iPod touch at the end of this? ,1,1553536919.0
3098,ejcskg3,t3_b5d6fv,SupaZT,No more Apple TV 4k Hardware? Are they done with it?,1,1553537035.0
3099,ejcsm1v,t3_b5d6fv,nateryland,Oh shit here we go,1,1553537065.0
3100,ejcsnhz,t3_b5d6fv,redmonkeyjunkie,So why wouldnt I just go into the Amazon/Hulu app on their own.. ,1,1553537089.0
3101,ejcsox6,t3_b5d6fv,llukino,I’m confused from the Apple TV presentation :O,1,1553537115.0
3102,ejcsrlx,t3_b5d6fv,jangxx,"Apple TV+; I don't think I've even been less interested in any service ever, and that's saying something considering today's presentation.",1,1553537163.0
3103,ejcsuiv,t3_b5d6fv,wahyu915,Captain america not impressed,1,1553537215.0
3104,ejct9p3,t3_b5d6fv,terminaldetective,Spielberg reminds me of Jobs. That's the must cool part of this whole thing.,1,1553537488.0
3105,ejcteto,t3_b5d6fv,PicklesAnonymous,And the point of that was.....?,1,1553537579.0
3106,ejctotx,t3_b5d6fv,deleted,[entfernt],2,1553537764.0
3107,ejctpbi,t3_b5d6fv,deleted,Why are the speeches sounds like corporate jargons?,1,1553537773.0
3108,ejctq6x,t3_b5d6fv,Universal-Omnicide,Reese has massive Egg-Lobes on her forehead.,1,1553537789.0
3109,ejctwp9,t3_b5d6fv,LISSAGASM,So was it just an ad for the  morning show? I don't get it,1,1553537908.0
3110,ejctx5b,t3_b5d6fv,ScHaKaLaKa___,The cringe is real...,1,1553537917.0
3111,ejcu22d,t3_b5d6fv,Buenos_Diaz_,That Khal Drogo?,1,1553538004.0
3112,ejcu7jt,t3_b5d6fv,jsally17,And here I thought this was going to be an incredibly accessible entertainment experience. But it's just a post apocalyptic show about blind people. ,1,1553538104.0
3113,ejcui1d,t3_b5d6fv,deleted,I’m so turned off by this I’m going to make it a point to never subscribe to this.,1,1553538293.0
3114,ejcui7i,t3_b5d6fv,T3CH--SUPP0RT,uh ,1,1553538296.0
3115,ejcurs2,t3_b5d6fv,BadGuyCraig,Any guess on who is going to come out next?,1,1553538468.0
3116,ejcusy5,t3_b5d6fv,brotherlymoses,I Lost,1,1553538489.0
3117,ejcux5u,t3_b5d6fv,xxiwisk,Lame joke,1,1553538565.0
3118,ejcv00w,t3_b5d6fv,diggwasmuchbetter,"A girl coder puppet. See, girls code too!",1,1553538616.0
3119,ejcv2d9,t3_b5d6fv,xxiwisk,Are they going to promote every show now?,1,1553538659.0
3120,ejcv4u7,t3_b5d6fv,deleted,[gelöscht],1,1553538704.0
3121,ejcv6hz,t3_b5d6fv,HappyHolidays666,i stepped way for 10min. any trailers yet? lmao,1,1553538735.0
3122,ejcv99r,t3_b5d6fv,Dick-Cheese-McGee,pls no,1,1553538785.0
3123,ejcv9jw,t3_b5d6fv,MPssuBf,Noooooo. Not the singingggggg!!!,1,1553538790.0
3124,ejcvdmg,t3_b5d6fv,pic2022,What the fuck is an actor going to make to make people sub?,1,1553538931.0
3125,ejcvekn,t3_b5d6fv,Alalamajama,Gil Amelio did better keynotes.,1,1553538952.0
3126,ejcvf96,t3_b5d6fv,deleted,I can’t wait to see all the insane corporate fanboys defend this mess. ,1,1553538964.0
3127,ejcvi3t,t3_b5d6fv,darkskeptic,"So they do have clips. Well, that’s something, at least. ",1,1553539022.0
3128,ejcvita,t3_b5d6fv,gosbts,Fall zzzzzz,1,1553539037.0
3129,ejcvitd,t3_b5d6fv,OGPixel5,"Today is a day, I miss Steve even more :( seriously",1,1553539037.0
3130,ejcviul,t3_b5d6fv,SuperYoshi95,Shit like this reminds me of Microsoft e3 conference's back in the early 2010's.,1,1553539038.0
3131,ejcviwj,t3_b5d6fv,pic2022,Soooo can someone confirm... Is the morning show an actual morning show or is it a shitty name for a sitcom?,1,1553539039.0
3132,ejcvk8a,t3_b5d6fv,IThinkThings,AARON PAUL WHAAATTTT,1,1553539067.0
3133,ejcvn8l,t3_b5d6fv,poopnugget998,So they missed GOT too? Ooof,1,1553539129.0
3134,ejcvnb4,t3_b5d6fv,T3CH--SUPP0RT,one more thing!,1,1553539130.0
3135,ejcvrpg,t3_b5d6fv,ninjadinogaming,Oprah,1,1553539220.0
3136,ejcvtvc,t3_b5d6fv,korndawgisu,Oprah...bfd.  ,1,1553539265.0
3137,ejcvxmx,t3_b5d6fv,flywithme666,Is that Colonel Sanders Oprah?,1,1553539337.0
3138,ejcw6mf,t3_b5d6fv,misterzadir,Pro tip on this idea that shows will bring people together: The people those shows NEED to reach... DGAF. ,1,1553539511.0
3139,ejcw8dx,t3_b5d6fv,PicklesAnonymous,No thanks ,1,1553539543.0
3140,ejcw9k6,t3_b5d6fv,terminaldetective,🙏Thank god for Apple Music / Beats1 Radio 🎧THAT'S ALL I NEED really🎵,1,1553539565.0
3141,ejcwbpr,t3_b5d6fv,bazanya,"good luck, you can't even live stream your own event",1,1553539605.0
3142,ejcwem2,t3_b5d6fv,That_One_Cool_Guy,Two of the most influential people on the planet sharing a stage together. Like it not that was truly an iconic moment. ,1,1553539660.0
3143,ejcwhrp,t3_b5d6fv,RealisticCount,"Frontrow dude, cut the WOOO already",1,1553539718.0
3144,ejcwhs9,t3_b5d6fv,philphan25,Oprah didn't give away anything.,1,1553539719.0
3145,ejcwi6w,t3_b5d6fv,27581009,The one thing I took away from this…. I started drinking at 1pm… and I have not consumed enough JD to deal with this.,1,1553539726.0
3146,ejcwl6y,t3_b5d6fv,lakernation21,When’s the next event happening?,1,1553539781.0
3147,ejcxd0e,t3_b5d6fv,deleted,[gelöscht],1,1553540291.0
3148,ejeduzl,t3_b5d6fv,FluffyHolyGhost,Thx for posting ,1,1553579891.0
3149,ejcphn9,t3_b5d6fv,Universal-Omnicide,"Magazines, Credit Cards. When is the tech being announced?",0,1553535063.0
3150,ejcseyd,t3_b5d6fv,klingtkomischisabaso,"As soon as there's an attractive woman on stage, people become super picky, critical and judgmental... classic...",-3,1553536937.0
3151,ejcpw4x,t3_b5d6fv,AdmiralFelchington,::Hoping for neat tech::  ::Gets a long-winded recitation of the back of a credit card contract.::,0,1553535323.0
3152,ejcs13e,t3_b5d6fv,deleted,[gelöscht],1,1553536686.0
3153,ejctyao,t3_b5d6fv,deleted,[gelöscht],-1,1553537937.0
3154,ejcxgke,t3_b5d6fv,deleted,I won’t get approved for the Apple Card so this was a waste of time.,-2,1553540355.0
3155,ejcos8i,t3_b5d6fv,Taypo98,"Resounding ""meh"" so far",0,1553534608.0
3156,ejcq463,t3_b5d6fv,gosbts,The card looks shit,0,1553535465.0
3157,ejcvttc,t3_b5d6fv,deleted,[gelöscht],-2,1553539264.0
3158,ejcwrj7,t3_b5d6fv,Rabus,"Wow, that was really shitty. Where's airpower? why not announce it on stage?",-3,1553539896.0
3159,ejcv4bo,t3_b5d6fv,Sollja,Look it’s the guy that ruined Star Wars. ,-3,1553538695.0
3160,ejcty8k,t3_b5d6fv,deleted,I guess Apple is more concerned with Hollywood than the average American. Shows how out of touch they’re becoming. I hope this flops (and it will).,-2,1553537936.0
3161,ejcwh61,t3_b5d6fv,deleted,dIvErSe PeRsPeCtIvEs ... no conservatives tho,-13,1553539707.0
3162,ejco2qc,t3_b5d6fv,prpfl,Looking at what he's wearing I'll pass for his personal recommendations. Thanks though,0,1553534153.0
3163,ejconmo,t3_b5d6fv,pussyonapedestal,decent price,0,1553534526.0
3164,ejcpbaw,t3_b5d6fv,jamesk93,You gonna need a Credit Card after this is over,0,1553534948.0
3165,ejcpmb5,t3_b5d6fv,turnuppig,Ill sign up in heart beat if you can get me 5-10% cash back,0,1553535147.0
3166,ejcpng8,t3_b5d6fv,welmoe,Meh the % back is average. ,0,1553535167.0
3167,ejcrlz2,t3_b5d6fv,hosker2,Apple should've bought the Fox movie assets.  The Mouse would've been piiiisssed.,0,1553536417.0
3168,ejcs7sa,t3_b5d6fv,GI_Sniper,No bra. Just saying ,0,1553536805.0
3169,ejcu9ub,t3_b5d6fv,Mezuzah,Quick! Send in some celebrities to distract people from how shitty this has been!,0,1553538146.0
3170,ejcv4tc,t3_b5d6fv,kilobitch,"Finally, that bird with the huge beak is off the stage… oh goddamit!",0,1553538704.0
3171,ejcwj8p,t3_b5d6fv,thesatchmo,IS THAT IT?,0,1553539745.0
3172,ejcoas9,t3_b5d6fv,rusty022,Yay! Apple picks the news for me! This is not dangerous at all!,-2,1553534298.0
3173,ejcpdkh,t3_b5d6fv,Andrew0085,Can’t use Apple card to buy apps in the App Store because it doesn’t take Apple Pay lol,-1,1553534990.0
3174,ejcqz7c,t3_b5d6fv,juanegg,PCMasterrace,-1,1553536009.0
3175,ejctyfu,t3_b5d6fv,holderORfolder,I'm not interested in Hollyweird people.,-1,1553537940.0
3176,ejcuen6,t3_b5d6fv,chaiscool,The best they can get for comedy genre is Nanjiani?,-1,1553538232.0
3177,ejcwpdz,t3_b5d6fv,DoctorZzzzz,Eeehh,-1,1553539857.0
3178,ejcx500,t3_b5d6fv,deleted,[gelöscht],-1,1553540145.0
3179,ejcrass,t3_b5d6fv,retarded_raptor,Indie garbage,-2,1553536213.0
3180,ejcrhsn,t3_b5d6fv,deleted,[entfernt],-1,1553536342.0
3181,ejcseu5,t3_b5d6fv,MS6_Boost,"Jesus, this woman is cringe-worthy at best.",-2,1553536934.0
3182,ejcu16z,t3_b5d6fv,deleted,[gelöscht],-3,1553537988.0
3183,ejcubux,t3_b5d6fv,deleted,[entfernt],-7,1553538183.0
3184,ejcu9p1,t3_b5d6fv,deleted,[entfernt],-3,1553538143.0
3185,ejcpzb9,t3_b5d6fv,pk3maross,bullshit. no way it is private,-3,1553535380.0
3186,ejcqlk1,t3_b5d6fv,pah-tosh,Oh now we have the asian presenter,-4,1553535768.0
3187,ejcnvoc,t3_b5d6fv,deleted,[gelöscht],0,1553534027.0
3188,ejco21d,t3_b5d6fv,deleted,Apple's live stream quality and production quality is world class. Unmatched by any other company.,0,1553534142.0
3189,ejcorro,t3_b5d6fv,badvok,$10/month. I'm sold.,0,1553534599.0
3190,ejcos7f,t3_b5d6fv,IThinkThings,Same price for family sharing is pretty cool.  right now Apple Music is $9.99/individual or $14.99/family,0,1553534607.0
3191,ejcotrs,t3_b5d6fv,FreeSM2014,"wtf, only US and Canada...",0,1553534634.0
3192,ejcov62,t3_b5d6fv,retarded_raptor,ZzZzzzzz,0,1553534658.0
3193,ejcpbp8,t3_b5d6fv,emaG_eh7,"All these comments about whatever some dude is wearing, but no pictures?! For shame.",0,1553534955.0
3194,ejcpcmt,t3_b5d6fv,deleted,[gelöscht],0,1553534972.0
3195,ejcpkfy,t3_b5d6fv,deleted,[gelöscht],0,1553535113.0
3196,ejcu95x,t3_b5d6fv,Pocchari_Kevin,"Lol open with Spielberg then 2 duds.  I love it though, I haven't seen people bomb like this since e3 years ago.",0,1553538133.0
3197,ejcua7m,t3_b5d6fv,Riash,All fluff no content. Someone wake me up when they start showing actual content.,0,1553538152.0
3198,ejcuyhd,t3_b5d6fv,deleted,I turned it off. I’ll just read the inevitable critiques of this later with my Apple News subscription.,0,1553538588.0
3199,ejcuz7s,t3_b5d6fv,xxiwisk,This is more cringe than Bollywood ,0,1553538601.0
3200,ejcv1h8,t3_b5d6fv,medpre,Can we like stop now please?? ,0,1553538642.0
3201,ejcv237,t3_b5d6fv,zikronix,who are these people  edit: ok one is sara barellies whos the other,0,1553538654.0
3202,ejcv5va,t3_b5d6fv,ThorTheWiseCracker,"This is not ComicCon, smh",0,1553538723.0
3203,ejcvajb,t3_b5d6fv,airtraq,Who is this girl singing?,0,1553538808.0
3204,ejcvwey,t3_b5d6fv,It-Wanted-A-Username,Really? Oprah?  God this fucking sucks,0,1553539314.0
3205,ejcvzfw,t3_b5d6fv,BlizzardShot,Is Oprah a big selling point in America?? Isn’t she just a talk show host?,0,1553539373.0
3206,ejcw5s3,t3_b5d6fv,teknic111,She’s so presidential!,0,1553539495.0
3207,ejcwapl,t3_b5d6fv,pah-tosh,Book club ?  😂😂😂😂😂😂😂😂😂😂😂😂😂😂😂😂😂😂😂,0,1553539587.0
3208,ejcwhhu,t3_b5d6fv,jimbo831,Anyone get a screen grab of that group photo?,0,1553539713.0
3209,ejcwirs,t3_b5d6fv,szzzn,Please just release AirPower on the store now thanks.,0,1553539736.0
3210,ejcwj67,t3_b5d6fv,h0n4m1,It's over. ,0,1553539744.0
3211,ejcr0yg,t3_b5d6fv,pah-tosh,After the white nerd the old lady the black guy the asian chick now the blue haired lesbian,-1,1553536040.0
3212,ejcn1w3,t3_b5d6fv,deleted,[gelöscht],-1,1553533485.0
3213,ejcnz1q,t3_b5d6fv,prpfl,I wonder if Trump will get Apple news+.   No more fake news! 😜,-2,1553534086.0
3214,ejcopyr,t3_b5d6fv,Frostythesnowmeme,Yup..... that’s 9.99 to much,-2,1553534567.0
3215,ejcoq2s,t3_b5d6fv,Universal-Omnicide,9.99 a month for a news feed.....,-2,1553534569.0
3216,ejcot43,t3_b5d6fv,jangxx,"Only English speaking countries, huh? Okay, so completely irrelevant for most people, great stuff.",-1,1553534622.0
3217,ejcp95p,t3_b5d6fv,tempest_fiend,"For all the money they’ve made, you’d think they could afford someone to come up with better names for their products.   Edit: nice to see the downvotes for this. Sticking the word Apple in front of a noun is not creative. This is a company who spend massive amounts of time and money on the design of their products, but apparently nothing on the names. They’re not even consistent, with most things following a naming convention, and then other just not. I’m looking at you air power.   They even named two seperate products the same name, and have to keep saying ‘Apple TV app’ to differentiate between the app and the physical device. ",-1,1553534909.0
3218,ejcudw0,t3_b5d6fv,bazhvn,Wtf is this dude,-1,1553538218.0
3219,ejcv4qx,t3_b5d6fv,teknic111,Damn shame what JJ did to Star Wars.,-2,1553538703.0
3220,ejcvuyb,t3_b5d6fv,szzzn,Serena Williams?,-1,1553539287.0
3221,ejcno2l,t3_b5d6fv,cobaltmk33,The day I pay for news is the day the internet exploded. I’ve never needed to open Apple News since I discovered r/All. ,-4,1553533888.0
3222,ejcq059,t3_b5d6fv,27581009,Still not worth a 1000 dollar iPhone.  Wall street doesn't seem too excited about this.  ,-5,1553535395.0
3223,ejcvb6f,t3_b5d6fv,WeatherWrestlingGuy,You guys are fucking bitter fucks who don’t like fun.   Like the Don Cherry of electronics.   Idiots. ,-4,1553538820.0
3224,ejcq8i0,t3_b5d6fv,sjsharksfan12,"Wait, then you can't use this card because all companies require it, especially the CCV number. ",-4,1553535540.0
3225,ejcxlwo,t3_b5d6fv,BFYTW_AHOLE,"Excited to pirate some of their new shows. Also, no thanks....don't need Apple curating (basically deciding) what news I see.",-7,1553540454.0
3226,ejcpvp3,t3_b5d6fv,redbull123,People actually use credit cards everyday for every single thing to the point they can trend it?  I use mine for holidays & expensive tech  *ok you can stop replying ,-2,1553535315.0
3227,ejcqjk5,t3_b5d6fv,chaiscool,Apple card can be used worldwide right? So foreigners can try apply using fake us address and use them in their own country,-2,1553535733.0
3228,ejcwem1,t3_b5d6fv,JetMars,"Just awful, apple turned back the clock 10 years. ",-2,1553539660.0
3229,ejcuab3,t3_b5d6fv,deleted,[gelöscht],-3,1553538154.0
3230,ejco5jo,t3_b5d6fv,deleted,[gelöscht],-1,1553534204.0
3231,ejcqor8,t3_b5d6fv,taubut,Worlds first? What about google literally a few days ago...,-1,1553535826.0
3232,ejcrd76,t3_b5d6fv,brotherlymoses,"iPhone Payments, subscriptions to enjoys iPhone, and apple card to pay it off. Milking people ",-1,1553536257.0
3233,ejctgy8,t3_b5d6fv,27581009,One prediction  correct…..  https://old.reddit.com/r/apple/comments/b564ux/apples_its_show_time_preevent_megathread/ejchfq0/  Second prediction:  https://old.reddit.com/r/apple/comments/b564ux/apples_its_show_time_preevent_megathread/ejchfq0/     Yet to be determined.  No Mr. Spielberg… alcoholism makes me forget myself.    ,-1,1553537618.0
3234,ejcua5k,t3_b5d6fv,deleted,[gelöscht],-1,1553538151.0
3235,ejcvwwo,t3_b5d6fv,szzzn,Man hater,-1,1553539323.0
3236,ejcw0jj,t3_b5d6fv,holderORfolder,Oprah. Now I know this is really going to fail hard,-1,1553539393.0
3237,ejcw6fj,t3_b5d6fv,Arvaci,So is Apple TV+ just all about shows that make political and cultural statements?,-1,1553539507.0
3238,ejcwdy8,t3_b5d6fv,deleted,[gelöscht],-16,1553539647.0
3239,ejco3t0,t3_b5d6fv,deleted,"The way the stage reflects, the lighting, and the camera angles just scream class and polish. Truly amazing. How do they even do it?",-3,1553534173.0
3240,ejcplsr,t3_b5d6fv,deleted,[gelöscht],-2,1553535137.0
3241,ejcqtco,t3_b5d6fv,Evari,Arcade... Not very original https://en.wikipedia.org/wiki/Xbox_Live_Arcade,-3,1553535906.0
3242,ejctix8,t3_b5d6fv,deleted,[gelöscht],-3,1553537654.0
3243,ejcuc8p,t3_b5d6fv,deleted,[entfernt],-20,1553538190.0
3244,ejcvag2,t3_b5d6fv,holderORfolder,This is what happens when liberals overtake a once great company and want to take Apple in a new direction.  Only this time Steve Jobs won't be there to save Apple.,-11,1553538807.0
3245,ejcmm5b,t3_b5d6fv,Dontalay,s🅱️eve jo🅱️s,0,1553533193.0
3246,ejcmrsz,t3_b5d6fv,TheAjwinner,OwO what’s this?,0,1553533297.0
3247,ejcndtq,t3_b5d6fv,HappyHolidays666,#1 everything!!!,0,1553533705.0
3248,ejcng3v,t3_b5d6fv,T3CH--SUPP0RT,newsstand??,0,1553533746.0
3249,ejcnmls,t3_b5d6fv,GI_Sniper,anyone watching this on the apple tv? I can't find the stream,0,1553533862.0
3250,ejcnuur,t3_b5d6fv,T3CH--SUPP0RT,who is this guy?,0,1553534012.0
3251,ejcojp4,t3_b5d6fv,pk3maross,I have an apple news?,0,1553534455.0
3252,ejcok9a,t3_b5d6fv,medpre,so is this gonna be a new app or built into existing app? ,0,1553534465.0
3253,ejcol61,t3_b5d6fv,deleted,Man if they had included the Athletic it would be a no brainer.,0,1553534482.0
3254,ejcop9d,t3_b5d6fv,philphan25,No advertisers? Then why would advertisers want to advertise? Riiiiight....,0,1553534554.0
3255,ejcovtt,t3_b5d6fv,deleted,Does this mean the Wired iPad app is going to be abandoned?,0,1553534670.0
3256,ejcovz6,t3_b5d6fv,ninjadinogaming,Apple Pay!,0,1553534672.0
3257,ejcoxnp,t3_b5d6fv,Stephs_mouthpiece,"If Apple makes a credit card, it’ll be metal with a sexy design ",0,1553534703.0
3258,ejcoy2t,t3_b5d6fv,retarded_raptor,Apple Paypal!,0,1553534710.0
3259,ejcoyfb,t3_b5d6fv,deleted,Oh. Apple pay. I'm listening.,0,1553534716.0
3260,ejcp382,t3_b5d6fv,brotherlymoses,Money money money Zzzzzzz,0,1553534802.0
3261,ejcp41o,t3_b5d6fv,deleted,Hope they let us add MARTA Breeze cards to it soon too. They already have the hardware for it on their fare gates.,0,1553534817.0
3262,ejcp53j,t3_b5d6fv,ninjadinogaming,Apple card,0,1553534836.0
3263,ejcpi8i,t3_b5d6fv,ThorTheWiseCracker,"Free money, lmao",0,1553535073.0
3264,ejcpty5,t3_b5d6fv,deleted,[gelöscht],0,1553535285.0
3265,ejcq2y6,t3_b5d6fv,Cryyp3r,"Well, buying my iPhone in the first place was a bad financial decision 🙃",0,1553535443.0
3266,ejcqmql,t3_b5d6fv,sneekerhad,EVER. MADE.  &#x200B;  Suck it Nintendo,0,1553535790.0
3267,ejcqogb,t3_b5d6fv,WouldItNot,Apple Arcade. That’s cute. ,0,1553535821.0
3268,ejcrdjn,t3_b5d6fv,ThorTheWiseCracker,Copying Xbox Gamepass. ,0,1553536264.0
3269,ejcrt9x,t3_b5d6fv,deleted,[gelöscht],0,1553536545.0
3270,ejcrwgk,t3_b5d6fv,jimbo831,This could make me actually want an Apple TV. ,0,1553536604.0
3271,ejcsqwi,t3_b5d6fv,DebrahRunner,"Apple TV Plus is a terrible name, LOL.  Oh well. Let's see these shows.",0,1553537151.0
3272,ejcsrjm,t3_b5d6fv,poopnugget998,GIVE US OPRAH OR GIVE US DEATH,0,1553537162.0
3273,ejctaiy,t3_b5d6fv,thelawtalkingguy,Un Film de Ron Howard ,0,1553537503.0
3274,ejctjqj,t3_b5d6fv,peetad,This is the lamest audience crowd I have ever seen. The secunder cringe is burning my skin.,0,1553537670.0
3275,ejctsd3,t3_b5d6fv,pintossbm123,USA USA,0,1553537829.0
3276,ejcttjn,t3_b5d6fv,poopnugget998,IT'S GRU,0,1553537850.0
3277,ejctwmp,t3_b5d6fv,KingBooScaresYou,"Oh jesus, of course they are discussing gender, an honest look at the complex relationships between women and men. Could this get any more clutching at straws and appealing to the SJW crowd to get good press?  &#x200B;  Has apple has just lost it with this? Rich celebrities on screen selling perhaps the most PG streaming service that nobody asked for, whilst they quietly update the hardware that people genuinely want? When netflix is killing it with R rates programs like Love Death Robots, Apples stake in this market is a pg rated analysis of gender relationships?  &#x200B;  Its just jaw dropping.",0,1553537907.0
3278,ejcu1ej,t3_b5d6fv,jimbo831,How much is this going to cost?,0,1553537992.0
3279,ejcu8x4,t3_b5d6fv,xxiwisk,No Pakistanis at the event lol,0,1553538129.0
3280,ejcuoja,t3_b5d6fv,chaiscool,"Tbf to Apple, the new concept presentation is probably their attempt on getting the non tech people interested in Apple new entertainment service.   Throwing star power probably more effective for the entertainment crowd than standard Apple presentation, suited for techie",0,1553538410.0
3281,ejcuqw0,t3_b5d6fv,ThorTheWiseCracker,CRINGE ,0,1553538452.0
3282,ejcut5x,t3_b5d6fv,rahl1,yikes ,0,1553538493.0
3283,ejcuvts,t3_b5d6fv,Arvaci,I need to do something cool and edgy to cleanse my mind of what I'm seeing right now. Any ideas?,0,1553538541.0
3284,ejcuzui,t3_b5d6fv,AccountSave,Does this mean we only get like 10 min on iOS software? ,0,1553538613.0
3285,ejcv151,t3_b5d6fv,JammyHendrix,YOU ARE JOKING?!,0,1553538636.0
3286,ejcv27k,t3_b5d6fv,Jailbreaker315,I’m enjoying this a lot! I like how they’re presenting all the new shows to us. Looking forward to all of them! ,0,1553538656.0
3287,ejcvebs,t3_b5d6fv,benc777,There's a reason I constantly go back to Netflix. Make good content and I'll probably subscribe  ,0,1553538947.0
3288,ejcvexs,t3_b5d6fv,darkskeptic,It’s over. ,0,1553538959.0
3289,ejcvf66,t3_b5d6fv,innocently_standing,Just got in from work. I’m in the UK. Do I need to look at what’s been announced or is it all US only?,0,1553538963.0
3290,ejcvfab,t3_b5d6fv,That_One_Cool_Guy,Did that say Cody?? AEW to Apple TV+??,0,1553538965.0
