,Comment ID,Parent ID,Author,Body,Score,Created (UTC)
0,ejcmf4o,t3_b5d6fv,exjr_,"@ me (by writing /u/exjr_ somewhere in your comment) if something is broken, or reply to this comment. 3 more mins!",1,1553533071.0
1,ejcsrki,t3_b5d6fv,Nothematic,So:  - News+ - Arcade - tv Channels - tv+ - Music  That’s a lot of subscriptions..,89,1553537163.0
2,ejcvj22,t3_b5d6fv,deleted,[gelöscht],204,1553539043.0
3,ejcs565,t3_b5d6fv,Oopsifartedsorry,Apple trying so hard not to mention Netflix lmao,104,1553536759.0
4,ejcst77,t3_b5d6fv,FireStorrrm,"Apple went from adding ""i"" in front of everything to adding ""+"" to the end.",103,1553537191.0
5,ejcshqb,t3_b5d6fv,thu22jun,Apple:   Guy in crowd: “WOOOOOO”,170,1553536986.0
6,ejcryd3,t3_b5d6fv,cjohn4043,Is it just me or does this TV presentation seem really confusing right now?,37,1553536638.0
7,ejcvrqh,t3_b5d6fv,Stephs_mouthpiece,Oprah+,46,1553539221.0
8,ejcwcfo,t3_b5d6fv,Nozed1ve,Watching this its like... these are just subscription services... but they talk like they’re curing cancer or some shit. Its like... dude... take it down a notch. This is literally not going to “change the world”. ,39,1553539618.0
9,ejctf6d,t3_b5d6fv,unitedfuck,If Steven Spielberg turns out to be a sexual predator they're definitely using that headshot in the news.,41,1553537585.0
10,ejctube,t3_b5d6fv,BlizzardShot,So when will Apple make The Office+,36,1553537864.0
11,ejcupyn,t3_b5d6fv,klingtkomischisabaso,"Cook really turned Apple into a money making machine with a primary focus on...well, making a lot of money.   Great for Apple, great for shareholders. But as a lifelong Apple customer, that beautiful symbiosis of me and useful and enabling Apple products turns into me primarily being a force-fed milk cow.",37,1553538435.0
12,ejculh4,t3_b5d6fv,thelawtalkingguy,"The Apple Credit card was one of the biggest surprises they’ve unleashed in recent memory, but they suddenly just drove this whole thing into bottomless ditch.  ",70,1553538355.0
13,ejcs8s4,t3_b5d6fv,That_One_Cool_Guy,“I LOVE JASON MOMOA AND GAME OF THRONES AND I CAN’T WAIT TO WATCH AQUAMAN”  Ok we get it stop yelling at me ,29,1553536823.0
14,ejcux26,t3_b5d6fv,BlackBriarReserve,Apple is basically just showing off their bank account at this point. ,28,1553538563.0
15,ejcw31h,t3_b5d6fv,Yasuuuya,Apple announces Oprah and Oprah XS Max,36,1553539442.0
16,ejcw4ns,t3_b5d6fv,25ina35,"Today, he truly became Tim Apple.",31,1553539473.0
17,ejd1jjh,t3_b5d6fv,Zekro,Apple Events are less exciting for a non US Apple User like me.. ,29,1553542974.0
18,ejcwgyf,t3_b5d6fv,UnluckyChemistry,NO WONDER THERE WAS SO MUCH CLAPPING.  &#x200B;  THEY ALL WORK FOR APPLE,60,1553539703.0
19,ejculjd,t3_b5d6fv,Enclavean,"Apple has convinced me, I’m upgrading to the 4k netflix plan",108,1553538356.0
20,ejcrxoy,t3_b5d6fv,That_One_Cool_Guy,I swear to God I already do this with my Apple TV app,55,1553536626.0
21,ejct83g,t3_b5d6fv,deleted,These people really fancy themselves.,25,1553537459.0
22,ejct8bb,t3_b5d6fv,quaitheoftheeast,This video is a bit dramatic and going on too long . Let’s see the trailers for the shows instead of whatever this ,27,1553537463.0
23,ejcti10,t3_b5d6fv,ValenOuteda,Spielberg: wtf i love streaming services now,26,1553537639.0
24,ejctlz2,t3_b5d6fv,Cheechers23,They doing entrances like they're the goddamn Undertaker  ,28,1553537711.0
25,ejcu2tc,t3_b5d6fv,therealcoon,Trailers in speech format! WTF,23,1553538017.0
26,ejcu53h,t3_b5d6fv,TroyAtWork,"Apple: What about instead of making trailers, we just kind of *explain* what the show is???",28,1553538059.0
27,ejcvx73,t3_b5d6fv,m0butt,im a huge apple fan boy but this is so ass,53,1553539329.0
28,ejctofz,t3_b5d6fv,deleted,MICHAEL SCOTT ARRIVES ,23,1553537757.0
29,ejcv4nm,t3_b5d6fv,dabocx,They don't have any trailers or teasers for this?  A 3-5 minute sizzle reel of all the shows would have sold me a lot more than this. ,23,1553538701.0
30,ejcw1ex,t3_b5d6fv,prpfl,And you get a shitty keynote and you get a shitty keynote and you get a shitty keynote and you and you and you and you you you!,24,1553539410.0
31,ejcvoaf,t3_b5d6fv,exjr_,"""One more""  **OH SHIT AIRPOWER**  ""Story telling""  Are you serious?",65,1553539150.0
32,ejcujhg,t3_b5d6fv,benc777,"""a young boy's dream to find a service provider that cares about his data and privacy"" coming to AppleTV+ ",22,1553538319.0
33,ejcv94d,t3_b5d6fv,treasy2,MAKE IT STOP TIM APPLE,22,1553538782.0
34,ejcs8vm,t3_b5d6fv,BlizzardShot,She has a very strong American woman accent ,20,1553536825.0
35,ejcthqq,t3_b5d6fv,sjsharksfan12,"Oh look, Mr. ""Netflix movies shouldn't be nominated for Oscars"" is on the apple stage now.  That seems a little hypocritical. ",59,1553537633.0
36,ejctej1,t3_b5d6fv,retarded_raptor,Wasn't Spielberg just talking shit about Netflix?,19,1553537573.0
37,ejcvq4h,t3_b5d6fv,Jinno,Nothing says creativity like Helvetica Neue.,17,1553539188.0
38,ejcuewv,t3_b5d6fv,ThorTheWiseCracker,"Steve jobs gonna come out of his grave and be like ""the fuck y'all did to my theater?""",41,1553538237.0
39,ejcuexl,t3_b5d6fv,TroyAtWork,"Is this a video content service, or a celebrity monologue service?  AppleCelebrity+",37,1553538237.0
40,ejco3cc,t3_b5d6fv,99X,Didn't we do this already years ago with [Apple Newsstand](https://en.wikipedia.org/wiki/Newsstand_\(software\)) before they removed it for Apple News?,72,1553534165.0
41,ejcsa4h,t3_b5d6fv,deleted,[gelöscht],20,1553536849.0
42,ejcv405,t3_b5d6fv,SqueezeAndRun,This is just such a bad format to show off tv shows. Why would they not show trailers instead of having people just vaguely talk about shows?,16,1553538688.0
43,ejcs58h,t3_b5d6fv,mirest,WHY IS SHE YELLING!? ,57,1553536760.0
44,ejcuwnn,t3_b5d6fv,deleted,[gelöscht],50,1553538556.0
45,ejcwd24,t3_b5d6fv,crc2993,Apple: Today's event will be all about services  Reddit after the event: Why were they only discussing services?,66,1553539630.0
46,ejcs4z0,t3_b5d6fv,poopnugget998,Her cadences are so unsettling ,16,1553536755.0
47,ejct6zh,t3_b5d6fv,Mystikal6700,omg get to the point,15,1553537439.0
48,ejcw5bd,t3_b5d6fv,Scheduled-Diarrhea,"Jesus Christ, Oprah. You're not curing cancer. You accepted a multi-million dollar deal to put two documentaries on a channel. Back it down a bit.  ""*We're going to replace shame*"" ",100,1553539485.0
49,ejcs2j8,t3_b5d6fv,kilobitch,This chick is yelling at me. ,37,1553536711.0
50,ejcqlsf,t3_b5d6fv,Stephs_mouthpiece,There’s ~~an app~~ a subscription for that ,16,1553535772.0
51,ejct7yq,t3_b5d6fv,123choji,Comments are entertaining me more ,16,1553537457.0
52,ejctz0x,t3_b5d6fv,mAsTeRhOva,i dont think anyone cares this much about apple tv+ as apple themselves,16,1553537950.0
53,ejcuhxr,t3_b5d6fv,BadGuyCraig,Thank god the Opportunity Rover isn't alive to see this.  **Wrong Rover  ***Curiosity is attempting to not be curious about this.,16,1553538291.0
54,ejcr85t,t3_b5d6fv,benc777,Not sure I'm gonna subscribe to this. Most of my mobile gaming is a pretty throwaway experience just to waste a bit of time.  ,13,1553536166.0
55,ejcru7s,t3_b5d6fv,deleted,That friend you have? I have friends? ,17,1553536562.0
56,ejcs8be,t3_b5d6fv,sebasvargas,Jesus her voice is annoying ,16,1553536815.0
57,ejcs8ms,t3_b5d6fv,nateryland,THAT WAS ***SAAOO EASAAAY***,14,1553536821.0
58,ejcs9fh,t3_b5d6fv,deleted,Stop yelling please ,16,1553536836.0
59,ejcs9h3,t3_b5d6fv,poopnugget998,ThErEs AlReaDy So mUcH hErE. THaT wAs s0 eAsy,13,1553536836.0
60,ejct58v,t3_b5d6fv,warmapplejuice,This video is stressing me out,14,1553537409.0
61,ejctdqj,t3_b5d6fv,TheRealMe99,oh look it's mr. streaming services don't deserve recognition himself,14,1553537559.0
62,ejctfvl,t3_b5d6fv,thu22jun,How much is Apple paying that one guy to “WOOOO” at every sentence?,14,1553537598.0
63,ejcu55e,t3_b5d6fv,terminaldetective,I never thought to say this but I prefer the nerds. BRING BACK THE NERDS!,14,1553538060.0
64,ejcwp2k,t3_b5d6fv,poopnugget998,THE APPLE CARD IS COOL. THAT IS MY ONLY TAKE AWAY,17,1553539851.0
65,ejd2wp8,t3_b5d6fv,Xillllix,As someone who really supported Apple before I really hate what Apple has become. People cheering for a damn credit card. Gosh It’s just pathetic. ,75,1553543815.0
66,ejcs2j9,t3_b5d6fv,Scheduled-Diarrhea,Why is this woman yelling at us about Apple TV,43,1553536711.0
67,ejcswz8,t3_b5d6fv,TroyAtWork,Steven Spielberg:  * Says Netflix movies should not be eligible for awards * Gets money thrown at him and partners with Apple TV+  ,44,1553537260.0
68,ejcnb5h,t3_b5d6fv,unitedfuck,Apple has to tell me where they found the only 50 people in the world who get so excited for a news app,82,1553533657.0
69,ejcp5ye,t3_b5d6fv,TroyAtWork,Tim Cook:  Audience: *woooo*,64,1553534852.0
70,ejcq5ed,t3_b5d6fv,hocotate,Where is Jony Ives talking about this card,14,1553535487.0
71,ejcs3na,t3_b5d6fv,burnertybg,please stop yelling,15,1553536732.0
72,ejcscv8,t3_b5d6fv,deleted,I’m way more excited about the credit card than the tv thing. What a let down. ,14,1553536899.0
73,ejct2ek,t3_b5d6fv,rainydayam,"I'm so confused by all of these services...so can i subscribe to netflix + HBO + showtime +whatever else all through apple for a reduced fee? if not, then how is this new?...",14,1553537358.0
74,ejctb1p,t3_b5d6fv,NJRFilms,"Spielberg has been complaining about Streaming services for the past month, sort of strange to see him here.",15,1553537512.0
75,ejctoxm,t3_b5d6fv,ValenOuteda,"Who’s next, Adam Sandler?",14,1553537766.0
76,ejcw2ox,t3_b5d6fv,tempest_fiend,Why is Oprah wearing a colonel sanders costume?,16,1553539435.0
77,ejcwb10,t3_b5d6fv,koolaidman1030,LOOK UNDER YOUR SEATS AND ALL OF YOU GET AN APPPPPPPPPPPLLLLLLLLLLLEEEEEEEEEEE,14,1553539593.0
78,ejcxmnl,t3_b5d6fv,deleted,[I expected nothing](https://i.imgur.com/PSDxRBP.gif),13,1553540469.0
79,ejetuif,t3_b5d6fv,deleted,remember when The Simpsons started to suck and instead of making the show better they just added celebrity cameos all the time? Welcome to Tim Cook's Apple.,13,1553602756.0
80,ejcstd7,t3_b5d6fv,thelawtalkingguy,This man has six adam’s apples.  ,29,1553537194.0
81,ejcukh4,t3_b5d6fv,TroyAtWork,Netflix about to release like 4 more series during this presentation before Apple can even show a trailer,33,1553538337.0
82,ejcpg71,t3_b5d6fv,Betang,Apple bank -> apple mortgages ,13,1553535037.0
83,ejcs3z0,t3_b5d6fv,ExtremelyQualified,Why are all the presenters talking like they’re hosting Blue’s Clues? ,12,1553536737.0
84,ejcu2f3,t3_b5d6fv,JM2845,Everyone coming on the stage looks super happy and mostly rich to be there ,12,1553538010.0
85,ejcu4mp,t3_b5d6fv,deleted,"Didn't Steve Jobs talk about the importance of being a focused company? Apple is in hardware, software, banking, and media.",13,1553538051.0
86,ejcukkm,t3_b5d6fv,UnitedRoad18,"“This is like Netflix, but with known Hollywood stars.”",11,1553538339.0
87,ejculr9,t3_b5d6fv,Chrisixx,So these are simply show pitches?   ETA 2021? ,14,1553538360.0
88,ejcv91s,t3_b5d6fv,deleted,[gelöscht],13,1553538781.0
89,ejcvb16,t3_b5d6fv,burnerjawn,i skipped the gym for this ,12,1553538817.0
90,ejcvv8j,t3_b5d6fv,costryme,Really shows how US-centric this event is because nobody cares about Oprah outside of the US,14,1553539292.0
91,ejcvx6f,t3_b5d6fv,TheJohnny346,Oprah gets higher billing than Steven Spielberg LMAO,15,1553539328.0
92,ejcvxxn,t3_b5d6fv,Evari,"""reach beyond the borders of our hearts and minds""  ... It's a fucking Netflix competitor.",14,1553539343.0
93,ejcwbo5,t3_b5d6fv,Universal-Omnicide,Has she actually said anything meaningful outside tacky metaphors and New age mumbo humbo?,13,1553539605.0
94,ejcx8dg,t3_b5d6fv,Mephistopheles-1,The Apple TV+ presentation made me so upset that I now have to watch something on my 10 other streaming services to calm down.,14,1553540207.0
95,ejdc86j,t3_b5d6fv,MaxxxNZ,Basically nothing for those of us who live outside the US. Most pointless event ever (for us).,40,1553549665.0
96,ejcseeb,t3_b5d6fv,aggressiveberries,"""IT'S THE BEST PLACE TO WATCH TV ONE ONE DEVICE AND I CAN'T WAIT FOR YOU TO TRY IT!!!!!!""",12,1553536926.0
97,ejcslsb,t3_b5d6fv,6d2c,"""Apple has always tried to make the world a better place""  http://hooli.xyz/",14,1553537060.0
98,ejcttwk,t3_b5d6fv,IllustriousSandwich,"you know, a trailer would've sufficed ",12,1553537857.0
99,ejcumny,t3_b5d6fv,Flying-Cock,"If there’s one more promotion for a show, that’s the end of the stream for me. Not even curious enough about the price.  Edit: alright cya lads fuck this",12,1553538376.0
100,ejcurd1,t3_b5d6fv,IJogInLanvin,What is Dee doing on stage?,12,1553538461.0
101,ejcus81,t3_b5d6fv,TinKnightRisesAgain,"AWWW FUCK YEA, BIG BIRD",14,1553538476.0
102,ejcuw0b,t3_b5d6fv,CarbonPhoto,If Netflix has taught me anything about television is that you don't need famous actors or directors to make stories good. ,11,1553538544.0
103,ejcuxgj,t3_b5d6fv,ninjadinogaming,Big Bird announces AirPower for 2020,11,1553538570.0
104,ejcv3lu,t3_b5d6fv,mention,WHEN WILL THIS END?,10,1553538681.0
105,ejcvmrw,t3_b5d6fv,XmiteYT,"“Just a sneak peek”  Ok, 45 minutes later. ",12,1553539119.0
106,ejcvuji,t3_b5d6fv,HEATCHECK77,“YOU GET AN IPHONE! AND YOU GET AN IPHONE!!! AND...”,11,1553539279.0
107,ejcvv1d,t3_b5d6fv,benc777,Is Oprah like God in the US? Can't ever say I've ever felt she was a massive star in the UK,14,1553539288.0
108,ejcwaxq,t3_b5d6fv,brandonsh,    ALL     CONNECTED     THROUGH     A P P L E E E E ,12,1553539591.0
109,ejcmy4g,t3_b5d6fv,deleted,Instantly my favourite intro ever,22,1553533415.0
110,ejcpj2k,t3_b5d6fv,trycat,And now introducing Apple Collections!  Pay your minimum balance or we turn off all your shit!,26,1553535088.0
111,ejcum5k,t3_b5d6fv,Java_Beans,This Apple event is reminding me why I don't watch things like Oscar awards.,24,1553538367.0
112,ejcvhvn,t3_b5d6fv,rusty022,So they had a trailer the ENTIRE TIME and wasted a half hour? What the actual fuck?,24,1553539018.0
113,ejcvsl4,t3_b5d6fv,Enclavean,Cant believe they used the one more thing line for fucking Oprah,29,1553539239.0
114,ejcube5,t3_b5d6fv,treasy2,I think Netflix execs are laughing so hard right now,22,1553538174.0
115,ejcr7xd,t3_b5d6fv,deleted,Would you guys do $30 bundle for every subscription including apple music?,12,1553536162.0
116,ejcs6fg,t3_b5d6fv,TheRealMe99,s o e a s y ,10,1553536781.0
117,ejct2ra,t3_b5d6fv,IllustriousSandwich,"Introducing, Apple TV+ exclusive, The Room 2.",12,1553537364.0
118,ejctea2,t3_b5d6fv,napoleon_wilson,These folks got paid+ for this. ,10,1553537569.0
119,ejctlin,t3_b5d6fv,TheRealMe99,lmao that picture of spielberg was just Steve Jobs+,12,1553537703.0
120,ejctorq,t3_b5d6fv,6d2c,"""Power dynamics between men and women in high stakes world of new shows""  Oh god. What the fuck is going on.",11,1553537763.0
121,ejctrjj,t3_b5d6fv,sjsharksfan12,"This is corny, even by Apple's standards. :(",9,1553537814.0
122,ejctsow,t3_b5d6fv,watashiwaerudes,Michael Scott gives a Apple Presentation ,11,1553537835.0
123,ejctxqk,t3_b5d6fv,pic2022,WHAT THE FUCK ARE THEY DOING NO ONE IS SAYING WHAT THIS IS,12,1553537928.0
124,ejctyw9,t3_b5d6fv,MeesterAndrew,"Enough celebrities, more services. ",11,1553537948.0
125,ejctyyi,t3_b5d6fv,MercurialMadnessMan,"Did I change channels to the Oscars, or what is going on?",12,1553537949.0
126,ejcu4t9,t3_b5d6fv,deleted,Apple bird box,12,1553538054.0
127,ejcu99r,t3_b5d6fv,Ravens2017,Normally you just show trailers of these shows instead of just talking about them. ,12,1553538135.0
128,ejcuef9,t3_b5d6fv,CasualGamerKing,"Just wait, at the end of all of this they won't even announce a price and it won't actually release until the Fall.",11,1553538228.0
129,ejcufe1,t3_b5d6fv,gnarlnick,He’s always repeating the same jokes,11,1553538245.0
130,ejcujwx,t3_b5d6fv,Griffdude13,"I find it funny that Spielberg was on stage introducing a project for a streaming service when just a month back, it seemed to leak that he wasn't a fan of streaming services competing at the Oscars.",10,1553538327.0
131,ejcuksn,t3_b5d6fv,deleted,Are we investors lol? Is he pitching me a show? Why are there no trailers ,11,1553538343.0
132,ejcupz1,t3_b5d6fv,dwilliamsjr,Jesus is this going to end?,11,1553538436.0
133,ejcuurv,t3_b5d6fv,Scheduled-Diarrhea,Holy shit. Is this what Big Bird sounds like now? Make it stop,11,1553538521.0
134,ejcv3ti,t3_b5d6fv,its_Shehan,Please let the next person be Tim Cook. Just please end this presentation. ,11,1553538685.0
135,ejcvh15,t3_b5d6fv,doeman,This whole event is making my AAPL sore.,10,1553539000.0
136,ejcvlw3,t3_b5d6fv,TroyAtWork,"Did they just have celebrities talk for 45 minutes to just say ""coming this fall""???",12,1553539101.0
137,ejcvu0s,t3_b5d6fv,poopnugget998,Lol they made it seem like Oprah died,12,1553539268.0
138,ejcwk2h,t3_b5d6fv,fatpat,This feels like an awards show.,9,1553539761.0
139,ejcx4jj,t3_b5d6fv,LS_DJ,So they didn’t announce pricing for Apple TV+ or Arcade? That’s not a good look ,11,1553540136.0
140,ejct03i,t3_b5d6fv,unitedfuck,"Tim Cook: ""We think you're going to love it""  Ron Howard: ""They didn't""",32,1553537317.0
141,ejcoejq,t3_b5d6fv,its_Shehan,I see we have a hypebeast on the stage. ,20,1553534364.0
142,ejct2lo,t3_b5d6fv,airtraq,Introducing the new debt+,22,1553537361.0
143,ejct4cp,t3_b5d6fv,cjohn4043,"in the last ten seconds of the event, Tim runs on stage...""by the way AirPower releases tomorrow KTHXBAI.""",22,1553537392.0
144,ejcufr9,t3_b5d6fv,NJRFilms,Google - We can stream 4K games in real time to any device Apple - Have you ever heard of a little thing called TV shows?,23,1553538252.0
145,ejcuwrk,t3_b5d6fv,H3000,"KIDS ARE NOT WATCHING THIS, APPLE",21,1553538558.0
146,ejcwleu,t3_b5d6fv,deleted,"ok wait.. Apple TV+ is a subscription service, but they didnt say what it costs? ",21,1553539785.0
147,ejcppfe,t3_b5d6fv,gr8kamon,Lol these rich actors don't give a shit about this. ,19,1553535203.0
148,ejcsd2i,t3_b5d6fv,ThisOneTimeAtLolCamp,This crowd certainly is easily pleased.,19,1553536903.0
149,ejcotwy,t3_b5d6fv,ziggie216,Are you happy now Canada?,11,1553534637.0
150,ejcqcxh,t3_b5d6fv,prpfl,I wish we had cash back on credit cards in Europe. ,9,1553535616.0
151,ejcrtz8,t3_b5d6fv,TheRealMe99,"""No matter where they come from""  Really?  Will netflix shows be in Up Next?",11,1553536557.0
152,ejcs4ln,t3_b5d6fv,deleted,Did we REALLY need this?,10,1553536749.0
153,ejcsbki,t3_b5d6fv,AccountSave,Yeahhhhh I’m just gonna stick to Netflix ,9,1553536876.0
154,ejcsg9r,t3_b5d6fv,TroyAtWork,An hour later and the best part of the presentation is STILL the jumpsuit,10,1553536960.0
155,ejcswbd,t3_b5d6fv,thu22jun,Apple is gonna have to create another service to tie all their services together in one place. ,11,1553537248.0
156,ejct26n,t3_b5d6fv,gnarlnick,Apollo 13+?,8,1553537354.0
157,ejctcfj,t3_b5d6fv,That_One_Cool_Guy,Is this a full fucking length documentary?? What the fuck,8,1553537537.0
158,ejctfdj,t3_b5d6fv,scoot87,This whole promo is like one long Oscar award introduction,10,1553537589.0
159,ejcthum,t3_b5d6fv,siege342,Steve Jobs +,10,1553537635.0
160,ejctjl0,t3_b5d6fv,TroyAtWork,I hope Steven Spielberg makes a great tv series or film for AppleTV+ and then it doesn't get nominated for a single award because of his comments on streaming,11,1553537667.0
161,ejcto5w,t3_b5d6fv,buttholdestr0yer,How is Friends lady still so hot,10,1553537751.0
162,ejctq8i,t3_b5d6fv,misterzadir,this is giving SNL so much material ,10,1553537790.0
163,ejctqq3,t3_b5d6fv,YoloChopsticks,ANNOUNCE THE OFFICE REBOOT,11,1553537799.0
164,ejcu0na,t3_b5d6fv,darthjoey91,"You know what would be better than people describing their shows? Trailers, showing us what a show would feel like.",10,1553537979.0
165,ejcucrt,t3_b5d6fv,deleted,Here's a better way to do this: 15 second intro then a 2 minute trailer ,10,1553538199.0
166,ejcugzm,t3_b5d6fv,elephantnut,This is so freaking weird. Are they pitching us the shows? Did Apple force these people on stage??,10,1553538274.0
167,ejcv3yv,t3_b5d6fv,mgold215,There’s no way that this isn’t the worst Apple event of all time,10,1553538688.0
168,ejcv7tv,t3_b5d6fv,lakernation21,Waiting for Lebron James to be up next in line with his new show ,10,1553538759.0
169,ejcv94f,t3_b5d6fv,deleted,"Well, at least Apple has sold me to never buy their Apple TV+ service. ",9,1553538782.0
170,ejcvb30,t3_b5d6fv,scoot87,"I like how Netflix just puts stuff out, while Apple has to make a whole spectacle out of it. ",10,1553538818.0
171,ejcvcar,t3_b5d6fv,cheezymau5,damn this subscription really hasn’t impressed me at all,10,1553538840.0
172,ejcvm9t,t3_b5d6fv,Hammytime2007,sneak peak? that was a lecture 😂,10,1553539109.0
173,ejcw3mt,t3_b5d6fv,SalBeats,T O X I C   L A B O R ,9,1553539454.0
174,ejcwbfw,t3_b5d6fv,Isaythree,Dafuq was that aaaaaapppppllllle shit?!,10,1553539600.0
175,ejcwd3d,t3_b5d6fv,Matuteg,When I heard  Connected through AAAApppLEEEE my ears started bleeding,10,1553539630.0
176,ejcwdow,t3_b5d6fv,Lolkac,Tim apple did this event just to meet Oprah ,12,1553539642.0
177,ejcwgfr,t3_b5d6fv,StayGooked,"I'll pay for Aaron Paul and that Jason Mamoa show tbh. Aaron Paul is a huge draw, since he hasn't really been given the opportunity to act his ass of like he did in Breaking Bad.",10,1553539693.0
178,ejdi57z,t3_b5d6fv,Tunez13,Yawwwwwwwn,10,1553553722.0
179,ejcruqu,t3_b5d6fv,nvidiasuksdonkeydick,Where's the pornhub channel?,19,1553536571.0
180,ejcs4me,t3_b5d6fv,nateryland,Holy shit her voice...please. Calm down. ,21,1553536749.0
181,ejcu2op,t3_b5d6fv,AccountSave,"I’m telling you guys, this is a first year business course presentation done the night before. ",20,1553538015.0
182,ejcue4q,t3_b5d6fv,UnitedRoad18,Whoever approved this part is the presentation should be fired. It’s completely removed all momentum. ,19,1553538223.0
183,ejcw3ad,t3_b5d6fv,trycat,"Ha, remember when you thought a free U2 album was a bad idea?",19,1553539447.0
184,ejco1ac,t3_b5d6fv,AccountSave,"When you’re skydiving at 11, but have a presentation at 10. ",35,1553534129.0
185,ejct6cb,t3_b5d6fv,c_will,"The video is pretentious as fuck. You're making movies, not solving world hunger. ",55,1553537428.0
186,ejcqc57,t3_b5d6fv,kaze_ni_naru,"This whole presentation feels a bit Black Mirror-y idk why. It's like Apple wants to game every part of your life, from content you consume to finances.",27,1553535603.0
187,ejcp7qa,t3_b5d6fv,TroyAtWork,No jumpsuit  = no listen,19,1553534885.0
188,ejcwsr6,t3_b5d6fv,UncheckedException,Am I the only one trying to *lower* the number of subscription fees in my life? It’s like we’re moving steadily into some dystopian future where every piece of media we consume has been fractured off into some separate monthly charge to nickel and dime our budgets to death. ,18,1553539918.0
189,ejcr2zo,t3_b5d6fv,jrt3370,*cries in 16GB*,9,1553536075.0
190,ejcr955,t3_b5d6fv,Klynn7,"I gotta say, the Family Sharing all the things part of this presentation sounds nice.",7,1553536184.0
191,ejcrdlt,t3_b5d6fv,tomofthepops,"No pricing lol, that doesn't bode well. ",9,1553536265.0
192,ejcrrvl,t3_b5d6fv,whereyoufirstmetme,This is basically on-demand TV,7,1553536520.0
193,ejcrsqp,t3_b5d6fv,utechtl,"That's a pity, none of the actually channels I want to watch.",9,1553536535.0
194,ejcrxnl,t3_b5d6fv,IcelandicHumdinger,Will be funny if the Credit Card is the best product of this event  &#x200B;,9,1553536625.0
195,ejcs2is,t3_b5d6fv,gr8kamon,Let's dive in,8,1553536711.0
196,ejcs5i6,t3_b5d6fv,deleted,"OH NO, AUTOPLAY TRAILERS",8,1553536765.0
197,ejcs777,t3_b5d6fv,pk3maross,**THAT WAS SO EASY**,8,1553536794.0
198,ejcsb3f,t3_b5d6fv,theNEWgoodgoat,is it just me or is this speaker shouting?,9,1553536867.0
199,ejcseeu,t3_b5d6fv,thereturnofjagger,"find someone who supports you like that first dude who yells ""woo"" at every Apple keynote pause",10,1553536926.0
200,ejcspco,t3_b5d6fv,ThisOneTimeAtLolCamp,The biggest round of applause for a + in history. Lol,9,1553537123.0
201,ejcsr3v,t3_b5d6fv,HappyHolidays666,Jesus Christ+,10,1553537154.0
202,ejcsrbu,t3_b5d6fv,WeezyWally,Why is everyone cheering this? They don’t even know what it is. ,10,1553537158.0
203,ejcsrto,t3_b5d6fv,geodebug,"Protip: A ""+"" in the service name means you'll be paying $9.99/month",10,1553537167.0
204,ejcsw2u,t3_b5d6fv,burnertybg,ahhh black and white. must be great content,9,1553537244.0
205,ejcswc9,t3_b5d6fv,ValenOuteda,Spielberg likes streaming services now? ,7,1553537248.0
206,ejct5ni,t3_b5d6fv,deleted,Lol at all this.Could easily have been could condensed.,9,1553537415.0
207,ejctb1i,t3_b5d6fv,jack0rias,"Ok, overall this has been a very boring keynote.  The titanium credit card was the coolest bit of it.",9,1553537512.0
208,ejcte3s,t3_b5d6fv,deleted,[gelöscht],11,1553537566.0
209,ejcteis,t3_b5d6fv,burnertybg,ok these “woooooos” sound manufactured lol,11,1553537573.0
210,ejcth6a,t3_b5d6fv,philphan25,Whoa SS public appearance,8,1553537623.0
211,ejctqyg,t3_b5d6fv,LISSAGASM,Why all these people? lol,10,1553537804.0
212,ejctrgc,t3_b5d6fv,c_will,This is fucking terrible. ,9,1553537813.0
213,ejctt8j,t3_b5d6fv,Chrispy__Bacon,Threat Level Midnight 2?,9,1553537845.0
214,ejcttet,t3_b5d6fv,misterzadir,If Apple did E3.,8,1553537848.0
215,ejcu0sj,t3_b5d6fv,AhmedWaliiD,I swear I haven’t felt that much cringe for so long. ,9,1553537981.0
216,ejcu294,t3_b5d6fv,Paddy0furniture,"Is it just me, or are these show announcements cringy as hell?",10,1553538007.0
217,ejcu2dt,t3_b5d6fv,PicklesAnonymous,"I have a feeling of confusion, does that count ",9,1553538010.0
218,ejcu2ph,t3_b5d6fv,deleted,Theres meme material here. We just have to find it ,8,1553538015.0
219,ejcu3qp,t3_b5d6fv,Mezuzah,I think I am switching to Linux permanently. ,8,1553538034.0
220,ejcu43i,t3_b5d6fv,lilacd,"It was just Cringe, now it's Cringe XS Max.",10,1553538041.0
221,ejcu6vv,t3_b5d6fv,That_One_Cool_Guy,The people weren’t blind in Bird Box.. why the fuck is everyone acting like they were lmao,8,1553538091.0
