,Comment ID,Parent ID,Author,Body,Score,Created (UTC)
4656,ejctqlf,t1_ejctn95,IAmAnAnonymousCoward,Netflix I guess.,1,1553537797.0
4657,ejctrrx,t1_ejctn95,deleted,same here. Spielberg cryptically announced something and Aniston and Witherspoon have a daily talk show.,1,1553537819.0
4658,ejcu5s6,t1_ejcu18j,WastingMyTime2013,what happened to Apple Inc. in general? Sad!,1,1553538071.0
4659,ejcu4u4,t1_ejcu2j0,YipYepYeah,"Yes, clearly",3,1553538054.0
4660,ejcuwra,t1_ejcusrl,sjsharksfan12,"He's also changed his voice quite a bit over the years, and yes the last time I watched Big Bird was 30 years ago so I know I'm past expiration date. ",2,1553538557.0
4661,ejcv02q,t1_ejcuxt3,Chrispy__Bacon,"Mr. Tim Apple, I don't feel so good...",2,1553538617.0
4662,ejcv2nw,t1_ejcuzfx,watashiwaerudes,Apple Weed+,1,1553538664.0
4663,ejcv4f3,t1_ejcuzfx,iziizi,Because it’s so fucking boring I think we’ve all been drugged,1,1553538697.0
4664,ejcw8et,t1_ejcw0eg,S1owdown,it's a business what were you expecting?  ,1,1553539544.0
4665,ejcwmxz,t1_ejcw0eg,Klynn7,"Uh, what else would it be?",1,1553539813.0
4666,ejcwcqu,t1_ejcw4ht,kjm16,Amazon doesn't like that idea.,1,1553539624.0
4667,ejcx8su,t1_ejcwv2p,deleted,Yeah so there’s that,1,1553540215.0
4668,ejcwud0,t1_ejcws3q,JammyHendrix,"Lol they didn't even announce pricing. Get real, this was insanely bad",11,1553539948.0
4669,ejcx5n3,t1_ejcws3q,hatramroany,I'm disappointed by that unnecessarily overlong piss poor celebrity dog and pony show,3,1553540157.0
4670,ejcww0w,t1_ejcws3q,TheMacMan,Tim clearly said at the very beginning that today was all about services. Then they announce nothing but services and Reddit loses their shit as if they'd been promised something different.,8,1553539979.0
4671,ejcwvvi,t1_ejcws3q,MrPhopo,Too long presentation for Apple TV +. No pricing or release dates for most services.,4,1553539976.0
4672,ejcxasa,t1_ejcws3q,deleted,"It was just terrible, fanboy. Sorry.",1,1553540251.0
4673,ejcw4g2,t1_ejcw0zj,UnitedRoad18,"In a way yes, but as a presentation this “event” blows. ",2,1553539468.0
4674,ejcw4yz,t1_ejcw0zj,drunkspaniel,IKR this seems exactly like what we thought it was going to be like?,2,1553539479.0
4675,ejcw37y,t1_ejcw0zj,afelzz,I say to you this; where is AirPower ,2,1553539446.0
4676,ejcw8pl,t1_ejcw0zj,judgedeath2,A lot of people mad the content looks to have a pretty heavy “liberal” tilt. Anyone saying Steve would be rolling in his grave seem to forget he was the ultimate “liberal hippie”.  ,1,1553539549.0
4677,ejcw47h,t1_ejcw0zj,IThinkThings,These shows and announcements have literally been in the news for over a year. It's exactly what was expected. These people are just uninformed and cranky.,1,1553539464.0
4678,ejcxhxn,t1_ejcwzhj,deleted,[entfernt],5,1553540381.0
4679,ejcyho8,t1_ejcx1ks,spn2000,Did you enjoy it? ,1,1553541041.0
4680,ejcx9f4,t1_ejcx1ks,deleted,[gelöscht],1,1553540226.0
4681,ejcp2ys,t1_ejcoory,utechtl,"Cheaper than 2/3 scripts, depending on your zines. I'm just getting flashbacks to the Newstand apps where the magzines were glorified PDFs",1,1553534798.0
4682,ejcos0d,t1_ejcoory,MancMike,You’re literally saving $7990.01!,0,1553534603.0
4683,ejcu3i4,t1_ejcty5q,thelambdamale,i mean prime hbo hulu create their own content as well,1,1553538030.0
4684,ejcu4iz,t1_ejcty5q,theexile14,"Netflix has been clear they don't want to use anyone else's platform but their own, that's more a Netflix thing than an Apple one.",1,1553538049.0
4685,ejcvgts,t1_ejcv5ro,monkeyman80,the card is what gets me. they've wanted to get rid of physical cards. and 1% cash back isn't all that great.   2% with apple pay would be fine if it was accepted more places. in england any card reader can take android pay/apple pay but its so restricted here. ,1,1553538996.0
4686,ejcwi4a,t1_ejcwcrs,throwback3023,When it became a tech/status symbol cult........,3,1553539725.0
4687,ejcwj3m,t1_ejcwcrs,Thermocap,lmao people have been worshipping steve jobs for years,3,1553539742.0
4688,ejcwga7,t1_ejcwcrs,Kitten-Mittons,years ago,2,1553539690.0
4689,ejcwhzl,t1_ejcwcrs,deleted,Years ago,2,1553539722.0
4690,ejcx2p2,t1_ejcwcrs,watashiwaerudes,Next thing you know they’ll stop paying taxes ,1,1553540103.0
4691,ejcug1q,t1_ejcucvs,CarolinGallego,That was one of the most chilling documentaries I've ever seen. ,1,1553538257.0
4692,ejcxadp,t1_ejcx1c4,deleted,[gelöscht],2,1553540243.0
4693,ejcnp5t,t1_ejcnkwz,deleted,We don’t buy them because most of us are interested in only one or two articles per magazine. This idea is brilliant. I’ll be subscribing for sure.,1,1553533908.0
4694,ejcnp9r,t1_ejcnkwz,wasteplease,I do... but I’m old ,1,1553533910.0
4695,ejctse7,t1_ejctqyf,MeesterAndrew,woooo,3,1553537830.0
4696,ejctxsq,t1_ejctqyf,Joshua_P,Imagine hating on people for being excited for something they like.,1,1553537929.0
4697,ejcvngu,t1_ejcvld7,ozophe,Finally a comment I can upvote,2,1553539134.0
4698,ejcnuts,t1_ejcnqdi,DebrahRunner,How so?,1,1553534011.0
4699,ejcozzs,t1_ejcoy7z,sjsharksfan12,It's apple and Tim Cook is like a god to tech nerds?  ,1,1553534745.0
4700,ejcp0op,t1_ejcoy7z,TooMuchBroccoli,Yea. That's in the contract they signed. ,0,1553534757.0
4701,ejcp2ka,t1_ejcoy7z,Witzler,Maybe there are many apple employees? Maybe there are many hardcore apple fans. I'm wondering the same,0,1553534791.0
4702,ejcqi8n,t1_ejcqh2u,jamesk93,😂,1,1553535710.0
4703,ejcqx3l,t1_ejcqszo,jdbrew,Kids. But thats it. I don't want to waste my most valuable resource (battery) on video games during the day. ,2,1553535972.0
4704,ejcr0jv,t1_ejcqszo,TroyAtWork,"Only puzzle games here, and rarely. Nothing real-time with touchscreen controls.",2,1553536032.0
4705,ejcqule,t1_ejcqszo,jimbo831,I play Clash Royale a lot. It’s not my primary gaming platform though. ,1,1553535928.0
4706,ejcr4gz,t1_ejcqszo,Priddee,"With the revenues some mobile games are pulling in, I think it's a resounding yes. ",0,1553536102.0
4707,ejcs1tz,t1_ejcrz7p,BeerMeUpToo,Knowing Apple it'll still be PG-13 and they'll keep their clothes on at all times. ,3,1553536699.0
4708,ejcs1ca,t1_ejcrz7p,f00gers,They don’t even allow swearing on beats one 😂,1,1553536690.0
4709,ejcs4oy,t1_ejcrz7p,nvidiasuksdonkeydick,Their only app that won't store data on your phone itself,1,1553536750.0
4710,ejctacr,t1_ejcsut8,klaykid123,TV Max,1,1553537500.0
4711,ejct8jl,t1_ejct1c0,YipYepYeah,Ron Howard does great storytelling ,1,1553537467.0
4712,ejcuomg,t1_ejcu1s2,izucantc,Lmao,1,1553538411.0
4713,ejcwwrg,t1_ejcwrlg,HLef,"Probably not for a while. Does Goldman Sachs even have the ability to operate something like that outside the US?  The whole MasterCard thing is fluff, really. It just means Americans who are traveling will be able to use it wherever MC is accepted.",1,1553539992.0
4714,ejcwt7k,t1_ejcwrlg,airtraq,Or anywhere apart from US,0,1553539927.0
4715,ejcwyi1,t1_ejcwwn2,airtraq,Should have been a press release. Or wait,3,1553540024.0
4716,ejcufde,t1_ejcuaib,x2040,It becomes very apparent who’s under the age of 25 here.,4,1553538245.0
4717,ejcubeg,t1_ejcuaib,warmapplejuice,Stop,-3,1553538174.0
4718,ejcrnzp,t1_ejcrmvy,ThorTheWiseCracker,Lmao,2,1553536452.0
4719,ejcvqvh,t1_ejcvpx8,benc777,Imagine lol ,5,1553539204.0
4720,ejctfrs,t1_ejcte1k,MS6_Boost,Prepare for the haters.,4,1553537596.0
4721,ejctf1s,t1_ejcte1k,pintossbm123,It was shit,1,1553537583.0
4722,ejctgj3,t1_ejcte1k,thelawtalkingguy,Dope like crack without the high or addiction ,-1,1553537610.0
4723,ejctgyr,t1_ejctef2,Court_esy,That guy Steven Spielberg you mean?,1,1553537618.0
4724,ejcwzln,t1_ejcwloj,CrimsonEnigma,"Apple Watch, AirPods, laptops without shitty displays...",1,1553540045.0
4725,ejcwofr,t1_ejcwloj,deleted,A pencil lol,2,1553539839.0
4726,ejcutc2,t1_ejcuqpc,FuturePreparation,"If you don't feel like roasting this, you are not human.",2,1553538496.0
4727,ejcuq1t,t1_ejcunqq,Danielvonluchau,"..... what? How is any of this pandering, pretentious or holier than thou?",-1,1553538437.0
4728,ejcnxtw,t1_ejcnqyw,jimbo831,$9.99 just for news according to all the leaks. ,1,1553534065.0
4729,ejcspkr,t1_ejcsijd,deleted,iTunes purchases. ,1,1553537127.0
4730,ejcu7wh,t1_ejcu6l1,mgcf1,Stop watching?,3,1553538110.0
4731,ejcv3jy,t1_ejcv0cw,deleted,[gelöscht],1,1553538680.0
4732,ejcvvi2,t1_ejcvsa7,Dr_Findro,You’re a weirdo man haha ,1,1553539297.0
4733,ejcxw2j,t1_ejcwz9z,riepmich,I’m waiting for JerryRiggEverything to carve a pumpkin in it.,1,1553540644.0
4734,ejcpdzs,t1_ejcozkw,ukplaying2,Well technically many of them won't have a monthly subscription plan in print and will cost even more if you are buying a single copy without a subscription.,1,1553534997.0
4735,ejcprax,t1_ejcplc7,theexile14,"I mean, 2% is pretty solid. It matches the Citi and USAA top end cashback cards and is higher than anything Chase offers.",1,1553535237.0
4736,ejcr4we,t1_ejcqy7i,HEATCHECK77,*cries in a pained pretension*,2,1553536109.0
4737,ejcnldk,t1_ejcnjr2,ken27238,Do you not have paper?,0,1553533841.0
4738,ejcnuzp,t1_ejcnrp5,Xerxster,I like the entertainment magazines for interviews.,-1,1553534014.0
4739,ejctmtd,t1_ejctfgw,Bathplug,It’s all very pretentious. ,3,1553537726.0
4740,ejctk95,t1_ejctfgw,plsdontattackmeok,"As I’m weeb, can confirm.",2,1553537680.0
4741,ejcu9p4,t1_ejcu3to,holderORfolder,Now they are just trying to get a slice of the reoccurring payments pie.,2,1553538143.0
4742,ejcusa6,t1_ejcuq7x,politisaurus_rex,No lol. My family has been in the US since the late 1500s  So I’m a child of a child of a child of a child...of a child of an immigrant ,2,1553538476.0
4743,ejcurwl,t1_ejcuq7x,thelawtalkingguy,No ,2,1553538470.0
4744,ejcutyz,t1_ejcuq7x,Begby1,I am native american.  There are a few of us still around that were not killed off.,1,1553538507.0
4745,ejcuu6r,t1_ejcuq7x,UCLAEngineerDumbDumb,Presumably first gen immigrants.,1,1553538511.0
4746,ejcutob,t1_ejcuq7x,TacoChowder,"Sure, but first generation are different than multi.",0,1553538502.0
4747,ejcvofc,t1_ejcvnez,wolfahmader,100 and still not mine ): ,0,1553539153.0
4748,ejcpm1n,t1_ejcph6w,frogmaskedchild,Why is this shit so exciting to me haha. Starting to feel a bit old.,2,1553535141.0
4749,ejcpq6w,t1_ejcph6w,TunerOfTuna,"It’s been like this for years. I wouldn’t say the tech has hit a plateu, but there just isn’t enough to warrent events this long. Even the phone and computer ones have. ",2,1553535217.0
4750,ejcs9ld,t1_ejcph6w,sethoftheyear,Jesus. Then don’t watch it. We all knew what this was going in.,0,1553536839.0
4751,ejcthmd,t1_ejcteny,FanofK,"Yeah wish they would just get to the point, but this has become such a big marketing event for them that they cant.",1,1553537631.0
4752,ejcvxr2,t1_ejcvui0,Imlookingtotalk,Agreed. Upgrading to a Samsung tomorrow ,1,1553539339.0
4753,ejcw7bq,t1_ejcw4fn,TheMacMan,Goodbye. Don't let the door hit ya on the way out.,2,1553539523.0
4754,ejcw6tn,t1_ejcw4fn,FanofK,no it does not.,1,1553539514.0
4755,ejcuiqu,t1_ejcu9d7,jamesk93,Because it’s incredibly forced and over the top,2,1553538305.0
4756,ejcudfr,t1_ejcu9d7,BigBlueNY,No one wants to hear what turned out to be pitches of TV shows. Bring on some trailers.,2,1553538211.0
4757,ejcueep,t1_ejcu9d7,francesco11111,Because we don’t fucking care about the actors. If you want hype for your Tv-show just show us the goddam trailers,2,1553538228.0
4758,ejcuqew,t1_ejcuevr,CleverBandName,"indeed, i shall go watch anime now",1,1553538443.0
4759,ejcxfgt,t1_ejcwiqw,deleted,Here’s a fun game; try to spot ANY white men in ANY Apple marketing,1,1553540335.0
4760,ejcwn8u,t1_ejcwiqw,deleted,[gelöscht],1,1553539818.0
4761,ejcwt73,t1_ejcwp1b,B0rax,Well it was a software keynote to begin with.,8,1553539926.0
4762,ejcwraq,t1_ejcwp1b,Rahkiin_RM,Then don’t watch the services presentation,13,1553539892.0
4763,ejcwu3r,t1_ejcwp1b,sneekerhad,"But that's not what this event was about. It's why they released hardware last week. Same with WWDC event btw. You're just going to see software updates and features, and hardly ever any new hardware.",1,1553539943.0
4764,ejcwyvr,t1_ejcwp1b,bourbonburn,Why not both? This wasn't a hardware conference.,1,1553540031.0
4765,ejcq70r,t1_ejcq45t,Shriman_Ripley,Credit cards are not going to create credit bubble but your concerns are valid.,3,1553535515.0
4766,ejcq7e7,t1_ejcq45t,deleted,Lol it’s called being a responsible adult ,7,1553535521.0
4767,ejcqcsd,t1_ejcq45t,Mystikal6700,Too bad I pay over my balances every month :P,2,1553535614.0
4768,ejcq65m,t1_ejcq45t,25ina35,Which is why apple is releasing it. They need more $$$,1,1553535500.0
4769,ejcnqwb,t1_ejcn3bn,jack0rias,Maybe Common Projects or Axel Arigato? I can't see them that well,1,1553533940.0
4770,ejcncep,t1_ejcnb55,f00gers,Aka me and my dog,8,1553533681.0
4771,ejcnymk,t1_ejcnw60,AirF225,"You dont say, they just started talking about it for the first time",1,1553534079.0
4772,ejcon2q,t1_ejcoi8d,r4bbl3d4bbl3,"Hoping for something like this, I am getting tired of all my subscriptions being on different services. ",2,1553534516.0
4773,ejcomdz,t1_ejcojuh,nobabeimnotonreddit,wah,-1,1553534504.0
4774,ejcoubp,t1_ejcosnk,atheoncrutch,Finally!,0,1553534644.0
4775,ejcp3wd,t1_ejcp29b,julinay,Super interested but so many questions.,1,1553534815.0
4776,ejcpjus,t1_ejcp29b,whitecleats,"They've started installing NFC readers in some stations, so I'm sure this is all beta before switching over all the turnstiles",1,1553535102.0
4777,ejcp6vd,t1_ejcp29b,Nolemretaw,Unless Apple is going to provide the readers. Which probably won’t happen. ,0,1553534869.0
4778,ejcp9j6,t1_ejcp4r7,quaitheoftheeast,Bank of America is good  and so is Wells Fargo iirc,1,1553534916.0
4779,ejcpz5l,t1_ejcpuek,deleted,Real honest group of people.  The best.,2,1553535377.0
4780,ejcq3zc,t1_ejcpuek,m1207,forgot the /s,1,1553535462.0
4781,ejcpzbk,t1_ejcpvi4,barronflux,same I think ,1,1553535380.0
4782,ejcqgj3,t1_ejcqf9l,njgreenwood,Apple Card XS Max - it's their black card.,5,1553535679.0
4783,ejcqoa8,t1_ejcqmzf,deleted,[gelöscht],0,1553535818.0
4784,ejcqqvp,t1_ejcqozi,LS_DJ,Depends on the games I suppose. ,1,1553535863.0
4785,ejcqtjh,t1_ejcqozi,taubut,"Neither, they are never a good value.",1,1553535910.0
4786,ejcrhs1,t1_ejcrg3p,airtraq,Like Michael Jacksons’ Neverland?,1,1553536342.0
4787,ejcrnj5,t1_ejcrgy7,QuitSplash,They mentioned multiplayer several times,1,1553536444.0
4788,ejcscnw,t1_ejcrsxw,BrunchIsAMust,No Cox,1,1553536896.0
4789,ejcsje0,t1_ejcsggl,TheAlmightyZach,No.. This is worse. This just bundles services like Netflix (but not Netflix) in one place.,3,1553537016.0
4790,ejcssl0,t1_ejcsggl,WastingMyTime2013,only 3 times the monthly cost!,1,1553537180.0
4791,ejcspfd,t1_ejcshvd,WastingMyTime2013,"they're all pretty bad, just not natural at all. even Tim Cook isn't the best but best of the lot. tough going from Steve Jobs as a presenter to anyone else I guess. Public speaking and presentations are not easy but they just need to not obviously be reading from a script. ",1,1553537124.0
4792,ejcsp2u,t1_ejcsjx9,terminaldetective,The Tech-Wars just moved to a next level. ,1,1553537118.0
4793,ejct26y,t1_ejcsypc,YipYepYeah,What? ,1,1553537354.0
4794,ejctnno,t1_ejctlh5,terminaldetective,No XXX tho.,1,1553537742.0
4795,ejcu87t,t1_ejcu7ep,Chrispy__Bacon,...no,2,1553538116.0
4796,ejcubef,t1_ejcu7ep,manamono,"Nope, unless you are into pointlessly long videos that don't add anything to what they were launching",2,1553538174.0
4797,ejcu8ko,t1_ejcu7ep,ninjadinogaming,"Not sure, everything’s very confusing. ",1,1553538123.0
4798,ejcu9dp,t1_ejcu7ep,Since88,Oh boy. Whos going to tell him?,1,1553538137.0
4799,ejcu9po,t1_ejcu7ep,Imlookingtotalk,"Yep, Apple stocks dropping around 10%",0,1553538143.0
4800,ejcuvwb,t1_ejcusne,likeastar20,Fitting name ,2,1553538542.0
4801,ejcv10u,t1_ejcuyja,deleted,*facepalm*,1,1553538634.0
4802,ejcv1s8,t1_ejcuyja,nvidiasuksdonkeydick,Probably trying to find a necromancer who can deal with the repercussions of bringing him back,1,1553538648.0
4803,ejcvhj7,t1_ejcvcg9,TunerOfTuna,What do you mean fad? This has been going on for decades. ,1,1553539011.0
4804,ejcvhph,t1_ejcvcg9,TheMacMan,Then turn it off and go do something else. No one is putting a gun to your head and forcing you to watch and complain.,1,1553539014.0
4805,ejcvviz,t1_ejcvs3g,kilobitch,It would never fly at anything close to that. I’m guessing $10-15. ,1,1553539298.0
4806,ejcx2xs,t1_ejcwtpd,hatramroany,What's the price?,1,1553540107.0
4807,ejcur4g,t1_ejcup0p,SilverDuckie11,You are crying about people crying.,1,1553538457.0
4808,ejcupjy,t1_ejcup0p,123choji,Yeet,2,1553538428.0
4809,ejcwubz,t1_ejcwrdt,Bieb,Idk what you're talking about. All of these services are in touch for what everyone wants outside of this sub.,0,1553539948.0
4810,ejcnh2j,t1_ejcnanv,sjsharksfan12,"I do, but I wish Siri would respond to Google Maps.  That will never happen though.  Apple doesn't want to give Google the satisfaction. ",2,1553533763.0
4811,ejcnfrv,t1_ejcnanv,deleted,I do LOL,1,1553533740.0
4812,ejcnea7,t1_ejcnanv,deleted,i do because it gives me directions on my watch automatically,1,1553533713.0
4813,ejcnf5n,t1_ejcnanv,phinnaeus7308,"I started using it while trying to de-google, it's not that bad. ",1,1553533728.0
4814,ejcnb8k,t1_ejcnanv,poopnugget998,I do :(,0,1553533659.0
4815,ejco126,t1_ejcnuwv,climbingrocks2day,I said that out loud in my best droid voice!,2,1553534124.0
4816,ejcoe68,t1_ejco4p4,jangxx,"But magazines are not really about news, they're more like written documentaries. If the articles have no value a few days after they come out, they're just bad articles.",1,1553534358.0
4817,ejcogz7,t1_ejco4p4,Xerxster,"Monthly magazines never were for news, your argument that they are not current enough would be true even a hundred years ago. Magazines are more for more in-depth articles days or weeks after the news has happened.  ",1,1553534406.0
4818,ejcoav2,t1_ejco5wk,deleted,I can't believe they're opening with this. ,2,1553534299.0
4819,ejcojjm,t1_ejcofdf,copswithguns,He looks like a painter. ,1,1553534453.0
4820,ejcpdgd,t1_ejcp8yt,alttabbins,Vendors are going to start putting prices into a calculator instead of having price tags on items.,1,1553534987.0
4821,ejcqexh,t1_ejcqb6m,deleted,Neither are credit cards. So different market anyways ,1,1553535651.0
4822,ejcso6x,t1_ejcsk14,geodebug,Arcade might keep it alive for some.,1,1553537102.0
4823,ejcsozz,t1_ejcsk14,BadGuyCraig,APPLE TV+ Straight from the heavens brother!,1,1553537117.0
4824,ejcsp10,t1_ejcsk14,treasy2,Dolby atmos,1,1553537117.0
4825,ejct85j,t1_ejcsk14,Exist50,"Why? You have more choice now, and it'd likely push down the prices of Apple TV.",1,1553537460.0
4826,ejcw0cf,t1_ejcvyxj,mharms1,That weird one that came out last year,1,1553539390.0
4827,ejcw5lm,t1_ejcvyxj,TheBalm,She’s a two time Oscar nominee. https://www.imdb.com/name/nm0001856/,1,1553539491.0
4828,ejcwaa8,t1_ejcvyxj,ccooffee,She's probably had more of a cultural impact than any movie.,1,1553539578.0
4829,ejctlvg,t1_ejctj5f,Cossil,Speak for yourself— this is way more interesting. ,1,1553537709.0
4830,ejctm4b,t1_ejctj5f,Logseman,They want other fans.,1,1553537714.0
4831,ejctmlp,t1_ejctj5f,TunerOfTuna,That is later this year. They always have two events. ,1,1553537723.0
4832,ejctqhf,t1_ejctj5f,Smorfar,They already released all of that,1,1553537795.0
4833,ejcqbli,t1_ejcq95y,dfiorentine7005,How so?,1,1553535594.0
4834,ejcwv9l,t1_ejcwr21,Mato13,"Makes sense. They are trying to get people used to using Apple Pay more. If you’re at target for example, you’re better off using Apple Pay then the actual card",5,1553539965.0
4835,ejcx0o1,t1_ejcwr21,HLef,"Probably trying to push adoption in the US. Make people want to use their phone/watch over a card. Elsewhere in the world, you can already tap your phone/watch pretty much everywhere.",1,1553540065.0
4836,ejcnn36,t1_ejcnkf8,deleted,These events usually are full of Apple employees so they clap at everything and anything.,5,1553533871.0
4837,ejcolsu,t1_ejcol9p,T3CH--SUPP0RT,yup,3,1553534493.0
4838,ejcou1m,t1_ejcol9p,BenovanStanchiano,It's embarrassing,3,1553534639.0
4839,ejcpm0c,t1_ejcpf7y,Nolemretaw,The fine print should reveal who is backing the card. Doubt Apple has stood up a bank with out someone would have leaked/posted that online ,2,1553535141.0
4840,ejcqfgq,t1_ejcpf7y,holderORfolder,Nope. They are partnering up with a bank.,1,1553535661.0
4841,ejcphmm,t1_ejcpf7y,It-Wanted-A-Username,Gotta use those $300 billion sitting in the bank somewhere,0,1553535062.0
4842,ejcqvs2,t1_ejcqtnf,25ina35,Besides their offshore bank accounts! lol,2,1553535949.0
4843,ejcqzhz,t1_ejcqtnf,jangxx,Sad but true.,0,1553536014.0
4844,ejcru1y,t1_ejcrr3d,Riguar,good thing this will be also US only,2,1553536559.0
4845,ejctwrd,t1_ejctu9u,RealisticCount,But not very far from the tree,0,1553537909.0
4846,ejcu1db,t1_ejctyu6,chaiscool,Millionaire with yes man,1,1553537991.0
4847,ejcvcs8,t1_ejcvais,r4bbl3d4bbl3,Don't you know everyone here is entitled to a perfect presentation that appeals to them in every personal way? Just stop watching something you don't like? How will I know what to complain about then?,1,1553538896.0
4848,ejcwj2y,t1_ejcwdae,misterzadir,"It's this burning sense of ""...can it get worse?""",1,1553539742.0
4849,ejcwq3g,t1_ejcwjsy,bitman_moon,Me too. This jaw dropping intro and then Oprah. Dafuq?,1,1553539870.0
4850,ejcwtgn,t1_ejcwjsy,turn-down-for-what,100% I was thinking the same thing lol,1,1553539932.0
4851,ejcxrhb,t1_ejcwl45,deleted,"He was so over it. They could have had an actually good event if they did their hardware announcements, instead of slowly rolling those out the week before. Steve Jobs is rolling in his grave.   ""Ok, we're gonna pay a bunch of celebrities to make a bunch of shows, that thing hollywood has done for the last 100 years."" eff off Apple.",2,1553540558.0
4852,ejcwsd8,t1_ejcwm2t,TheMacMan,"Apple stock price drops a bit after every single keynote. Even when they announced the original iPhone it went down. There has never been a keynote where stock price went up, no matter what was announced.",3,1553539911.0
4853,ejcyqrf,t1_ejcx00r,Evo-L,"I dont think it will ever happen. iMessage is more than a blue text, its a way to show others you're an apple user. ",1,1553541206.0
4854,ejcqh57,t1_ejcqeiw,TheKharmeleon,Apple is an American company. Get over it. ,3,1553535690.0
4855,ejcrcvp,t1_ejcrauh,aBstraCt1xz,I’ve got some bad news for you. ,2,1553536251.0
4856,ejcrdbx,t1_ejcrauh,BadGuyCraig,Suck you into the ecosystem. ,2,1553536259.0
4857,ejcrfwn,t1_ejcrauh,deleted,Do you think you have to subscribe to this? Just continue to normally purchase games. Crazy!,1,1553536307.0
4858,ejcri86,t1_ejcrauh,BaconIsHappiness,"i dont think this is such a bad thing, xbox has seen massive success with its gamepass, which is essentially the same thing, if the price isn’t ridiculous i think this could be really cool",1,1553536350.0
4859,ejcu8tm,t1_ejcu79s,DrGiggleFr1tz,Lmfao,3,1553538127.0
4860,ejcub4q,t1_ejcu79s,izucantc,Lol,3,1553538169.0
4861,ejcubll,t1_ejcu79s,Klynn7,Get out.  He's great in Silicon Valley.,0,1553538178.0
4862,ejcoolg,t1_ejcnv70,deleted,I wonder if the magazine companies put that in the deal that they’d have to make a video like that lol,1,1553534543.0
4863,ejcopff,t1_ejcojo5,Samamaniac,"lmao how on earth would news not be ""human curated""?? Are you waiting for AI to decide before you look at nytimes.com ?",3,1553534557.0
4864,ejcp1hy,t1_ejcojo5,BenovanStanchiano,So you only read articles written by bots?,1,1553534772.0
4865,ejctxl6,t1_ejctsc4,elephantnut,"Yes, they’re actors it’s what they do",0,1553537925.0
4866,ejcv95y,t1_ejcv3yz,Frosty1887,"It’s a valuable skill that encourages critical thinking and has shown in studies to help children, if there was any takeaway that was valuable in this train wreck it was that. ",1,1553538783.0
4867,ejcvwjw,t1_ejcvu3y,koolaidman1030,*puke mode engaged*,1,1553539317.0
4868,ejcwt1u,t1_ejcwoqf,qxzv,The services will be successful even if the presentation was terrible.,-2,1553539924.0
4869,ejcwpw2,t1_ejcwnux,rnarkus,So what was expected?   Lol some of you people,13,1553539866.0
4870,ejcwvm5,t1_ejcwnux,CrimsonEnigma,"Apple: “We’re having a presentation about upcoming services!”  Reddit: “Oh boy, I can’t wait to see all the hardware they’re going to announce!”",6,1553539971.0
4871,ejct13t,t1_ejcsxqe,jacopojjj,"Yeah, always like this ",3,1553537335.0
4872,ejctbbd,t1_ejcsxqe,fantasticum,"I think it matches this Apple event pretty nicely, though. Perhaps the worst Apple event ever.  ",1,1553537517.0
4873,ejcmr8n,t1_ejcmmai,Tlr321,Listomania by Phoenix is what played right before the event started,3,1553533286.0
4874,ejcn1bx,t1_ejcmmxf,deleted,[gelöscht],1,1553533475.0
4875,ejcmw28,t1_ejcmtbi,ken27238,Not happening.,2,1553533375.0
4876,ejcn2xi,t1_ejcmtbi,kungfugilly,lmfaoo,1,1553533504.0
4877,ejcnujn,t1_ejcn4cu,IAmSunken,Heyy i'm not alone lol  &#x200B;,1,1553534006.0
4878,ejcnz8j,t1_ejcnxlg,luckycharmxs,Your name XDDDDDDDDDDDDDDDDDDDDDDDDDDDDDD,-1,1553534090.0
4879,ejco101,t1_ejcnzn9,Logseman,He’s excited.,1,1553534123.0
4880,ejcouz7,t1_ejcoqyw,alttabbins,"What a dumb idea, a bunch of Magazines? Who reads magazines anymore? Wall Street Journal? I consider ramen an investment... Wait, a free month? I'm in.",1,1553534655.0
4881,ejcp1vc,t1_ejcoz1s,prpfl,So annoying. ,2,1553534779.0
4882,ejcp665,t1_ejcp3ho,chaiscool,You know what they say about guys with big hands...,2,1553534856.0
4883,ejcp7ii,t1_ejcp3ho,Isaythree,...you mean Tim apple?,2,1553534880.0
4884,ejcpmzn,t1_ejcpk7r,dmodavid,200iq play lol,1,1553535159.0
4885,ejcpt8u,t1_ejcpqbo,25ina35,You can get rotating 5% tho,1,1553535272.0
4886,ejcq46f,t1_ejcpqbo,luckycharmxs,Chase is still worth it if you have CSP/CSR because you get UR points which are more valuable than 2% cash back.,1,1553535466.0
4887,ejcqjih,t1_ejcq1vh,taubut,Never sadly.,1,1553535732.0
4888,ejcqd0q,t1_ejcqbbf,Stephs_mouthpiece,It’s titanium ,2,1553535617.0
