Unnamed: 0,Comment ID,Parent ID,Author,Body,Score,Created (UTC)
2856,g8pug2t,t1_g8psohx,dranide,guy comment repli,3,1602614235.0
2857,g8pvyzl,t1_g8pssd5,Hybridxx9018,dude exact boat x crack camera face scanner batteri much quicker year,2,1602614999.0
2858,g8pujmu,t1_g8pssd5,dranide,idk real big phone small phone tablet home everyday phone batteri health,1,1602614283.0
2859,g8punex,t1_g8puckl,dranide,weird flex,5,1602614337.0
2860,g8q9loq,t1_g8pymfg,j1h15233,terribl option futur last year upgrad,1,1602621638.0
2861,g8qbxxy,t1_g8pvllp,theonehodge,sure uk third parti job case awar,1,1602622616.0
2862,g8prufm,t1_g8prs49,JulioCesarSalad,passcod pain ass,4,1602612943.0
2863,g8r9btg,t1_g8qpphh,docbauies,physic constraint reason pro,3,1602640741.0
2864,g8q153p,t1_g8pu96g,Elliro02,wow disappoint,14,1602617569.0
2865,g8q4rup,t1_g8pu96g,Julia_Child,sensor huge deal imag qualiti lowlight condit ask dslr crop sensor full sensor,20,1602619393.0
2866,g8qaqsd,t1_g8pu96g,shannister,whole pro rang max featur way phablet thank,10,1602622115.0
2867,g8qk901,t1_g8pu96g,cptsir,max one sensor stabil,4,1602626705.0
2868,g8qgeu1,t1_g8pu96g,frockinbrock,yeah room,2,1602624653.0
2869,g8q6fkt,t1_g8q53vw,Bhawk-11,lot stuff simpl effici easi way cabl port yank singl laptop manufactur peopl attitud one limb brand connector laptop current standard laptop connector fine snapon magnet power adapt point failur magsaf record reliabl open sourc entir industri notch,16,1602620228.0
2870,g8qybox,t1_g8q53vw,blue_nylon,patent electr connector magnet,3,1602634651.0
2871,g8qifdo,t1_g8q2rlk,kw2024,okay penni ipad,1,1602625717.0
2872,g8pronh,t1_g8prmmm,Gen7isTrash,noic,-1,1602612865.0
2873,g8psbdb,t1_g8prn7n,Laty69,planet charger,64,1602613177.0
2874,g8ptc5m,t1_g8prn7n,GreenBlueSeduce,iphon brick link issu,43,1602613683.0
2875,g8ptdnl,t1_g8prn7n,IMakeApps,fine vs watt peopl,9,1602613703.0
2876,g8pt47d,t1_g8prn7n,epsiblivion,amazon,7,1602613572.0
2877,g8ptaci,t1_g8prn7n,admljhnsn,macbook one phone,12,1602613657.0
2878,g8ptevs,t1_g8prn7n,freeiphonexcase,shitti peopl usbc wall plug,6,1602613720.0
2879,g8ptqej,t1_g8prn7n,leviwhite9,charg cabl stuff,3,1602613876.0
2880,g8pu8nw,t1_g8prn7n,Javild,valu accessori iirc due box size price,3,1602614132.0
2881,g8q2iqj,t1_g8prn7n,ru_benz,charger,3,1602618267.0
2882,g8ptseq,t1_g8prn7n,the5headpepega,unreason,2,1602613904.0
2883,g8pvxlz,t1_g8prn7n,Sergeant--Tibbs,rich,2,1602614979.0
2884,g8qqo83,t1_g8prn7n,MajorWipeout,pd brick,1,1602630245.0
2885,g8u4hpt,t1_g8prn7n,Alexhasskills,one,1,1602710505.0
2886,g8q9rb5,t1_g8q6zlm,xvxvxvxvxvxvx,futur faster brick usbc cabl dollar usbc brick old usba dollar,12,1602621700.0
2887,g8qh0hw,t1_g8q6zlm,alex2003super,android devic c cabl time,0,1602624967.0
2888,g8q2poz,t1_g8pv3vs,OptimusLemon,bullshit usbc europ,1,1602618362.0
2889,g8qdj8c,t1_g8pv3vs,InevitableWords,charger end mandatori part right phone end usbclightn mean eu reg,1,1602623289.0
2890,g8pv9lg,t1_g8ptqbt,lachlanhunt,usbc comput year mani peopl avail power brick usd similar parti charger,9,1602614643.0
2891,g8pzotd,t1_g8ptacl,compounding,ship cabl devic ewast standpoint reduct cabl iphon user cabl extra wast port,5,1602616851.0
2892,g8pvrsz,t1_g8psrwv,gt4rs,android user ok googl usb c brick year samsung flagship sure midrang,4,1602614899.0
2893,g8qb4v2,t1_g8pvpmv,SaskatchewanSteve,cabl brick abl advantag fast iphon old brick,2,1602622278.0
2894,g8qb7qm,t1_g8pvkyo,SaskatchewanSteve,nice cabl iphon,2,1602622311.0
2895,g8q4dig,t1_g8pzlsm,hoti0101,littl annoy pair headphon claim green cost primari driver usb cabl piss charger headphon cheap minor ecosystem,2,1602619194.0
2896,g8q89jb,t1_g8pzzml,jan386,iphon pro,1,1602621085.0
2897,g8ptbnt,t1_g8ps64p,DreadnaughtHamster,magnet ram,5,1602613676.0
2898,g8q3kgj,t1_g8ps64p,jsphillips86,conspiraci nightmar,3,1602618791.0
2899,g8ps3jb,t1_g8prpvf,peanuty_almondy,rwoosh,3,1602613069.0
2900,g8pvbaf,t1_g8puoyx,merrlyne,flew head,3,1602614667.0
2901,g8pw3y7,t1_g8pucfq,deleted,,0,1602615067.0
2902,g8q7d7n,t1_g8ps735,cicuz,funni,1,1602620688.0
2903,g8qhtbb,t1_g8ps735,JOHNFARNSWORTH,ah man wish year,1,1602625392.0
2904,g8qdo5g,t1_g8qb275,Endemoniada,fair camera mirrorless principl nice heavi glass big highqual sensor mirrorless camera camera phone term mirrorless camera system dslr class mirrorless mani differ class camera devic,5,1602623347.0
2905,g8pwjl7,t1_g8pw8tv,Quack66,blame op popup origin pictur,3,1602615282.0
2906,g8r40xv,t1_g8qa5zd,gundamfan83,thank,0,1602637810.0
2907,g8psnj7,t1_g8ps15g,SPACExCASE,v r n,22,1602613342.0
2908,g8vo6em,t1_g8qhe7f,_ilf04_,happi cake day,2,1602747732.0
2909,g8pu2hd,t1_g8ptmhf,aka_liam,ah hang usbc lightn cabl phone,7,1602614046.0
2910,g8ptifg,t1_g8pt2uk,That0nekid1,,11,1602613767.0
2911,g8pypfa,t1_g8ptqik,Dood567,,2,1602616361.0
2912,g8q439l,t1_g8pvbur,myrisotto73,moto phone,2,1602619052.0
2913,g8pw1v2,t1_g8pvw3d,Pretagonist,home time day wifi edg,13,1602615039.0
2914,g8qoefu,t1_g8pvw3d,SpoopyCandles,problem network time scenario network rang vice versa issu citi phone batteri life bad potenti custom mini action bother,1,1602628935.0
2915,g8pwpln,t1_g8pvxc0,Jkins20,comparison page ecomiphonecompar pro max hour video playback,10,1602615365.0
2916,g8pwrd4,t1_g8pvxc0,vvashington,comparison page pro max estim speak model,3,1602615390.0
2917,g8pz9me,t1_g8pxwko,thisistherubberduck,,2,1602616640.0
2918,g8qa9aw,t1_g8pxfk9,oak_nuggins00,mask timr,6,1602621912.0
2919,g8puo5n,t1_g8pu2sg,AdHistorical3130,free bumper case,8,1602614347.0
2920,g8s7rmj,t1_g8qgueg,BA_calls,model lot us mobil local sim,1,1602671146.0
2921,g8q1xw0,t1_g8q176j,elessarjd,yeah standpoint dumb move lot peopl move android generat android phone usbc power brick case cabl,14,1602617975.0
2922,g8q30pq,t1_g8q176j,ICantPCGood,usb typec charger typea wall wart phone year,4,1602618514.0
2923,g8qpc4p,t1_g8q176j,Horong,android power brick usb c,1,1602629479.0
2924,g8pwtwt,t1_g8pwrgl,Benay148,usb,-4,1602615425.0
2925,g8pzlpp,t1_g8pud4d,TheEmeraldDoe,qualiti transit bit long,12,1602616809.0
2926,g8pydlv,t1_g8pud4d,This_was_hard_to_do,part fun product valu,5,1602616195.0
2927,g8ql3ro,t1_g8pud4d,thatsoundright,hereditari,2,1602627175.0
2928,g8pt6f0,t1_g8ps5ss,ravepeacefully,offens investor care care money public sentiment execut stock compens door top hold p materi amount compani speak mr irrelev,-4,1602613603.0
2929,g8qmcpn,t1_g8q03wt,manablaster_,australian telco retail lot shadi hidden fee us carrier aus transpar peopl stupid thing id fault super import real busi call deal game,1,1602627824.0
2930,g8sot2y,t1_g8puwxq,filmantopia,doubleplusgood,2,1602684210.0
2931,g8q701k,t1_g8pykqi,_N0S,verizon verizon verizon forgot,3,1602620513.0
2932,g8puloj,t1_g8pts6j,OppositeJellyfish3,devic order lmao,5,1602614312.0
2933,g8pwshj,t1_g8ptnl8,newmacbookpro,scratch annoy display bleedi finger,15,1602615405.0
2934,g8q4sf0,t1_g8ptnl8,reddit_xeno,screen iphon year fair shatter screen hard target audienc nokia,5,1602619401.0
2935,g8pt9w3,t1_g8prqpc,th3davinci,courag someth courag ftfi,9,1602613651.0
2936,g8r5u6e,t1_g8prqpc,Youaresowronglolumad,superpromaxqxretinahzenhancedlsrmot,1,1602638806.0
2937,g8pweym,t1_g8prqpc,yp261,display ipad pro,1,1602615219.0
2938,g8qquyu,t1_g8qjki2,tikituki,oooh,1,1602630355.0
2939,g8q7chk,t1_g8prta0,Asiriya,much iphon none batteri tbh anyth most camera upgrad differ pro model,5,1602620679.0
2940,g8qk0m6,t1_g8prta0,Dravarden,stylus phone,-1,1602626577.0
2941,g8qoea5,t1_g8qnedp,manablaster_,display samsung note ultra batteri promot brand ipad pro refer variabl refresh rate hz natur film watch edit creativ profession push iphon pro sens featur fix hz panel,0,1602628932.0
2942,g8pw0up,t1_g8pvkur,manablaster_,fair take iphon x last max year flagship devic iphon x iphon typic upgrad path batteri x io year highend iphon year,2,1602615025.0
2943,g8q2321,t1_g8pwy05,RnjEzspls,someon iphon batteri note ultra,1,1602618048.0
2944,g8qyvrl,t1_g8qwds5,manablaster_,fix hz display variabl promot display ipad pro money iphon next year,1,1602634967.0
2945,g8qmkzc,t1_g8pxzqj,manablaster_,note ultra implement variabl refresh rate promot ipad iphon disappoint realiti situat,0,1602627937.0
2946,g8qa4us,t1_g8q8tb6,bassetisanasset,pro raw import lot telephoto pro way main issu size hand glove sensor stabil wide interest ultra wide action sport footag stabil import phone tablet pocket problem off perfect devic everyon mini averag consum,10,1602621859.0
2947,g8puulj,t1_g8ptxf2,RaggleFraggle_,latenc worth,3,1602614435.0
2948,g8py7ya,t1_g8ptxf2,bfire123,lte frequenc frequenc futur,2,1602616116.0
2949,g8putg7,t1_g8pss57,007meow,wtf user upgrad water resist lame,36,1602614419.0
2950,g8qaje5,t1_g8pss57,Spiderpirate,everyon randroid post peopl spare batteri pocket normal anyth hour screen time unaccept,8,1602622032.0
2951,g8pw6yb,t1_g8pss57,tHeSiD,randroid signatur,14,1602615108.0
2952,g8pwmyo,t1_g8pss57,newmacbookpro,cartwheel,3,1602615328.0
2953,g8qlio3,t1_g8pss57,wcooper97,forget expand storag,3,1602627410.0
2954,g8qmz84,t1_g8pss57,The_Finglonger,thumbscrew,3,1602628132.0
2955,g8pwvfx,t1_g8pss57,Richinaru,damn expect reddit communiti haha,4,1602615446.0
2956,g8qrv7j,t1_g8pss57,TabaCh1,phone lmao,1,1602630935.0
2957,g8s72p0,t1_g8pss57,ledessert,phone base free brick price pro oppo find x peopl right stupid wish,1,1602670391.0
2958,g8qm4bz,t1_g8psl33,FoxBearBear,softwar wise nice sefiai selfi rear end camera someon head landscap,1,1602627713.0
2959,g8prg6x,t1_g8prceu,SlothTheHeroo,,2,1602612749.0
2960,g8prq9c,t1_g8prkqr,erriiinnnnn7,avail next week right,2,1602612886.0
2961,g8pu0fj,t1_g8prfjw,InvaderDJ,pro screen year pro max screen mini screen,4,1602614017.0
2962,g8prjex,t1_g8prfjw,erriiinnnnn7,max big ass brick,3,1602612793.0
2963,g8qqed6,t1_g8puc8n,erriiinnnnn7,crazi screen current x,1,1602630087.0
2964,g8qzuz7,t1_g8qyg08,the5headpepega,phone lot differ blue color differ,2,1602635515.0
2965,g8ptvd9,t1_g8psgtj,Hailgod,,5,1602613945.0
2966,g8ptnsc,t1_g8psgtj,Trisentriom,mini pro bad,2,1602613841.0
2967,g8qz1s1,t1_g8pscuk,NATOuk,strang differ display spec bright nit nit pro guess someth peopl pro,3,1602635062.0
2968,g8q6odb,t1_g8pwrue,Bhawk-11,run ryzen rig year big navi gnlttjc benchmark,3,1602620351.0
2969,g8qkfmk,t1_g8pwrue,Dravarden,futur ear present,1,1602626809.0
2970,g8q8bfv,t1_g8q7ug8,deleted,,-5,1602621108.0
2971,g8qwbgj,t1_g8qtxr9,Gen7isTrash,us,0,1602633505.0
2972,g8sqehi,t1_g8q593m,filmantopia,drawer futur unus earphon useless lot,1,1602685117.0
2973,g8q74bc,t1_g8q593m,cicuz,buck,1,1602620572.0
2974,g8qe1r4,t1_g8qay8s,ohyeah_mamaman,radic upgrad anyth reason charg block singl thing mention peopl nice opt point serious wast default option,5,1602623512.0
2975,g8qfank,t1_g8qay8s,rasheeeed_wallace,iphon charger wireless charger usbc charger android phone peopl box peopl none usba charger small minor peopl,2,1602624066.0
2976,g8qapsw,t1_g8pu8tz,yunqifunki,tbf imagin adapt headphon high price product kind insan buy product item box,10,1602622105.0
2977,g8qgh23,t1_g8qff48,TheYoungLung,ipad pro wager,3,1602624686.0
2978,g8qwuwo,t1_g8qff48,Draciilord,use,0,1602633817.0
2979,g8qwvui,t1_g8qff48,metaornotmeta,never everyon someth,0,1602633831.0
2980,g8qx0cy,t1_g8qpb3f,Draciilord,unabl iphon today ultra month,-1,1602633899.0
2981,g8qfbim,t1_g8qe6o1,quisquiliae_pandam,nice refresh rate sure appreci iphon,3,1602624079.0
2982,ga8cu54,t1_ga83pjq,rworange,consum million test optim product relev concess android phone price will user experi number vendor world,1,1603764059.0
2983,g8qkdq7,t1_g8qkaxo,TheEmeraldDoe,phrase actual stuff,2,1602626780.0
2984,g8pyn6a,t1_g8py24h,Gen7isTrash,mani time suspect call duti,4,1602616329.0
2985,g8rlrkr,t1_g8ra56g,yeet_ing,kinda novelti user base qualiti video lot storag,0,1602648820.0
2986,g8pyr08,t1_g8pxws3,Destroyer_Amanogawa,usba charger usba cabl iphon albeit slow andriod micro b sol android user phone coupl year old usbc charger,10,1602616382.0
2987,g8pym6p,t1_g8pxws3,gablopico,old brick old cabl,5,1602616315.0
2988,g8pz3e9,t1_g8pve1c,nermal543,price scheme wrong way sure mini extra moneygrabbi headphon brick,3,1602616554.0
2989,g8q3ueb,t1_g8pxh8t,Ithrazel,resal valu iphon eur galaxi year last year pro second hand xs second hand,3,1602618929.0
2990,g8q9ayb,t1_g8q3whq,-Phinocio,pro max convers rate ridicul,2,1602621516.0
2991,g8q52ul,t1_g8q1unt,theDEVIN8310,last gen devic cheap mean standout exact reason articl price compani current gen base level flagship current gen offer line actual equival pro,6,1602619551.0
2992,g8qv33v,t1_g8q1unt,daaangerz0ne,iphon solid deal previous year old model year accessori let earpod wall charger combin valu drop price vs previous year,4,1602632799.0
2993,g8qurmg,t1_g8pta6b,bradnod,low world low,3,1602632615.0
2994,g8q0nmi,t1_g8q03nq,kal423,awesom camera g steal pictur futur camera pro,3,1602617329.0
2995,g8qea68,t1_g8pxt4c,bco268,upgrad program year,1,1602623611.0
2996,g8pw4uv,t1_g8pvw9r,nermal543,big issu power brick wast mani brick cabl compat brick cabl wast peopl usb c brick wast move money way,6,1602615080.0
2997,g8qarl3,t1_g8q9zaa,david6283,,1,1602622124.0
2998,g8qg44v,t1_g8q44u4,jonathandoeford,notch part iphon ident vast disarray rectangular slab notch part ident notch mani advertis decept background notch ipad macbook cours notch ugli look possibl,2,1602624498.0
2999,g8r0rkt,t1_g8pt3o8,CHADWARDENPRODUCTION,sub strong sens certain crowd crowd,3,1602636030.0
3000,g8pt9aa,t1_g8psmrc,Grimarne,year lot year lot peopl devic littl bit last year,1,1602613643.0
3001,g8pz08e,t1_g8ps301,CHADWARDENPRODUCTION,absolut nerv guy thing loser,4,1602616510.0
3002,g8ps52u,t1_g8ps301,Grimarne,,-4,1602613090.0
3003,g8ps104,t1_g8prj74,Laty69,mini,3,1602613034.0
3004,g8pvttx,t1_g8psmne,bwjxjelsbd,slide,1,1602614927.0
3005,g8ptxjy,t1_g8pthgg,PwnasaurusRawr,entir budget bit tax iphon pro camera like batteri hard number awar camera len camera overal iphon pro price point budget coupl dollar curious advic other awesom phone worth,1,1602613976.0
3006,g8qkoiq,t1_g8q3jl0,InvaderDJ,pro pro max brand leather case sure crazi brand leather case store last year,2,1602626944.0
3007,g8ps6n8,t1_g8prw0v,Zavehi,leak month true bore,38,1602613112.0
3008,g8ps4fz,t1_g8prw0v,ThrowawayBlueYeti,symptom year updat upgrad symptom big thing iphon,16,1602613081.0
3009,g8pvnoy,t1_g8prw0v,Zerufos,excit big leap cpu architectur upgrad resolut bump wireless upgrad huge rumor channel last year fun announc,4,1602614841.0
3010,g8pskqh,t1_g8prw0v,austinalexan,event boast camera featur touch id pencil support hz display none minut present camera last year model,3,1602613304.0
3011,g8pt8kc,t1_g8prw0v,Azeemotron,rumour interest event noth,-1,1602613633.0
3012,g8q02oy,t1_g8pssl8,thecremeegg,oneui mile stock android,5,1602617042.0
3013,g8pvg37,t1_g8pulwb,crediblereality,tech nerd shit peopl care,-4,1602614734.0
3014,g8puovn,t1_g8ptlt6,Simpleton5,phone rumor,2,1602614357.0
3015,g8pubju,t1_g8ptlt6,lonelysidechick,rumor,1,1602614173.0
3016,g8py0ji,t1_g8pxbdz,PBMthrowawayguy,custom underr bixbi button bunch differ option instanc long press audibl quick tap spotifi tap long press navig home fenc featur facetim watch typec phone cycl,2,1602616014.0
3017,g8q0a6r,t1_g8pxbdz,CallMeBinks,last year first time iphon custom first coupl month time abl widget io come time app muscl memori icon abl custom icon widget gestur theme sure yearish lock function point phone muscl memori batteri life stellar camera nice screen differ use case bit extend use night gambl face multipl cabl fast charg nice batteri day matter random googl play servic batteri hour damn reason boogeyman situat cabl gasp cabl next bed minut last rest day part switch mini anyth next coupl releas sweet sweet compact phone,2,1602617145.0
3018,g8qmtsw,t1_g8pxbdz,tapwater86,samsung moment ad samsung pay watch seri month notif,1,1602628056.0
3019,g8sgknb,t1_g8rv01k,SavouryPlains,photo ton music iphon space anytim magic icloud,1,1602679041.0
3020,g8rjqed,t1_g8qks0x,yolomyfroyo,rip,1,1602647352.0
3021,g8qck0a,t1_g8q8q1u,MysteriousRoll,wow peopl unemploy abl iphon trailer park peopl concern stabl incom,3,1602622874.0
3022,g8ptrzl,t1_g8ptemk,theL0rd,major peopl year oneyear upgrad cycl,13,1602613898.0
3023,g8pu1z1,t1_g8ptta8,djoliverm,remind store appoint pretti sure appoint window shop screen ecar store super,1,1602614039.0
3024,g8priiq,t1_g8prb3d,JustHalfBlack,wrong xb start pro,2,1602612781.0
3025,g8prler,t1_g8prb3d,TexasGulfOil,iphon start,1,1602612820.0
3026,g8prs8s,t1_g8prdnp,gusborn,demon time,-1,1602612913.0
3027,g8q2ds5,t1_g8pyfdc,PalmHacks,eh anyon glove small minor anyway someon wear glove touchid conveni faceid screen phone anyway care authent,0,1602618198.0
3028,g8ql4oe,t1_g8q9im3,manablaster_,note ultra ltpo display watch similar ipad pro tech refresh rate way fluiditi way hz batteri hz natur filmwatch experi ultra hz display much pro filmmak power user phone promot brand shame hz display year differ,1,1602627188.0
3029,g8pyubo,t1_g8pys60,Gen7isTrash,right,1,1602616428.0
3030,g8pw07e,t1_g8pvwvk,____Batman______,common sens magnet place,0,1602615016.0
3031,g8px36l,t1_g8pwhkl,gaysaucemage,retail leftov stock direct amazon best buy phone carrier,3,1602615551.0
3032,g8pvpce,t1_g8pve2q,____Batman______,year,1,1602614864.0
3033,g8pyrpl,t1_g8pvtt7,nermal543,featur speed differ batteri life,2,1602616393.0
3034,g8pxofd,t1_g8px5na,strcy,np,1,1602615844.0
3035,g8pw2o6,t1_g8pvp68,____Batman______,iphonewatch dual accessori,1,1602615050.0
3036,g8sdl8g,t1_g8rfuo4,WolfXemo,look novemb mini pro max readi preorder magsaf charger leather wallet magsaf pro silicon case clear case avail friday octob iphon pro leather case avail friday novemb magsaf duo charger leather sleev avail later date via newsroom section specif pro line pro announc leather case normal,2,1602676748.0
3037,g8pypay,t1_g8pykg4,blizzy399,phone bestsel anyway mini,1,1602616359.0
3038,g8q13as,t1_g8q0nht,Gen7isTrash,sure color chang price usernam hehe,2,1602617545.0
3039,g8pyny1,t1_g8pye23,Gen7isTrash,wow,1,1602616340.0
3040,g8qq5z0,t1_g8pzd8s,xSGAx,suck er tho,1,1602629953.0
3041,g8pz72s,t1_g8pz35l,____Batman______,differ answer batteri life comparison,2,1602616605.0
3042,g8q2k4p,t1_g8q25me,yeyeman9,verizon ceo thing wild rift,1,1602618286.0
3043,g8q0xyz,t1_g8q0knm,Gen7isTrash,stainless steel matt pro,1,1602617470.0
3044,g8qj2hv,t1_g8qhp8p,BeJeezus,thirti forti usb wall adapt box thing world,1,1602626064.0
3045,g8q91gi,t1_g8q6zek,hamberdler,doubt penni point singl phone ipad last decad wall charger mani thing place way mani extra true motiv big chang next decad much kid,1,1602621404.0
3046,g8qf5tb,t1_g8qea1u,MadMarioMax,price,0,1602623997.0
3047,g8qgi6b,t1_g8qge45,Boccaccioac,amazon black friday deal,1,1602624702.0
3048,g8r4jbb,t1_g8qsc4n,azulshotput,right cumbersom front pant pocket,2,1602638089.0
3049,g8qocdk,t1_g8qo9fn,flyrickyfly,citizen bank iup,1,1602628902.0
3050,g8sng72,t1_g8r0w6q,ant1992,spotifi advertis competitor,1,1602683427.0
3051,g8siox3,t1_g8rbknf,GizmoVader,regular pro max big,1,1602680487.0
3052,g8r5133,t1_g8qn5it,GizmoVader,flat edg lidar magsaf,2,1602638362.0
3053,g8q4mpw,t1_g8pstwi,SwagYoloJesus,starter upgrad vast major user averag iphon user shoot edit publish bit hdr video dolbi vision lidar phone cours half thing singl user moment phone use experi night day screen shit peopl refresh rate thing someth notch size rid instant substanti qualityoflif upgrad make revers wireless avail scienc lot use case peopl wireless earbud phone capabl wireless power make display devic time batteri power instant palpabl use upgrad migrat usbc yyug instant upgrad list meaning upgrad processor averag iphon user plateau kind gimmicki shit magnet edg phone generat generat worthwhil featur upgrad averag iphon user generat old devic,3,1602619322.0
3054,g8px385,t1_g8pwxpd,Gen7isTrash,yep flat side iphon,2,1602615552.0
3055,g8q3aan,t1_g8q13ur,InvaderDJ,pro intent price increas closer pro spite,1,1602618648.0
3056,g8qnmyo,t1_g8qln5x,spack12,normal usb brick lightn cabl cord box,2,1602628497.0
3057,g8prpcl,t1_g8prkty,____Batman______,iphon port next year,1,1602612873.0
3058,g8prj7i,t1_g8prgtc,____Batman______,,1,1602612790.0
3059,g8qeqz7,t1_g8py4vw,i_heart_bear_mkts,genau,1,1602623807.0
3060,g8pt5vq,t1_g8psy7a,____Batman______,xs max pro pro max ecom,1,1602613596.0
3061,g8pz7zf,t1_g8pveyf,Issaction,next year year littl thicker batteri camera chang mini past year rare day phone,1,1602616617.0
3062,g8ptgqq,t1_g8pt5yf,____Batman______,headphon charger iphon dude,0,1602613744.0
3063,g8ptl1j,t1_g8psybq,Gen7isTrash,switch,1,1602613803.0
3064,g8psr21,t1_g8psp4t,Kaneki2019,bot,2,1602613391.0
3065,g8pt2w6,t1_g8psxv8,aka_liam,,1,1602613555.0
3066,g8pv0ar,t1_g8pups4,manablaster_,breath buddi,1,1602614513.0
3067,g8q00ec,t1_g8pyn47,nermal543,terribl,1,1602617011.0
3068,g8qubnm,t1_g8qpqmt,WolfXemo,magsaf charger leather wallet magsaf pro silicon case clear case avail friday octob iphon pro leather case avail friday novemb magsaf duo charger leather sleev avail later date via newsroom,2,1602632358.0
3069,g8r74na,t1_g8r6t1c,WolfXemo,newsroom releas magsaf charger leather wallet magsaf pro silicon case clear case avail friday octob iphon pro leather case avail friday novemb magsaf duo charger leather sleev avail later date via newsroom,1,1602639527.0
3070,g8q4i5c,t1_g8pyp5z,InvaderDJ,gsm version verizon complaint iphon generat network perform problem intel modem gsm version speed network strength,1,1602619258.0
3071,g8q4nv3,t1_g8q3k3l,Reginald002,long answer thank general view experi collect cabl usbc cabl macbook pro usbc seller talent suitabl power brick avail,1,1602619337.0
3072,g8q7ntk,t1_g8q5q2c,thorthor111,sure apertur light,1,1602620820.0
3073,g8q6qgy,t1_g8q6hak,DonnieTheCatcher,sure boat us larg citi proof case sens year partial design magsaf appeal,1,1602620381.0
3074,g8q9vg2,t1_g8q9ru1,DonnieTheCatcher,comparison wizard site,1,1602621748.0
3075,g8qbc6q,t1_g8qaki5,DonnieTheCatcher,paper fact deficit practic,2,1602622364.0
3076,g8q7bud,t1_g8q77pv,MysteriousRoll,initi post pretti similar comparison page csclqleefdcmtiddqpcridpgrid cidwwauskwgoiphon slid brandiphoneannounc,1,1602620672.0
3077,g8qaoco,t1_g8q9y2m,david6283,batteri life video playback time,1,1602622088.0
3078,g8qkia3,t1_g8q9y2m,DizzyKnicht,exact situat size pro max bit big batteri life size enough reason pro model sure idea pro line standard line,1,1602626850.0
3079,g8qxnpc,t1_g8qwflq,Familiar-Particular,advantag upgrad coupl differ option interest iphon plan carrier year card month plan checkout phone preorder phone much year year upgrad yrs minimum x sorta feel wast reason att phone verizon servic lot lot cc reward hard credit pull feel,1,1602634269.0
3080,g8sbd3j,t1_g8s7whd,ProximityAlert,bezel thin pro bezel thick pro,1,1602674802.0
3081,g8svprk,t1_g8svb39,WolfXemo,yep,2,1602687937.0
3082,g8px3mn,t1_g8pv5nv,Morica_,yeah ik step iphon idk,1,1602615557.0
3083,g8pvgl7,t1_g8puyw4,quisquiliae_pandam,true whini day,1,1602614741.0
3084,g8q70lx,t1_g8pzskr,SwagYoloJesus,babi,1,1602620521.0
3085,g8q88jo,t1_g8q7wyw,____Batman______,differ time import usbc,0,1602621073.0
3086,g8qamrt,t1_g8q8as3,BeJeezus,silli thing peopl devic oh dollar cabl pad,1,1602622070.0
3087,g8pyf98,t1_g8pxdd1,Gen7isTrash,sidegrad averag user care much iphon,1,1602616217.0
3088,g8pyboi,t1_g8pxa5i,Gen7isTrash,pro regular camera size big small side grade last gen flagship current gen mainstream,1,1602616168.0
3089,g8px4gk,t1_g8pwr4w,____Batman______,,1,1602615568.0
3090,g8qsk53,t1_g8qs3gk,WolfXemo,xs max bother strang approach iphon first time head scratcher,1,1602631336.0
3091,g8qvynf,t1_g8qvpky,WolfXemo,phone first time iphon buyer head,1,1602633303.0
3092,g8px845,t1_g8pvav8,Pepszi98,iphon,2,1602615617.0
3093,g8pyi9c,t1_g8pxgih,Gen7isTrash,,-1,1602616260.0
3094,g8ps9kj,t1_g8ps3jp,Tumblrrito,old model discount price event model frank complaint super dumb first place,2,1602613152.0
3095,g8pt4n7,t1_g8psrc4,SpiritWolfie,os contact version,1,1602613578.0
3096,g8pv80f,t1_g8psil3,HeartyBeast,countri,1,1602614620.0
3097,g8pzr97,t1_g8px5n6,blondedwetsuit,trade phone deal screen bit chang long haul much screen repair area much charg quick googl search averag repair offer version total cost trade x base price bit give caus site trade option payment plan deal depth conveni haha edit site trade offer employe store lenient simpl crack screen store open moment,1,1602616884.0
3098,g8pz1cr,t1_g8py49i,ligonsker,theori point number iphon past differ android samsung mani case camera spec opposit price market bullshit iphon look price mountain cash greed join rwearenotslav,1,1602616525.0
3099,g8pyouu,t1_g8py49i,Gen7isTrash,,0,1602616353.0
3100,g8q2w07,t1_g8q2lg1,Gen7isTrash,clue,1,1602618449.0
3101,g8q3rgj,t1_g8q3nqj,____Batman______,thank servic,2,1602618887.0
3102,g8q0f6p,t1_g8pz8qi,nuclear_hangover,need upgrad xr,1,1602617214.0
3103,g8qjqyt,t1_g8q6q3r,InvaderDJ,thing android trust devic unlock nice,2,1602626429.0
3104,g8qaefk,t1_g8q9ny4,BeJeezus,discount android drawer one month resal valu iphon complet shit,1,1602621972.0
3105,g8pzjt7,t1_g8pzf58,Gen7isTrash,,1,1602616783.0
3106,g8qsn6y,t1_g8qp9mf,DashAttack,sourc,1,1602631387.0
3107,g8q3wb6,t1_g8q1xat,kal423,logo indent back io tap stuff silicon one parti case,3,1602618955.0
3108,g8rycpr,t1_g8rqybm,Kvakke,compat magsaf problem futur,1,1602660174.0
3109,g8qveew,t1_g8qv9qr,Donghoon,great time modem super expens glad compani step environ,2,1602632980.0
3110,g8sipx6,t1_g8r3mhc,Donghoon,sticker,1,1602680505.0
3111,g8pv8o7,t1_g8prz7q,SuperMazziveH3r0,bit hdr record cool cool xs max next year pro motion avail,51,1602614630.0
3112,g8pvqxj,t1_g8prz7q,krystalflame_,iphon xs long time,7,1602614887.0
3113,g8puzq5,t1_g8prz7q,FieldOfFox,generat price industri norm soc perform abl generat,9,1602614506.0
3114,g8q1kn6,t1_g8prz7q,acosmichippo,perform old phone,2,1602617788.0
3115,g8pvagg,t1_g8prz7q,SirNarwhal,lag phone faulti batteri free replac program,1,1602614655.0
