Unnamed: 0,Comment ID,Parent ID,Author,Body,Score,Created (UTC)
805,g8q84aq,t3_jaiwph,Jkl1999,pre order deliveri vacat novemb camera,1,1602621024.0
806,g8q8680,t3_jaiwph,RubenTheHound,pro promax,1,1602621046.0
807,g8q88zn,t3_jaiwph,The-Hyrax,foldabl duo charger,1,1602621079.0
808,g8q8fh8,t3_jaiwph,ilaich21,past year abl preauthor preorder date time hit purchas option year differ day,1,1602621154.0
809,g8q8y2a,t3_jaiwph,shane400m,curious event alot peopl upcom thing event alot peopl dissapoint complain mix feel toward differ one happi iphon iphon alot peopl event gon phone product xs,1,1602621364.0
810,g8q92zn,t3_jaiwph,Mayucchi,iphon leather case avail silicon case leather case time phone,1,1602621423.0
811,g8q96fv,t3_jaiwph,taeem,w thing current iphon first phone,1,1602621464.0
812,g8q9isf,t3_jaiwph,RubenTheHound,promax pro photo qualiti matter lot,1,1602621605.0
813,g8q9x5t,t3_jaiwph,tooflyforwifii,iphon normal wireless,1,1602621768.0
814,g8q9y4u,t3_jaiwph,galaxymilky,design iphon iphon,1,1602621780.0
815,g8qatxx,t3_jaiwph,venomtail,notch big oof,1,1602622150.0
816,g8qb4en,t3_jaiwph,jfish718,friday preorder live midnight,1,1602622272.0
817,g8qbjb8,t3_jaiwph,kingsup,disappoint display peopl reason iphon next year es polici,1,1602622451.0
818,g8qbwv0,t3_jaiwph,fatrunnerjr08,iphon bezel pro,1,1602622604.0
819,g8qc6kx,t3_jaiwph,varzaguy,iphon review releas day phone,1,1602622718.0
820,g8qe17y,t3_jaiwph,cfedey,surviv year,1,1602623506.0
821,g8qefhy,t3_jaiwph,InevitableWords,pros physic size screen size,1,1602623672.0
822,g8qejil,t3_jaiwph,iTouneCorloi,air power magsaf phone,1,1602623718.0
823,g8qf50t,t3_jaiwph,PompousPidgeon,one space side phone pencil diagram tech spec anyon ipad pro air model exact,1,1602623985.0
824,g8qgjy0,t3_jaiwph,deleted,anyon mention iphon price iphon releas price one account,1,1602624728.0
825,g8qgp89,t3_jaiwph,Luph,anyon phone avail store,1,1602624804.0
826,g8qgyzj,t3_jaiwph,misterjuju,pro mini anyth camera batteri life phone verizon overal swap,1,1602624945.0
827,g8qh6br,t3_jaiwph,mikerichh,iphon question expect batteri life everyon,1,1602625053.0
828,g8qhpgl,t3_jaiwph,chodestroker420,anyon homepod mini ireland irish store us uk store seem odd,1,1602625333.0
829,g8qht5o,t3_jaiwph,pah-tosh,screen resolut number point confirm model resolut render pixel x render xr render pixel x render iphon pro inform xr width xr pro max amount inform size xr iphon data width,1,1602625389.0
830,g8qi3lb,t3_jaiwph,Relevantcobalion,question differ size x fenc pro max stick regular model input,1,1602625543.0
831,g8qjsa7,t3_jaiwph,DizzyKnicht,sure upgrad plan pro honest differ standard pro stainless steel band blue standard beauti big fan pacif blue pro justif pro case pro max standard iphon line batteri life huge question phone pro batteri life okay great pro max size antenna huge hit life,1,1602626449.0
832,g8qk4sr,t3_jaiwph,rpvee,crazi icloud tier avail raw photo hdr video,1,1602626641.0
833,g8qkuql,t3_jaiwph,youngsmoooveee,pre approv iup,1,1602627039.0
834,g8qld0l,t3_jaiwph,InertRiver5,android user iphon pocket engin design effort manufactur process soc super effici batteri iphon hand beast android counter part soc manufactur mass type devic howev damn cabl usb c everyth proprietari money compani amount wast throat usb stand serial bus univers mean everyth cabl everyth mani problem everyon ewast price entrylevel,1,1602627318.0
835,g8qlped,t3_jaiwph,neoisneoisneo,iphon upgrad gb cad insan valu,1,1602627510.0
836,g8qmmvw,t3_jaiwph,Remos_,could someon activ fee peopl end pay verizon extra due fee phone sim free sim verizon version sim function someth matter,1,1602627964.0
837,g8qnknp,t3_jaiwph,DoctorStrangeBlood,airtag,1,1602628461.0
838,g8qplzx,t3_jaiwph,GildDigger,anyon abl friday chase bank point point chase preorder first year iphon preorder first time chase point product abl right app abl launch day week phone help,1,1602629636.0
839,g8qqfnj,t3_jaiwph,craigbam,featur dual frequenc gps support anyon heard interview gnss support differ last year,1,1602630108.0
840,g8qqina,t3_jaiwph,shortestnamepossible,setup preapprov process peopl iup avail uk link,1,1602630157.0
841,g8qqjyn,t3_jaiwph,GLSNR,magsaf box separ purchas,1,1602630178.0
842,g8qqmo8,t3_jaiwph,BlueSwoosh248,done iup preapprov iphon pro gb tmobil,1,1602630221.0
843,g8qqmw6,t3_jaiwph,Mernyer,,1,1602630224.0
844,g8qre86,t3_jaiwph,igormuba,use old charger old charger devic,1,1602630666.0
845,g8qsw3z,t3_jaiwph,karahbit,iphon leather case,1,1602631531.0
846,g8qtmtt,t3_jaiwph,robocop88,question price differ unlock verizon front verizon version verizon plan busi plan busi websit etc etc abl verizon version activ sorri rodeo busi site phone old sim,1,1602631956.0
847,g8qtvc8,t3_jaiwph,manablaster_,mention big sur releas date mac event novemb,1,1602632093.0
848,g8quh9t,t3_jaiwph,jellyfeeesh,entir event seri dev omin tone whole time,1,1602632447.0
849,g8qv5cr,t3_jaiwph,X01D,guy iphon confer enthusiast mani featur refresh display samsung,1,1602632837.0
850,g8qvcx2,t3_jaiwph,Teach8870,someon bezel notch devic iphon pro model,1,1602632958.0
851,g8qwiv0,t3_jaiwph,jacob1600,iphon se home button face scan never face scan home button case,1,1602633623.0
852,g8qwmob,t3_jaiwph,srirachael1,sure iphon pro load pictur instagram etc camera differ massiv differ thank help,1,1602633684.0
853,g8qy3xl,t3_jaiwph,parkSXD,overwhelm month littl iphon se price actual possibl,1,1602634527.0
854,g8qyjp9,t3_jaiwph,LeKobeBryeent,casual tech fan guy fan much peopl thing product nee version thing fastbal,1,1602634778.0
855,g8qynra,t3_jaiwph,DrySausage,soooo noth ipad air,1,1602634842.0
856,g8qz24b,t3_jaiwph,theylineupfordays,idea mini hand se screen super interest x big heavi,1,1602635068.0
857,g8qzycz,t3_jaiwph,cbfw86,ipad mini ok hibern,1,1602635567.0
858,g8r14k3,t3_jaiwph,Twrd4321,phil schiller bring,1,1602636234.0
859,g8r2ydp,t3_jaiwph,boner_jamz_69,word big sur releas date,1,1602637239.0
860,g8r4wmi,t3_jaiwph,venk,iphon x camera janki batteri screen vertic line physic damag death bed crappi year mini launch situat,1,1602638293.0
861,g8r7f6o,t3_jaiwph,socaponed,hard display max design pretti nice video improv hurt regardless iup,1,1602639694.0
862,g8ra6a2,t3_jaiwph,bengals14182532,much ram iphon pro sure event spec websit,1,1602641223.0
863,g8rbncm,t3_jaiwph,sjs48,ram spec friday,1,1602642095.0
864,g8rcb4z,t3_jaiwph,Angryangmo,iphon pro store,1,1602642503.0
865,g8rf1kj,t3_jaiwph,BeenHadThat,magsaf featur amaz magsaf camera lidar scanner old iphon form screen none particular experi pro great phone measur,1,1602644222.0
866,g8rj3gg,t3_jaiwph,MugenKatana,car,1,1602646914.0
867,g8rkzit,t3_jaiwph,russian-jewboi,batteri life poo poo,1,1602648247.0
868,g8rlvl7,t3_jaiwph,beautrash,macbook pro version worth intel music product asi prevent thank input,1,1602648904.0
869,g8rn3wt,t3_jaiwph,Arnav33,non variant avail,1,1602649838.0
870,g8rove0,t3_jaiwph,DrewTheHobo,keynot chanc everyth wireless iphon,1,1602651199.0
871,g8rpqfe,t3_jaiwph,Reasonable_Doubt86,issu emphasi video power creativ hell support hifi audio iphon decent audio codec bluetooth damn headphon jack aptx qualcomm ldac soni fuck sake partner somebodi proprietari codec bluetooth headphon fuck sake man,1,1602651920.0
872,g8rpwz8,t3_jaiwph,mbrochh,underwhelm,1,1602652074.0
873,g8rq4bg,t3_jaiwph,AntiquatedAntelope,anyon nsa standalon,1,1602652247.0
874,g8rqxap,t3_jaiwph,born_to_do_dishes,iphon leather case,1,1602652939.0
875,g8rriao,t3_jaiwph,TimeValueOfMoney,reason employ cell phone stipend maximum purchas tmobil bill month free xr,1,1602653445.0
876,g8ru44c,t3_jaiwph,nkooiker,hand review peopl mkbhd pre order friday,1,1602655845.0
877,g8rzabw,t3_jaiwph,Stealthynoob,upgrad pro pro max use max magsaf issu accessori third parti car vent holder charger mous case vent mount etc charger wont releas decemb anyon recommend case spigen mous phone littl thicc iphon impress magsaf camera,1,1602661218.0
878,g8s015o,t3_jaiwph,cottoncandy_cc,live outsid us iphon updat iphon updat,1,1602662070.0
879,g8s52p4,t3_jaiwph,jonaskid,thing event xb coverag countri thing futhermor much bandwidth place poor coverag notic slow coverag speed well game phone differ entir subject screen design flat contour experi tell rubber cover factor hous pod ipad iphon macbook skip thing screen qualiti resolut camera night mode whatnot pro stuff raw excess instagram pictur reddit stuff batteri life price countri expens mini end day slight decreas iphon price model appeal,1,1602668097.0
880,g8sjrj2,t3_jaiwph,fdotcico,anyon much space minut dolbi vision hdr video h codec,1,1602681186.0
881,g8pr4ya,t3_jaiwph,bjdj94,tv airpod studio sort disappoint,2,1602612598.0
882,g8pr59c,t3_jaiwph,1terrortoast,tv airtag airpod yawn,1,1602612603.0
883,g8pr6bp,t3_jaiwph,rzan12,screen refresh rate huh,1,1602612617.0
884,g8pu4qn,t3_jaiwph,themasterlythrower,anyon phone unlock method facial recognit world mask norm love someon,2,1602614077.0
885,g8qd3kq,t3_jaiwph,Richiieee,iphon cinematograph great phone averag regular person omg color cool irrelev case cool tower aw servic carrier tower shitti wifi shitti lte servic sudden insan anyon decis charger box price oh box smaller better environ back fatthick design ew homepod mini capabl iphon watch shit siri iphon peopl call question thing iphon way iphon x iphon iphon littl chang much ask iphon need differ camera peopl one singl reason iphon x,0,1602623104.0
886,g8pr3or,t3_jaiwph,deleted,,1,1602612582.0
887,g8pr3ri,t3_jaiwph,TheJerdle,,1,1602612583.0
888,g8pr4fw,t3_jaiwph,BlueWizard69,detail big sur one,1,1602612591.0
889,g8pr4wg,t3_jaiwph,Farleftistheway,ipad air game,1,1602612598.0
890,g8pr5b1,t3_jaiwph,damn_it_jeremy,heck watch snap bracelet,1,1602612603.0
891,g8pr6vn,t3_jaiwph,FormerBandmate,fourth year design peopl year,1,1602612624.0
892,g8ps4cf,t3_jaiwph,deleted,,1,1602613080.0
893,g8ps6gq,t3_jaiwph,Tyler927,year peopl phone disappoint,1,1602613110.0
894,g8pvpiv,t3_jaiwph,kw2024,case phone condom supermodel risk ta take,1,1602614867.0
895,g8pw5d1,t3_jaiwph,AcidNoX,iphon pro pro design feel chang sake chang usbc notch imo excit featur mag safe eco system devic iphon fit watch stuff much oh year jealous samsung hardwar,1,1602615087.0
896,g8py48q,t3_jaiwph,goingontwelvethirty,time live event,1,1602616064.0
897,g8q7g7i,t3_jaiwph,councillleak,randroid usbc port phone pretti pleas half product tech product last year tire friend cord,1,1602620724.0
898,g8pr3a5,t3_jaiwph,gracecloud,air,1,1602612577.0
899,g8pr562,t3_jaiwph,Universal-Omnicide,confer iglass announc thing next year,1,1602612601.0
900,g8pr5hw,t3_jaiwph,AlbinoAlex,real,1,1602612606.0
901,g8pr6us,t3_jaiwph,nochill92,studio fuck,1,1602612624.0
902,g8pr76w,t3_jaiwph,soccerperson,sad pro model price,1,1602612628.0
903,g8pr8xj,t3_jaiwph,masterfalcon,ass whole event,1,1602612651.0
904,g8pr9i5,t3_jaiwph,dabocx,airtag airpod studio tv light event reason pro model regular,1,1602612659.0
905,g8prkbi,t3_jaiwph,VuuDuu,lacklust imo,1,1602612805.0
906,g8prm8v,t3_jaiwph,MarcBelmaati,holi,1,1602612832.0
907,g8prsm8,t3_jaiwph,flerken,leather case,1,1602612918.0
908,g8pruan,t3_jaiwph,upandaboutandaround,purpl,1,1602612941.0
909,g8ps6hi,t3_jaiwph,speedmonster95,event pander design wise ive price competit big splash anybodi pixel devic year product reveal render delici,1,1602613110.0
910,g8psek4,t3_jaiwph,_Regulate,trade valu pro model harsh,1,1602613220.0
911,g8psgg1,t3_jaiwph,____Batman______,iphon xr lmao,1,1602613244.0
912,g8psyfn,t3_jaiwph,igcetra,one iphon mini price expens charger headphon less expens storag model reason green everyon charger hypocrit wireless headphon iphon model year powerbrick usbc one cabl reason brick store fnodecaaaacbeefdbdbffbcacdededbbefcfdccfaebdbcadeababadefbbdeffeaecececefeaffc total bullshit way impress salti price remov lightn usbc,1,1602613494.0
913,g8pt6kp,t3_jaiwph,Gen7isTrash,tl dr flat ole iphon,1,1602613605.0
914,g8pt6ly,t3_jaiwph,ChemicalDaniel,event mess everyon exact detail iphon event peopl abl photo iphon homepod mini iphon xs style entir event twitter hope asi launch one wwdc confer leagu one edit thing excit magsaf iphon mac return magsaf old magsaf product side,1,1602613606.0
915,g8pt7jc,t3_jaiwph,InquisitiveIngwer,day year phone design phone technolog year real damn plateau googl samsung year galaxi fold design year core featur slight screen batteri camera improv much money end board phone tech,1,1602613618.0
916,g8ptcc2,t3_jaiwph,SpacemanTomX,magsaf usbc iphon disappoint unmeasur day,1,1602613685.0
917,g8pte3l,t3_jaiwph,gaysaucemage,usbc iphon point disappoint rumor,1,1602613709.0
918,g8pupdk,t3_jaiwph,spectradawn77,iphon nice upgrad display way month price upgrad need screen protector,1,1602614364.0
919,g8pvrot,t3_jaiwph,Tumblrrito,sustain argument power brick proprietari port phone,1,1602614897.0
920,g8pw0eu,t3_jaiwph,bakedleaf,anyon iphon pro iphon reason pro advantag current camera lidar anyth fine edit upgrad program month,1,1602615019.0
921,g8pwi75,t3_jaiwph,Knoxicutioner,lot peopl meme x year trade valu fice option unreal month iphon x trade valu month phone matt green color option,1,1602615263.0
922,g8pwiof,t3_jaiwph,KayJay24,world rich person pro pay ficial situat,1,1602615270.0
923,g8pwkv7,t3_jaiwph,mario1138,someon lisa roof comment livestream,1,1602615300.0
924,g8pxx82,t3_jaiwph,PeachyKeen73,xr pro thank deal deal carrier,1,1602615966.0
925,g8pxy3y,t3_jaiwph,xxxxn,anyon iphon pro landscap mode iphon ole afraid pro max ipadlik landscap mode,1,1602615978.0
926,g8py1hv,t3_jaiwph,Lvevan,switch x iphon brainer bigger screen thinner gram deep x gram version x done,1,1602616027.0
927,g8pz9mr,t3_jaiwph,sarlatan747,anybodi iphon,1,1602616640.0
928,g8q0bmr,t3_jaiwph,Marsupial_Ape,sorri inappropri place price drop jump android frugal,1,1602617166.0
929,g8q1qby,t3_jaiwph,dereq_j,earli batteryg mini se user issu form factor screen bodi ratio screen intern forgiv pessim guy os optim,1,1602617869.0
930,g8q2f8r,t3_jaiwph,squrr1,phone rcs standard,1,1602618218.0
931,g8q2g1v,t3_jaiwph,deleted,,1,1602618229.0
932,g8q5zpq,t3_jaiwph,burningderp,entir smart speaker watch band iphon sameish price increas canada price charger headphon ab shit current gen qualcomm futur gen exyno joke god g iphon pro g profession filmmak tuber g proconsum one fuck fuck prorezhdrretinadolbymotionhdraudiovideosolut life amen,1,1602620008.0
933,g8qboy2,t3_jaiwph,Ben_ts,year iphon,1,1602622514.0
934,g8qcjz4,t3_jaiwph,PartyingChair52,android pro leak pro batteri,1,1602622873.0
935,g8qqolw,t3_jaiwph,lukushonkle,phone usbc everyon work brick,1,1602630252.0
936,g8qv8qw,t3_jaiwph,philphan25,bring magsaf,1,1602632892.0
937,g8pr3xi,t3_jaiwph,Rudy_Colludiani,meh,0,1602612585.0
938,g8priw4,t3_jaiwph,manablaster_,reason hz ltpo display avail iphon size samsung type panel phone galaxi note ultra compromis batteri life key featur high refresh rate halfbak phone display hz,0,1602612786.0
939,g8ps479,t3_jaiwph,Deertopus,one ceram shield gorilla glass victus samsung flagship pro xdr samsung amol year af notch fingerprint mask life phone sub par,0,1602613077.0
940,g8pw0dv,t3_jaiwph,kaspar737,,0,1602615018.0
941,g8qba3a,t3_jaiwph,adamzanny,congrat custom team android last year man lineup sexi af price point hard,0,1602622340.0
942,g8pr629,t3_jaiwph,chaiscool,screen macbook air screen abomin,-2,1602612613.0
943,g8pr465,t3_jaiwph,Helpdesk512,kind snoozefest event imo,-1,1602612588.0
944,g8pr58b,t3_jaiwph,rockinadios,lame,-1,1602612602.0
945,g8prdfa,t3_jaiwph,UsefulCode6,,-1,1602612712.0
946,g8prw14,t3_jaiwph,quisquiliae_pandam,guess year reason,-1,1602612964.0
947,g8pr3y4,t3_jaiwph,DisjointedHuntsville,afraid futur,-6,1602612585.0
948,g8pr36g,t3_jaiwph,johnlu48,eh,0,1602612575.0
949,g8pr383,t3_jaiwph,paymesucka,hmm,0,1602612576.0
950,g8pr3h0,t3_jaiwph,ticuxdvc,premium mini pro x,0,1602612579.0
951,g8pr3tn,t3_jaiwph,Sregtur,airtag,0,1602612584.0
952,g8pr4id,t3_jaiwph,terrestiall,okay whos buy,0,1602612592.0
953,g8pr5cg,t3_jaiwph,MediumBurntToast,,0,1602612604.0
954,g8pr5e0,t3_jaiwph,kaspis29,,0,1602612604.0
955,g8pr5m6,t3_jaiwph,twarihay,need max,0,1602612608.0
956,g8pr6da,t3_jaiwph,Tiagoff,reason pro model,0,1602612617.0
957,g8pr7m8,t3_jaiwph,a343,xs owner batteri hard spend increment upgrad might pro clearanc drop,0,1602612634.0
958,g8pr7oe,t3_jaiwph,ThaJokaBabee,round edg pro,0,1602612634.0
959,g8pr7wx,t3_jaiwph,Rizzzzzooooo,bore af,0,1602612638.0
960,g8pr86d,t3_jaiwph,MisterBolainas,notch old cmon,0,1602612641.0
961,g8pr8e9,t3_jaiwph,feeblemuffin,hzairtag sad,0,1602612644.0
962,g8pr8rc,t3_jaiwph,SwoleMedic1,touch id noth,0,1602612649.0
963,g8pr8t3,t3_jaiwph,Free_Mind,huge focus uncomfort innov difficult,0,1602612650.0
964,g8pr8y8,t3_jaiwph,JuusteZ,buy,0,1602612651.0
965,g8prexm,t3_jaiwph,jonas691,happi batteri life split pro max reg,0,1602612732.0
966,g8prfao,t3_jaiwph,ditto_ditto__,familiar desir anyon care big deal,0,1602612737.0
967,g8priaw,t3_jaiwph,coolylame,camera usual present,0,1602612778.0
968,g8prilb,t3_jaiwph,redwall_hp,rearfac lidar huge deal lot cool icat,0,1602612782.0
969,g8prnp4,t3_jaiwph,idkVarun,nah disappoint charger earphon box major upgrad,0,1602612851.0
970,g8prnyq,t3_jaiwph,PineappleMeister,horribl name max pro hrd,0,1602612855.0
971,g8pror6,t3_jaiwph,Dreldan,accessori box environ money suuuur everyon airpod wireless station,0,1602612866.0
972,g8ps15a,t3_jaiwph,Morica_,magsaf intellig magnet system someth idk magnet much intellig magnet,0,1602613035.0
973,g8ps54e,t3_jaiwph,NineduceXII,wow refresh rate headphon jack pro touch id expand storag share,0,1602613091.0
974,g8psad2,t3_jaiwph,Perks92,someon android year uproar reaction bizarr great,0,1602613163.0
975,g8psdwk,t3_jaiwph,Vyper91,gon tv bloodi airtag thing disappoint phone sexi frost max,0,1602613211.0
976,g8pslqr,t3_jaiwph,HowDoesThisHappen666,separ thread anyon ebook reader book file folder iphon pdf file,0,1602613317.0
977,g8pso4d,t3_jaiwph,running_out_of_lette,kind absurd peopl hill,0,1602613350.0
978,g8pstd4,t3_jaiwph,WhiteHoney88,hell preorder time pst actual,0,1602613423.0
979,g8pszie,t3_jaiwph,MyNameIsSushi,base model europ readi thank,0,1602613509.0
980,g8pt1f2,t3_jaiwph,deleted,,0,1602613534.0
981,g8ptdp1,t3_jaiwph,jbrodie32,verizon tradein offer iphon x crack screen elig tradein offer iphon screen,0,1602613704.0
982,g8ptls5,t3_jaiwph,Xenowrath,question benefit pro,0,1602613813.0
983,g8ptno4,t3_jaiwph,srstone71,insist year spend time weed graphic display camera tech spec photograph videograph clear market tim care realli cook iphon departur foundat principl job product day phone ipod internet communic devic,0,1602613839.0
984,g8ptnoh,t3_jaiwph,deleted,,0,1602613840.0
985,g8ptzje,t3_jaiwph,swmill08,today x screen regret noth today line notchlesshz iphon year,0,1602614004.0
986,g8puxor,t3_jaiwph,ak3331,unfuck real price tier tmobil iphon mini add buck bullshit,0,1602614478.0
987,g8puxpo,t3_jaiwph,im_always,ha naysay small phone,0,1602614478.0
988,g8pv5xr,t3_jaiwph,Hhhhhlol,iphon thing anyon notch pretti huge flagship,0,1602614591.0
989,g8pv9ye,t3_jaiwph,im-just-lonely,announc leaqu legend iphon,0,1602614648.0
990,g8pvfdl,t3_jaiwph,MotherLoot,special user feel comfort year,0,1602614723.0
991,g8pvhg1,t3_jaiwph,Cows_Go_POO,educ discount iphon avail next friday physic store,0,1602614753.0
992,g8pw3dm,t3_jaiwph,JPWRX9786,raw format bit hdr market limit,0,1602615060.0
993,g8pwvt3,t3_jaiwph,TeeGeeAlpha,region price joke iphon countri pro usa normal iphon suck,0,1602615451.0
994,g8pxtrx,t3_jaiwph,ligonsker,charger brick headphon box environ usbc lightn cabl one brick usbc socket brick regular usb socket price fan mass iphon past ridicul rwearenotslav,0,1602615918.0
995,g8pxx9c,t3_jaiwph,nyrol,extra cutout border phone power button site differentprototyp model,0,1602615967.0
996,g8py1bq,t3_jaiwph,no1careskid,loui rossmann field day clown power brick usd,0,1602616024.0
997,g8pyekk,t3_jaiwph,CatManZebra,iphon se gen user year annoy touchid pandem,0,1602616208.0
998,g8pzpwz,t3_jaiwph,reallyConfusedPanda,ca phone hate countri,0,1602616866.0
999,g8q13yl,t3_jaiwph,VanWesley,guess ta year high refresh rate screen,0,1602617553.0
1000,g8q2l9p,t3_jaiwph,spigotjones,iphon pencil support use featur way sketch notepad ipad pictur draw power communic tool pencil,0,1602618302.0
1001,g8q5afr,t3_jaiwph,SpiritWolfie,lte perform phone court,0,1602619659.0
1002,g8q5auz,t3_jaiwph,Slim97Shady,x iphon android android counterpar much iphon war sword enemi opinion strong point chip,0,1602619664.0
1003,g8qel66,t3_jaiwph,cvnvr,og homepod homepod mini room side room anyon og mini speaker mini,0,1602623738.0
1004,g8rhrhn,t3_jaiwph,jakart3,iphon homescreen simpl neat current android phone homescreen android,0,1602646016.0
1005,g8rncgn,t3_jaiwph,thortilla27,nice touch id usba cord,0,1602650019.0
1006,g8s4v99,t3_jaiwph,ThisDorito,look iphon iphon,0,1602667854.0
1007,g8qcknb,t3_jaiwph,BakaFame,iphon,-4,1602622881.0
1008,g8pr6b4,t3_jaiwph,MisterBolainas,,-1,1602612616.0
1009,g8ps61e,t3_jaiwph,VobraX,thing fingerprint scanner,-1,1602613104.0
1010,g8pspwl,t3_jaiwph,Bombstar10,jesus christ user flow magsaf disast cool idea accessori charg magsaf case edit case materi complex thick case design clear case idea concept modular accessori,-1,1602613375.0
1011,g8pvqjz,t3_jaiwph,Gen7isTrash,marqu brownle iphon decad,-1,1602614881.0
1012,g8pz2ar,t3_jaiwph,DeeZnutZzZ69,pro max wrong,-1,1602616538.0
1013,g8q06ef,t3_jaiwph,mart1373,touchid iphon iphon coupl year mani custom iphon size iphon mini year long touchid faceid touchid pandem problem iphon user mask phone gon touchid everyon mani year realize wrong disappoint,-1,1602617092.0
1014,g8q725j,t3_jaiwph,ChocolateG0ku,iphon year old pro look year,-1,1602620543.0
1015,g8r1076,t3_jaiwph,m0butt,mini small overal decent stupid upgrad year,-1,1602636165.0
1016,g8rogop,t3_jaiwph,DangerousCrime,man backward iphon design lame fingerprint sensor power button lame lame,-1,1602650876.0
1017,g8pr55k,t3_jaiwph,BrigadeArea51,camera lmao realiz peopl,-5,1602612601.0
1018,g8pr4qk,t3_jaiwph,triparoundthesun,,-2,1602612595.0
1019,g8pr57o,t3_jaiwph,deleted,,-2,1602612602.0
1020,g8pr5c7,t3_jaiwph,nisch231,yike phone,-2,1602612604.0
1021,g8pr5kc,t3_jaiwph,israel_esports,,-2,1602612607.0
1022,g8pr7dk,t3_jaiwph,MaxNuker,prooooooo bigger sensor hurr durr low light situat situat lot led buld firework light team flood light anyth,-2,1602612630.0
1023,g8qps5g,t3_jaiwph,deleted,entfernt,-2,1602629735.0
1024,g8r0xii,t3_jaiwph,al0kz,anyon accessori iphon pro video accessori,-2,1602636124.0
1025,g8pr4cd,t3_jaiwph,Tapacehko,,-4,1602612590.0
1026,g8ps6ht,t3_jaiwph,jaddf,rofl kid,-5,1602613110.0
1027,g8puxq5,t1_g8prgjy,mime454,seem case store page silicon case leather price,60,1602614478.0
1028,g8qfaok,t1_g8prgjy,HolyFreakingXmasCake,wallet,5,1602624067.0
1029,g8qfy8s,t1_g8prgjy,JayySur,like kinda bad environ someth lmao,1,1602624413.0
1030,g8qsqz9,t1_g8prgjy,thomalexday,homepod,1,1602631448.0
1031,g8prtxd,t1_g8prdrp,StraY_WolF,carbon footprint,133,1602612936.0
1032,g8prqvt,t1_g8prdrp,d4danger,histori lisa,324,1602612894.0
1033,g8pseyj,t1_g8prdrp,gablopico,free power brick earphon,91,1602613225.0
1034,g8ptnrb,t1_g8prdrp,Scheduled-Diarrhea,tim face brunt charger headphon box announc roof poor gal,62,1602613841.0
1035,g8pzdot,t1_g8prdrp,smellythief,solar panel feel bad,6,1602616697.0
1036,g8pxuol,t1_g8prdrp,pineappleppp,offic year,4,1602615931.0
1037,g8psbi8,t1_g8prdrp,austinalexan,usb c brick,8,1602613179.0
1038,g8ps3xb,t1_g8prdrp,Dreldan,liza funki name,8,1602613074.0
1039,g8rqpuf,t1_g8prdrp,deleted,emili full access build unintent meme announc,2,1602652759.0
1040,g8uyhvj,t1_g8prdrp,LyokoMan95,someon tim,2,1602727456.0
1041,g8pxyl6,t1_g8prdrp,Mr_Incredible91,great thing trend islisaokay,3,1602615985.0
1042,g8qg17u,t1_g8prdrp,ordinarythermos,lisa escap tv,1,1602624456.0
1043,g8qvd7t,t1_g8prdrp,deleted,event brain minut refer end fassbend steve job movi,1,1602632962.0
1044,g8qygiw,t1_g8prdrp,huxrules,person hse eye har,1,1602634728.0
1045,g8slhuo,t1_g8prdrp,Dragon_yum,environ employe ladder home,1,1602682263.0
1046,g8pr7kh,t1_g8pr2ik,sjwillis,magsaf cool redesign anyth worth xs,370,1602612633.0
1047,g8prquk,t1_g8pr2ik,RedPanda888,someon regular wireless charger wont charger phone otherwis,15,1602612893.0
1048,g8pr9pr,t1_g8pr2ik,StealeesWheel,excit lmao,42,1602612662.0
1049,g8pr949,t1_g8pr2ik,SuccessAndSerenity,yup bummer place airpod,24,1602612654.0
1050,g8pr9v9,t1_g8pr2ik,jimbo831,abl,13,1602612664.0
1051,g8prua8,t1_g8pr2ik,MercurialMadnessMan,year speak,3,1602612941.0
1052,g8puxo9,t1_g8pr2ik,Jwarren1895,item websit,2,1602614478.0
1053,g8prhn7,t1_g8pr2ik,Adium,fuck usbc,2,1602612769.0
1054,g8prerr,t1_g8pr2ik,enjoytheshow,price,1,1602612729.0
1055,g8prgk7,t1_g8pr2ik,AngeloSantelli,seri compat qi charger magsaf accessori devic qi iphon se magnet part,1,1602612754.0
1056,g8prjg8,t1_g8pr2ik,Reddittoomuch,peak interest nice store,1,1602612794.0
1057,g8psch4,t1_g8pr2ik,observationalhumour,present transit speaker,1,1602613192.0
1058,g8psfjc,t1_g8pr2ik,bonestamp,phone abl airpod magsaf charger standard magsaf charger page compat airpod pro wireless case standard airpod,1,1602613232.0
1059,g8pszr6,t1_g8pr2ik,InvaderDJ,question magsaf charger magnet plate necessari compat standard qi devic charger devic,1,1602613512.0
1060,g8ptiut,t1_g8pr2ik,mvoxo,mag safe clear case pro model safe case pros reason,1,1602613773.0
1061,g8pzygx,t1_g8pr2ik,LeftHandShoeToo,yeah,1,1602616984.0
1062,g8q07uf,t1_g8pr2ik,SDdrohead,much,1,1602617112.0
1063,g8q5fd2,t1_g8pr2ik,khumbaya23,chip insan overkil mobil,1,1602619727.0
1064,g8q8g1k,t1_g8pr2ik,Fridaykevin,question mag safe walletcov phone purpos magnet cover wallet,1,1602621160.0
1065,g8qgu2o,t1_g8pr2ik,deleted,info,1,1602624874.0
1066,g8qwti9,t1_g8pr2ik,danvalour,watt cours googl pixel non devic case speed,1,1602633794.0
1067,g8qxp3z,t1_g8pr2ik,Joester202,magsaf glad usb c iphon,1,1602634292.0
1068,g8prlqe,t1_g8pr2ik,PapaKeth,tl dw verizon special shoutout belkin,1,1602612824.0
