Unnamed: 0,Comment ID,Parent ID,Author,Body,Score,Created (UTC)
0,g8prgjy,t3_jaiwph,HellBlazeSRB,magsaf leather,134,1602612754.0
1,g8prdrp,t3_jaiwph,EliteAgent51,poor lisa roof forgotten,863,1602612716.0
2,g8pr2ik,t3_jaiwph,Mrwright96,magsaf charger watch charger thing tbh,1014,1602612566.0
3,g8pr58o,t3_jaiwph,Matuteg,takeaway homepod mini price braid watch band usbc box one brick year oh pretti sure,1463,1602612602.0
4,g8pr3cw,t3_jaiwph,IowaIsAwful,mini full normal,380,1602612578.0
5,g8pr43v,t3_jaiwph,timtimteo,tim cook,617,1602612587.0
6,g8pr4q0,t3_jaiwph,alkakmana,magsaf,101,1602612595.0
7,g8pr5o4,t3_jaiwph,barceva,photograph interior design today,255,1602612608.0
8,g8prdbr,t3_jaiwph,StinkyChupacabra,thing noth,81,1602612711.0
9,g8pr2x0,t3_jaiwph,PeanutButterTaint,day next year,1704,1602612571.0
10,g8pr20a,t3_jaiwph,SplitLipGrizzlyBear,airtag sad,411,1602612559.0
11,g8pr26l,t3_jaiwph,RealHomieJohn,airpod studio,585,1602612562.0
12,g8pr277,t3_jaiwph,DominicDom,capabl,533,1602612562.0
13,g8pr34f,t3_jaiwph,TheGuyWhoCodes,hard sell camera look x year,386,1602612574.0
14,g8pran7,t3_jaiwph,MrTriceps,camera differ pro model,128,1602612674.0
15,g8psbq3,t3_jaiwph,cheesepuff07,model nonpro verizon phone right,63,1602613181.0
16,g8prh7r,t3_jaiwph,MightBeJerryWest,note stock price keynotepresent day lack usbc block usbc part mainstream product except macbook iphon pro ipad pro mainstream watch usbc block iphon fact annoy usba cabl okay fine million block case usbc magsaf iphon cool macbook pros interest car mount,121,1602612763.0
17,g8pr6bw,t3_jaiwph,TimeRemove,charger standard iphon charg cabl usbc peopl environ someth,1265,1602612617.0
18,g8pr4yi,t3_jaiwph,SgtRootCanal,summari today event magnet,134,1602612599.0
19,g8pr7bj,t3_jaiwph,4dollarWater,woman roof,196,1602612630.0
20,g8pr3n6,t3_jaiwph,-I-Am-That-Guy-,iphon,283,1602612581.0
21,g8prddn,t3_jaiwph,magicalgin,camera point,86,1602612711.0
22,g8pr78i,t3_jaiwph,vbdfg43tr,base model nice step year,44,1602612629.0
23,g8prahh,t3_jaiwph,NESpahtenJosh,photo,178,1602612672.0
24,g8pr4u6,t3_jaiwph,Gumby420,pro power button touchid sensor edit second edit mkbhd antenna cutout,34,1602612597.0
25,g8prpw7,t3_jaiwph,SqueezeAndRun,power brick environ ship phone usb c cabl one power brick,447,1602612881.0
26,g8precx,t3_jaiwph,bittabet,lack comment batteri life batteri life huge hit modem someth guess mini batteri life,220,1602612724.0
27,g8pr46l,t3_jaiwph,manuelps,okay sensor right side sim slot,68,1602612588.0
28,g8psnbk,t3_jaiwph,yallrealize,weird unlock option regular model tmobil sprint model extra mini regular model pro model btw,29,1602613339.0
29,g8prqxs,t3_jaiwph,-C0MPUTER-,takeaway usb c planet peopl usb c wall brick,166,1602612895.0
30,g8pr4kb,t3_jaiwph,jeckersly,pump iphon pro max event minut lot filler way much time got ta appeas stock investor overlord,228,1602612593.0
31,g8pr7th,t3_jaiwph,deleted,,226,1602612636.0
32,g8pr1lq,t3_jaiwph,thdtjdals,ipad air releas date,114,1602612554.0
33,g8psg9e,t3_jaiwph,Gen7isTrash,talk batteri life,24,1602613242.0
34,g8pr3vi,t3_jaiwph,soik90,sure jerryrigeverth fun ceram shield,143,1602612584.0
35,g8prgbm,t3_jaiwph,ps-73,,61,1602612751.0
36,g8pr28x,t3_jaiwph,Loganberrynz,,308,1602612563.0
37,g8pssi2,t3_jaiwph,omnipotentsco,thing wrong way generat pro line pro pro max max camera popul pro max pro giant phone abl camera,40,1602613411.0
38,g8ptc9w,t3_jaiwph,Charlie_went_Brown,sure anyon iphon pro max wide telephoto camera iphon pro,44,1602613684.0
39,g8prufp,t3_jaiwph,gobackclark,iphon mini phone,17,1602612943.0
40,g8pr23q,t3_jaiwph,metroidmen,,435,1602612561.0
41,g8prcc4,t3_jaiwph,viners,mac year anoth event,36,1602612697.0
42,g8pr894,t3_jaiwph,CoolbananasKD,ipad air,16,1602612642.0
43,g8psfaj,t3_jaiwph,steelandwine,wow tradein price iphon pro,16,1602613229.0
44,g8pr2f8,t3_jaiwph,messiiiiiiiii,pre order timelin,14,1602612565.0
45,g8pr5fz,t3_jaiwph,VarkingRunesong,gon coverag map nationwid verizon rollout bullet,15,1602612605.0
46,g8pu6tc,t3_jaiwph,phatboy5289,simfre tmobil sprint version base iphon model extra wtf,14,1602614106.0
47,g8pr3ig,t3_jaiwph,subz1987,reason pro care advanc camera experi,54,1602612580.0
48,g8prlay,t3_jaiwph,hammerheadtiger,singl continu shot approach septemb event top tier transit level whimsic product valu insan class homepod mini kind look child bixbi speaker candl mode top screen mood intercom great featur platform glad bad sound qualiti promis true xb han verizon spokespersonceo pterodactyl wingspan arm usual mockup super skeptic flat side anecho relax place victori lap leagu legend es team play leagu imagin eddi cue iphon boardroom sad magsaf gon magnet strength person credit card phone magnet power earpod power adapt someon box unus earpod power brick xb mini kaiann dranc favorit exec absolut comed time yall small full screen iphon vote wallet xb pro hard time color year joz jame bond villain scheme dark lair seem bulk upgrad regular iphon screen upgrad peopl fine regular phone xb airtag anyon welfar check airtag team worri airtag lidar ax,146,1602612819.0
49,g8pr7r5,t3_jaiwph,Pulse99,tim,14,1602612635.0
50,g8pr79i,t3_jaiwph,deleted,ipad air sadfac birthday gift girlfriend,29,1602612629.0
51,g8psl4b,t3_jaiwph,CapnJujubeeJaneway,base model price mini pro pro max cri canadian,30,1602613309.0
52,g8prvko,t3_jaiwph,rasheeeed_wallace,sub felatio sub event act tim cook dog,68,1602612958.0
53,g8prbl5,t3_jaiwph,I_CAPE_RUNTS,minut retail box,64,1602612687.0
54,g8pr33g,t3_jaiwph,MapleMooseAttack,,49,1602612574.0
55,g8pslib,t3_jaiwph,SDK04,fanboy event exclus nich featur averag consum tim minut dolbi vision cinematographi everyon major studio lmfao,46,1602613314.0
56,g8ps1u4,t3_jaiwph,German_Irish_chicken,thing guess,13,1602613045.0
57,g8pxey7,t3_jaiwph,Swav3,man tech pro max gon na girl onlyfan cinemat af,11,1602615711.0
58,g8pr45c,t3_jaiwph,Gatsby_James,oh hi speed money readi stratospher,24,1602612588.0
59,g8pr544,t3_jaiwph,ILoveTheAtomicBomb,bummer video dolbi vision price nice,59,1602612600.0
60,g8prmjr,t3_jaiwph,RitardStrength,iphon great improv chip xr singl slow phone whole lineup great,11,1602612836.0
61,g8ps7k4,t3_jaiwph,blrmdll,damn roof,10,1602613125.0
62,g8pu981,t3_jaiwph,squirrelhoodie,sad nov releas date love iphon mini blue phone true successor iphon se,11,1602614139.0
63,g8q0j4k,t3_jaiwph,FLUSH_THE_TRUMP,anyon gon bad premium premiumlarg phone pro pro max,10,1602617269.0
64,g8psb83,t3_jaiwph,AutumnStar,hard upgrad,8,1602613175.0
65,g8q8hkm,t3_jaiwph,The-Hyrax,last year touch xs max pro max,9,1602621176.0
66,g8pta9i,t3_jaiwph,Holyspider,hey charger box usbc cabl old charger,28,1602613656.0
67,g8pupd2,t3_jaiwph,QuietlyVicious,iphon start mini carrier tmobilesprint simfre,7,1602614364.0
68,g8q6i1x,t3_jaiwph,hostelo,wont,8,1602620263.0
69,g8pr3dq,t3_jaiwph,DoomSleighor,price standout devic someth,94,1602612578.0
70,g8pr346,t3_jaiwph,DadAsFuck,event day airpod studio,25,1602612574.0
71,g8pr3ag,t3_jaiwph,Jeremiah_Edwards,mini,20,1602612577.0
72,g8pr70g,t3_jaiwph,skystopper,guess,14,1602612626.0
73,g8pr7uc,t3_jaiwph,IntrepidAd6697,tv,14,1602612637.0
74,g8pr6lo,t3_jaiwph,Esteban95,minigang ta novemb,7,1602612620.0
75,g8prb0p,t3_jaiwph,FanofK,kind funni date ipad air friday everyth,6,1602612680.0
76,g8ps3ss,t3_jaiwph,LightsOut5774,guess gon xs max year batteri life anyon batteri life pro,7,1602613072.0
77,g8psh81,t3_jaiwph,italics,look trade valu year,7,1602613255.0
78,g8pvmyu,t3_jaiwph,hnty,magsaf wireless charg seed noport phone next year,7,1602614830.0
79,g8qjwle,t3_jaiwph,Pixel-Lick,minut key back phone,8,1602626514.0
80,g8pr943,t3_jaiwph,nate0023,reason iphon x,18,1602612654.0
81,g8psofk,t3_jaiwph,WillTheGreat,sure faceid improv covid secur aspect present secur centerpiec event,19,1602613355.0
82,g8psx97,t3_jaiwph,Calla89,someth lot complaint buy usbc charger lightn port end,12,1602613477.0
83,g8pr3az,t3_jaiwph,FragrantBrilliant6,okay product cri where headphon,36,1602612577.0
84,g8prhf9,t3_jaiwph,aka_liam,iphon x year,5,1602612766.0
85,g8pt83h,t3_jaiwph,handtoglandwombat,magsaf magsaf laptop cabl phone,7,1602613626.0
86,g8ptefn,t3_jaiwph,inthepickles,pro sure hz,7,1602613713.0
87,g8q6v4q,t3_jaiwph,y414p,lot comment xr year someon iphon excit,5,1602620445.0
88,g8qd58a,t3_jaiwph,TacoBellLavaSauce,today event last month event,6,1602623124.0
89,g8prq5m,t3_jaiwph,rasinansar,underwhelm launch pro regular iphon xb bit mini foldabl magsaf charger,19,1602612885.0
90,g8pr3ac,t3_jaiwph,SleepingSicarii,event short,25,1602612577.0
91,g8pr2zt,t3_jaiwph,ButItWasAGoodDay,,76,1602612573.0
92,g8pr7b9,t3_jaiwph,Xionpig,idk pro status item point,6,1602612629.0
93,g8ps2rh,t3_jaiwph,CapnJujubeeJaneway,safe magsaf iphon phone trip charg cord,5,1602613058.0
94,g8pvgs7,t3_jaiwph,kcahmadi,pro pro max differ pro,6,1602614743.0
95,g8q33pj,t3_jaiwph,TheJadedSF,glimmer power button touch id god iphon stuff ipad face id mask home suck,5,1602618555.0
96,g8q7n30,t3_jaiwph,halolordkiller3,jesus christ confus hell camera pro max wtf hardwar pro differ screen size,6,1602620811.0
97,g8qoqb3,t3_jaiwph,0800-BLINY,ridicul spare charger yeah usbc watch usba cabl two differ charger usbcusba multiport monstros like environment argument window evangelist peak stupid,4,1602629127.0
98,g8q0nk3,t3_jaiwph,NiftWatch,cell phone year someth technolog cours year chill xs max owner excit telephoto len hdr video blue stainless steel finish midnight green phone year ridicul,9,1602617328.0
99,g8pr4l2,t3_jaiwph,ElDuderino2112,wtf ipad air yet,16,1602612593.0
100,g8pretl,t3_jaiwph,The_Atticus,unimpress propro max model point screen reason pro model batteri life first year camera useless data cap softthrottl exist,25,1602612731.0
101,g8prb3u,t3_jaiwph,New-Monarchy,parodi reveal event covid thing,33,1602612681.0
102,g8pr79q,t3_jaiwph,platypusanimus,mysteri u chip appear,8,1602612629.0
103,g8prdlz,t3_jaiwph,Kaltrax,lmao releas date ipad air avail octob,8,1602612714.0
104,g8pr7km,t3_jaiwph,skidallas418,hell iphon pro iphon,4,1602612633.0
105,g8prkvg,t3_jaiwph,Solertia,releas date ipad air weird,4,1602612813.0
106,g8prsdo,t3_jaiwph,IAMSNORTFACED,fice deal announc bit,3,1602612915.0
107,g8ps0uk,t3_jaiwph,Pparadigm,iphon mini europ daylight robberi,3,1602613031.0
108,g8psat0,t3_jaiwph,Gen7isTrash,iphon,5,1602613169.0
109,g8ptlfa,t3_jaiwph,alastairlerouge,custom eu exagger exchang rate product iphon pro level tbh iphon pro usd eur averag eu vat germani vat franc vat itali vat price ridicul,4,1602613809.0
110,g8puazs,t3_jaiwph,biochrono79,surpris thing event releas date ipad air,2,1602614165.0
111,g8puw7z,t3_jaiwph,XiXMak,iphon mini price sim free us verizon,4,1602614457.0
112,g8pv059,t3_jaiwph,blacmac,websit iphon start unlock tmobil reason verizon gb pro differ upsel year,4,1602614511.0
113,g8pv9il,t3_jaiwph,Gen7isTrash,advic iphon batteri upgrad,5,1602614642.0
114,g8pvua1,t3_jaiwph,MJA182,magsaf pop socket type accessori use pop socket phone,5,1602614933.0
115,g8pwqi7,t3_jaiwph,hotdogpowers,someon tune io environ benefit iphon x issu camera speed stream music gps fine year generat leap,4,1602615378.0
116,g8q1nus,t3_jaiwph,Gen7isTrash,interest,4,1602617833.0
117,g8q1scq,t3_jaiwph,Endemoniada,went event pro longev batteri mini possibl world camera photographi mini display disappoint,4,1602617898.0
118,g8q33wr,t3_jaiwph,thelateoctober,word leather case thing store silicon clear,4,1602618558.0
119,g8qg1ew,t3_jaiwph,deleted,ca year,4,1602624459.0
120,g8qqx4b,t3_jaiwph,Nebula-Lynx,amus thing year everyon subreddit super mad upset iphon,3,1602630390.0
121,g8pts3f,t3_jaiwph,Gen7isTrash,,8,1602613899.0
122,g8pr1xv,t3_jaiwph,rrobe53,,97,1602612558.0
123,g8pr24r,t3_jaiwph,Revotix,,19,1602612561.0
124,g8prgot,t3_jaiwph,wujoh1,earth phone usbc standard long time refus rest product usbc,17,1602612756.0
125,g8prchv,t3_jaiwph,That_One_Cool_Guy,need max,9,1602612699.0
126,g8pr3vw,t3_jaiwph,Fightrface,size notch charger block box,11,1602612585.0
127,g8pr4tt,t3_jaiwph,muhwtvracct,reason xr,3,1602612597.0
128,g8pr5g0,t3_jaiwph,favoritecolorpurple,thought mini,3,1602612605.0
129,g8pr6s7,t3_jaiwph,PVLVCE,,3,1602612623.0
130,g8pr7el,t3_jaiwph,Bronson_AD,,3,1602612631.0
131,g8pr83p,t3_jaiwph,FoxMuldertheGrey,iphon cant,3,1602612640.0
132,g8pr9br,t3_jaiwph,StumpedDev,iphon wait room,3,1602612657.0
133,g8pra9m,t3_jaiwph,Beltedfar,,3,1602612669.0
134,g8prfuu,t3_jaiwph,humpadiddy,sensor right side power button id,3,1602612745.0
135,g8prh5w,t3_jaiwph,beermeupscotty,c p u n l,3,1602612762.0
136,g8pro5k,t3_jaiwph,TheTrain,batteri,3,1602612858.0
137,g8prprw,t3_jaiwph,ruizach,whole event phone,3,1602612879.0
138,g8prwc2,t3_jaiwph,deleted,mini se mini spec perfect replac,3,1602612968.0
139,g8prwgc,t3_jaiwph,supercakefish,uk folk live store dollar price swap pound sign,3,1602612970.0
140,g8ps6so,t3_jaiwph,German_Irish_chicken,iphon x xs,3,1602613114.0
141,g8ps7hr,t3_jaiwph,Eisenhorne8,xs max hand wallet safe thank,3,1602613124.0
142,g8psem5,t3_jaiwph,galacticHitchhik3r,next year iphon big one,3,1602613220.0
143,g8pslh0,t3_jaiwph,UnknownTreasure,poor air gen releas date,3,1602613314.0
144,g8psrkz,t3_jaiwph,oohe,reason pro,3,1602613398.0
145,g8psxmk,t3_jaiwph,mildloneliness,anyon refresh rate iphon,3,1602613482.0
146,g8ptgmi,t3_jaiwph,A-Person-Alone,reason xr camera improv ole big deal,3,1602613743.0
147,g8pu1xn,t3_jaiwph,Kkvle,first time preorder anyon gon option store launch day,3,1602614038.0
148,g8pu33v,t3_jaiwph,EpicQQ,wireless chargingqi year iphon x batteri life month skeptic technolog gimmick pleas,3,1602614054.0
149,g8pu9ic,t3_jaiwph,Dustin81783,es site price news crack iphon x free nice ugh,3,1602614143.0
150,g8pu9vc,t3_jaiwph,THAT_ONE_GUY_JESUS,takeaway happi iphon,3,1602614149.0
151,g8pub0z,t3_jaiwph,chuckst3r,airpod studio,3,1602614165.0
152,g8pvlt0,t3_jaiwph,To_be_C0ntinued,much addit magsaf year iphon enough featur,3,1602614814.0
153,g8pvvz5,t3_jaiwph,worldwideconnected,black mirror episod,3,1602614957.0
154,g8pwjk9,t3_jaiwph,deleted,,3,1602615282.0
155,g8pyr5e,t3_jaiwph,Toprelemons,xs,3,1602616384.0
156,g8q05pv,t3_jaiwph,lakers_liverpool,iphon pro money right move camera downgrad signific averag photo taker use work anyth,3,1602617083.0
157,g8q0bwm,t3_jaiwph,aidapng,airtag,3,1602617169.0
158,g8q0h87,t3_jaiwph,TheEmeraldDoe,blue none case store match blue,3,1602617243.0
159,g8q0skf,t3_jaiwph,alotanonsense,realworld differ iphon camera low light much lidar photo,3,1602617396.0
160,g8q16iv,t3_jaiwph,Gen7isTrash,fun fact iphon cost iphon xr msrp,3,1602617589.0
161,g8q17qi,t3_jaiwph,SargeantAlTowel,yawn snooz fest,3,1602617606.0
162,g8q1f0d,t3_jaiwph,sleetybasher,clue ram size model,3,1602617710.0
163,g8q1q6g,t3_jaiwph,Wontonbeef,xs max strong,3,1602617867.0
164,g8q22ty,t3_jaiwph,BranCracker,clear case due magsaf extra wallet,3,1602618045.0
165,g8q2mne,t3_jaiwph,dinozero,wow carrier aggress deal free iphon upgrad tradein newer iphon last time deal good lacklust phone time covid,3,1602618320.0
166,g8q3cl9,t3_jaiwph,oldandverytired,homepod mini sound great deal look nice touchid,3,1602618680.0
167,g8qap7e,t3_jaiwph,PirateNinjaa,pro touch id power button promot display mini,3,1602622098.0
168,g8qaxvn,t3_jaiwph,TexasGulfOil,stand roof,3,1602622195.0
169,g8qbx3n,t3_jaiwph,Uber-A,se gen,3,1602622607.0
170,g8qc0lx,t3_jaiwph,redditUserError404,wish list improv speaker improv batteri life slow motion frame rate,3,1602622646.0
171,g8qel3l,t3_jaiwph,obelisk0,expens sim free att verizon variant,3,1602623737.0
172,g8qkek1,t3_jaiwph,donpianta,idea sleepwak button look pencil chargecontact point ipad pro,3,1602626793.0
173,g8qo2bj,t3_jaiwph,The_Cows_Are_Home,tim cook today,3,1602628741.0
174,g8qok2j,t3_jaiwph,GuggGugg,magsaf sake univers connector connector phone back magsaf technolog poor magsaf man shit,3,1602629027.0
175,g8qqtcp,t3_jaiwph,luvmuppet,thought homepod mini base iphon nice much advertis verizon event kind surpris much airtim mention format event clip littl park event cmon homekit demo cool intercom neat usbc lightn cabl thing qi charger multiport charger anker usbc port plenti usb cabl previous devic port iphon hope peopl iphon upgrad program devic watch seri peopl store open preorder week littl annoy oh,3,1602630329.0
176,g8qqzno,t3_jaiwph,TheOGGizmo,comparison absolut trash year lowkey,3,1602630432.0
177,g8qrvhi,t3_jaiwph,Syynthoras,everyth get label pro overabus word,3,1602630939.0
178,g8r1rx4,t3_jaiwph,TheAtlanticGuy,everyon iphon convinc pro curious,3,1602636602.0
179,g8pr2kf,t3_jaiwph,mcandhp,,21,1602612567.0
180,g8proeo,t3_jaiwph,ThaJokaBabee,worth imo big coastal citi work tech pretenti short film spare time,29,1602612861.0
181,g8prb8v,t3_jaiwph,Meta_Man_X,covid toll resourc iphon releas ton product avail event iphon nice real hard sell featur cours devic hard,5,1602612683.0
182,g8prguv,t3_jaiwph,agiantkenyan,anyon long store phone display person mini regular size,6,1602612758.0
183,g8psbm8,t3_jaiwph,CalvinYHobbes,,4,1602613180.0
184,g8pueqj,t3_jaiwph,heyyoudvd,biggest highlight homepod mini price magsaf accessori ecosystem ceram shield glass biggest disappoint homepod stereo pair surround sound abil mini rear speaker current homepod pair tv leather case websit case clear case silicon case magsaf leather case year real downgrad zoom unchang pro improv current ratio max zoom improv siri announc whole segment siri improv hear anyth improv capabl present anyon understand,5,1602614216.0
185,g8pu1cr,t3_jaiwph,steveox152,power adapt everyon cabl power adapt one,6,1602614030.0
186,g8pr5ul,t3_jaiwph,faze_fazebook,whack event pro motion display airtag airpod studio arm mac,6,1602612611.0
187,g8pr37z,t3_jaiwph,IOnlyPlayAs-Brainiac,price,5,1602612576.0
188,g8pratv,t3_jaiwph,hgmanifold,big factor batteri case magsaf previous version light adapt batteri case kind hate rid popsocket bit order,2,1602612677.0
189,g8pxmg1,t3_jaiwph,WillTheGreat,takeaway usual event batteri life secur year centerpiec present rid touchid faceid improv address facial obstruct chang faceid batteri massiv drain earli gen lte phone htc thunderbolt exampl batteri life huge deal present aw first gen lte phone bad bad generat iphon win price year price flagship competit consum whole reason flagship low thousand mark introduct iphon accept phone fact top line other pretti qualiti materi finish price point standard disappoint reveal real issu recent line iphon wrong touchid thing normal vaccin real time line mask forese futur fact secur super disappoint,4,1602615816.0
190,g8qfwah,t3_jaiwph,rafibomb_explosion,sorri environment bullshit money emiss,3,1602624385.0
191,g8pr4fr,t3_jaiwph,rcast16,underwhelm,8,1602612591.0
192,g8pr30l,t3_jaiwph,____Batman______,magsaf,6,1602612573.0
193,g8pr7e4,t3_jaiwph,Phoenix_King76,yeah huge let year thing cool blue color guess iphon xs max,6,1602612631.0
194,g8pr3v0,t3_jaiwph,NonPinkPinkPanther,shrunken notch airtag shame,5,1602612584.0
195,g8pr4r8,t3_jaiwph,aa2051,introduc airtag proud time halflif,4,1602612596.0
196,g8pr699,t3_jaiwph,bc12392,,5,1602612616.0
197,g8praw8,t3_jaiwph,throwaway123454321,prerecord event event,6,1602612678.0
198,g8pr354,t3_jaiwph,RichHomieWayne,screen tho,14,1602612575.0
199,g8pr5wl,t3_jaiwph,deleted,anyon screenshot price current iphon might oneplus,2,1602612611.0
200,g8pr6do,t3_jaiwph,Mr_Fat_Lai,slot power button,2,1602612617.0
201,g8pr6vc,t3_jaiwph,hamhamflan,hors ok possibl retina damag overglisten,2,1602612624.0
202,g8pr7vh,t3_jaiwph,InsufficientFrosting,anyon glass wall build roof support column,2,1602612637.0
203,g8pr88n,t3_jaiwph,Chippo,travel covid reason camera upgrad iphon x,2,1602612642.0
204,g8pr8lt,t3_jaiwph,hocotate,xr huh,2,1602612647.0
205,g8pr8y9,t3_jaiwph,Tumblrrito,promot man magsaf awesom wallet case car mount glad,2,1602612651.0
206,g8pr8zo,t3_jaiwph,MrBigtime_97,promot art thou,2,1602612652.0
207,g8pr9me,t3_jaiwph,laughin_on_the_metro,disappoint air tag pretti sure homepod mini year iphon lineup excit last coupl year edit homepod mini uk ouch,2,1602612661.0
208,g8pr9x4,t3_jaiwph,Renix,everyon whelm,2,1602612665.0
209,g8praf7,t3_jaiwph,CrookedStubby15,entir event word,2,1602612672.0
210,g8pray1,t3_jaiwph,RaynareAmano,thing touch id feelssadman,2,1602612679.0
211,g8prbzb,t3_jaiwph,shacoand2boxes,lidar scanner cool cool iphon screen lidar,2,1602612692.0
212,g8prd93,t3_jaiwph,sjsharksfan12,thing event fanci camera xr phone batteri life reason,2,1602612710.0
213,g8prgc1,t3_jaiwph,turnuppig,meh year x,2,1602612751.0
214,g8prgpk,t3_jaiwph,johnabc123,hz year gon processor,2,1602612756.0
215,g8prk1n,t3_jaiwph,NIGHTHAWK017,power block materi usbc adaptor usb c block usbc connector singl item,2,1602612802.0
216,g8prky7,t3_jaiwph,deleted,,2,1602612814.0
217,g8prlr4,t3_jaiwph,Zaccory,ipad order store updat,2,1602612824.0
218,g8prm2o,t3_jaiwph,hocotate,uh maco big sur,2,1602612829.0
219,g8prpqu,t3_jaiwph,flux8,slow roll trickl product sens physic event whole bunch journalistsdevelopersoth product week advanc notic way pandem end afterward,2,1602612879.0
220,g8prpwg,t3_jaiwph,Alex9rome,sear ipad air,2,1602612881.0
221,g8prq8w,t3_jaiwph,00DEADBEEF,iphon pro uk iphon pro,2,1602612886.0
222,g8prrlh,t3_jaiwph,Hans_Grubert,leak front camera comparison old camera system faceid batteri life lidar redesign edg grand flat pro max iup,2,1602612903.0
223,g8prtz8,t3_jaiwph,SDK04,camera pro look impress lack old pro homepod nice tho,2,1602612937.0
224,g8prun3,t3_jaiwph,deleted,,2,1602612946.0
225,g8prwzu,t3_jaiwph,Craftyboss2,big question magsaf qi standard qi charg usabl kind bullshit proprietari technolog,2,1602612978.0
226,g8przlz,t3_jaiwph,Breckmoney,awhil preorder time preorder est edit ecom pdt,2,1602613014.0
227,g8ps1c4,t3_jaiwph,okin107,groot job ceo verizon,2,1602613038.0
228,g8ps25y,t3_jaiwph,NickyRibs,smart move year minim updat next year,2,1602613049.0
229,g8ps8sm,t3_jaiwph,deleted,touchid covid world pencil support pro max note larg phone notepad ipad,2,1602613142.0
230,g8ps9c3,t3_jaiwph,totallyunsuspecting,shot time someon rip devic,2,1602613149.0
231,g8ps9ne,t3_jaiwph,college_bound_baby,rip canadian price control mini pro pro max,2,1602613153.0
232,g8psd71,t3_jaiwph,Morica_,verizon magnet,2,1602613202.0
233,g8pse96,t3_jaiwph,HopBiscuits,anyon touchid ipad air sure,2,1602613216.0
234,g8psg6h,t3_jaiwph,CowsArentReal,joke mani cool thing mom iphon iphon xr upgrad pro pro max,2,1602613240.0
235,g8psknp,t3_jaiwph,SilverIdaten,power brick headphon box price great year cheap shit great look,2,1602613303.0
236,g8pslxl,t3_jaiwph,Sef545f,usb c port pro motion hey wow verizon speed everybodi,2,1602613320.0
237,g8psmpz,t3_jaiwph,Rtzizle,disappoint lack thing mah pro samsung galaxi edg year mah posit year gon year full price iphon year releas,2,1602613331.0
238,g8psr4m,t3_jaiwph,afieldonearth,thing event product valu event evolutionari revolutionari huge leap websit cook begin phasechapterwhatev iphon life fine noth wrong anyth persuas phone old,2,1602613392.0
239,g8psrie,t3_jaiwph,TonyStark39,peopl brick usbc usb common peopl,2,1602613397.0
240,g8pssfd,t3_jaiwph,Saint_Icarus,brick issu next year qualifi purchas product usb brick usbc brick discount guy old charger billion old charger sit phone manufactur billion world,2,1602613410.0
241,g8psulv,t3_jaiwph,Dragon2268,peopl upgrad year year iphon perfect mum big pictur nerd,2,1602613440.0
242,g8psum6,t3_jaiwph,ElDuderino2112,ipad air announc excit order announc,2,1602613440.0
243,g8psvz6,t3_jaiwph,FatherDanner,plus max phone max think anyon issu phone regular size benefit price,2,1602613459.0
244,g8pswkc,t3_jaiwph,AFluffyWombat,sure feel reason,2,1602613468.0
245,g8psxfq,t3_jaiwph,BlueSwoosh248,leather case,2,1602613479.0
246,g8psz4c,t3_jaiwph,Dragon2268,huge shame hz yeah jon right market boy market much market jargon,2,1602613503.0
247,g8pt1cp,t3_jaiwph,Pak-O,addit magsaf port iphon,2,1602613533.0
248,g8pt1fx,t3_jaiwph,furish,great event pro lineup iphon pro unveil felt announc fifa hz display present smartphon innov nowaday big step possibl realli content effort machin learn augment realiti tho,2,1602613534.0
249,g8pt1iv,t3_jaiwph,Dragon2268,kid verizon b tch,2,1602613536.0
250,g8pt2ao,t3_jaiwph,legoknight,tradit leather case iphon pro max,2,1602613547.0
251,g8pt5wp,t3_jaiwph,LordCheezus,overund port year iphon,2,1602613596.0
252,g8pt9bp,t3_jaiwph,_Bussey_,verizon,2,1602613643.0
253,g8ptbvv,t3_jaiwph,chilean_quant,iphon,2,1602613679.0
254,g8ptcpt,t3_jaiwph,TheRealHBR,reason pro phone pay telephoto lidar shit max guess pro max,2,1602613690.0
255,g8ptcwi,t3_jaiwph,Kchrpm,longtim googl ecosystem devote pixelbook go pixel xl youtub video androidtvpow smart tv introduct pro proraw dolbi vision video record edit jealous googl capabl devic,2,1602613693.0
256,g8ptd0w,t3_jaiwph,Mac_to_the_future,look xr year verizon coverag area spotti fast refresh screen still lightn,2,1602613695.0
257,g8ptdm3,t3_jaiwph,ColdxCrush,focus much camera anyon camera extent focus innov featur,2,1602613703.0
258,g8ptdq7,t3_jaiwph,Gen7isTrash,wont port,2,1602613704.0
259,g8ptdtd,t3_jaiwph,chipsnmilk,someon first iphon sens factor,2,1602613705.0
260,g8ptgse,t3_jaiwph,zakuropan,okay sorri colour pastel rang bright green phone small phone pretti color lavend pretti,2,1602613745.0
261,g8pti3j,t3_jaiwph,deleted,,2,1602613762.0
262,g8pto3l,t3_jaiwph,beall49,phone month preorder time pro model site congest,2,1602613845.0
263,g8pto4b,t3_jaiwph,spiralcurve,anyon price breakdown model base storag option mini pro pro max,2,1602613845.0
264,g8pttl4,t3_jaiwph,nvfl600d,iphon lineup eu price insan moment iphon mini start plus wtf,2,1602613920.0
265,g8pttx4,t3_jaiwph,pao_lo,first time base pro model bad flat edg thing,2,1602613925.0
266,g8ptu0a,t3_jaiwph,dahliamma,iphon expens tmobil sprint,2,1602613926.0
267,g8ptvtu,t3_jaiwph,its-an-addiction,pros littl disappoint year care much camera tough,2,1602613951.0
268,g8pu1df,t3_jaiwph,ArchfiendX,year iphon flat design sooooo,2,1602614030.0
269,g8pu1pb,t3_jaiwph,agp11234,ipad air,2,1602614035.0
